text,sense,label,ind,new_label
"allow me , then , to avoid dishonor by death ; let me take refuge in martyrdom .","('let', 'laisser', 'dejadme')",0,11,0
"i supplicate you , i implore you on my knees -- let me die , and my last sigh shall be a blessing for my preserver . ""","('let', 'laisser', 'dejadme')",0,11,0
let me conduct your business and my own .,"('let', 'laisser', 'dejadme')",0,0,0
""" now that i know everything , my friend ! ah ! that 's very good . but go on , go on . first , though , let me tell you that those gentlemen have put themselves to a useless expense . ""","('let', 'laisser', 'dejadme')",0,28,0
""" no , "" replied fix coldly , "" i think him a rascal . sh ! do n't budge , and let me speak . as long as mr . fogg was on english ground , it was for my interest to detain him there until my warrant of arrest arrived . i did everything i could to keep him back . i sent the bombay priests after him , i got you intoxicated at hong kong , i separated you from him , and i made him miss the yokohama steamer . ""","('let', 'laisser', 'dejadme')",0,22,0
""" let me pass ! ""","('let', 'laisser', 'dejadme')",0,1,0
""" it is he ! "" cried d’artagnan , pale with anger , and with the sweat on his brow , "" it is he ! let me overtake him ! "" "" he ?","('let', 'laisser', 'dejadme')",0,26,0
""" let me reflect a little ! ay , that will do -- at armentieres . ""","('let', 'laisser', 'dejadme')",0,1,0
"leave your hold , then , i beg of you , and let me go where my business calls me . ""","('let', 'laisser', 'dejadme')",0,12,0
