text,sense,label,ind,new_label
""" yes , sir , all the windows . ""","('window', 'fenêtre', 'ventana')",0,7,0
""" look here , barrymore , "" said sir henry , sternly ; "" we have made up our minds to have the truth out of you , so it will save you trouble to tell it sooner rather than later . come , now ! no lies ! what were you doing at that window ? ""","('window', 'fenêtre', 'ventana')",0,55,0
""" i took advantage of a moment when they left me alone ; and as i had known since morning the reason of my abduction , with the help of the sheets i let myself down from the window . then , as i believed my husband would be at home , i hastened hither . ""","('window', 'fenêtre', 'ventana')",0,38,0
""" i was doing no harm , sir . i was holding a candle to the window . ""","('window', 'fenêtre', 'ventana')",0,16,0
""" and why were you holding a candle to the window ? ""","('window', 'fenêtre', 'ventana')",0,10,0
"at five in the morning i was awoke by the neighing and pawing of four horses under my window . i dressed hastily and came down into the street . hans was finishing our packing , almost as it were without moving a limb ; and yet he did his work cleverly . my uncle made more noise than execution , and the guide seemed to pay very little attention to his energetic directions .","('window', 'fenêtre', 'ventana')",0,18,0
"i showed him the volume on the shelf : he took it down , and withdrawing to his accustomed window recess , he began to read it .","('window', 'fenêtre', 'ventana')",0,19,0
he then took up his station near the window and gazed through the foliage .,"('window', 'fenêtre', 'ventana')",0,8,0
""" move your light across the window , watson ! "" cried the baronet . "" see , the other moves also ! now , you rascal , do you deny that it is a signal ? come , speak up ! who is your confederate out yonder , and what is this conspiracy that is going on ? ""","('window', 'fenêtre', 'ventana')",0,6,0
""" yes , we shall make our little ambush here . get into this hollow , lestrade . you have been inside the house , have you not , watson ? can you tell the position of the rooms ? what are those latticed windows at this end ? ""","('window', 'fenêtre', 'ventana')",0,44,0
i tiptoed down the path and stooped behind the low wall which surrounded the stunted orchard . creeping in its shadow i reached a point whence i could look straight through the uncurtained window .,"('window', 'fenêtre', 'ventana')",0,33,0
"the stranger looked at him again with a slight smile , and retiring from the window , came out of the hostelry with a slow step , and placed himself before the horse , within two paces of d’artagnan .","('window', 'fenêtre', 'ventana')",0,15,0
"his quiet manner and the ironical expression of his countenance redoubled the mirth of the persons with whom he had been talking , and who still remained at the window .","('window', 'fenêtre', 'ventana')",0,29,0
""" this horse is decidedly , or rather has been in his youth , a buttercup , "" resumed the stranger , continuing the remarks he had begun , and addressing himself to his auditors at the window , without paying the least attention to the exasperation of d’artagnan , who , however placed himself between him and them . "" it is a color very well known in botany , but till the present time very rare among horses . ""","('window', 'fenêtre', 'ventana')",0,37,0
"this , then , was the explanation of the stealthy expeditions at night and the light at the window . sir henry and i both stared at the woman in amazement . was it possible that this stolidly respectable person was of the same blood as one of the most notorious criminals in the country ?","('window', 'fenêtre', 'ventana')",0,18,0
"when they were gone we looked out of the window again . sir henry had flung it open , and the cold night wind beat in upon our faces . far away in the black distance there still glowed that one tiny point of yellow light .","('window', 'fenêtre', 'ventana')",0,9,0
"the star of day , pale but nevertheless still splendid , was setting in the horizon , glorifying at once the heavens and the sea with bands of fire , and casting upon the towers and the old houses of the city a last ray of gold which made the windows sparkle like the reflection of a conflagration .","('window', 'vitre', 'cristal')",1,50,1
"it was long past noon when he awoke . his valet had crept several times on tiptoe into the room to see if he was stirring , and had wondered what made his young master sleep so late . finally his bell sounded , and victor came in softly with a cup of tea , and a pile of letters , on a small tray of old sevres china , and drew back the olive - satin curtains , with their shimmering blue lining , that hung in front of the three tall windows .","('window', 'fenêtre', 'ventana')",0,93,0
"as to the gentleman , he resumed his place at the window , and surveyed the crowd with a certain impatience , evidently annoyed by their remaining undispersed .","('window', 'fenêtre', 'ventana')",0,11,0
"when the settlers , leaning from their windows , gazed on the huge watery masses breaking beneath their eyes , they could not but admire the magnificent spectacle of the ocean in its impotent fury .","('window', 'fenêtre', 'ventana')",0,7,0
"milady was looking out at the window , and pretended not to hear the door as it opened .","('window', 'fenêtre', 'ventana')",0,6,0
"as soon as he was dressed , he went into the library and sat down to a light french breakfast that had been laid out for him on a small round table close to the open window . it was an exquisite day . the warm air seemed laden with spices . a bee flew in and buzzed round the blue - dragon bowl that , filled with sulphur - yellow roses , stood before him . he felt perfectly happy .","('window', 'fenêtre', 'ventana')",0,36,0
"some heavy clouds , swept from the sky by a rising wind , had left the moon bare ; and her light , streaming in through a window near , shone full both on us and on the approaching figure , which we at once recognised as miss temple .","('window', 'fenêtre', 'ventana')",0,27,0
the fog - bank lay like white wool against the window . holmes held the lamp towards it .,"('window', 'fenêtre', 'ventana')",0,10,0
"from this window were visible the porter 's lodge and the carriage - road , and just as i had dissolved so much of the silver - white foliage veiling the panes as left room to look out , i saw the gates thrown open and a carriage roll through .","('window', 'fenêtre', 'ventana')",0,2,0
"as to the guns obtained from the brig , they were pretty pieces of ordnance , which , at pencroft 's entreaty , were hoisted by means of tackle and pulleys , right up into granite house ; embrasures were made between the windows , and the shining muzzles of the guns could soon be seen through the granite cliff .","('window', 'fenêtre', 'ventana')",0,43,0
"every time he passed with a friend before his windows , at one of which mousqueton was sure to be placed in full livery , porthos raised his head and his hand , and said , "" that is my abode ! ""","('window', 'fenêtre', 'ventana')",0,9,0
"i gave another tug before i answered , for i wanted the bird to be secure of its bread : the sash yielded ; i scattered the crumbs , some on the stone sill , some on the cherry - tree bough , then , closing the window , i replied--","('window', 'fenêtre', 'ventana')",0,47,0
"paralyzed , rigid with anguish , my hair standing on end , my eyes popping out of my head , short of breath , suffocating , speechless , i stared-- i too ! i was glued to the window by an irresistible allure !","('window', 'vitre', 'cristal')",1,38,1
"the captain stood up and invited me to follow him . i 'd had time to collect myself . i did so . the lounge was dark , but the sea 's waves sparkled through the transparent windows . i stared .","('window', 'vitre', 'cristal')",1,37,1
"from a distance they perceived aramis , seated in a melancholy manner at his window , looking out , like sister anne , at the dust in the horizon .","('window', 'fenêtre', 'ventana')",0,14,0
"the next morning , when d’artagnan entered aramis ’s chamber , he found him at the window .","('window', 'fenêtre', 'ventana')",0,16,0
"a tremendous report was heard , but the piece had held good , and the colonists rushing to the windows , saw the shot graze the rocks of mandible cape , nearly five miles from granite house , and disappear in shark gulf .","('window', 'fenêtre', 'ventana')",0,19,0
"it was verging on dusk , and the clock had already given warning of the hour to dress for dinner , when little adele , who knelt by me in the drawing - room window - seat , suddenly exclaimed--","('window', 'fenêtre', 'ventana')",0,34,0
""" how provoking ! "" exclaimed miss ingram : "" you tiresome monkey ! "" ( apostrophising adele ) , "" who perched you up in the window to give false intelligence ? "" and she cast on me an angry glance , as if i were in fault .","('window', 'fenêtre', 'ventana')",0,27,0
it was a chamber whose furniture was at once appropriate for a prisoner or a free man ; and yet bars at the windows and outside bolts at the door decided the question in favor of the prison .,"('window', 'fenêtre', 'ventana')",0,23,0
""" and , "" said he , "" it is so already in heart , if not in deed ! "" in the meantime , the flag was hoisted at the central window of granite house , and the settlers saluted it with three cheers .","('window', 'fenêtre', 'ventana')",0,32,0
"involuntarily my eyes flew to the window , but i could n't stand the fire devouring it .","('window', 'vitre', 'cristal')",1,6,1
"i reached the lodge at gateshead about five o'clock in the afternoon of the first of may : i stepped in there before going up to the hall . it was very clean and neat : the ornamental windows were hung with little white curtains ; the floor was spotless ; the grate and fire - irons were burnished bright , and the fire burnt clear . bessie sat on the hearth , nursing her last - born , and robert and his sister played quietly in a corner .","('window', 'fenêtre', 'ventana')",0,38,0
"and all dressing in haste rushed to the windows , which they opened .","('window', 'fenêtre', 'ventana')",0,8,0
she ran to the window and opened it .,"('window', 'fenêtre', 'ventana')",0,4,0
""" well , it was evident from what we have heard that baskerville has been very closely shadowed by someone since he has been in town . how else could it be known so quickly that it was the northumberland hotel which he had chosen ? if they had followed him the first day i argued that they would follow him also the second . you may have observed that i twice strolled over to the window while dr . mortimer was reading his legend . ""","('window', 'fenêtre', 'ventana')",0,76,0
"the lad flushed up and , going to the window , looked out for a few moments on the green , flickering , sun - lashed garden . "" i owe a great deal to harry , basil , "" he said at last , "" more than i owe to you . you only taught me to be vain . ""","('window', 'fenêtre', 'ventana')",0,9,0
"he went to his room and dressed . there was a wild recklessness of gaiety in his manner as he sat at table , but now and then a thrill of terror ran through him when he remembered that , pressed against the window of the conservatory , like a white handkerchief , he had seen the face of james vane watching him .","('window', 'vitre', 'cristal')",1,43,1
""" nothing , nothing , only shut the window .","('window', 'fenêtre', 'ventana')",0,8,0
"how i wished sleep would silence her . it seemed as if , could i but go back to the idea which had last entered my mind as i stood at the window , some inventive suggestion would rise for my relief .","('window', 'fenêtre', 'ventana')",0,32,0
the two musketeers met at the gate . athos and d’artagnan watched their approach from the window .,"('window', 'fenêtre', 'ventana')",0,16,0
""" i , monseigneur ? "" said athos . "" i did not even draw my sword , but i took him who offended me round the body , and threw him out of the window . it appears that in falling , "" continued athos , with some hesitation , "" he broke his thigh . ""","('window', 'fenêtre', 'ventana')",0,35,0
"milady shut the window , extinguished the lamp , and went , as felton had desired her , to lie down on the bed .","('window', 'fenêtre', 'ventana')",0,3,0
"meantime the young woman continued to advance , counting the houses and windows .","('window', 'fenêtre', 'ventana')",0,12,0
""" ah , ah ! "" said the listener , "" not through doors , but through windows ! ah , this visit was expected .","('window', 'fenêtre', 'ventana')",0,17,0
milady mounted upon a chair and passed the upper part of her body through the window . she saw the young officer suspended over the abyss by a ladder of ropes .,"('window', 'fenêtre', 'ventana')",0,15,0
"cyrus harding and pencroft went to the room occupied by the stranger , who was found lying near the window and gazing at the sky .","('window', 'fenêtre', 'ventana')",0,19,0
""" very good , barrymore . we may talk further of this some other time . "" when the butler had gone i walked over to the black window , and i looked through a blurred pane at the driving clouds and at the tossing outline of the wind - swept trees . it is a wild night indoors , and what must it be in a stone hut upon the moor . what passion of hatred can it be which leads a man to lurk in such a place at such a time ! and what deep and earnest purpose can he have which calls for such a trial ! there , in that hut upon the moor , seems to lie the very centre of that problem which has vexed me so sorely . i swear that another day shall not have passed before i have done all that man can do to reach the heart of the mystery .","('window', 'fenêtre', 'ventana')",0,28,0
"after ned was dressed , i reentered the lounge , whose windows had been uncovered ; stationed next to conseil , i examined the strata surrounding and supporting the nautilus .","('window', 'vitre', 'cristal')",1,11,1
"not a second was to be lost . milady passed her two arms round felton ’s neck , and let herself slip out of the window .","('window', 'fenêtre', 'ventana')",0,25,0
""" oh ! "" cried mme . bonacieux , darting to the window , "" can it be he ? ""","('window', 'fenêtre', 'ventana')",0,12,0
"on looking around him , however , as he could perceive no threatening object , as nothing indicated that he ran any real danger , as the bench was comfortably covered with a well - stuffed cushion , as the wall was ornamented with a beautiful cordova leather , and as large red damask curtains , fastened back by gold clasps , floated before the window , he perceived by degrees that his fear was exaggerated , and he began to turn his head to the right and the left , upward and downward .","('window', 'fenêtre', 'ventana')",0,65,0
"the baron was one of the most powerful lords in westphalia , for his castle had not only a gate , but even windows , and his great hall was hung with tapestry .","('window', 'fenêtre', 'ventana')",0,23,0
""" no , "" said d’artagnan ; "" no , i confess it . it was chance that threw me in your way ; i saw a woman knocking at the window of one of my friends . ""","('window', 'fenêtre', 'ventana')",0,31,0
"the room in which i found myself was very large and lofty . the windows were long , narrow , and pointed , and at so vast a distance from the black oaken floor as to be altogether inaccessible from within .","('window', 'fenêtre', 'ventana')",0,14,0
"if the window had been open or even ajar , i should think nothing of it ; but , no -- all was hermetically sealed .","('window', 'fenêtre', 'ventana')",0,2,0
"in this apartment a continued buzzing prevailed from morning till night , while m. de treville , in his office contiguous to this antechamber , received visits , listened to complaints , gave his orders , and like the king in his balcony at the louvre , had only to place himself at the window to review both his men and arms .","('window', 'fenêtre', 'ventana')",0,54,0
""" in africa ! "" repeated passepartout . "" just think , monsieur , i had no idea that we should go farther than paris ; and all that i saw of paris was between twenty minutes past seven and twenty minutes before nine in the morning , between the northern and the lyons stations , through the windows of a car , and in a driving rain ! how i regret not having seen once more pere la chaise and the circus in the champs elysees ! ""","('window', 'vitre', 'cristal')",1,58,1
"i had risen half - an - hour before her entrance , and had washed my face , and put on my clothes by the light of a half - moon just setting , whose rays streamed through the narrow window near my crib .","('window', 'fenêtre', 'ventana')",0,40,0
""" i like this day ; i like that sky of steel ; i like the sternness and stillness of the world under this frost . i like thornfield , its antiquity , its retirement , its old crow - trees and thorn - trees , its grey facade , and lines of dark windows reflecting that metal welkin : and yet how long have i abhorred the very thought of it , shunned it like a great plague - house ? how i do still abhor-- ""","('window', 'fenêtre', 'ventana')",0,54,0
"and , as we shall not fire from the windows of granite house , the pirates will not think of causing irreparable damage by throwing shell against it .","('window', 'fenêtre', 'ventana')",0,9,0
one window was lighted .,"('window', 'fenêtre', 'ventana')",0,1,0
""" while i watched the window , he guarded the door . ""","('window', 'fenêtre', 'ventana')",0,5,0
"athos sprang from his horse , gave the bridle to grimaud , and advanced toward the window , after having made a sign to the rest of the troop to go toward the door .","('window', 'fenêtre', 'ventana')",0,16,0
"the little house was surrounded by a low , quickset hedge , two or three feet high . athos sprang over the hedge and went up to the window , which was without shutters , but had the half - curtains closely drawn .","('window', 'fenêtre', 'ventana')",0,28,0
"athos , perceiving that she knew him , pushed the window with his knee and hand . the window yielded .","('window', 'fenêtre', 'ventana')",0,10,0
"athos , perceiving that she knew him , pushed the window with his knee and hand . the window yielded .","('window', 'fenêtre', 'ventana')",0,18,0
""" yes ; the back parlour was both his study and ours : he sat near the window , and we by the table . ""","('window', 'fenêtre', 'ventana')",0,17,0
"the orator 's wife happened to put her head out of the window at that instant , when , seeing a man who doubted whether the pope was antichrist , she discharged upon his head a utensil full of water .","('window', 'fenêtre', 'ventana')",0,12,0
"milady remained for some minutes in the same position , for she thought they might perhaps be examining her through the keyhole ; she then slowly raised her head , which had resumed its formidable expression of menace and defiance , ran to the door to listen , looked out of her window , and returning to bury herself again in her large armchair , she reflected .","('window', 'fenêtre', 'ventana')",0,52,0
"if light was thus obtained , so would a means of access , for it would be as easy to pierce a door as windows , and to establish an exterior ladder .","('window', 'fenêtre', 'ventana')",0,24,0
the four lackeys guarded the door and the window .,"('window', 'fenêtre', 'ventana')",0,8,0
"we now slowly ascended a drive , and came upon the long front of a house : candlelight gleamed from one curtained bow - window ; all the rest were dark . the car stopped at the front door ; it was opened by a maid - servant ; i alighted and went in .","('window', 'fenêtre', 'ventana')",0,24,0
"it was not even probable that his attention had been awakened by the screen of green branches and creepers hiding the windows of granite house , and showing rather conspicuously on the bare rock .","('window', 'fenêtre', 'ventana')",0,21,0
"d’artagnan opened it , and as the day was beginning to decline , he approached the window to read it .","('window', 'fenêtre', 'ventana')",0,16,0
"then turning toward m. de treville and walking with him toward the embrasure of a window , "" well , monsieur , "" continued he , "" you say it is his eminence ’s guards who have sought a quarrel with your musketeers ? ""","('window', 'fenêtre', 'ventana')",0,15,0
"it was the engineer 's intention to divide the right portion of the cavern into several rooms , preceded by an entrance passage , and to light it by means of five windows and a door , pierced in the front .","('window', 'fenêtre', 'ventana')",0,32,0
"pencroft was much pleased with the five windows , but he could not understand the use of the door , since the passage offered a natural staircase , through which it would always be easy to enter granite house .","('window', 'fenêtre', 'ventana')",0,7,0
through two luminous windows saw,"('window', 'fenêtre', 'ventana')",0,3,0
"if we accept the hypotheses of the microbiologist ehrenberg-- who believes that these underwater depths are lit up by phosphorescent organisms -- nature has certainly saved one of her most prodigious sights for residents of the sea , and i could judge for myself from the thousandfold play of the light . on both sides i had windows opening over these unexplored depths . the darkness in the lounge enhanced the brightness outside , and we stared as if this clear glass were the window of an immense aquarium .","('window', 'fenêtre', 'ventana')",0,57,0
"having opened my chamber window , and seen that i left all things straight and neat on the toilet table , i ventured forth .","('window', 'fenêtre', 'ventana')",0,4,0
"he passed out of the room and began the ascent , basil hallward following close behind . they walked softly , as men do instinctively at night . the lamp cast fantastic shadows on the wall and staircase . a rising wind made some of the windows rattle .","('window', 'fenêtre', 'ventana')",0,46,0
""" in the street , facing your window , in the embrasure of that door -- a man wrapped in a cloak . ""","('window', 'fenêtre', 'ventana')",0,7,0
"planchet mounted by the window and installed himself across the doorway , while grimaud went and shut himself up in the stable , undertaking that by five o’clock in the morning he and the four horses should be ready .","('window', 'fenêtre', 'ventana')",0,4,0
"the front of granite house was then to be lighted by five windows and a door , besides a large bay window and some smaller oval ones , which would admit plenty of light to enter into the marvelous nave which was to be their chief room .","('window', 'fenêtre', 'ventana')",0,12,0
"when they opened the window , they saw the poor lad lying senseless , with his head split by a blow with a pitchfork .","('window', 'fenêtre', 'ventana')",0,4,0
"on re - entering the parlour , i found diana standing at the window , looking very thoughtful .","('window', 'fenêtre', 'ventana')",0,13,0
"the windows at granite house were soon furnished with panes ; not very white , perhaps , but still sufficiently transparent .","('window', 'fenêtre', 'ventana')",0,1,0
through the red - litten windows see,"('window', 'fenêtre', 'ventana')",0,5,0
"as long as the procurator ’s wife could follow him with her eyes , she waved her handkerchief to him , leaning so far out of the window as to lead people to believe she wished to precipitate herself .","('window', 'fenêtre', 'ventana')",0,27,0
""" it 's all these goings - on , sir , "" he cried at last , waving his hand towards the rain - lashed window which faced the moor . "" there 's foul play somewhere , and there 's black villainy brewing , to that i 'll swear ! very glad i should be , sir , to see sir henry on his way back to london again ! ""","('window', 'fenêtre', 'ventana')",0,25,0
"lord de winter , d’artagnan , athos , porthos , and aramis , went out close behind her . the lackeys followed their masters , and the chamber was left solitary , with its broken window , its open door , and its smoky lamp burning sadly on the table .","('window', 'fenêtre', 'ventana')",0,35,0
"herbert 's recovery progressed , and from his bed , placed near one of the windows of granite house , he could inhale the fresh air , charged with ozone , which could not fail to restore his health .","('window', 'fenêtre', 'ventana')",0,15,0
"a sudden thought struck him . he put on his fur coat and hat and went out into the hall . there he paused , hearing the slow heavy tread of the policeman on the pavement outside and seeing the flash of the bull's - eye reflected in the window . he waited and held his breath .","('window', 'fenêtre', 'ventana')",0,49,0
"at nine o’clock , lord de winter made his customary visit , examined the window and the bars , sounded the floor and the walls , looked to the chimney and the doors , without , during this long and minute examination , he or milady pronouncing a single word .","('window', 'fenêtre', 'ventana')",0,14,0
""" yes ; this is the dining - room . i have just opened the window , to let in a little air and sunshine ; for everything gets so damp in apartments that are seldom inhabited ; the drawing - room yonder feels like a vault . ""","('window', 'fenêtre', 'ventana')",0,15,0
"she pointed to a wide arch corresponding to the window , and hung like it with a tyrian - dyed curtain , now looped up .","('window', 'fenêtre', 'ventana')",0,9,0
"in a room without a window , there burnt a fire guarded by a high and strong fender , and a lamp suspended from the ceiling by a chain . grace poole bent over the fire , apparently cooking something in a saucepan .","('window', 'fenêtre', 'ventana')",0,5,0
