text,sense,label,ind,new_label
"i drew aside my curtains before i went to bed and looked out from my window . it opened upon the grassy space which lay in front of the hall door . beyond , two copses of trees moaned and swung in a rising wind . a half moon broke through the rifts of racing clouds . in its cold light i saw beyond the trees a broken fringe of rocks , and the long , low curve of the melancholy moor . i closed the curtain , feeling that my last impression was in keeping with the rest .","('window', 'fenêtre', 'ventana')",0,15,0
""" did n't it measure about six meters ? "" said conseil , who was stationed at the window and examining anew the crevices in the cliff .","('window', 'vitre', 'cristal')",1,18,1
he had risen and paced the room as he spoke . now he halted in the recess of the window . there was such a ring of conviction in his voice that i glanced up in surprise .,"('window', 'fenêtre', 'ventana')",0,19,0
"it appeared simplest to harding to make it of brick clay ; as creating an outlet for it to the upper plateau was not to be thought of , a hole was pierced in the granite above the window of the kitchen , and the pipe met it like that of an iron stove .","('window', 'fenêtre', 'ventana')",0,38,0
i stared at conseil . ned land rushed to the window .,"('window', 'vitre', 'cristal')",1,10,1
i returned to the window and fetched it thence .,"('window', 'fenêtre', 'ventana')",0,4,0
"“ you must not — you shall not behold this ! ” said i , shuddering , to usher , as i led him , with a gentle violence , from the window to a seat . “ these appearances , which bewilder you , are merely electrical phenomena not uncommon — or it may be that they have their ghastly origin in the rank miasma of the tarn .","('window', 'fenêtre', 'ventana')",0,32,0
"now , i 'll teach you to rummage my bookshelves : for they _ are _ mine ; all the house belongs to me , or will do in a few years . go and stand by the door , out of the way of the mirror and the windows . ""","('window', 'fenêtre', 'ventana')",0,49,0
"thick shutters closed the windows of the facade , until the engineer had time to make glass .","('window', 'fenêtre', 'ventana')",0,4,0
"gideon spilett had very artistically arranged on the rocky projections around the windows plants of different kinds , as well as long streaming grass , so that the openings were picturesquely framed in green , which had a pleasing effect .","('window', 'fenêtre', 'ventana')",0,12,0
"the view from the windows extended over a boundless horizon , which was closed by the two mandible capes on the north , and claw cape on the south .","('window', 'fenêtre', 'ventana')",0,4,0
"the apparatus had been placed at one of the windows of the dining - room at granite house , and consequently overlooked the shore and the bay .","('window', 'fenêtre', 'ventana')",0,9,0
"i continued sketching . these monsters kept pace in our waters with such precision , they seemed to be standing still , and i could have traced their outlines in miniature on the window . but we were moving at a moderate speed .","('window', 'vitre', 'cristal')",1,33,1
"while lord henry sat dreaming on these things , a knock came to the door , and his valet entered and reminded him it was time to dress for dinner . he got up and looked out into the street . the sunset had smitten into scarlet gold the upper windows of the houses opposite . the panes glowed like plates of heated metal . the sky above was like a faded rose . he thought of his friend 's young fiery - coloured life and wondered how it was all going to end .","('window', 'fenêtre', 'ventana')",0,50,0
"the same look of pity came into dorian gray 's eyes . then he stretched out his hand , took a piece of paper , and wrote something on it . he read it over twice , folded it carefully , and pushed it across the table . having done this , he got up and went over to the window .","('window', 'fenêtre', 'ventana')",0,60,0
""" i have been calling on mortimer , and he pointed you out to me from the window of his surgery as you passed . as our road lay the same way i thought that i would overtake you and introduce myself . i trust that sir henry is none the worse for his journey ? ""","('window', 'fenêtre', 'ventana')",0,17,0
harding examined it ; then seizing his telescope he rushed to the window .,"('window', 'fenêtre', 'ventana')",0,12,0
""" he is not a gentleman , mother , and i hate the way he talks to me , "" said the girl , rising to her feet and going over to the window .","('window', 'fenêtre', 'ventana')",0,33,0
"the candle , wasted at last , went out ; as it expired , i perceived streaks of grey light edging the window curtains : dawn was then approaching .","('window', 'fenêtre', 'ventana')",0,22,0
"milady opened the window , and made a sign to mme . bonacieux to join her .","('window', 'fenêtre', 'ventana')",0,3,0
""" the good george ! "" said she , closing the window with an expression of countenance full of affection and melancholy .","('window', 'fenêtre', 'ventana')",0,11,0
"the time seemed long ; the guide ever and anon left them to take an observation on the edge of the wood , but the guards watched steadily by the glare of the torches , and a dim light crept through the windows of the pagoda .","('window', 'fenêtre', 'ventana')",0,42,0
"but what the colonists could not do for themselves chance did for them , and on the 3rd of may shouts from neb , who had stationed himself at the kitchen window , announced that the whale was stranded on the beach of the island .","('window', 'fenêtre', 'ventana')",0,31,0
"from behind one pillar i could peep round quietly at the full front of the mansion . i advanced my head with precaution , desirous to ascertain if any bedroom window - blinds were yet drawn up : battlements , windows , long front -- all from this sheltered station were at my command .","('window', 'fenêtre', 'ventana')",0,40,0
"however , no light shone through the window .","('window', 'fenêtre', 'ventana')",0,7,0
"this was , in fact , the worst complaint of louis xiii , who would sometimes take one of his courtiers to a window and say , "" monsieur so - and - so , let us weary ourselves together . ""","('window', 'fenêtre', 'ventana')",0,23,0
she went to the window .,"('window', 'fenêtre', 'ventana')",0,4,0
"the lawn , the grounds were trodden and waste : the portal yawned void . the front was , as i had once seen it in a dream , but a well - like wall , very high and very fragile - looking , perforated with paneless windows : no roof , no battlements , no chimneys -- all had crashed in .","('window', 'fenêtre', 'ventana')",0,47,0
"mrs . fairfax surprised me by looking out of the window with a sad countenance , and saying gravely--""miss eyre , will you come to breakfast ? ""","('window', 'fenêtre', 'ventana')",0,10,0
"boats were often seen passing under the windows of the farm laden with effendis , bashaws , and cadis , that were going into banishment to lemnos , mytilene and erzerum . and other cadis , bashaws , and effendis were seen coming back to succeed the place of the exiles , and were driven out in their turns . they saw several heads curiously stuck upon poles , and carried as presents to the sublime porte .","('window', 'fenêtre', 'ventana')",0,7,0
through this window shone a mild light which silvered the foliage of two or three linden trees which formed a group outside the park .,"('window', 'fenêtre', 'ventana')",0,2,0
"in the meanwhile top was ordered to mount guard below the windows of granite house , and when top received an order he obeyed it without any questioning .","('window', 'fenêtre', 'ventana')",0,11,0
""" with windows to light them ! "" said herbert , laughing .","('window', 'fenêtre', 'ventana')",0,2,0
"i pointed out this circumstance to mrs . fairfax , who was standing at the window with me--","('window', 'fenêtre', 'ventana')",0,15,0
"ayrton at first paled slightly , and for a moment his eyes became dim ; then , leaning out the window , he surveyed the horizon , but could see nothing .","('window', 'fenêtre', 'ventana')",0,20,0
"from his windows he saw all the visitors who were caught . then , having removed a plank from his floor , and nothing remaining but a simple ceiling between him and the room beneath , in which the interrogatories were made , he heard all that passed between the inquisitors and the accused .","('window', 'fenêtre', 'ventana')",0,2,0
"m de treville smiled at this flourish ; and leaving his young man compatriot in the embrasure of the window , where they had talked together , he seated himself at a table in order to write the promised letter of recommendation .","('window', 'fenêtre', 'ventana')",0,19,0
the captain did n't reply but went to lean against the window .,"('window', 'vitre', 'cristal')",1,11,1
"adele , who appeared to be still under the influence of a most solemnising impression , sat down , without a word , on the footstool i pointed out to her . i retired to a window - seat , and taking a book from a table near , endeavoured to read .","('window', 'fenêtre', 'ventana')",0,36,0
"the lane was still deserted , and the same calm soft light shone through the window .","('window', 'fenêtre', 'ventana')",0,15,0
"it was with a renewed feeling of disappointment that she waved the tattered lace handkerchief from the window , as her son drove away . she was conscious that a great opportunity had been wasted . she consoled herself by telling sibyl how desolate she felt her life would be , now that she had only one child to look after . she remembered the phrase . it had pleased her . of the threat she said nothing . it was vividly and dramatically expressed . she felt that they would all laugh at it some day .","('window', 'fenêtre', 'ventana')",0,17,0
"suddenly he started . his eyes grew strangely bright , and he gnawed nervously at his underlip . between two of the windows stood a large florentine cabinet , made out of ebony and inlaid with ivory and blue lapis . he watched it as though it were a thing that could fascinate and make afraid , as though it held something that he longed for and yet almost loathed . his breath quickened . a mad craving came over him . he lit a cigarette and then threw it away . his eyelids drooped till the long fringed lashes almost touched his cheek . but he still watched the cabinet . at last he got up from the sofa on which he had been lying , went over to it , and having unlocked it , touched some hidden spring . a triangular drawer passed slowly out . his fingers moved instinctively towards it , dipped in , and closed on something . it was a small chinese box of black and gold - dust lacquer , elaborately wrought , the sides patterned with curved waves , and the silken cords hung with round crystals and tasselled in plaited metal threads . he opened it . inside was a green paste , waxy in lustre , the odour curiously heavy and persistent .","('window', 'fenêtre', 'ventana')",0,22,0
i took a seat in the lounge with conseil . through the open window we stared at the lower strata of this southernmost ocean . the thermometer rose again . the needle on the pressure gauge swerved over its dial .,"('window', 'vitre', 'cristal')",1,13,1
"once there , for greater security , the young man barricaded the door . they both approached the window , and through a slit in the shutter they saw bonacieux talking with a man in a cloak .","('window', 'fenêtre', 'ventana')",0,18,0
"and , at this moment , as if to bear witness to the truth of the sailor 's words , two or three quadrumana showed themselves at the windows , from which they had pushed back the shutters , and saluted the real proprietors of the place with a thousand hideous grimaces .","('window', 'fenêtre', 'ventana')",0,28,0
"the window was again opened slowly , and the same face appeared , only it was now still more pale than before .","('window', 'fenêtre', 'ventana')",0,1,0
"a moment after , those who , surprised by this tumult , had gone to their windows to learn the cause of it , saw the door open , and four men , clothed in black , not come out of it , but fly , like so many frightened crows , leaving on the ground and on the corners of the furniture , feathers from their wings ; that is to say , patches of their clothes and fragments of their cloaks .","('window', 'fenêtre', 'ventana')",0,16,0
"d’artagnan drew near the window , and lent his ear .","('window', 'fenêtre', 'ventana')",0,4,0
i sit in the shade -- if any shade there be in this brilliantly - lit apartment ; the window - curtain half hides me . again the arch yawns ; they come .,"('window', 'fenêtre', 'ventana')",0,19,0
""" why , these apes are so cunning , "" returned pencroft ; "" they wo n't show themselves again at the windows and so we ca n't kill them ; and when i think of the mischief they may do in the rooms and storehouse-- ""","('window', 'fenêtre', 'ventana')",0,22,0
"from the corner of the divan of persian saddle - bags on which he was lying , smoking , as was his custom , innumerable cigarettes , lord henry wotton could just catch the gleam of the honey - sweet and honey- coloured blossoms of a laburnum , whose tremulous branches seemed hardly able to bear the burden of a beauty so flamelike as theirs ; and now and then the fantastic shadows of birds in flight flitted across the long tussore - silk curtains that were stretched in front of the huge window , producing a kind of momentary japanese effect , and making him think of those pallid , jade - faced painters of tokio who , through the medium of an art that is necessarily immobile , seek to convey the sense of swiftness and motion .","('window', 'fenêtre', 'ventana')",0,93,0
"the neighbors who had opened their windows , with the coolness peculiar to the inhabitants of paris in these times of perpetual riots and disturbances , closed them again as soon as they saw the four men in black flee -- their instinct telling them that for the time all was over .","('window', 'fenêtre', 'ventana')",0,6,0
"barrymore was crouching at the window with the candle held against the glass . his profile was half turned towards me , and his face seemed to be rigid with expectation as he stared out into the blackness of the moor . for some minutes he stood watching intently . then he gave a deep groan and with an impatient gesture he put out the light . instantly i made my way back to my room , and very shortly came the stealthy steps passing once more upon their return journey . long afterwards when i had fallen into a light sleep i heard a key turn somewhere in a lock , but i could not tell whence the sound came . what it all means i can not guess , but there is some secret business going on in this house of gloom which sooner or later we shall get to the bottom of . i do not trouble you with my theories , for you asked me to furnish you only with facts . i have had a long talk with sir henry this morning , and we have made a plan of campaign founded upon my observations of last night . i will not speak about it just now , but it should make my next report interesting reading .","('window', 'fenêtre', 'ventana')",0,5,0
"this noise acted upon her joy like the storm which awakens the sleeper in the midst of a happy dream ; she grew pale and ran to the window , while mme . bonacieux , rising all in a tremble , supported herself upon her chair to avoid falling .","('window', 'fenêtre', 'ventana')",0,28,0
"the panels had opened , and i could see a completely white sea around the nautilus . steaming sulfurous fumes uncoiled in the midst of waves bubbling like water in a boiler . i leaned my hand against one of the windows , but the heat was so great , i had to snatch it back .","('window', 'vitre', 'cristal')",1,41,1
"two hours passed , during which the apes took care not to show themselves , but they were still there , and three or four times a nose or a paw was poked out at the door or windows , and was immediately saluted by a gun - shot .","('window', 'fenêtre', 'ventana')",0,38,0
"by this time she had found her way into a tidy little room with a table in the window , and on it ( as she had hoped ) a fan and two or three pairs of tiny white kid gloves : she took up the fan and a pair of the gloves , and was just going to leave the room , when her eye fell upon a little bottle that stood near the looking- glass . there was no label this time with the words ' drink me , ' but nevertheless she uncorked it and put it to her lips . ' i know something interesting is sure to happen , ' she said to herself , ' whenever i eat or drink anything ; so i 'll just see what this bottle does . i do hope it 'll make me grow large again , for really i 'm quite tired of being such a tiny little thing ! '","('window', 'fenêtre', 'ventana')",0,18,0
"presently the rabbit came up to the door , and tried to open it ; but , as the door opened inwards , and alice 's elbow was pressed hard against it , that attempt proved a failure . alice heard it say to itself ' then i 'll go round and get in at the window . '","('window', 'fenêtre', 'ventana')",0,56,0
"' that you wo n't ' thought alice , and , after waiting till she fancied she heard the rabbit just under the window , she suddenly spread out her hand , and made a snatch in the air . she did not get hold of anything , but she heard a little shriek and a fall , and a crash of broken glass , from which she concluded that it was just possible it had fallen into a cucumber - frame , or something of the sort .","('window', 'fenêtre', 'ventana')",0,23,0
"' now tell me , pat , what 's that in the window ? '","('window', 'fenêtre', 'ventana')",0,12,0
"' an arm , you goose ! who ever saw one that size ? why , it fills the whole window ! '","('window', 'fenêtre', 'ventana')",0,20,0
""" perhaps then he pays a visit every night to that particular window , "" i suggested .","('window', 'fenêtre', 'ventana')",0,12,0
"gideon spilett and herbert went to take their share of the breakfast , leaving top to watch under the windows .","('window', 'fenêtre', 'ventana')",0,19,0
"it was during the night of december 9 - 10 that the nautilus encountered this army of distinctly nocturnal mollusks . they numbered in the millions . they were migrating from the temperate zones toward zones still warmer , following the itineraries of herring and sardines . we stared at them through our thick glass windows : they swam backward with tremendous speed , moving by means of their locomotive tubes , chasing fish and mollusks , eating the little ones , eaten by the big ones , and tossing in indescribable confusion the ten feet that nature has rooted in their heads like a hairpiece of pneumatic snakes . despite its speed , the nautilus navigated for several hours in the midst of this school of animals , and its nets brought up an incalculable number , among which i recognized all nine species that professor orbigny has classified as native to the pacific ocean .","('window', 'vitre', 'cristal')",1,55,1
they heard the horsemen pass under the windows .,"('window', 'fenêtre', 'ventana')",0,7,0
"the ceiling lights in the lounge then went out , the panels opened , and through the windows i saw , for a half - mile radius , the sea brightly lit by the beacon 's rays .","('window', 'vitre', 'cristal')",1,17,1
"i stood up , went , leaned on my elbows before the window , and i saw it .","('window', 'vitre', 'cristal')",1,12,1
"all five advanced and indeed , through the window fronting them , they saw glimmering a feeble light .","('window', 'fenêtre', 'ventana')",0,8,0
"' a barrowful of what ? ' thought alice ; but she had not long to doubt , for the next moment a shower of little pebbles came rattling in at the window , and some of them hit her in the face . ' i 'll put a stop to this , ' she said to herself , and shouted out , ' you 'd better not do that again ! ' which produced another dead silence .","('window', 'fenêtre', 'ventana')",0,32,0
two or three ran and clambered from one window to another with the agility of acrobats .,"('window', 'fenêtre', 'ventana')",0,8,0
""" open the window , then ! you have been at your club all day , i perceive . ""","('window', 'fenêtre', 'ventana')",0,3,0
"we had arranged no plan of campaign , but the baronet is a man to whom the most direct way is always the most natural . he walked into the room , and as he did so barrymore sprang up from the window with a sharp hiss of his breath and stood , livid and trembling , before us . his dark eyes , glaring out of the white mask of his face , were full of horror and astonishment as he gazed from sir henry to me .","('window', 'fenêtre', 'ventana')",0,42,0
