text,sense,label,ind,new_label
"they set noiselessly to work , and the parsee on one side and passepartout on the other began to loosen the bricks so as to make an aperture two feet wide . they were getting on rapidly , when suddenly a cry was heard in the interior of the temple , followed almost instantly by other cries replying from the outside . passepartout and the guide stopped . had they been heard ? was the alarm being given ? common prudence urged them to retire , and they did so , followed by phileas fogg and sir francis . they again hid themselves in the wood , and waited till the disturbance , whatever it might be , ceased , holding themselves ready to resume their attempt without delay . but , awkwardly enough , the guards now appeared at the rear of the temple , and there installed themselves , in readiness to prevent a surprise .","('cry', 'cri', 'gritar')",2,41,2
"suddenly , to my intense astonishment , i noticed a strange fact , and i uttered a cry of surprise .","('cry', 'cri', 'gritar')",2,17,2
"i listened , i watched in the darkness for an answer , a cry , a mere breath of sound , but nothing came . some minutes passed . a whole world of ideas had opened in my mind . i thought that my weakened voice could never penetrate to my companions .","('cry', 'cri', 'gritar')",2,13,2
""" and her husband found out that she had a fleur - de - lis on her shoulder ? "" cried porthos .","('cry', 'écrier', 'exclamar')",0,20,0
""" oh ! "" cried he , "" those are not gulls nor sea - mews ! ""","('cry', 'écrier', 'exclamar')",0,4,0
the three friends uttered a cry of surprise .,"('cry', 'cri', 'gritar')",2,5,2
""" ah ! "" cried he , on perceiving d’artagnan , "" ah ! this is frightful !","('cry', 'écrier', 'exclamar')",0,4,0
""" is the child dumb ? "" cried the professor , who , proud of his knowledge of many languages , now tried french : "" _ comment appellet - on cette montagne , mon enfant ? _ ""","('cry', 'écrier', 'exclamar')",0,7,0
""" halloo ! "" cried jussac , advancing toward them and making a sign to his men to do so likewise , "" halloo , musketeers ? fighting here , are you ?","('cry', 'écrier', 'exclamar')",1,4,0
""" no , upon my honor ! "" cried his majesty ’s guardsman .","('cry', 'écrier', 'exclamar')",0,8,0
