text,sense,label,ind,new_label
"now , if the convicts were suspecting nothing , if they knew nothing of the expedition against them , if , lastly , there now existed a chance of surprising them , ought this chance to be lost by inconsiderately attempting to cross the palisades ?","('chance', 'chance', 'probabilidad')",0,34,0
"a short time ago , while making researches in the royal library for my history of louis xiv , i stumbled by chance upon the memoirs of m. d’artagnan , printed -- as were most of the works of that period , in which authors could not tell the truth without the risk of a residence , more or less long , in the bastille -- at amsterdam , by pierre rouge .","('chance', 'hasard', 'casualidad')",2,22,2
""" my dear friend , "" said aramis , "" remember that he goes in an opposite direction from that in which we are going , that he has a fresh horse , and ours are fatigued , so that we shall disable our own horses without even a chance of overtaking him .","('chance', 'chance', 'posibilidad')",1,49,1
""" will that be the answer , "" replied the secretary , smiling , "" which he must transmit to his majesty if , by chance , his majesty should have the curiosity to know why no vessel is to leave any of the ports of great britain ? ""","('chance', 'hasard', 'casualidad')",2,25,2
"luckily for alice , the little magic bottle had now had its full effect , and she grew no larger : still it was very uncomfortable , and , as there seemed to be no sort of chance of her ever getting out of the room again , no wonder she felt unhappy .","('chance', 'chance', 'posibilidad')",1,37,1
""" i mean to say that since we last met you have changed your religion . you have not by chance married a protestant for a third husband , have you ? ""","('chance', 'hasard', 'casualidad')",2,20,2
""" pencroft , "" replied the engineer , placing his hand on the sailor 's shoulder , "" if any misfortune happens to you , or to this lad , whom chance has made our child , do you think we could ever cease to blame ourselves ? ""","('chance', 'hasard', 'casualidad')",2,31,2
there is a chance of it .,"('chance', 'chance', 'probabilidad')",0,3,0
