text,sense,label,ind,new_label
""" i was then right in saying , "" exclaimed the sailor , "" that even after his death the captain would render us a last service . ""","('sailor', 'marin', 'marinar')",0,11,0
""" well , captain , what are we stopping for ? "" asked the sailor , impatient to enter the narrow passage .","('sailor', 'marin', 'marinar')",0,14,0
"captain harding had listened to the sailor without saying a word , but his eyes shone with satisfaction .","('sailor', 'marin', 'marinar')",0,6,0
""" and we will save him , "" replied the sailor . "" we will nurse him as if he was one of ourselves . ""","('sailor', 'marin', 'marinar')",0,10,0
"the sailor was wounded himself , but his wound was insignificant , as were those of his companions ; for thanks to their firearms they had been almost always able to keep their assailants at a distance .","('sailor', 'marin', 'marinar')",0,1,0
""" how many people do you wish to bring with you ? "" asked the sailor .","('sailor', 'marin', 'marinar')",0,15,0
""" why uninhabitable ? "" asked the sailor .","('sailor', 'marin', 'marinar')",0,7,0
"this work had been so quickly done , that pencroft , gideon spilett , and herbert found time to make an expedition to port balloon , the sailor was very anxious to know if the little creek in which the "" bonadventure "" was moored , had been visited by the convicts .","('sailor', 'marin', 'marinar')",0,27,0
"the sailor and his companions set off on the 10th of november , after dinner , well armed .","('sailor', 'marin', 'marinar')",0,1,0
""" well , the ' bonadventure ' is always there , mr . spilett , "" answered the sailor .","('sailor', 'marin', 'marinar')",1,18,0
"it was the work of a few minutes only , and the sailor rejoined his companions .","('sailor', 'marin', 'marinar')",0,12,0
""" it would amuse me all the same , "" resumed the sailor , "" if some fine day he said to me , ' suppose we change pipes , pencroft . ' ""","('sailor', 'marin', 'marinar')",0,12,0
""" some money , sir -- not much , and a six - shooter . there was no name of any kind . a decent - looking man , sir , but rough - like . a sort of sailor we think . ""","('sailor', 'matelot', 'marinero')",2,39,2
"harding , not knowing what the future might have in store for them , approved the sailor 's idea of making the craft as strong as possible .","('sailor', 'marin', 'marinar')",0,16,0
"all at once , the sailor having examined the bitts to which the cable of the anchor was secured,--","('sailor', 'marin', 'marinar')",0,5,0
"the sailor , observing the heavy surf on the shore , shook his head .","('sailor', 'marin', 'marinar')",0,1,0
""" i am not mistaken ! "" declared the sailor .","('sailor', 'marin', 'marinar')",1,9,0
""" never mind , "" added the sailor , "" i should like very much to be top just for a quarter of an hour , for he does n't bark for nothing ! ""","('sailor', 'marin', 'marinar')",1,7,0
""" however that may be , "" said the sailor , "" as sure as my name is bonadventure pencroft , of the vineyard , our ' bonadventure ' has sailed without us ! ""","('sailor', 'marin', 'marinar')",0,9,0
the sailor was positive that neither gideon spilett nor herbert could dispute his statement .,"('sailor', 'marin', 'marinar')",0,1,0
"as to the sailor , he had not the slightest doubt that the anchor had been raised and then dropped again .","('sailor', 'marin', 'marinar')",0,3,0
""" why , mr . spilett , "" replied the sailor , "" they would only have to start in the night with a good breeze , and they would be out of sight of the island in two hours . ""","('sailor', 'marin', 'marinar')",0,10,0
""" why , mr . spilett , "" replied the sailor , "" we must put that among the unaccountable things , and not think anything more about it .","('sailor', 'marin', 'marinar')",0,10,0
"the sailor approached him , and touching his arm , "" captain ! "" said he .","('sailor', 'marin', 'marinar')",0,1,0
""" i am not particular about anything at all , "" retorted the sailor , who was rather vexed by the engineer 's opposition , but who did not wish to cause him anxiety .","('sailor', 'marin', 'marinar')",0,13,0
"while he was proving his argument a priori , the ship foundered , and the whole crew perished , except pangloss , candide , and the sailor who had been the means of drowning the good anabaptist . the villain swam ashore ; but pangloss and candide reached the land upon a plank .","('sailor', 'matelot', 'marinero')",2,26,2
"the sailor , whistling and swearing , cried , "" damn it , there 's something to be got here . ""","('sailor', 'matelot', 'marinero')",2,1,2
"the sailor , defying death in the pursuit of plunder , rushed into the midst of the ruin , where he found some money , with which he got drunk , and , after he had slept himself sober he purchased the favors of the first good - natured wench that came in his way , amidst the ruins of demolished houses and the groans of half - buried and expiring persons . pangloss pulled him by the sleeve . "" friend , "" said he , "" this is not right , you trespass against the universal reason , and have mistaken your time . ""","('sailor', 'matelot', 'marinero')",2,1,2
""" what 's the matter , "" replied the sailor ; "" a rock ? ""","('sailor', 'marin', 'marinar')",0,9,0
"while the gaze of the reporter and neb were cast upon the ocean , the sailor and herbert looked eagerly for the coast in the west .","('sailor', 'marin', 'marinar')",0,15,0
""" are you quite sure of that , pencroft ? "" asked the engineer , looking at the sailor .","('sailor', 'marin', 'marinar')",0,18,0
""" it appears fortunate , that 's all , "" answered the sailor .","('sailor', 'marin', 'marinar')",1,12,0
"they asked me what i was , in portuguese , and in spanish , and in french , but i understood none of them ; but at last a scotch sailor , who was on board , called to me : and i answered him , and told him i was an englishman , that i had made my escape out of slavery from the moors , at sallee ; they then bade me come on board , and very kindly took me in , and all my goods .","('sailor', 'matelot', 'marinero')",2,30,2
""" but , "" as the sailor said , "" they quite took the wind out of the sails of the robinsons , for whom everything was done by a miracle . ""","('sailor', 'marin', 'marinar')",0,6,0
"from time to time herbert relieved him at the helm , and the lad 's hand was so firm that the sailor had not a point to find fault with .","('sailor', 'marin', 'marinar')",0,21,0
"when the sailor was enthusiastic , neb always looked as if he would say , "" nothing could be more natural . ""","('sailor', 'marin', 'marinar')",0,2,0
""" there is some good and some bad , as in everything , "" replied the sailor .","('sailor', 'marin', 'marinar')",1,16,0
"all at once the reporter sprang up , and telling the sailor that he would rejoin them at that same place , he climbed the cliff in the direction which the negro neb had taken a few hours before .","('sailor', 'marin', 'marinar')",0,11,0
the sailor had only heard the last words uttered by the reporter .,"('sailor', 'marin', 'marinar')",0,1,0
""" i 'll pay the villains off ! "" cried the sailor , shaking his fist in a menacing manner .","('sailor', 'marin', 'marinar')",0,11,0
"the sailor and his two companions returned to the shore , to the place where they had left the "" bonadventure . ""","('sailor', 'marin', 'marinar')",0,1,0
"the sailor had at first lighted a fire in the hut , which was not wanting in things necessary for life .","('sailor', 'marin', 'marinar')",0,1,0
"the sailor ascertained that at this time -- that is to say , at low tide , when the rising floods did not reach it -- it was sweet .","('sailor', 'marin', 'marinar')",0,1,0
"the sailor and his companions naturally followed the route which cut diagonally across the island , and they were thus obliged to follow the stream which flowed towards the sea .","('sailor', 'marin', 'marinar')",0,1,0
the sailor then thought that they could utilize this ebb and flow for the transport of heavy objects .,"('sailor', 'marin', 'marinar')",0,1,0
"after having walked for a quarter of an hour , the sailor and the boy arrived at the angle which the river made in turning towards the left .","('sailor', 'marin', 'marinar')",0,11,0
""" my captain kept me concealed behind him , and with his drawn scimitar cut down everyone who opposed him ; at length i saw all our italian women and my mother mangled and torn in pieces by the monsters who contended for them . the captives , my companions , the moors who took us , the soldiers , the sailors , the blacks , the whites , the mulattoes , and lastly , my captain himself , were all slain , and i remained alone expiring upon a heap of dead bodies .","('sailor', 'matelot', 'marinero')",2,61,2
""" to talk about ? "" asked the sailor .","('sailor', 'marin', 'marinar')",0,8,0
""" well , my boy , "" replied the sailor , "" there must be some way of carrying this wood ; there is always a way of doing everything .","('sailor', 'marin', 'marinar')",0,9,0
"the sailor , followed by herbert , directed his steps towards the river .","('sailor', 'marin', 'marinar')",0,1,0
"in a kind of little bay , created by a point of the shore which broke the current , the sailor and the lad placed some good - sized pieces of wood , which they had fastened together with dry creepers . a raft was thus formed , on which they stacked all they had collected , sufficient , indeed , to have loaded at least twenty men .","('sailor', 'marin', 'marinar')",0,20,0
""" he will not return , "" said the sailor , shaking his head .","('sailor', 'marin', 'marinar')",0,9,0
"no ! no ! "" repeated the sailor , in a tone of conviction ; "" no , he has not left the island !","('sailor', 'marin', 'marinar')",0,7,0
the sailor shook his head sadly .,"('sailor', 'marin', 'marinar')",0,1,0
"at the point where the sailor had left his raft of wood , it began to run between the two high granite walls ; but if on the left bank the wall remained clear and abrupt , on the right bank , on the contrary , it sank gradually , the massive sides changed to isolated rocks , the rocks to stones , the stones to shingle running to the extremity of the point .","('sailor', 'marin', 'marinar')",0,5,0
""" are we on an island ? "" murmured the sailor .","('sailor', 'marin', 'marinar')",0,10,0
""" bread , cakes , tarts ! "" replied the sailor .","('sailor', 'marin', 'marinar')",1,10,0
""" one , i suppose ! "" replied the sailor , surprised at the question .","('sailor', 'marin', 'marinar')",0,9,0
""" very little indeed , "" answered the sailor , "" and we will save the survivor of her crew if he is still living , to whatever country he may belong .","('sailor', 'marin', 'marinar')",0,8,0
""" no , "" replied the sailor ; "" but what i do know is , that i am nothing better than a fool ! ""","('sailor', 'marin', 'marinar')",0,6,0
"but a sailor is never at a loss when there is a question of cables or ropes , and pencroft rapidly twisted a cord , a few fathoms long , made of dry creepers .","('sailor', 'marin', 'marinar')",0,2,0
"this vegetable cable was fastened to the after - part of the raft , and the sailor held it in his hand while herbert , pushing off the raft with a long pole , kept it in the current .","('sailor', 'marin', 'marinar')",0,16,0
"herbert accordingly took the path which led towards the cultivated part of the islet , while the sailor and the reporter entered the forest .","('sailor', 'marin', 'marinar')",0,17,0
""" provided it grows ! "" cried the sailor .","('sailor', 'marin', 'marinar')",0,8,0
"the sailor was of herculean strength , the reporter also very powerful , and in spite of the monster 's resistance he was firmly tied so that he could not even move .","('sailor', 'marin', 'marinar')",0,1,0
""" god forbid ! "" replied the sailor .","('sailor', 'marin', 'marinar')",0,7,0
"their wood was stowed away in one of the rooms , and the sailor laid in the fireplace some logs and brushwood .","('sailor', 'marin', 'marinar')",0,13,0
"the sailor rushed out , followed by the boy .","('sailor', 'marin', 'marinar')",0,1,0
""" i knew better than that , "" replied the sailor ; "" but such a small article could easily disappear in the tumbling about we have gone through .","('sailor', 'marin', 'marinar')",0,10,0
""" shall we leave him bound ? "" asked the sailor .","('sailor', 'marin', 'marinar')",0,10,0
"as to the sailor , from the moment when he found that the foxes were not classed in the genus eatable , they were nothing to him .","('sailor', 'marin', 'marinar')",0,3,0
""" no , my boy , "" replied the sailor ; "" they were in a copper box which shut very tightly ; and now what are we to do ? ""","('sailor', 'marin', 'marinar')",1,9,0
""" i doubt it , "" replied the sailor , shaking his head , "" for neither neb nor captain harding smoke , and i believe that mr . spilett would rather keep his note - book than his match - box . ""","('sailor', 'marin', 'marinar')",0,8,0
"before returning to the cave , the sailor and herbert , in the event of fire being positively unattainable , collected some more shell - fish , and then silently retraced their steps to their dwelling .","('sailor', 'marin', 'marinar')",0,7,0
"but on the sailor showing him one of the ducks which herbert had killed , he pounced on it like a wild beast , and devoured it greedily .","('sailor', 'marin', 'marinar')",0,3,0
"their situation was truly serious , and the sailor had reason to fear that he was lost on the wide sea without any possibility of recovering his course .","('sailor', 'marin', 'marinar')",0,8,0
""" confound it ! "" exclaimed the sailor .","('sailor', 'marin', 'marinar')",0,7,0
""" who knows ? "" answered the sailor , who did not hazard this shameful supposition without hesitating .","('sailor', 'marin', 'marinar')",0,7,0
"the sailor first made sure that it was quite dry ; that done , "" we must have some paper , "" said he .","('sailor', 'marin', 'marinar')",0,1,0
""" excuse me , captain , "" replied the sailor , "" we are four . ""","('sailor', 'marin', 'marinar')",0,9,0
""" row ! "" said he to the sailors .","('sailor', 'matelot', 'marinero')",2,8,2
"a minute later the dry wood crackled and a cheerful flame , assisted by the vigorous blowing of the sailor , sprang up in the midst of the darkness .","('sailor', 'marin', 'marinar')",0,19,0
""" no , captain , "" answered the sailor , "" and i repented of my suspicion a long time ago !","('sailor', 'marin', 'marinar')",0,8,0
"the sailor had also made snares from the long tough fibers of a certain plant , and they were even more successful than the traps .","('sailor', 'marin', 'marinar')",0,1,0
""" my boy , "" replied the sailor , bending over the trap and drawing out one of these representatives of the family of sus by the little appendage which served it as a tail . "" let me believe that these are pigs . ""","('sailor', 'marin', 'marinar')",0,7,0
""" i am very fond of pig , "" replied the sailor , "" particularly of its feet , and if it had eight instead of four , i should like it twice as much ! ""","('sailor', 'marin', 'marinar')",0,11,0
""" in port balloon , "" replied the sailor .","('sailor', 'marin', 'marinar')",1,8,0
"an illusion perhaps , but still an illusion to be respected , and one which the sailor did not wish to destroy .","('sailor', 'marin', 'marinar')",0,16,0
"herbert and the sailor then re - embarked on board the "" bonadventure , "" the anchor was weighed , the sail hoisted , and the wind drove her rapidly towards claw cape .","('sailor', 'marin', 'marinar')",0,3,0
""" to the chase , herbert , "" said the sailor .","('sailor', 'marin', 'marinar')",1,10,0
the sailor thought it very sensible advice .,"('sailor', 'marin', 'marinar')",0,1,0
"they spoke most often of things belonging to the navy , which must interest a sailor .","('sailor', 'marin', 'marinar')",0,15,0
"i did n't reply , and while staring at these suspicious waves , i began to put on my heavy aquatic clothes , helped by the longboat 's sailors . captain nemo and my two companions suited up as well . none of the nautilus 's men were to go with us on this new excursion .","('sailor', 'matelot', 'marinero')",2,28,2
"meanwhile , the sailor attentively observed the disposition and nature of the surrounding country .","('sailor', 'marin', 'marinar')",0,3,0
"an instant later , the longboat 's sailors helped us overboard one after the other , and we set foot on level sand in a meter and a half of water . captain nemo gave us a hand signal . we followed him down a gentle slope and disappeared under the waves .","('sailor', 'matelot', 'marinero')",2,7,2
""" this will be a good opportunity to taste jacamar , "" replied the sailor , "" if that fellow is in a humor to be roasted ! ""","('sailor', 'marin', 'marinar')",0,14,0
""" no , no , my boy ! "" replied the sailor .","('sailor', 'marin', 'marinar')",1,11,0
"the sailor and the lad , creeping among the grass , arrived at the foot of a tree , whose lower branches were covered with little birds .","('sailor', 'marin', 'marinar')",0,1,0
""" then it will be seasonable ! "" said the sailor .","('sailor', 'marin', 'marinar')",0,10,0
"so the sailor actively pursued his researches , though he exclaimed , when some animal which he had not even time to recognize fled into the long grass , "" if only we had had the dog top ! ""","('sailor', 'marin', 'marinar')",0,2,0
the sailor reported these words to his companions .,"('sailor', 'marin', 'marinar')",0,1,0
"it was , therefore , nineteen days since neb had had other news than that brought by top -- disastrous news : ayrton disappeared , herbert severely wounded , the engineer , reporter , and sailor , as it were , imprisoned in the corral !","('sailor', 'marin', 'marinar')",0,35,0
"back on board , the sailors helped divest us of our heavy copper carapaces .","('sailor', 'matelot', 'marinero')",2,5,2
"a whole half - hour passed , but then , as the sailor had surmised , several couple of grouse returned to their nests .","('sailor', 'marin', 'marinar')",0,12,0
""" i do n't know what sort of a man we have brought here , "" said the sailor .","('sailor', 'marin', 'marinar')",1,18,0
"it was the first time that he had ever seen birds taken with a line , but the sailor modestly confessed that it was not his first attempt , and that besides he could not claim the merit of invention .","('sailor', 'marin', 'marinar')",0,18,0
""" we are going to have a dirty night , mr . spilett ! "" said the sailor : "" petrels delight in wind and rain . ""","('sailor', 'marin', 'marinar')",1,17,0
the sailor had not expected this question .,"('sailor', 'marin', 'marinar')",0,1,0
""" that 's right , that 's right , "" returned the sailor , who was not pleased whenever he heard his chase made light of . "" you like to make objections .","('sailor', 'marin', 'marinar')",0,12,0
""" it is not astonishing , with such a heavy sea , "" replied the sailor .","('sailor', 'marin', 'marinar')",1,15,0
"and the sailor , followed by neb , entered the kitchen , where they were soon absorbed in their culinary labors .","('sailor', 'marin', 'marinar')",0,2,0
"having said this , the sailor returned to the chimneys .","('sailor', 'marin', 'marinar')",0,5,0
""" the matter ? the matter is that i have just broken a tooth ! "" replied the sailor .","('sailor', 'marin', 'marinar')",0,18,0
""" but , "" observed the sailor , "" there is one thing which i can not explain . ""","('sailor', 'marin', 'marinar')",0,6,0
""" and then , "" continued the sailor , "" if the document was several years old , if it had been shut up in that bottle for several years , it would have been injured by damp .","('sailor', 'marin', 'marinar')",0,7,0
""" no ! a hundred times no ! a thousand times no ! "" cried the sailor , springing up from the table .","('sailor', 'marin', 'marinar')",0,16,0
"the sailor strained his ears , but could hear no noise beyond those caused by the storm .","('sailor', 'marin', 'marinar')",0,1,0
""" it 's not possible ! "" replied the sailor .","('sailor', 'marin', 'marinar')",1,9,0
""" captain , "" asked the sailor , "" would it not be a good plan , before setting out , to build a canoe in which we could either ascend the river , or , if we liked , coast round the inland ?","('sailor', 'marin', 'marinar')",0,6,0
""" yes , a real boat , "" replied the sailor ; "" but we do not want one for a sea voyage , and in five days at the most , i will undertake to construct a canoe fit to navigate the mercy . ""","('sailor', 'marin', 'marinar')",0,10,0
"the sailor squeezed the reporter 's hand , for he could not make himself heard , in a way which signified "" wait ! "" then he reentered the passage .","('sailor', 'marin', 'marinar')",0,1,0
""" we will find him ! "" repeated the sailor .","('sailor', 'marin', 'marinar')",0,9,0
"while the sailor , seconded by the engineer , thus occupied himself without losing an hour , gideon spilett and herbert were not idle .","('sailor', 'marin', 'marinar')",0,2,0
"the reporter and herbert walked behind the dog , and the sailor brought up the rear .","('sailor', 'marin', 'marinar')",0,11,0
"as soon as the sailor and his companions left the precipice , the wind struck them again with renewed fury .","('sailor', 'marin', 'marinar')",0,4,0
"arrived at the dockyard , where the engineer and the sailor were working together , herbert recounted what had happened .","('sailor', 'marin', 'marinar')",0,10,0
""" oh ! the stupids ! "" cried the sailor , "" to have let at least fifty meals escape ! ""","('sailor', 'marin', 'marinar')",1,9,0
""" hurrah ! "" cried the sailor , who did not disdain to celebrate thus his own triumph .","('sailor', 'marin', 'marinar')",0,6,0
""" that 's nothing , neb , "" replied the sailor ; "" the wood will get seasoned .","('sailor', 'marin', 'marinar')",1,10,0
""" that was well said , captain , "" replied the sailor , "" but , all the same , it is my opinion that we shall not find the gentleman until he pleases . ""","('sailor', 'marin', 'marinar')",0,11,0
"the sailor first crossed the channel , and steered close to the southern point of the islet .","('sailor', 'marin', 'marinar')",0,1,0
""" but , captain-- "" answered the sailor , little disposed to obey .","('sailor', 'marin', 'marinar')",0,7,0
""" barrels , barrels , which perhaps are full , "" replied the sailor .","('sailor', 'marin', 'marinar')",0,13,0
""" it 's my opinion , "" said the sailor , "" that captain harding will be able to listen to you still better , if he will have some more grouse jelly,--for we have grouse , captain , "" added he , presenting him with a little of this jelly , to which he this time added some of the flesh .","('sailor', 'marin', 'marinar')",0,9,0
""" well ! "" said the sailor , "" there is plenty of food at the chimneys , for you must know , captain , that down there , in the south , we have a house , with rooms , beds , and fireplace , and in the pantry , several dozen of birds , which our herbert calls couroucous .","('sailor', 'marin', 'marinar')",0,6,0
"lord glenarvan , his wife , the two children , the major , the frenchman , captain mangles , and a few sailors composed the little band under the command of ayrton , while the ' duncan , ' under charge of the mate , tom austin , proceeded to melbourne , there to await lord glenarvan 's instructions .","('sailor', 'matelot', 'marinero')",2,22,2
"and the sailor , raising a heavy block , was about to break in one of the sides of the chest , when the engineer arrested his hand .","('sailor', 'marin', 'marinar')",0,2,0
"gideon spilett and the sailor were not men to draw back , but they knew that any imprudence on their part , of which they would be the first victims , would fall afterwards on their companions .","('sailor', 'marin', 'marinar')",0,4,0
"the reporter and the sailor hearing nothing , asked themselves whether they had not better scale the palisades and penetrate into the corral .","('sailor', 'marin', 'marinar')",0,4,0
the sailor did as the engineer requested .,"('sailor', 'marin', 'marinar')",0,1,0
""" if only there was-- "" said the sailor in a low voice .","('sailor', 'marin', 'marinar')",0,8,0
"but he was obliged to lean on the sailor , or he would have fallen .","('sailor', 'marin', 'marinar')",0,8,0
""" even the photographic box ! "" exclaimed the sailor incredulously .","('sailor', 'marin', 'marinar')",0,9,0
"it was open ! "" what do you say now ? "" asked the engineer , turning to the sailor and spilett .","('sailor', 'marin', 'marinar')",0,19,0
""" but has ayrton told the truth ? "" asked the sailor .","('sailor', 'marin', 'marinar')",0,11,0
