text,ind,sense,label
"passepartout 's visage darkened with the skies , and for two days the poor fellow experienced constant fright . but phileas fogg was a bold mariner , and knew how to maintain headway against the sea ; and he kept on his course , without even decreasing his steam . the henrietta , when she could not rise upon the waves , crossed them , swamping her deck , but passing safely . sometimes the screw rose out of the water , beating its protruding end , when a mountain of water raised the stern above the waves ; but the craft always kept straight ahead .",11,"('day', 'jour', 'día')",0
"a few moments after , the funnel of the henrietta vomited forth torrents of smoke . the vessel continued to proceed with all steam on ; but on the 18th , the engineer , as he had predicted , announced that the coal would give out in the course of the day .",51,"('day', 'journée', 'día')",1
""" then i must be mad ; for do n't i see the light of day , and do n't i hear the wind blowing , and the sea breaking on the shore ? """,15,"('day', 'jour', 'día')",0
"it was necessary to have dry wood to keep the steam up to the adequate pressure , and on that day the poop , cabins , bunks , and the spare deck were sacrificed . on the next day , the 19th of december , the masts , rafts , and spars were burned ; the crew worked lustily , keeping up the fires . passepartout hewed , cut , and sawed away with all his might . there was a perfect rage for demolition .",20,"('day', 'jour', 'día')",0
it will be easily conceived that after an imprisonment of forty seven days in a narrow gallery it was the height of physical enjoyment to breathe a moist air impregnated with saline particles .,12,"('day', 'jour', 'día')",0
"fix was out of breath , and his hair was in disorder . he could not speak . "" sir , "" he stammered , "" sir -- forgive me -- most -- unfortunate resemblance -- robber arrested three days ago -- you are free ! """,39,"('day', 'jour', 'día')",0
"first of all , the worthy fellow had gone up to his room , and had extinguished the gas burner , which had been burning for eighty days . he had found in the letter - box a bill from the gas company , and he thought it more than time to put a stop to this expense , which he had been doomed to bear .",27,"('day', 'jour', 'día')",0
""" and weep over a faithless florizel , "" said lord henry , laughing , as he leaned back in his chair . "" my dear dorian , you have the most curiously boyish moods . do you think this girl will ever be really content now with any one of her own rank ? i suppose she will be married some day to a rough carter or a grinning ploughman . well , the fact of having met you , and loved you , will teach her to despise her husband , and she will be wretched . from a moral point of view , i can not say that i think much of your great renunciation . even as a beginning , it is poor . besides , how do you know that hetty is n't floating at the present moment in some starlit mill - pond , with lovely water - lilies round her , like ophelia ? """,62,"('day', 'jour', 'día')",0
"throughout this day ( sunday ) the house in saville row was as if uninhabited , and phileas fogg , for the first time since he had lived in that house , did not set out for his club when westminster clock struck half - past eleven .",2,"('day', 'journée', 'día')",1
"it is time to relate what a change took place in english public opinion when it transpired that the real bankrobber , a certain james strand , had been arrested , on the 17th day of december , at edinburgh . three days before , phileas fogg had been a criminal , who was being desperately followed up by the police ; now he was an honourable gentleman , mathematically pursuing his eccentric journey round the world .",42,"('day', 'jour', 'día')",0
"his five friends of the reform club passed these three days in a state of feverish suspense . would phileas fogg , whom they had forgotten , reappear before their eyes ! where was he at this moment ? the 17th of december , the day of james strand 's arrest , was the seventy - sixth since phileas fogg 's departure , and no news of him had been received . was he dead ? had he abandoned the effort , or was he continuing his journey along the route agreed upon ? and would he appear on saturday , the 21st of december , at a quarter before nine in the evening , on the threshold of the reform club saloon ?",10,"('day', 'jour', 'día')",0
"his five friends of the reform club passed these three days in a state of feverish suspense . would phileas fogg , whom they had forgotten , reappear before their eyes ! where was he at this moment ? the 17th of december , the day of james strand 's arrest , was the seventy - sixth since phileas fogg 's departure , and no news of him had been received . was he dead ? had he abandoned the effort , or was he continuing his journey along the route agreed upon ? and would he appear on saturday , the 21st of december , at a quarter before nine in the evening , on the threshold of the reform club saloon ?",45,"('day', 'jour', 'día')",0
""" the fact is , "" resumed thomas flanagan , "" mr . fogg 's project was absurdly foolish . whatever his punctuality , he could not prevent the delays which were certain to occur ; and a delay of only two or three days would be fatal to his tour . """,44,"('day', 'jour', 'día')",0
"these wise and sober thoughts continued all the while the storm lasted , and indeed some time after ; but the next day the wind was abated , and the sea calmer , and i began to be a little inured to it ; however , i was very grave for all that day , being also a little sea - sick still ; but towards night the weather cleared up , the wind was quite over , and a charming fine evening followed ; the sun went down perfectly clear , and rose so the next morning ; and having little or no wind , and a smooth sea , the sun shining upon it , the sight was , as i thought , the most delightful that ever i saw .",53,"('day', 'jour', 'día')",0
"the sixth day of our being at sea we came into yarmouth roads ; the wind having been contrary and the weather calm , we had made but little way since the storm . here we were obliged to come to an anchor , and here we lay , the wind continuing contrary — viz . at south - west — for seven or eight days , during which time a great many ships from newcastle came into the same roads , as the common harbour where the ships might wait for a wind for the river .",2,"('day', 'jour', 'día')",0
"the sixth day of our being at sea we came into yarmouth roads ; the wind having been contrary and the weather calm , we had made but little way since the storm . here we were obliged to come to an anchor , and here we lay , the wind continuing contrary — viz . at south - west — for seven or eight days , during which time a great many ships from newcastle came into the same roads , as the common harbour where the ships might wait for a wind for the river .",65,"('day', 'jour', 'día')",0
"it happened one time , that going a - fishing in a calm morning , a fog rose so thick that , though we were not half a league from the shore , we lost sight of it ; and rowing we knew not whither or which way , we laboured all day , and all the next night ; and when the morning came we found we had pulled off to sea instead of pulling in for the shore ; and that we were at least two leagues from the shore . however , we got well in again , though with a great deal of labour and some danger ; for the wind began to blow pretty fresh in the morning ; but we were all very hungry .",52,"('day', 'jour', 'día')",0
""" yes , yes , yes , yes ! "" cried passepartout . "" you have made a mistake of one day ! we arrived twenty - four hours ahead of time ; but there are only ten minutes left ! """,21,"('day', 'jour', 'día')",0
"yet such was the fright i had taken of the moors , and the dreadful apprehensions i had of falling into their hands , that i would not stop , or go on shore , or come to an anchor ; the wind continuing fair till i had sailed in that manner five days ; and then the wind shifting to the southward , i concluded also that if any of our vessels were in chase of me , they also would now give over ; so i ventured to make to the coast , and came to an anchor in the mouth of a little river , i knew not what , nor where , neither what latitude , what country , what nation , or what river . i neither saw , nor desired to see any people ; the principal thing i wanted was fresh water . we came into this creek in the evening , resolving to swim on shore as soon as it was dark , and discover the country ; but as soon as it was quite dark , we heard such dreadful noises of the barking , roaring , and howling of wild creatures , of we knew not what kinds , that the poor boy was ready to die with fear , and begged of me not to go on shore till day .",53,"('day', 'jour', 'día')",0
"“ well , xury , ” said i , “ then i wo n’t ; but it may be that we may see men by day , who will be as bad to us as those lions . ”",25,"('day', 'jour', 'día')",0
phileas fogg had accomplished the journey round the world in eighty days !,11,"('day', 'jour', 'día')",0
"phileas fogg had , without suspecting it , gained one day on his journey , and this merely because he had travelled constantly eastward ; he would , on the contrary , have lost a day had he gone in the opposite direction , that is , westward .",10,"('day', 'jour', 'día')",0
"in journeying eastward he had gone towards the sun , and the days therefore diminished for him as many times four minutes as he crossed degrees in this direction . there are three hundred and sixty degrees on the circumference of the earth ; and these three hundred and sixty degrees , multiplied by four minutes , gives precisely twenty - four hours -- that is , the day unconsciously gained . in other words , while phileas fogg , going eastward , saw the sun pass the meridian eighty times , his friends in london only saw it pass the meridian seventy - nine times . this is why they awaited him at the reform club on saturday , and not sunday , as mr . fogg thought .",12,"('day', 'jour', 'día')",0
"in journeying eastward he had gone towards the sun , and the days therefore diminished for him as many times four minutes as he crossed degrees in this direction . there are three hundred and sixty degrees on the circumference of the earth ; and these three hundred and sixty degrees , multiplied by four minutes , gives precisely twenty - four hours -- that is , the day unconsciously gained . in other words , while phileas fogg , going eastward , saw the sun pass the meridian eighty times , his friends in london only saw it pass the meridian seventy - nine times . this is why they awaited him at the reform club on saturday , and not sunday , as mr . fogg thought .",68,"('day', 'jour', 'día')",0
d’artagnan passed the day in exhibiting his musketeer ’s uniform in every street of the camp .,3,"('day', 'journée', 'día')",1
"and passepartout 's famous family watch , which had always kept london time , would have betrayed this fact , if it had marked the days as well as the hours and the minutes !",25,"('day', 'jour', 'día')",0
"he dreamed of canals facilitating the transport of the riches of the ground ; workings of quarries and mines ; machines for every industrial manufacture ; railroads ; yes , railroads ! of which a network would certainly one day cover lincoln island .",39,"('day', 'jour', 'día')",0
"but i was hurried on , and obeyed blindly the dictates of my fancy rather than my reason ; and , accordingly , the ship being fitted out , and the cargo furnished , and all things done , as by agreement , by my partners in the voyage , i went on board in an evil hour , the 1st september 1659 , being the same day eight years that i went from my father and mother at hull , in order to act the rebel to their authority , and the fool to my own interests .",67,"('day', 'jour', 'día')",0
""" that we might have made the tour of the world in only seventy - eight days . """,16,"('day', 'jour', 'día')",0
"in this distress we had , besides the terror of the storm , one of our men die of the calenture , and one man and the boy washed overboard . about the twelfth day , the weather abating a little , the master made an observation as well as he could , and found that he was in about eleven degrees north latitude , but that he was twenty - two degrees of longitude difference west from cape st . augustino ; so that he found he was upon the coast of guiana , or the north part of brazil , beyond the river amazon , toward that of the river orinoco , commonly called the great river ; and began to consult with me what course he should take , for the ship was leaky , and very much disabled , and he was going directly back to the coast of brazil .",34,"('day', 'jour', 'día')",0
"phileas fogg had won his wager , and had made his journey around the world in eighty days . to do this he had employed every means of conveyance -- steamers , railways , carriages , yachts , trading - vessels , sledges , elephants . the eccentric gentleman had throughout displayed all his marvellous qualities of coolness and exactitude . but what then ? what had he really gained by all this trouble ? what had he brought back from this long and weary journey ?",17,"('day', 'jour', 'día')",0
"i was positively against that ; and looking over the charts of the sea - coast of america with him , we concluded there was no inhabited country for us to have recourse to till we came within the circle of the caribbee islands , and therefore resolved to stand away for barbadoes ; which , by keeping off at sea , to avoid the indraft of the bay or gulf of mexico , we might easily perform , as we hoped , in about fifteen days ’ sail ; whereas we could not possibly make our voyage to the coast of africa without some assistance both to our ship and to ourselves .",86,"('day', 'jour', 'día')",0
"i had been now thirteen days on shore , and had been eleven times on board the ship , in which time i had brought away all that one pair of hands could well be supposed capable to bring ; though i believe verily , had the calm weather held , i should have brought away the whole ship , piece by piece . but preparing the twelfth time to go on board , i found the wind began to rise : however , at low water i went on board , and though i thought i had rummaged the cabin so effectually that nothing more could be found , yet i discovered a locker with drawers in it , in one of which i found two or three razors , and one pair of large scissors , with some ten or a dozen of good knives and forks : in another i found about thirty - six pounds value in money — some european coin , some brazil , some pieces of eight , some gold , and some silver .",5,"('day', 'jour', 'día')",0
there was no possibility of taking a walk that day .,9,"('day', 'jour', 'día')",0
"on the flat of the green , just before this hollow place , i resolved to pitch my tent . this plain was not above a hundred yards broad , and about twice as long , and lay like a green before my door ; and , at the end of it , descended irregularly every way down into the low ground by the seaside . it was on the n.n.w . side of the hill ; so that it was sheltered from the heat every day , till it came to a w. and by s. sun , or thereabouts , which , in those countries , is near the setting .",86,"('day', 'jour', 'día')",0
"every day , the reporter and herbert , who had been voted purveyors to the colony , devoted some hours to the chase .",1,"('day', 'jour', 'día')",0
"after i had been there about ten or twelve days , it came into my thoughts that i should lose my reckoning of time for want of books , and pen and ink , and should even forget the sabbath days ; but to prevent this , i cut with my knife upon a large post , in capital letters — and making it into a great cross , i set it up on the shore where i first landed—“i came on shore here on the 30th september 1659 . ” upon the sides of this square post i cut every day a notch with my knife , and every seventh notch was as long again as the rest , and every first day of the month as long again as that long one ; and thus i kept my calendar , or weekly , monthly , and yearly reckoning of time .",9,"('day', 'jour', 'día')",0
"after i had been there about ten or twelve days , it came into my thoughts that i should lose my reckoning of time for want of books , and pen and ink , and should even forget the sabbath days ; but to prevent this , i cut with my knife upon a large post , in capital letters — and making it into a great cross , i set it up on the shore where i first landed—“i came on shore here on the 30th september 1659 . ” upon the sides of this square post i cut every day a notch with my knife , and every seventh notch was as long again as the rest , and every first day of the month as long again as that long one ; and thus i kept my calendar , or weekly , monthly , and yearly reckoning of time .",40,"('day', 'jour', 'día')",0
"all the rest of the day i spent in afflicting myself at the dismal circumstances i was brought to — viz . i had neither food , house , clothes , weapon , nor place to fly to ; and in despair of any relief , saw nothing but death before me — either that i should be devoured by wild beasts , murdered by savages , or starved to death for want of food . at the approach of night i slept in a tree , for fear of wild creatures ; but slept soundly , though it rained all night .",5,"('day', 'jour', 'día')",0
"_ from the 1st of october to the 24th_.—all these days entirely spent in many several voyages to get all i could out of the ship , which i brought on shore every tide of flood upon rafts . much rain also in the days , though with some intervals of fair weather ; but it seems this was the rainy season .",10,"('day', 'journée', 'día')",1
"_ oct . _ 25.—it rained all night and all day , with some gusts of wind ; during which time the ship broke in pieces , the wind blowing a little harder than before , and was no more to be seen , except the wreck of her , and that only at low water . i spent this day in covering and securing the goods which i had saved , that the rain might not spoil them .",10,"('day', 'jour', 'día')",0
"_ oct . _ 25.—it rained all night and all day , with some gusts of wind ; during which time the ship broke in pieces , the wind blowing a little harder than before , and was no more to be seen , except the wreck of her , and that only at low water . i spent this day in covering and securing the goods which i had saved , that the rain might not spoil them .",60,"('day', 'jour', 'día')",0
"_ oct . _ 26.—i walked about the shore almost all day , to find out a place to fix my habitation , greatly concerned to secure myself from any attack in the night , either from wild beasts or men . towards night , i fixed upon a proper place , under a rock , and marked out a semicircle for my encampment ; which i resolved to strengthen with a work , wall , or fortification , made of double piles , lined within with cables , and without with turf .",11,"('day', 'jour', 'día')",0
"yes , indeed , those are the marks of teeth imprinted upon the metal ! the jaws which they arm must be possessed of amazing strength . is there some monster beneath us belonging to the extinct races , more voracious than the shark , more fearful in vastness than the whale ? i could not take my eyes off this indented iron bar . surely will my last night 's dream be realised ? these thoughts agitated me all day , and my imagination scarcely calmed down after several hours ' sleep .",80,"('day', 'jour', 'día')",0
"the rooms had now only to be furnished , and this would be work for the long winter days .",18,"('day', 'jour', 'día')",0
"he bullied and punished me ; not two or three times in the week , nor once or twice in the day , but continually : every nerve i had feared him , and every morsel of flesh in my bones shrank when he came near .",21,"('day', 'jour', 'día')",0
"_ nov . _ 14 , 15 , 16.—these three days i spent in making little square chests , or boxes , which might hold about a pound , or two pounds at most , of powder ; and so , putting the powder in , i stowed it in places as secure and remote from one another as possible . on one of these three days i killed a large bird that was good to eat , but i knew not what to call it .",10,"('day', 'jour', 'día')",0
"_ nov . _ 14 , 15 , 16.—these three days i spent in making little square chests , or boxes , which might hold about a pound , or two pounds at most , of powder ; and so , putting the powder in , i stowed it in places as secure and remote from one another as possible . on one of these three days i killed a large bird that was good to eat , but i knew not what to call it .",66,"('day', 'jour', 'día')",0
"_ nov . _ 17.—this day i began to dig behind my tent into the rock , to make room for my further conveniency .",5,"('day', 'jour', 'día')",0
"_ nov . _ 23.—my other work having now stood still , because of my making these tools , when they were finished i went on , and working every day , as my strength and time allowed , i spent eighteen days entirely in widening and deepening my cave , that it might hold my goods commodiously .",42,"('day', 'jour', 'día')",0
"_ dec . _ 17.—from this day to the 20th i placed shelves , and knocked up nails on the posts , to hang everything up that could be hung up ; and now i began to be in some order within doors .",6,"('day', 'jour', 'día')",0
_ dec . _ 24.—much rain all night and all day . no stirring out .,10,"('day', 'jour', 'día')",0
"a little trench , made below their level , produced this result ; and this derivation from a pure and inexhaustible source yielded twenty - five or thirty gallons a day .",30,"('day', 'jour', 'día')",0
_ dec . _ 25.—rain all day .,6,"('day', 'journée', 'día')",1
"all this time i worked very hard , the rains hindering me many days , nay , sometimes weeks together ; but i thought i should never be perfectly secure till this wall was finished ; and it is scarce credible what inexpressible labour everything was done with , especially the bringing piles out of the woods and driving them into the ground ; for i made them much bigger than i needed to have done .",13,"('day', 'jour', 'día')",0
"_ april _ 28 , 29.—these two whole days i took up in grinding my tools , my machine for turning my grindstone performing very well .",8,"('day', 'jour', 'día')",0
"_ april _ 30.—having perceived my bread had been low a great while , now i took a survey of it , and reduced myself to one biscuit cake a day , which made my heart very heavy .",30,"('day', 'jour', 'día')",0
"_ may _ 10–14.—went every day to the wreck ; and got a great many pieces of timber , and boards , or plank , and two or three hundredweight of iron .",5,"('day', 'jour', 'día')",0
"_ may _ 16.—it had blown hard in the night , and the wreck appeared more broken by the force of the water ; but i stayed so long in the woods , to get pigeons for food , that the tide prevented my going to the wreck that day .",49,"('day', 'jour', 'día')",0
"_ june _ 16.—going down to the seaside , i found a large tortoise or turtle . this was the first i had seen , which , it seems , was only my misfortune , not any defect of the place , or scarcity ; for had i happened to be on the other side of the island , i might have had hundreds of them every day , as i found afterwards ; but perhaps had paid dear enough for them .",67,"('day', 'jour', 'día')",0
"_ june _ 18.—rained all day , and i stayed within . i thought at this time the rain felt cold , and i was something chilly ; which i knew was not usual in that latitude .",5,"('day', 'journée', 'día')",1
"one thing is certain , that is that the days are already short , and the evenings long .",9,"('day', 'jour', 'día')",0
"they had to profit by the low tide to cross the channel , and it was agreed that they would construct , for this purpose , as well as they could , a boat which would render communication so much easier , and would also permit them to ascend the mercy , at the time of their grand exploration of the southwest of the island , which was put off till the first fine days .",74,"('day', 'jour', 'día')",0
"i lay here , however , two days , because the wind blowing pretty fresh at ese . , and that being just contrary to the current , made a great breach of the sea upon the point : so that it was not safe for me to keep too close to the shore for the breach , nor to go too far off , because of the stream .",7,"('day', 'jour', 'día')",0
"still i am constrained to confess that hitherto we have been wonderfully favoured , and that for some reason unknown to myself we have accomplished our journey under singularly favourable conditions of temperature . but it seems manifest to me that some day we shall reach a region where the central heat attains its highest limits , and goes beyond a point that can be registered by our thermometers .",42,"('day', 'jour', 'día')",0
"milady had him one day turned out of doors , with sundry blows of a good stick to accelerate his motions . now , planchet has an excellent memory ; and i will be bound that sooner than relinquish any possible means of vengeance , he will allow himself to be beaten to death .",4,"('day', 'jour', 'día')",0
"however , providence came directly to their aid , in an infinitesimal proportion it is true , but cyrus harding , with all his intelligence , all his ingenuity , would never have been able to produce that which , by the greatest chance , herbert one day found in the lining of his waistcoat , which he was occupied in setting to rights .",47,"('day', 'jour', 'día')",0
