text,ind,sense,label
""" if you are in haste , monsieur , "" said d’artagnan , with the same simplicity with which a moment before he had proposed to him to put off the duel for three days , "" and if it be your will to dispatch me at once , do not inconvenience yourself , i pray you . """,34,"('day', 'jour', 'día')",0
""" to - morrow , at break of day , we will leave the canoe , and in two hours i hope we shall cross the distance which separates us from the coast , and then we shall have the whole day in which to explore the shore . """,8,"('day', 'jour', 'día')",0
when i awoke it was day : an unusual movement roused me ; i looked up ; i was in somebody 's arms ; the nurse held me ; she was carrying me through the passage back to the dormitory .,5,"('day', 'jour', 'día')",0
"i was not reprimanded for leaving my bed ; people had something else to think about ; no explanation was afforded then to my many questions ; but a day or two afterwards i learned that miss temple , on returning to her own room at dawn , had found me laid in the little crib ; my face against helen burns 's shoulder , my arms round her neck .",29,"('day', 'jour', 'día')",0
""" well , it was evident from what we have heard that baskerville has been very closely shadowed by someone since he has been in town . how else could it be known so quickly that it was the northumberland hotel which he had chosen ? if they had followed him the first day i argued that they would follow him also the second . you may have observed that i twice strolled over to the window while dr . mortimer was reading his legend . """,53,"('day', 'jour', 'día')",0
pencroft and neb carried sufficient provision for the little band for at least two days .,14,"('day', 'jour', 'día')",0
"this document remained locked in my drawer all day : after tea , i asked leave of the new superintendent to go to lowton , in order to perform some small commissions for myself and one or two of my fellow - teachers ; permission was readily granted ; i went .",8,"('day', 'jour', 'día')",0
"it was a walk of two miles , and the evening was wet , but the days were still long ; i visited a shop or two , slipped the letter into the post - office , and came back through heavy rain , with streaming garments , but with a relieved heart .",16,"('day', 'jour', 'día')",0
she had still four days before her . four days would quite suffice to complete the seduction of felton .,4,"('day', 'jour', 'día')",0
she had still four days before her . four days would quite suffice to complete the seduction of felton .,9,"('day', 'jour', 'día')",0
"i had brushed my black stuff travelling - dress , prepared my bonnet , gloves , and muff ; sought in all my drawers to see that no article was left behind ; and now having nothing more to do , i sat down and tried to rest . i could not ; though i had been on foot all day , i could not now repose an instant ; i was too much excited .",60,"('day', 'journée', 'día')",1
"in a few days you will be away from this place ; your life , madame , will then no longer be under my care , and , "" added he , with a sigh , "" then you can do what you will with it . """,3,"('day', 'jour', 'día')",0
""" do you believe , then , that at the day of the last judgment god will separate blind executioners from iniquitous judges ? you are not willing that i should kill my body , and you make yourself the agent of him who would kill my soul . """,10,"('day', 'jour', 'día')",0
"now should they undertake it immediately , and devote this day to it ?",10,"('day', 'journée', 'día')",1
"but be of good courage , my lad ; in three days we shall be delivered from this creature , and where i shall send her she can harm nobody . """,11,"('day', 'jour', 'día')",0
""" that would be a long day 's march .",6,"('day', 'journée', 'día')",1
""" but i 'll not keep you sitting up late to - night , "" said she ; "" it is on the stroke of twelve now , and you have been travelling all day : you must feel tired .",34,"('day', 'jour', 'día')",0
""" he hailed me at half - past nine in trafalgar square . he said that he was a detective , and he offered me two guineas if i would do exactly what he wanted all day and ask no questions . i was glad enough to agree . first we drove down to the northumberland hotel and waited there until two gentlemen came out and took a cab from the rank . we followed their cab until it pulled up somewhere near here . """,36,"('day', 'journée', 'día')",1
""" the boat has remained by itself for one day at the sources of the mercy , "" replied gideon spilett ; "" it may just as well stay there two days !",9,"('day', 'jour', 'día')",0
i have known you four days ; i have loved him four years . i therefore may hesitate between you . be not alarmed at what i say ; i want to be convinced .,5,"('day', 'jour', 'día')",0
"sir henry baskerville and dr . mortimer were ready upon the appointed day , and we started as arranged for devonshire . mr . sherlock holmes drove with me to the station and gave me his last parting injunctions and advice .",12,"('day', 'jour', 'día')",0
""" anything which may seem to have a bearing however indirect upon the case , and especially the relations between young baskerville and his neighbours or any fresh particulars concerning the death of sir charles . i have made some inquiries myself in the last few days , but the results have , i fear , been negative . one thing only appears to be certain , and that is that mr . james desmond , who is the next heir , is an elderly gentleman of a very amiable disposition , so that this persecution does not arise from him . i really think that we may eliminate him entirely from our calculations . there remain the people who will actually surround sir henry baskerville upon the moor . """,46,"('day', 'jour', 'día')",0
""" because the sands are still more dangerous than the rocks , for they swallow up everything that is thrown on them . in a few days the hull of a ship of several hundred tons would disappear entirely in there ! """,26,"('day', 'jour', 'día')",0
""" most certainly . keep your revolver near you night and day , and never relax your precautions . """,11,"('day', 'jour', 'día')",0
""" except yesterday afternoon . i usually give up one day to pure amusement when i come to town , so i spent it at the museum of the college of surgeons . """,10,"('day', 'journée', 'día')",1
"she knew she had only two days left ; that when once the order was signed by buckingham -- and buckingham would sign it the more readily from its bearing a false name , and he could not , therefore , recognize the woman in question -- once this order was signed , we say , the baron would make her embark immediately , and she knew very well that women condemned to exile employ arms much less powerful in their seductions than the pretendedly virtuous woman whose beauty is lighted by the sun of the world , whose style the voice of fashion lauds , and whom a halo of aristocracy gilds with enchanting splendors .",6,"('day', 'jour', 'día')",0
"we stayed there nearly a week : i and sophie used to walk every day in a great green place full of trees , called the park ; and there were many children there besides me , and a pond with beautiful birds in it , that i fed with crumbs . """,14,"('day', 'jour', 'día')",0
"for an active , ambitious nature , like that of milady , days not spent in climbing are inauspicious days . what word , then , can be found to describe the days which they occupy in descending ?",12,"('day', 'jour', 'día')",0
"for an active , ambitious nature , like that of milady , days not spent in climbing are inauspicious days . what word , then , can be found to describe the days which they occupy in descending ?",19,"('day', 'jour', 'día')",0
"for an active , ambitious nature , like that of milady , days not spent in climbing are inauspicious days . what word , then , can be found to describe the days which they occupy in descending ?",32,"('day', 'jour', 'día')",0
""" there 's a convict escaped from princetown , sir . he 's been out three days now , and the warders watch every road and every station , but they 've had no sight of him yet . the farmers about here do n't like it , sir , and that 's a fact . """,16,"('day', 'jour', 'día')",0
there were days when she was quite silent ; but there were others when i could not account for the sounds she made .,2,"('day', 'jour', 'día')",0
"but the night passed away without any fresh attempt on the part of my persecutor . day came ; the table had disappeared , only i had still the knife in my hand .",16,"('day', 'jour', 'día')",0
"sleeplessness inflamed my eyes ; i had not dared to sleep a single instant . the light of day reassured me ; i went and threw myself on the bed , without parting with the emancipating knife , which i concealed under my pillow . "" when i awoke , a fresh meal was served .",18,"('day', 'jour', 'día')",0
""" i shall try my luck some day . """,7,"('day', 'jour', 'día')",0
""" my friends , "" at last said cyrus harding , "" there is only one thing to be done at present ; wait for day , and then act according to circumstances .",25,"('day', 'jour', 'día')",0
"whoever it was , the only thing practicable was to do as the engineer proposed , to go to the chimneys and there wait for day .",25,"('day', 'jour', 'día')",0
""" the day passed away without having any other influence on me than to strengthen the resolution i had formed ; only i took care that my face should not betray the thoughts of my heart , for i had no doubt i was watched . several times , even , i felt a smile on my lips .",2,"('day', 'journée', 'día')",1
"it was not only that they were extremely anxious to find out the cause of what had happened , whether it was the result of an accident which would be discovered at the return of day , or whether on the contrary it was the work of a human being ; but they also had very uncomfortable beds .",35,"('day', 'jour', 'día')",0
"all the day , all the next night passed away without my seeing him again .",2,"('day', 'journée', 'día')",1
""" i passed the day and the night in prayer , for i hoped that god would pardon me my suicide .",4,"('day', 'jour', 'día')",0
""" mr . rochester would be glad if you and your pupil would take tea with him in the drawing - room this evening , "" said she : "" he has been so much engaged all day that he could not ask to see you before . """,37,"('day', 'jour', 'día')",0
"if you have not had any report within the last few days it is because up to to - day there was nothing of importance to relate . then a very surprising circumstance occurred , which i shall tell you in due course . but , first of all , i must keep you in touch with some of the other factors in the situation .",11,"('day', 'jour', 'día')",0
""" ’ listen ! ’ said he . ’ i give you the rest of tonight and all day tomorrow . reflect : promise to be silent , and riches , consideration , even honor , shall surround you ; threaten to speak , and i will condemn you to infamy . ’",18,"('day', 'journée', 'día')",1
""" thanks , sire , thanks , "" said the duke ; "" but your majesty may be assured that it is not those -- i do not speak of monsieur de treville -- whom your majesty sees at all hours of the day that are most devoted to you . "" "" ah !",43,"('day', 'jour', 'día')",0
""" what the devil ! "" continued the king . "" seven of his eminence ’s guards placed hors de combat by you four in two days !",26,"('day', 'jour', 'día')",0
"one now and then i do n’t say much about ; but seven in two days , i repeat , it is too many , it is far too many ! """,15,"('day', 'jour', 'día')",0
"seven men in two days , and those of his very best ! but that ’s quite enough , gentlemen ; please to understand , that ’s enough . you have taken your revenge for the rue ferou , and even exceeded it ; you ought to be satisfied . """,4,"('day', 'jour', 'día')",0
"at this epoch , the ideas of pride which are in fashion in our days did not prevail .",14,"('day', 'jour', 'día')",0
"the cardinal , as his majesty had said , was really furious , so furious that during eight days he absented himself from the king ’s gaming table . this did not prevent the king from being as complacent to him as possible whenever he met him , or from asking in the kindest tone , "" well , monsieur cardinal , how fares it with that poor jussac and that poor bernajoux of yours ? """,18,"('day', 'jour', 'día')",0
"the repast was carried into effect that very day , and the lackey waited at table .",8,"('day', 'jour', 'día')",0
"but all my fortune is in england . communication being closed by the war , i was in want of everything . i was then obliged to come back again . six days ago , i landed at portsmouth . """,32,"('day', 'jour', 'día')",0
on these days he spoke a little .,2,"('day', 'jour', 'día')",0
"during the day the bodies of the apes were carried into the wood , where they were buried ; then the settlers busied themselves in repairing the disorder caused by the intruders , disorder but not damage , for although they had turned everything in the rooms topsy - turvy , yet they had broken nothing .",2,"('day', 'journée', 'día')",1
"did you sit at them long each day ? """,7,"('day', 'jour', 'día')",0
"one day , when he had an appointment with a duchess , he endeavored even to borrow it of athos .",1,"('day', 'jour', 'día')",0
"athos always carried the key of this coffer about him ; but he one day opened it before porthos , and porthos was convinced that this coffer contained nothing but letters and papers -- love letters and family papers , no doubt .",14,"('day', 'jour', 'día')",0
"for several subsequent days i saw little of mr . rochester . in the mornings he seemed much engaged with business , and , in the afternoon , gentlemen from millcote or the neighbourhood called , and sometimes stayed to dine with him .",3,"('day', 'jour', 'día')",0
""" he 'll break into no house , sir . i give you my solemn word upon that . but he will never trouble anyone in this country again . i assure you , sir henry , that in a very few days the necessary arrangements will have been made and he will be on his way to south america . for god 's sake , sir , i beg of you not to let the police know that he is still on the moor . they have given up the chase there , and he can lie quiet until the ship is ready for him . you ca n't tell on him without getting my wife and me into trouble . i beg you , sir , to say nothing to the police . """,42,"('day', 'jour', 'día')",0
"she had only one day left . lord de winter had announced her embarkation for the twenty - third , and it was now the morning of the twenty - second .",4,"('day', 'jour', 'día')",0
"porthos had his fits . on the days when he won he was insolent and ostentatious ; if he lost , he disappeared completely for several days , after which he reappeared with a pale face and thinner person , but with money in his purse .",7,"('day', 'jour', 'día')",0
"porthos had his fits . on the days when he won he was insolent and ostentatious ; if he lost , he disappeared completely for several days , after which he reappeared with a pale face and thinner person , but with money in his purse .",26,"('day', 'jour', 'día')",0
"a few days afterwards , herbert snared a couple of gallinaceae , with spreading tails composed of long feathers , magnificent alectors , which soon became tame .",2,"('day', 'jour', 'día')",0
"the friendship which united these four men , and the need they felt of seeing another three or four times a day , whether for dueling , business , or pleasure , caused them to be continually running after one another like shadows ; and the inseparables were constantly to be met with seeking one another , from the luxembourg to the place st . sulpice , or from the rue du vieux - colombier to the luxembourg .",21,"('day', 'jour', 'día')",0
"it was decided that for a few days they should be allowed to roam freely about the plateau , where there was an abundance of grass , and the engineer immediately began to prepare a stable near the poultry - yard , in which the onagers might find food , with a good litter , and shelter during the night .",7,"('day', 'jour', 'día')",0
"in the meantime harness of vegetable fiber had been manufactured , and some days after the capture of the onagers , not only the cart was ready , but a straight road , or rather a cutting , had been made through the forests of the far west , from the angle of the mercy to port balloon .",13,"('day', 'jour', 'día')",0
"i have only one other incident to record upon this tempestuous and melancholy day . this was my conversation with barrymore just now , which gives me one more strong card which i can play in due time .",13,"('day', 'jour', 'día')",0
"on this day all the colony , except pencroft who walked at the animals ' heads , mounted the cart , and set out on the road to port balloon .",2,"('day', 'jour', 'día')",0
""" i do n't know , sir . i hope to heaven that he has gone , for he has brought nothing but trouble here ! i 've not heard of him since i left out food for him last , and that was three days ago . """,45,"('day', 'jour', 'día')",0
"from this phrase , "" d’artagnan awakened planchet , "" the reader must not suppose it was night , or that day was hardly come .",21,"('day', 'jour', 'día')",0
"judge then of the pleasure master jup gave to the inhabitants of granite house when , without their having had any idea of it , he appeared one day , napkin on his arm , ready to wait at table .",28,"('day', 'jour', 'día')",0
"nothing was heard but that , and jup without ever being disconcerted , replied to every one , watched for everything , and he shook his head in a knowing way when pencroft , referring to his joke of the first day , said to him,--",41,"('day', 'jour', 'día')",0
""" not on the very day of sir charles 's death ? """,5,"('day', 'jour', 'día')",0
"this was done on the 7th of february , on a beautiful summer 's day , and every one took part in it .",14,"('day', 'journée', 'día')",1
""" now , my wife came home four days ago , monsieur . one of her conditions was that she should come and see me twice a week ; for , as i had the honor to tell you , my wife loves me dearly -- my wife , then , came and confided to me that the queen at that very moment entertained great fears . """,8,"('day', 'jour', 'día')",0
"this hunting day was very fatiguing . such going and coming , and running and riding and shouting !",2,"('day', 'journée', 'día')",1
"but i tell you -- and you may mark my words -- you will come some day to a craggy pass in the channel , where the whole of life 's stream will be broken up into whirl and tumult , foam and noise : either you will be dashed to atoms on crag points , or lifted up and borne on by some master - wave into a calmer current -- as i am now .",16,"('day', 'jour', 'día')",0
""" i like this day ; i like that sky of steel ; i like the sternness and stillness of the world under this frost . i like thornfield , its antiquity , its retirement , its old crow - trees and thorn - trees , its grey facade , and lines of dark windows reflecting that metal welkin : and yet how long have i abhorred the very thought of it , shunned it like a great plague - house ? how i do still abhor-- """,4,"('day', 'journée', 'día')",1
""" yes , my wife pointed him out to me one day . """,11,"('day', 'jour', 'día')",0
""" my life has been one incessant persecution from a husband whom i abhor . the law is upon his side , and every day i am faced by the possibility that he may force me to live with him . at the time that i wrote this letter to sir charles i had learned that there was a prospect of my regaining my freedom if certain expenses could be met . it meant everything to me -- peace of mind , happiness , self - respect -- everything . i knew sir charles 's generosity , and i thought that if he heard the story from my own lips he would help me . """,24,"('day', 'jour', 'día')",0
"for eleven months all communication between them and the rest of their fellow - creatures had been interrupted , and in a short time the 24th of march would arrive , the anniversary of the day on which the balloon had thrown them on this unknown coast .",35,"('day', 'jour', 'día')",0
""" none . one day , as i was conveying my wife back to the louvre , he was coming out as she was going in , and she showed him to me . """,4,"('day', 'jour', 'día')",0
""" you 'll be surprised to hear that his food is taken to him by a child . i see him every day through my telescope upon the roof . he passes along the same path at the same hour , and to whom should he be going except to the convict ? """,22,"('day', 'jour', 'día')",0
"if he does go , the change will be doleful . suppose he should be absent spring , summer , and autumn : how joyless sunshine and fine days will seem ! """,28,"('day', 'jour', 'día')",0
""" you may be sure , sir , that i have very good grounds before i come to an opinion . i have seen the boy again and again with his bundle . every day , and sometimes twice a day , i have been able -- but wait a moment , dr . watson . do my eyes deceive me , or is there at the present moment something moving upon that hill- side ? """,34,"('day', 'jour', 'día')",0
""" you may be sure , sir , that i have very good grounds before i come to an opinion . i have seen the boy again and again with his bundle . every day , and sometimes twice a day , i have been able -- but wait a moment , dr . watson . do my eyes deceive me , or is there at the present moment something moving upon that hill- side ? """,40,"('day', 'journée', 'día')",1
"the atmosphere , violently agitated by the electric commotions , could not recover its former purity , and there was almost invariably rain and fog , except for three or four fine days on which several excursions were made .",32,"('day', 'journée', 'día')",1
"d’artagnan opened it , and as the day was beginning to decline , he approached the window to read it .",7,"('day', 'jour', 'día')",0
"one day in this month of march , pencroft , talking to the engineer , reminded cyrus harding of a promise which the latter had not as yet had time to fulfil .",1,"('day', 'jour', 'día')",0
"there were some difficulties to be encountered ; but , after several fruitless attempts , he succeeded in setting up a glass manufactory , which gideon spilett and herbert , his usual assistants , did not leave for several days .",39,"('day', 'jour', 'día')",0
""" here are your reports , my dear fellow , and very well thumbed , i assure you . i made excellent arrangements , and they are only delayed one day upon their way . i must compliment you exceedingly upon the zeal and the intelligence which you have shown over an extraordinarily difficult case . """,30,"('day', 'jour', 'día')",0
""" my lord , "" said felton , "" the baron de winter wrote to you the other day to request you to sign an order of embarkation relative to a young woman named charlotte backson . """,18,"('day', 'jour', 'día')",0
"sense would resist delirium : judgment would warn passion . too feverish to rest , i rose as soon as day dawned .",20,"('day', 'jour', 'día')",0
"i both wished and feared to see mr . rochester on the day which followed this sleepless night : i wanted to hear his voice again , yet feared to meet his eye .",12,"('day', 'jour', 'día')",0
"the day was fine , such as an october day in the northern hemisphere might be .",1,"('day', 'journée', 'día')",1
""" i was at the louvre on the day when he scattered his pearls ; and , pardieu , i picked up two that i sold for ten pistoles each .",8,"('day', 'jour', 'día')",0
"a single thing had the honor of drawing him , but for one day only , from his dockyard .",13,"('day', 'jour', 'día')",0
"you should have seen the dining - room that day -- how richly it was decorated , how brilliantly lit up !",9,"('day', 'jour', 'día')",0
""" all right , herbert , and on that day our worthy companion will have nothing left to wish for in this world . """,9,"('day', 'jour', 'día')",0
for some days they had observed an enormous animal two or three miles out in the open sea swimming around lincoln island .,2,"('day', 'jour', 'día')",0
"a week passed , and no news arrived of mr . rochester : ten days , and still he did not come .",14,"('day', 'jour', 'día')",0
"and mrs . fairfax swallowed her breakfast and hastened away to commence operations . the three days were , as she had foretold , busy enough . i had thought all the rooms at thornfield beautifully clean and well arranged ; but it appears i was mistaken .",16,"('day', 'jour', 'día')",0
""" my dear watson , you were born to be a man of action . your instinct is always to do something energetic . but supposing , for argument 's sake , that we had him arrested to - night , what on earth the better off should we be for that ? we could prove nothing against him . there 's the devilish cunning of it ! if he were acting through a human agent we could get some evidence , but if we were to drag this great dog to the light of day it would not help us in putting a rope round the neck of its master . """,95,"('day', 'jour', 'día')",0
"from school duties she was exonerated : mrs . fairfax had pressed me into her service , and i was all day in the storeroom , helping ( or hindering ) her and the cook ; learning to make custards and cheese - cakes and french pastry , to truss game and garnish desert - dishes .",21,"('day', 'journée', 'día')",1
"adele , too , would be dressed : though i thought she had little chance of being introduced to the party that day at least .",22,"('day', 'jour', 'día')",0
"the birds , who had watched this rich prey for several days , had determined to take possession of it without further delay , and it was necessary to drive them off by firing at them repeatedly .",11,"('day', 'jour', 'día')",0
