text,ind,sense,label
around the world in 80 days,5,"('day', 'jour', 'día')",0
""" why , about fifteen or eighteen days ago . """,7,"('day', 'jour', 'día')",0
there was a general clapping of hands at this : it was the first really clever thing the king had said that day .,22,"('day', 'jour', 'día')",0
"phileas fogg was seated squarely in his armchair , his feet close together like those of a grenadier on parade , his hands resting on his knees , his body straight , his head erect ; he was steadily watching a complicated clock which indicated the hours , the minutes , the seconds , the days , the months , and the years . at exactly half - past eleven mr . fogg would , according to his daily habit , quit saville row , and repair to the reform .",55,"('day', 'jour', 'día')",0
""" every day . i could n't be happy if i did n't see him every day . he is absolutely necessary to me . """,2,"('day', 'jour', 'día')",0
""" every day . i could n't be happy if i did n't see him every day . he is absolutely necessary to me . """,16,"('day', 'jour', 'día')",0
"' it 's a pun ! ' the king added in an offended tone , and everybody laughed , ' let the jury consider their verdict , ' the king said , for about the twentieth time that day .",38,"('day', 'jour', 'día')",0
""" i hate them for it , "" cried hallward . "" an artist should create beautiful things , but should put nothing of his own life into them . we live in an age when men treat art as if it were meant to be a form of autobiography . we have lost the abstract sense of beauty . some day i will show the world what it is ; and for that reason the world shall never see my portrait of dorian gray . """,61,"('day', 'jour', 'día')",0
""" days in summer , basil , are apt to linger , "" murmured lord henry . "" perhaps you will tire sooner than he will . it is a sad thing to think of , but there is no doubt that genius lasts longer than beauty . that accounts for the fact that we all take such pains to over - educate ourselves . in the wild struggle for existence , we want to have something that endures , and so we fill our minds with rubbish and facts , in the silly hope of keeping our place . the thoroughly well - informed man -- that is the modern ideal . and the mind of the thoroughly well - informed man is a dreadful thing . it is like a bric - a - brac shop , all monsters and dust , with everything priced above its proper value .",1,"('day', 'jour', 'día')",0
""" in eighty days , "" interrupted phileas fogg .",3,"('day', 'jour', 'día')",0
""" that is true , gentlemen , "" added john sullivan . "" only eighty days , now that the section between rothal and allahabad , on the great indian peninsula railway , has been opened . here is the estimate made by the daily telegraph :",15,"('day', 'jour', 'día')",0
""" yes , in eighty days ! "" exclaimed stuart , who in his excitement made a false deal . "" but that does n't take into account bad weather , contrary winds , shipwrecks , railway accidents , and so on . """,5,"('day', 'jour', 'día')",0
""" the journey round the world in eighty days ? """,8,"('day', 'jour', 'día')",0
""" but , mr . fogg , eighty days are only the estimate of the least possible time in which the journey can be made . """,8,"('day', 'jour', 'día')",0
""" a true englishman does n't joke when he is talking about so serious a thing as a wager , "" replied phileas fogg , solemnly . "" i will bet twenty thousand pounds against anyone who wishes that i will make the tour of the world in eighty days or less ; in nineteen hundred and twenty hours , or a hundred and fifteen thousand two hundred minutes . do you accept ? """,49,"('day', 'jour', 'día')",0
""" no , you do n't feel it now . some day , when you are old and wrinkled and ugly , when thought has seared your forehead with its lines , and passion branded your lips with its hideous fires , you will feel it , you will feel it terribly . now , wherever you go , you charm the world . will it always be so ? . . . you have a wonderfully beautiful face , mr . gray . do n't frown . you have . and beauty is a form of genius-- is higher , indeed , than genius , as it needs no explanation . it is of the great facts of the world , like sunlight , or spring - time , or the reflection in dark waters of that silver shell we call the moon . it can not be questioned . it has its divine right of sovereignty . it makes princes of those who have it .",11,"('day', 'jour', 'día')",0
"you will become sallow , and hollow - cheeked , and dull- eyed . you will suffer horribly .... ah ! realize your youth while you have it . do n't squander the gold of your days , listening to the tedious , trying to improve the hopeless failure , or giving away your life to the ignorant , the common , and the vulgar . these are the sickly aims , the false ideals , of our age . live ! live the wonderful life that is in you ! let nothing be lost upon you . be always searching for new sensations . be afraid of nothing . . . . a new hedonism-- that is what our century wants . you might be its visible symbol . with your personality there is nothing you could not do . the world belongs to you for a season . . . .",36,"('day', 'jour', 'día')",0
"it was then agreed that the engineer and the reporter were to pass the day at the chimneys , so as to examine the shore and the upper plateau .",14,"('day', 'journée', 'día')",1
""" in eighty days , "" responded mr . fogg . "" so we have n't a moment to lose . """,3,"('day', 'jour', 'día')",0
there looked down upon me the faithful companion of my labours and my recreations . every day she helped me to arrange my uncle 's precious specimens ; she and i labelled them together . mademoiselle gräuben was an accomplished mineralogist ; she could have taught a few things to a savant . she was fond of investigating abstruse scientific questions . what pleasant hours we have spent in study ; and how often i envied the very stones which she handled with her charming fingers .,16,"('day', 'jour', 'día')",0
"now , if your mistress is not dead , if it is she we have just seen , you will meet with her again some day or other .",25,"('day', 'jour', 'día')",0
"d’artagnan was well known among the honorable corps of the king ’s musketeers , in which it was known he would one day take his place ; he was considered beforehand as a comrade .",22,"('day', 'jour', 'día')",0
it was evident that the engineer and his companions had employed their day well .,12,"('day', 'journée', 'día')",1
""" the letter was lost , "" replied his eminence ; "" yes , i know that . but monsieur de treville is a skilled physiognomist , who knows men at first sight ; and he placed you in the company of his brother - in - law , monsieur dessessart , leaving you to hope that one day or other you should enter the musketeers . """,58,"('day', 'jour', 'día')",0
""" since that time many things have happened to you . you were walking one day behind the chartreux , when it would have been better if you had been elsewhere . then you took with your friends a journey to the waters of forges ; they stopped on the road , but you continued yours .",15,"('day', 'jour', 'día')",0
"as a proof , remember the date of the day on which i had you bidden to come to me , and seek in your memory for what happened to you that very night . """,9,"('day', 'jour', 'día')",0
""" yes , and in eighty days ! he says it is on a wager ; but , between us , i do n't believe a word of it . that would n't be common sense . there 's something else in the wind . """,6,"('day', 'jour', 'día')",0
""" why , no ; i entered his service the very day we left london . """,11,"('day', 'jour', 'día')",0
""" i wished to explain this plan to you on the day you received my first invitation ; but you did not come .",11,"('day', 'jour', 'día')",0
""" pretty far . it is a ten days ' voyage by sea . """,8,"('day', 'jour', 'día')",0
""" consul , "" said he , "" i have no longer any doubt . i have spotted my man . he passes himself off as an odd stick who is going round the world in eighty days . """,37,"('day', 'jour', 'día')",0
""" i hope so , monsieur fix . you see , a man of sound sense ought not to spend his life jumping from a steamer upon a railway train , and from a railway train upon a steamer again , pretending to make the tour of the world in eighty days ! no ; all these gymnastics , you may be sure , will cease at bombay . """,51,"('day', 'jour', 'día')",0
""" very bad indeed . in fact i consider you extremely dangerous , and if anything happens to our good duchess , we shall all look on you as being primarily responsible . but i should like to talk to you about life . the generation into which i was born was tedious . some day , when you are tired of london , come down to treadley and expound to me your philosophy of pleasure over some admirable burgundy i am fortunate enough to possess . """,55,"('day', 'jour', 'día')",0
""" do you know , mr . passepartout , that this pretended tour in eighty days may conceal some secret errand -- perhaps a diplomatic mission ? """,15,"('day', 'jour', 'día')",0
"the mongolia was due at bombay on the 22nd ; she arrived on the 20th . this was a gain to phileas fogg of two days since his departure from london , and he calmly entered the fact in the itinerary , in the column of gains .",25,"('day', 'jour', 'día')",0
"the aspect of the country , as well as the manners and distinctions of race , is daily changing . formerly one was obliged to travel in india by the old cumbrous methods of going on foot or on horseback , in palanquins or unwieldy coaches ; now fast steamboats ply on the indus and the ganges , and a great railway , with branch lines joining the main line at many points on its route , traverses the peninsula from bombay to calcutta in three days .",86,"('day', 'jour', 'día')",0
"at that time it was believed that the separation of the musketeers and the guards would be but momentary , the king holding his parliament that very day and proposing to set out the day after .",27,"('day', 'jour', 'día')",0
"the engineer , accordingly , regardless of fatigue , leaving pencroft and neb to arrange the beds , and gideon spilett to note the incidents of the day , began to follow the edge of the plateau , going towards the north .",27,"('day', 'jour', 'día')",0
""" no one has . people will some day , however . she is a genius . """,8,"('day', 'jour', 'día')",0
"gräuben and i , hand in hand , but in silence , pursued our way . the emotions of that day were breaking my heart .",20,"('day', 'journée', 'día')",1
""" my dear boy , the people who love only once in their lives are really the shallow people . what they call their loyalty , and their fidelity , i call either the lethargy of custom or their lack of imagination . faithfulness is to the emotional life what consistency is to the life of the intellect -- simply a confession of failure . faithfulness ! i must analyse it some day . the passion for property is in it . there are many things that we would throw away if we were not afraid that others might pick them up . but i do n't want to interrupt you . go on with your story . """,72,"('day', 'jour', 'día')",0
""" it must have been just like the palmy days of the british drama . """,9,"('day', 'jour', 'día')",0
""" not at all ; but i knew that some obstacle or other would sooner or later arise on my route . nothing , therefore , is lost . i have two days , which i have already gained , to sacrifice . a steamer leaves calcutta for hong kong at noon , on the 25th . this is the 22nd , and we shall reach calcutta in time . """,32,"('day', 'jour', 'día')",0
"it will be hard if we do n't manage to get away some day or other from a place where certainly no one will detain us ! """,13,"('day', 'jour', 'día')",0
""" it is only the sacred things that are worth touching , dorian , "" said lord henry , with a strange touch of pathos in his voice . "" but why should you be annoyed ? i suppose she will belong to you some day . when one is in love , one always begins by deceiving one 's self , and one always ends by deceiving others . that is what the world calls a romance . you know her , at any rate , i suppose ? """,45,"('day', 'jour', 'día')",0
"everything was in the same state . the duke of buckingham and his english , masters of the isle of re , continued to besiege , but without success , the citadel st . martin and the fort of la pree ; and hostilities with la rochelle had commenced , two or three days before , about a fort which the duc d’angouleme had caused to be constructed near the city .",53,"('day', 'jour', 'día')",0
""" you do n't understand her , harry . she regarded me merely as a person in a play . she knows nothing of life . she lives with her mother , a faded tired woman who played lady capulet in a sort of magenta dressing - wrapper on the first night , and looks as if she had seen better days . """,61,"('day', 'jour', 'día')",0
""" my dear harry , we either lunch or sup together every day , and i have been to the opera with you several times , "" said dorian , opening his blue eyes in wonder .",12,"('day', 'jour', 'día')",0
""" a suttee , "" returned the general , "" is a human sacrifice , but a voluntary one . the woman you have just seen will be burned to - morrow at the dawn of day . """,36,"('day', 'jour', 'día')",0
"very good ! thought i , just the place we want to end our days in ; and great as it is , that asylum is not big enough to contain all professor liedenbrock 's madness !",14,"('day', 'jour', 'día')",0
"and it was so ; for five days in succession , i was obliged to undergo this anti - vertiginous exercise ; and whether i would or not , i made some improvement in the art of "" lofty contemplations . """,7,"('day', 'jour', 'día')",0
""" ten days , "" the captain replied , "" if we do n't meet a nor'-wester in passing the faroes . """,2,"('day', 'jour', 'día')",0
"the hours passed , and the lighter shades now announced the approach of day , though it was not yet light .",13,"('day', 'jour', 'día')",0
"in two days more we sighted the coast of scotland near peterhead , and the _ valkyria _ turned her lead towards the faroe islands , passing between the orkneys and shetlands .",2,"('day', 'jour', 'día')",0
"according to his journal , he was due at calcutta on the 25th of october , and that was the exact date of his actual arrival . he was therefore neither behind - hand nor ahead of time . the two days gained between london and bombay had been lost , as has been seen , in the journey across india . but it is not to be supposed that phileas fogg regretted them .",41,"('day', 'jour', 'día')",0
"she laughed and took his arm . "" you dear old jim , you talk as if you were a hundred . some day you will be in love yourself . then you will know what it is . do n't look so sulky . surely you should be glad to think that , though you are going away , you leave me happier than i have ever been before . life has been hard for us both , terribly hard and difficult . but it will be different now . you are going to a new world , and i have found one . here are two chairs ; let us sit down and see the smart people go by . """,23,"('day', 'jour', 'día')",0
"now this happened the 30th of march , 1865 . they little knew that sixteen days afterwards a frightful crime would be committed in washington , and that on good friday abraham lincoln would fall by the hand of a fanatic .",15,"('day', 'jour', 'día')",0
"it was an instrument of excellent quality , a perfect pocket chronometer , which the reporter had not forgotten to wind up carefully every day .",24,"('day', 'jour', 'día')",0
"the whole army talked of this expedition for a day , and monsieur paid him his compliments upon it .",9,"('day', 'jour', 'día')",0
"she heaved a deep sigh . it was a sigh of relief . the terrible moment , the moment that night and day , for weeks and months , she had dreaded , had come at last , and yet she felt no terror . indeed , in some measure it was a disappointment to her . the vulgar directness of the question called for a direct answer . the situation had not been gradually led up to . it was crude . it reminded her of a bad rehearsal .",22,"('day', 'jour', 'día')",0
""" good , "" said the judge . "" you have been looked for , prisoners , for two days on the trains from bombay . """,19,"('day', 'jour', 'día')",0
"meantime , monsieur , who knew that from one day to the other he might expect to be removed from his command by the duc d’angouleme , by bassompierre , or by schomberg , who were all eager for his post , did but little , lost his days in wavering , and did not dare to attempt any great enterprise to drive the english from the isle of re , where they still besieged the citadel st . martin and the fort of la pree , as on their side the french were besieging la rochelle .",9,"('day', 'jour', 'día')",0
"it was with a renewed feeling of disappointment that she waved the tattered lace handkerchief from the window , as her son drove away . she was conscious that a great opportunity had been wasted . she consoled herself by telling sibyl how desolate she felt her life would be , now that she had only one child to look after . she remembered the phrase . it had pleased her . of the threat she said nothing . it was vividly and dramatically expressed . she felt that they would all laugh at it some day .",96,"('day', 'jour', 'día')",0
"during the first days of the journey aouda became better acquainted with her protector , and constantly gave evidence of her deep gratitude for what he had done . the phlegmatic gentleman listened to her , apparently at least , with coldness , neither his voice nor his manner betraying the slightest emotion ; but he seemed to be always on the watch that nothing should be wanting to aouda 's comfort . he visited her regularly each day at certain hours , not so much to talk himself , as to sit and hear her talk . he treated her with the strictest politeness , but with the precision of an automaton , the movements of which had been arranged for this purpose . aouda did not quite know what to make of him , though passepartout had given her some hints of his master 's eccentricity , and made her smile by telling her of the wager which was sending him round the world . after all , she owed phileas fogg her life , and she always regarded him through the exalting medium of her gratitude .",3,"('day', 'jour', 'día')",0
"the result of the treaty was , that hans engaged on his part to conduct us to the village of stapi , on the south shore of the snæfell peninsula , at the very foot of the volcano . by land this would be about twenty - two miles , to be done , said my uncle , in two days .",60,"('day', 'jour', 'día')",0
""" no , no , "" replied fix ; "" i shall stop at hong kong -- at least for some days . """,21,"('day', 'jour', 'día')",0
""" as well and as punctual as ever , not a day behind time ! but , monsieur fix , you do n't know that we have a young lady with us . """,11,"('day', 'jour', 'día')",0
"at eleven o'clock the rangoon rode out of singapore harbour , and in a few hours the high mountains of malacca , with their forests , inhabited by the most beautifully - furred tigers in the world , were lost to view . singapore is distant some thirteen hundred miles from the island of hong kong , which is a little english colony near the chinese coast . phileas fogg hoped to accomplish the journey in six days , so as to be in time for the steamer which would leave on the 6th of november for yokohama , the principal japanese port .",77,"('day', 'jour', 'día')",0
""" you are in a great hurry , then , "" said fix to him one day , "" to reach hong kong ? """,16,"('day', 'jour', 'día')",0
"my god , grant that he may one day suffer what i suffer ! """,8,"('day', 'jour', 'día')",0
""" gentlemen , "" said d’artagnan , addressing the guardsmen , "" you may easily comprehend that such a feast can only be very dull after what has taken place ; so accept my excuses , and put off the party till another day , i beg of you . """,43,"('day', 'jour', 'día')",0
"the weather was bad during the latter days of the voyage . the wind , obstinately remaining in the north - west , blew a gale , and retarded the steamer . the rangoon rolled heavily and the passengers became impatient of the long , monstrous waves which the wind raised before their path .",7,"('day', 'jour', 'día')",0
"fix did not look at the state of things in the same light . the storm greatly pleased him . his satisfaction would have been complete had the rangoon been forced to retreat before the violence of wind and waves . each delay filled him with hope , for it became more and more probable that fogg would be obliged to remain some days at hong kong ; and now the heavens themselves became his allies , with the gusts and squalls . it mattered not that they made him sea - sick -- he made no account of this inconvenience ; and , whilst his body was writhing under their effects , his spirit bounded with hopeful exultation .",63,"('day', 'jour', 'día')",0
"he threw himself into a chair and began to think . suddenly there flashed across his mind what he had said in basil hallward 's studio the day the picture had been finished . yes , he remembered it perfectly . he had uttered a mad wish that he himself might remain young , and the portrait grow old ; that his own beauty might be untarnished , and the face on the canvas bear the burden of his passions and his sins ; that the painted image might be seared with the lines of suffering and thought , and that he might keep all the delicate bloom and loveliness of his then just conscious boyhood . surely his wish had not been fulfilled ? such things were impossible . it seemed monstrous even to think of them . and , yet , there was the picture before him , with the touch of cruelty in the mouth .",27,"('day', 'jour', 'día')",0
""" this is bad , "" muttered passepartout , "" for the gentlemen of the reform club ! "" he accosted fix with a merry smile , as if he had not perceived that gentleman 's chagrin . the detective had , indeed , good reasons to inveigh against the bad luck which pursued him . the warrant had not come ! it was certainly on the way , but as certainly it could not now reach hong kong for several days ; and , this being the last english territory on mr . fogg 's route , the robber would escape , unless he could manage to detain him .",81,"('day', 'jour', 'día')",0
fix now decided to make a bold move ; he resolved to tell passepartout all . it seemed to be the only possible means of keeping phileas fogg several days longer at hong kong .,29,"('day', 'jour', 'día')",0
""" yes , harry , i know what you are going to say . something dreadful about marriage . do n't say it . do n't ever say things of that kind to me again . two days ago i asked sibyl to marry me . i am not going to break my word to her . she is to be my wife . """,37,"('day', 'jour', 'día')",0
"the juncture was favorable . the english , who require , above everything , good living in order to be good soldiers , only eating salt meat and bad biscuit , had many invalids in their camp . still further , the sea , very rough at this period of the year all along the sea coast , destroyed every day some little vessel ; and the shore , from the point of l’aiguillon to the trenches , was at every tide literally covered with the wrecks of pinnacles , roberges , and feluccas . the result was that even if the king ’s troops remained quietly in their camp , it was evident that some day or other , buckingham , who only continued in the isle from obstinacy , would be obliged to raise the siege .",60,"('day', 'jour', 'día')",0
"my uncle soon discovered what sort of a man he had to do with ; instead of a good and learned man he found a rude and coarse peasant . he therefore resolved to commence the grand expedition at once , and to leave this inhospitable parsonage . he cared nothing about fatigue , and resolved to spend some days upon the mountain .",59,"('day', 'jour', 'día')",0
"it was upon the cardinal that all the responsibility fell , for one is not a despotic minister without responsibility . all , therefore , of the vast resources of his genius were at work night and day , engaged in listening to the least report heard in any of the great kingdoms of europe .",37,"('day', 'jour', 'día')",0
"courtiers , becoming every instant more numerous , succeeded one another , day and night , in the little house of the bridge of la pierre , in which the cardinal had established his residence .",12,"('day', 'jour', 'día')",0
"now , one evening when d’artagnan , who was in the trenches , was not able to accompany them , athos , porthos , and aramis , mounted on their battle steeds , enveloped in their war cloaks , with their hands upon their pistol butts , were returning from a drinking place called the red dovecot , which athos had discovered two days before upon the route to jarrie , following the road which led to the camp and quite on their guard , as we have stated , for fear of an ambuscade , when , about a quarter of a league from the village of boisnau , they fancied they heard the sound of horses approaching them . they immediately all three halted , closed in , and waited , occupying the middle of the road . in an instant , and as the moon broke from behind a cloud , they saw at a turning of the road two horsemen who , on perceiving them , stopped in their turn , appearing to deliberate whether they should continue their route or go back .",63,"('day', 'jour', 'día')",0
""" how can you tell ? you know scarcely anything about him . you went into his service the day he came away ; and he came away on a foolish pretext , without trunks , and carrying a large amount in banknotes . and yet you are bold enough to assert that he is an honest man ! """,19,"('day', 'jour', 'día')",0
