text,ind
"i must , then , repeat continually that we are for ever sundered:--and yet , while i breathe and think , i must love him . """,11
""" pencroft , "" replied the engineer , placing his hand on the sailor 's shoulder , "" if any misfortune happens to you , or to this lad , whom chance has made our child , do you think we could ever cease to blame ourselves ? """,42
""" therefore , my dear mr . o’reilly , you are my prisoner . and if you wish ever to leave my palace , you can not ; so make the best of it .",18
but when st . john had mused a few moments he recommenced as imperturbably and with as much acumen as ever .,20
"what a success for the authorized reporter of the new york herald , and for the number which should contain the article , if it should ever reach the address of its editor , the honorable james bennett !",26
"not that i ever suffered much from them ; i took care to turn the tables . what tricks theodore and i used to play on our miss wilsons , and mrs . greys , and madame jouberts ! mary was always too sleepy to join in a plot with spirit .",3
"their comfort would have been complete , if complete comfort could ever exist for those who are far from their fellow - creatures , and without any means of communication with them .",11
""" and now , "" resumed buckingham , looking earnestly at the young man , "" how shall i ever acquit myself of the debt i owe you ? """,19
"milady changed the conversation without any appearance of affectation , and asked d’artagnan in the most careless manner possible if he had ever been in england .",22
"he would be all that they liked , "" even a professor of dancing and deportment , "" said he to neb , if that was ever necessary .",26
"although milady would very willingly have gone without sleep , sustained as she was by all the excitements which a new adventure awakened in her heart , ever thirsting for intrigues , she nevertheless accepted the offer of the superior . during the last fifteen days she had experienced so many and such various emotions that if her frame of iron was still capable of supporting fatigue , her mind required repose .",27
""" you bear him no good will , madam , "" said holmes . "" tell us then where we shall find him . if you have ever aided him in evil , help us now and so atone . """,27
"i would have been deeply interested in visiting this long , 360-league reef , against which the ever - surging sea broke with the fearsome intensity of thunderclaps . but just then the nautilus 's slanting fins took us to great depths , and i could see nothing of those high coral walls . i had to rest content with the various specimens of fish brought up by our nets . among others i noted some long - finned albacore , a species in the genus scomber , as big as tuna , bluish on the flanks , and streaked with crosswise stripes that disappear when the animal dies . these fish followed us in schools and supplied our table with very dainty flesh . we also caught a large number of yellow - green gilthead , half a decimeter long and tasting like dorado , plus some flying gurnards , authentic underwater swallows that , on dark nights , alternately streak air and water with their phosphorescent glimmers . among mollusks and zoophytes , i found in our trawl 's meshes various species of alcyonarian coral , sea urchins , hammer shells , spurred - star shells , wentletrap snails , horn shells , glass snails . the local flora was represented by fine floating algae : sea tangle , and kelp from the genus macrocystis , saturated with the mucilage their pores perspire , from which i selected a wonderful nemastoma geliniaroidea , classifying it with the natural curiosities in the museum .",17
"but more than that we were never destined to know , though there was much which we might surmise . there was no chance of finding footsteps in the mire , for the rising mud oozed swiftly in upon them , but as we at last reached firmer ground beyond the morass we all looked eagerly for them . but no slightest sign of them ever met our eyes . if the earth told a true story , then stapleton never reached that island of refuge towards which he struggled through the fog upon that last night . somewhere in the heart of the great grimpen mire , down in the foul slime of the huge morass which had sucked him in , this cold and cruel - hearted man is forever buried .",65
""" not with women , "" said the duchess , shaking her head ; "" and women rule the world . i assure you we ca n't bear mediocrities . we women , as some one says , love with our ears , just as you men love with your eyes , if you ever love at all . """,54
"taking advantage of this situation , my two companions and i found seats on the ever - deserted platform . in front of us stood the pilothouse , and unless i 'm extremely mistaken , captain nemo must have been inside , steering his nautilus himself .",15
"although the musketeer was not expected before one o’clock , the procurator ’s wife had been on the watch ever since midday , reckoning that the heart , or perhaps the stomach , of her lover would bring him before his time .",19
""" my dear gladys ! "" cried lord henry . "" how can you say that ? romance lives by repetition , and repetition converts an appetite into an art . besides , each time that one loves is the only time one has ever loved . difference of object does not alter singleness of passion . it merely intensifies it . we can have in life but one great experience at best , and the secret of life is to reproduce that experience as often as possible . """,44
""" it is possible that stapleton did not know of the existence of an heir in canada . in any case he would very soon learn it from his friend dr . mortimer , and he was told by the latter all details about the arrival of henry baskerville . stapleton 's first idea was that this young stranger from canada might possibly be done to death in london without coming down to devonshire at all . he distrusted his wife ever since she had refused to help him in laying a trap for the old man , and he dared not leave her long out of his sight for fear he should lose his influence over her . it was for this reason that he took her to london with him . they lodged , i find , at the mexborough private hotel , in craven street , which was actually one of those called upon by my agent in search of evidence . here he kept his wife imprisoned in her room while he , disguised in a beard , followed dr . mortimer to baker street and afterwards to the station and to the northumberland hotel . his wife had some inkling of his plans ; but she had such a fear of her husband -- a fear founded upon brutal ill - treatment -- that she dare not write to warn the man whom she knew to be in danger . if the letter should fall into stapleton 's hands her own life would not be safe . eventually , as we know , she adopted the expedient of cutting out the words which would form the message , and addressing the letter in a disguised hand . it reached the baronet , and gave him the first warning of his danger .",81
""" it is a formidable difficulty , and i fear that you ask too much when you expect me to solve it . the past and the present are within the field of my inquiry , but what a man may do in the future is a hard question to answer . mrs . stapleton has heard her husband discuss the problem on several occasions . there were three possible courses . he might claim the property from south america , establish his identity before the british authorities there and so obtain the fortune without ever coming to england at all ; or he might adopt an elaborate disguise during the short time that he need be in london ; or , again , he might furnish an accomplice with the proofs and papers , putting him in as heir , and retaining a claim upon some proportion of his income . we can not doubt from what we know of him that he would have found some way out of the difficulty . and now , my dear watson , we have had some weeks of severe work , and for one evening , i think , we may turn our thoughts into more pleasant channels . i have a box for ' les huguenots . ' have you heard the de reszkes ? might i trouble you then to be ready in half an hour , and we can stop at marcini 's for a little dinner on the way ? """,95
captain nemo gave me an odd look and gestured no . which told me pretty clearly that nothing would ever force him to set foot on a land mass again . then he said :,19
but the dog continued to bark more furiously than ever .,9
he _ did _ love me -- no one will ever love me so again .,10
"as you know , at the turn of the tide , the waters confined between the faroe and lofoten islands rush out with irresistible violence . they form a vortex from which no ship has ever been able to escape . monstrous waves race together from every point of the horizon . they form a whirlpool aptly called "" the ocean 's navel , "" whose attracting power extends a distance of fifteen kilometers . it can suck down not only ships but whales , and even polar bears from the northernmost regions .",35
"on the 13th they passed the edge of the banks of newfoundland , a dangerous locality ; during the winter , especially , there are frequent fogs and heavy gales of wind . ever since the evening before the barometer , suddenly falling , had indicated an approaching change in the atmosphere ; and during the night the temperature varied , the cold became sharper , and the wind veered to the south - east .",33
""" truly it is wonderful that you have not been killed a hundred times over . but , for the love of god , do n't let us ever separate again , or we many never see each other more . """,28
"perfect beauty is a strong expression ; but i do not retrace or qualify it : as sweet features as ever the temperate clime of albion moulded ; as pure hues of rose and lily as ever her humid gales and vapoury skies generated and screened , justified , in this instance , the term .",20
"perfect beauty is a strong expression ; but i do not retrace or qualify it : as sweet features as ever the temperate clime of albion moulded ; as pure hues of rose and lily as ever her humid gales and vapoury skies generated and screened , justified , in this instance , the term .",36
""" yes , "" my uncle replied , "" the liedenbrock sea ; and i do n't suppose any other discoverer will ever dispute my claim to name it after myself as its first discoverer . """,22
"not one of the former colonists of lincoln island was absent , for they had sworn to live always together . neb was with his master ; ayrton was there ready to sacrifice himself for all ; pencroft was more a farmer than he had ever been a sailor ; herbert , who completed his studies under the superintendence of cyrus harding , and gideon spilett , who founded the new lincoln herald , the best - informed journal in the world .",45
""" this is the first time i ever heard his name pronounced . """,7
""" it is the first time , then , that you ever went to that house ? """,11
"phileas fogg was free ! he walked to the detective , looked him steadily in the face , and with the only rapid motion he had ever made in his life , or which he ever would make , drew back his arms , and with the precision of a machine knocked fix down .",26
"phileas fogg was free ! he walked to the detective , looked him steadily in the face , and with the only rapid motion he had ever made in his life , or which he ever would make , drew back his arms , and with the precision of a machine knocked fix down .",35
"but this illusion lasted a very short time . we were the only living creatures in this subterranean world . when the wind lulled , a deeper silence than that of the deserts fell upon the arid , naked rocks , and weighed upon the surface of the ocean . i then desired to pierce the distant haze , and to rend asunder the mysterious curtain that hung across the horizon . anxious queries arose to my lips . where did that sea terminate ? where did it lead to ? should we ever know anything about its opposite shores ?",93
""" and weep over a faithless florizel , "" said lord henry , laughing , as he leaned back in his chair . "" my dear dorian , you have the most curiously boyish moods . do you think this girl will ever be really content now with any one of her own rank ? i suppose she will be married some day to a rough carter or a grinning ploughman . well , the fact of having met you , and loved you , will teach her to despise her husband , and she will be wretched . from a moral point of view , i can not say that i think much of your great renunciation . even as a beginning , it is poor . besides , how do you know that hetty is n't floating at the present moment in some starlit mill - pond , with lovely water - lilies round her , like ophelia ? """,42
""" what influence could i have ? "" replied aouda . "" mr . fogg is influenced by no one . has he ever understood that my gratitude to him is overflowing ? has he ever read my heart ? my friend , he must not be left alone an instant ! you say he is going to speak with me this evening ? """,35
""" i have not the slightest idea . if basil chooses to hide himself , it is no business of mine . if he is dead , i do n't want to think about him . death is the only thing that ever terrifies me . i hate it . """,42
"dorian said nothing , but rose from the table , and passing into the next room , sat down to the piano and let his fingers stray across the white and black ivory of the keys . after the coffee had been brought in , he stopped , and looking over at lord henry , said , "" harry , did it ever occur to you that basil was murdered ? """,62
""" you may say so , uncle ; but to me it is most extraordinary , and i can hardly believe my eyes . who would ever have imagined , under this terrestrial crust , an ocean with ebbing and flowing tides , with winds and storms ? """,26
"if ever mortal painted an idea , that mortal was roderick usher .",1
""" i ? in what can i have offended her -- i who ever since i have known her have lived at her feet like a slave ? speak , i beg you ! """,13
""" kitty , "" said he , "" i will read to the bottom of your soul when - ever you like ; do n’t let that disturb you . """,19
""" well , then , come here , my dear , "" said d’artagnan , establishing himself in an easy chair ; "" come , and let me tell you that you are the prettiest soubrette i ever saw ! """,37
"these wise and sober thoughts continued all the while the storm lasted , and indeed some time after ; but the next day the wind was abated , and the sea calmer , and i began to be a little inured to it ; however , i was very grave for all that day , being also a little sea - sick still ; but towards night the weather cleared up , the wind was quite over , and a charming fine evening followed ; the sun went down perfectly clear , and rose so the next morning ; and having little or no wind , and a smooth sea , the sun shining upon it , the sight was , as i thought , the most delightful that ever i saw .",129
""" miss oliver is ever surrounded by suitors and flatterers : in less than a month , my image will be effaced from her heart . she will forget me ; and will marry , probably , some one who will make her far happier than i should do . """,4
""" what , the mercer ’s wife of the rue des fossoyeurs ? has he not already forgotten she ever existed ?",19
"“ xury , ” says i , “ you shall on shore and kill him . ” xury , looked frighted , and said , “ me kill ! he eat me at one mouth!”—one mouthful he meant . however , i said no more to the boy , but bade him lie still , and i took our biggest gun , which was almost musket - bore , and loaded it with a good charge of powder , and with two slugs , and laid it down ; then i loaded another gun with two bullets ; and the third ( for we had three pieces ) i loaded with five smaller bullets . i took the best aim i could with the first piece to have shot him in the head , but he lay so with his leg raised a little above his nose , that the slugs hit his leg about the knee and broke the bone . he started up , growling at first , but finding his leg broken , fell down again ; and then got upon three legs , and gave the most hideous roar that ever i heard . i was a little surprised that i had not hit him on the head ; however , i took up the second piece immediately , and though he began to move off , fired again , and shot him in the head , and had the pleasure to see him drop and make but little noise , but lie struggling for life . then xury took heart , and would have me let him go on shore .",194
"that evening , mr . fogg , as tranquil and phlegmatic as ever , said to aouda : "" is our marriage still agreeable to you ? """,12
"as i had once done thus in my breaking away from my parents , so i could not be content now , but i must go and leave the happy view i had of being a rich and thriving man in my new plantation , only to pursue a rash and immoderate desire of rising faster than the nature of the thing admitted ; and thus i cast myself down again into the deepest gulf of human misery that ever man fell into , or perhaps could be consistent with life and a state of health in the world .",79
"with this design we changed our course , and steered away n.w . by w. , in order to reach some of our english islands , where i hoped for relief . but our voyage was otherwise determined ; for , being in the latitude of twelve degrees eighteen minutes , a second storm came upon us , which carried us away with the same impetuosity westward , and drove us so out of the way of all human commerce , that , had all our lives been saved as to the sea , we were rather in danger of being devoured by savages than ever returning to our own country .",105
""" thus agitated and perplexed , now distracted and lost , now half dead with grief , i revolved in my mind the murder of my father , mother , and brother , committed before my eyes ; the insolence of the rascally bulgarian soldier ; the wound he gave me in the groin ; my servitude ; my being a cook - wench to my bulgarian captain ; my subjection to the hateful jew , and my cruel inquisitor ; the hanging of doctor pangloss ; the miserere sung while you were being whipped ; and particularly the kiss i gave you behind the screen , the last day i ever beheld you .",111
"each picture told a story ; mysterious often to my undeveloped understanding and imperfect feelings , yet ever profoundly interesting : as interesting as the tales bessie sometimes narrated on winter evenings , when she chanced to be in good humour ; and when , having brought her ironing - table to the nursery hearth , she allowed us to sit about it , and while she got up mrs . reed 's lace frills , and crimped her nightcap borders , fed our eager attention with passages of love and adventure taken from old fairy tales and other ballads ; or ( as at a later period i discovered ) from the pages of pamela , and henry , earl of moreland .",17
this same issachar was the most choleric little hebrew that had ever been in israel since the captivity of babylon .,11
"i shudder as i recall these monsters to my remembrance . no human eye has ever beheld them living . they burdened this earth a thousand ages before man appeared , but their fossil remains , found in the argillaceous limestone called by the english the lias , have enabled their colossal structure to be perfectly built up again and anatomically ascertained .",15
""" did ever anybody see such a picture of passion ! """,2
""" the moors presently stripped us as bare as ever we were born . my mother , my maids of honor , and myself , were served all in the same manner .",9
"_ june _ 17.—i spent in cooking the turtle . i found in her three - score eggs ; and her flesh was to me , at that time , the most savoury and pleasant that ever i tasted in my life , having had no flesh , but of goats and fowls , since i landed in this horrid place .",36
"my uncle i had heard was dead -- my only relative ; ever since being made aware of his existence , i had cherished the hope of one day seeing him : now , i never should .",12
"no one that shall ever read this account will expect that i should be able to describe the horrors of my soul at this terrible vision . i mean , that even while it was a dream , i even dreamed of those horrors . nor is it any more possible to describe the impression that remained upon my mind when i awaked , and found it was but a dream .",4
"you have seen an earthquake ; but tell me , miss , have you ever had the plague ? """,14
""" if you had ever had it , "" continued the old woman , "" you would own an earthquake was a trifle to it . it is very common in africa ; i was seized with it .",4
alas ! yes : no jail was ever more secure .,7
"i leaped up on the rock ; my uncle lightly followed , while our hunter remained at his post , like a man too wise ever to be astonished .",25
"why was i always suffering , always browbeaten , always accused , for ever condemned ?",13
""" no ; that does not satisfy me ! "" i exclaimed : and indeed there was something in the hasty and unexplanatory reply which , instead of allaying , piqued my curiosity more than ever .",35
"alice was not a bit hurt , and she jumped up on to her feet in a moment : she looked up , but it was all dark overhead ; before her was another long passage , and the white rabbit was still in sight , hurrying down it . there was not a moment to be lost : away went alice like the wind , and was just in time to hear it say , as it turned a corner , ' oh my ears and whiskers , how late it 's getting ! ' she was close behind it when she turned the corner , but the rabbit was no longer to be seen : she found herself in a long , low hall , which was lit up by a row of lamps hanging from the roof . there were doors all round the hall , but they were all locked ; and when alice had been all the way down one side and up the other , trying every door , she walked sadly down the middle , wondering how she was ever to get out again .",186
"alice opened the door and found that it led into a small passage , not much larger than a rat - hole : she knelt down and looked along the passage into the loveliest garden you ever saw . how she longed to get out of that dark hall , and wander about among those beds of bright flowers and those cool fountains , but she could not even get her head though the doorway ; ' and even if my head would go through , ' thought poor alice , ' it would be of very little use without my shoulders . oh , how i wish i could shut up like a telescope ! i think i could , if i only know how to begin . ' for , you see , so many out - of - the - way things had happened lately , that alice had begun to think that very few things indeed were really impossible . there seemed to be no use in waiting by the little door , so she went back to the table , half hoping she might find another key on it , or at any rate a book of rules for shutting people up like telescopes : this time she found a little bottle on it , ( ' which certainly was not here before , ' said alice , ) and round the neck of the bottle was a paper label , with the words ' drink me ' beautifully printed on it in large letters .",36
"as you hope ever to be forgiven , mr . rivers , the high crime and misdemeanour of spoiling a sanded kitchen , tell me what i wish to know . """,3
"poor alice ! it was as much as she could do , lying down on one side , to look through into the garden with one eye ; but to get through was more hopeless than ever : she sat down and began to cry again .",36
"ere long , i became aware that some one was handling me ; lifting me up and supporting me in a sitting posture , and that more tenderly than i had ever been raised or upheld before . i rested my head against a pillow or an arm , and felt easy .",31
""" an island , ever so big , is an island all the same ! "" said pencroft .",4
"' that was a narrow escape ! ' said alice , a good deal frightened at the sudden change , but very glad to find herself still in existence ; ' and now for the garden ! ' and she ran with all speed back to the little door : but , alas ! the little door was shut again , and the little golden key was lying on the glass table as before , ' and things are worse than ever , ' thought the poor child , ' for i never was so small as this before , never ! and i declare it 's too bad , that it is ! '",81
"this affair put an end to our pursuit of the canoe with the other savages , who were now almost out of sight ; and it was happy for us that we did not , for it blew so hard within two hours after , and before they could be got a quarter of their way , and continued blowing so hard all night , and that from the north - west , which was against them , that i could not suppose their boat could live , or that they ever reached their own coast .",91
"' as wet as ever , ' said alice in a melancholy tone : ' it does n't seem to dry me at all . '",4
""" no , captain , no , we sha n't forget it , "" replied pencroft ; "" and if ever i find one of those tobacco - seeds , which multiply by three hundred and sixty thousand , i assure you i wo n't throw it away !",20
""" oh , no ! mason will not defy me ; nor , knowing it , will he hurt me -- but , unintentionally , he might in a moment , by one careless word , deprive me , if not of life , yet for ever of happiness . """,46
"and thus i have given the first part of a life of fortune and adventure — a life of providence ’s chequer - work , and of a variety which the world will seldom be able to show the like of ; beginning foolishly , but closing much more happily than any part of it ever gave me leave so much as to hope for .",55
""" was ! "" exclaimed herbert , "" do you despair of ever seeing him again ? """,12
""" are you quite sure that this is a man , or that he has ever been one ? "" said pencroft to the reporter .",15
