text,ind
"it was evident that if the castaway had ever been a civilized being , solitude had made him a savage , or worse , perhaps a regular man of the woods .",8
"luckily for alice , the little magic bottle had now had its full effect , and she grew no larger : still it was very uncomfortable , and , as there seemed to be no sort of chance of her ever getting out of the room again , no wonder she felt unhappy .",40
"i followed him to a headland , after he had given his instructions to the hunter . there preserved meat , biscuit , and tea made us an excellent meal , one of the best i ever remember . hunger , the fresh air , the calm quiet weather , after the commotions we had gone through , all contributed to give me a good appetite .",36
""" you mean axel island . do n't decline the honour of having given your name to the first island ever discovered in the central parts of the globe . """,20
"' an arm , you goose ! who ever saw one that size ? why , it fills the whole window ! '",8
"nevertheless , i 'm well aware that the nautilus is drawing near to populated shores , and if some chance for salvation becomes available to us , it would be sheer cruelty to sacrifice my companions to my passion for the unknown . i must go with them , perhaps even guide them . but will this opportunity ever arise ? the human being , robbed of his free will , craves such an opportunity ; but the scientist , forever inquisitive , dreads it .",58
""" is the wandering and sinful , but now rest - seeking and repentant , man justified in daring the world 's opinion , in order to attach to him for ever this gentle , gracious , genial stranger , thereby securing his own peace of mind and regeneration of life ? """,31
""" my son , "" said the old gascon gentleman , in that pure bearn patois of which henry iv could never rid himself , "" this horse was born in the house of your father about thirteen years ago , and has remained in it ever since , which ought to make you love it .",46
"for about an hour the nautilus cruised in the midst of this school of mollusks . then , lord knows why , they were gripped with a sudden fear . as if at a signal , every sail was abruptly lowered ; arms folded , bodies contracted , shells turned over by changing their center of gravity , and the whole flotilla disappeared under the waves . it was instantaneous , and no squadron of ships ever maneuvered with greater togetherness .",76
"bravo , planchet , you are a lad of your word , and if ever you leave your master , i will promise you a place in my service . """,14
"on the 28th of march , 1863 , some excavators working under the direction of m. boucher de perthes , in the stone quarries of moulin quignon , near abbeville , in the department of somme , found a human jawbone fourteen feet beneath the surface . it was the first fossil of this nature that had ever been brought to light . not far distant were found stone hatchets and flint arrow - heads stained and encased by lapse of time with a uniform coat of rust .",57
"he got into debt and into jail : his mother helped him out twice , but as soon as he was free he returned to his old companions and habits . his head was not strong : the knaves he lived amongst fooled him beyond anything i ever heard .",47
"if rage or sorrow ever torture the heart , it is when a lover receives under a name which is not his own protestations of love addressed to his happy rival .",4
that your eye was as steady as ever ;,7
but the stranger knew not the headstrong personage he had to do with ; d’artagnan was not the man ever to cry for quarter .,19
"then these new continents will become , in their turn , uninhabitable ; heat will die away , as does the heat from a body when the soul has left it ; and life will disappear from the globe , if not for ever , at least for a period .",43
"bessie supplied the hiatus by a homily of an hour 's length , in which she proved beyond a doubt that i was the most wicked and abandoned child ever reared under a roof .",29
""" oh , as to his name , i know nothing about it ; but if i were ever to meet him , i should recognize him in an instant , i will answer for it , were he among a thousand persons . """,18
"thus engaged , he appeared , sitting in his own recess , quiet and absorbed enough ; but that blue eye of his had a habit of leaving the outlandish- looking grammar , and wandering over , and sometimes fixing upon us , his fellow - students , with a curious intensity of observation : if caught , it would be instantly withdrawn ; yet ever and anon , it returned searchingly to our table .",65
""" but i am not a foreigner , sir , "" said she , with an accent as pure as ever was heard between portsmouth and manchester ; "" my name is lady clarik , and this measure-- """,20
"i watched it ascending the drive with indifference ; carriages often came to gateshead , but none ever brought visitors in whom i was interested ; it stopped in front of the house , the door - bell rang loudly , the new - comer was admitted .",17
""" thou marvellous genius ! "" he cried , "" thou hast not forgotten one indication which might serve to lay open to mortals the road through the terrestrial crust ; and thy fellow - creatures may even now , after the lapse of three centuries , again trace thy footsteps through these deep and darksome ways . you reserved the contemplation of these wonders for other eyes besides your own . your name , graven from stage to stage , leads the bold follower of your footsteps to the very centre of our planet 's core , and there again we shall find your own name written with your own hand . i too will inscribe my name upon this dark granite page . but for ever henceforth let this cape that advances into the sea discovered by yourself be known by your own illustrious name -- cape saknussemm . """,127
""" very true , "" said cacambo , "" but we have still two sheep remaining , with more treasure than ever the king of spain will be possessed of ; and i espy a town at a distance , which i take to be surinam , a town belonging to the dutch .",21
""" but , "" i said , "" getting back to pearls of great value , i do n't think any sovereign ever possessed one superior to the pearl owned by captain nemo . """,22
""" and should you like to fall into that pit , and to be burning there for ever ? """,17
""" i hope that sigh is from the heart , and that you repent of ever having been the occasion of discomfort to your excellent benefactress . """,15
""" in fact , "" i said , "" mr . land is right . and if we ever brought back to europe or america a pearl worth millions , it would make the story of our adventures more authentic -- and much more rewarding . """,18
""" but , "" said conseil , who perpetually returned to the didactic side of things , "" is this pearl fishing ever dangerous ? """,22
and this idea rooted itself deeper than ever in his determined heart .,7
"yes , to a certainty , and to such a degree , that cyrus harding and the reporter wondered if the reason of the unfortunate man had ever been totally extinguished .",27
i scarce ever knew a city that did not wish the destruction of its neighboring city ; nor a family that did not desire to exterminate some other family .,2
"who is fit for it ? or who , that ever was truly called , believed himself worthy of the summons ?",10
i have watched you ever since we first met : i have made you my study for ten months .,4
would he ever be a convalescent ?,2
"in leaving england , i should leave a loved but empty land -- mr . rochester is not there ; and if he were , what is , what can that ever be to me ?",31
"at length they descried the coast of france , when candide said to martin , "" pray monsieur martin , were you ever in france ? """,22
""" but , pray , monsieur martin , were you ever in paris ? """,10
"i declare she talked to me once like something mad , or like a fiend -- no child ever spoke or looked as she did ; i was glad to get her away from the house .",18
"ere i had finished this reply , my soul began to expand , to exult , with the strangest sense of freedom , of triumph , i ever felt .",27
"' well ! i 've often seen a cat without a grin , ' thought alice ; ' but a grin without a cat ! it 's the most curious thing i ever saw in my life ! '",32
"this diver did n't see us . a shadow cast by our crag hid us from his view . and besides , how could this poor indian ever have guessed that human beings , creatures like himself , were near him under the waters , eavesdropping on his movements , not missing a single detail of his fishing !",27
"this man was armand jean duplessis , cardinal de richelieu ; not such as he is now represented -- broken down like an old man , suffering like a martyr , his body bent , his voice failing , buried in a large armchair as in an anticipated tomb ; no longer living but by the strength of his genius , and no longer maintaining the struggle with europe but by the eternal application of his thoughts -- but such as he really was at this period ; that is to say , an active and gallant cavalier , already weak of body , but sustained by that moral power which made of him one of the most extraordinary men that ever lived , preparing , after having supported the duc de nevers in his duchy of mantua , after having taken nimes , castres , and uzes , to drive the english from the isle of re and lay siege to la rochelle .",121
"how can we be for ever together -- sometimes in solitudes , sometimes amidst savage tribes -- and unwed ? """,5
"through my means , he opens to you a noble career ; as my wife only can you enter upon it . refuse to be my wife , and you limit yourself for ever to a track of selfish ease and barren obscurity .",33
"however difficult it might be , or rather as he pretended it was , to astonish our young traveler , this pastime really astonished him . he had seen in his province -- that land in which heads become so easily heated -- a few of the preliminaries of duels ; but the daring of these four fencers appeared to him the strongest he had ever heard of even in gascony .",65
"it was the first time that he had ever seen birds taken with a line , but the sailor modestly confessed that it was not his first attempt , and that besides he could not claim the merit of invention .",8
""" well then , we 'll enter that atlantic ocean with which we are n't yet familiar . what 's wrong , ned my friend ? are you tired of this voyage under the seas ? are you bored with the constantly changing sight of these underwater wonders ? speaking for myself , i 'll be extremely distressed to see the end of a voyage so few men will ever have a chance to make . """,69
""" in its appointed time . meanwhile there 's nothing we can do about it , and our discussions are futile . my gallant ned , if you come and tell me , ' a chance to escape is available to us , ' then i 'll discuss it with you . but that is n't the case , and in all honesty , i do n't think captain nemo ever ventures into european seas . """,70
"' and ever since that , ' the hatter went on in a mournful tone , ' he wo n't do a thing i ask ! it 's always six o'clock now . '",2
"poor , suffering woman ! it was too late for her to make now the effort to change her habitual frame of mind : living , she had ever hated me -- dying , she must hate me still .",28
' at any rate i 'll never go there again ! ' said alice as she picked her way through the wood . ' it 's the stupidest tea - party i ever was at in all my life ! ',32
""" then , since you 've already mentioned the crossing of the israelites and the catastrophe that befell the egyptians , i would ask if you 've ever discovered any traces under the waters of that great historic event ? """,27
""" an underwater tunnel ! "" he exclaimed . "" a connection between two seas ! who ever heard of such malarkey ! """,17
""" ned my friend , "" conseil replied , "" had you ever heard of the nautilus ? no , yet here it is ! so do n't shrug your shoulders so blithely , and do n't discount something with the feeble excuse that you 've never heard of it . """,12
""" yes , "" replied the venetian , "" there are i think three thousand , and not three dozen of them good for anything . as to those huge volumes of divinity , and those enormous collections of sermons , they are not all together worth one single page in seneca ; and i fancy you will readily believe that neither myself , nor anyone else , ever looks into them . """,68
i was excited more than i had ever been ; and whether what followed was the effect of excitement the reader shall judge .,7
"the fifth said : "" i am king of poland also . i have twice lost my kingdom ; but providence has given me other dominions , where i have done more good than all the sarmatian kings put together were ever able to do on the banks of the vistula ; i resign myself likewise to providence ; and have come to spend the carnival at venice . """,41
""" but this was an odd adventure we met with at venice . i do not think there ever was an instance before of six dethroned monarchs supping together at a public inn . """,18
"but there was no getting at the place of sojourn of the future abbe ; the defiles of the chamber of aramis were as well guarded as the gardens of armida . bazin was stationed in the corridor , and barred his passage with the more intrepidity that , after many years of trial , bazin found himself near a result of which he had ever been ambitious .",65
""" will you ever go back ? """,3
"but this just retaliation would not bring ayrton back to life , and from the examination of the footprints left in the ground , they must , alas ! conclude that all hopes of ever seeing him again must be abandoned .",34
"a cadi ordered me to receive a hundred blows on the soles of my feet , and sent me to the galleys . i do not believe that there was ever an act of more flagrant injustice .",30
"i confess that such discussions with the canadian always baffled me . i did n't want to restrict my companions ' freedom in any way , and yet i had no desire to leave captain nemo . thanks to him and his submersible , i was finishing my undersea research by the day , and i was rewriting my book on the great ocean depths in the midst of its very element . would i ever again have such an opportunity to observe the ocean 's wonders ? absolutely not ! so i could n't entertain this idea of leaving the nautilus before completing our course of inquiry .",75
""" within the last few months it became increasingly plain to me that sir charles 's nervous system was strained to the breaking point . he had taken this legend which i have read you exceedingly to heart -- so much so that , although he would walk in his own grounds , nothing would induce him to go out upon the moor at night . incredible as it may appear to you , mr . holmes , he was honestly convinced that a dreadful fate overhung his family , and certainly the records which he was able to give of his ancestors were not encouraging . the idea of some ghastly presence constantly haunted him , and on more than one occasion he has asked me whether i had on my medical journeys at night ever seen any strange creature or heard the baying of a hound . the latter question he put to me several times , and always with a voice which vibrated with excitement .",136
"if i ever find him again -- and i will find him , i swear , were it in hell ! """,2
""" a great deal : you are good to those who are good to you . it is all i ever desire to be .",20
"alice said nothing ; she had sat down with her face in her hands , wondering if anything would ever happen in a natural way again .",19
""" that will not prevent me , "" replied d’artagnan , "" if ever i find him . """,13
""" and suppose he adds that this offer he 's making you today wo n't ever be repeated , then would you accept ? """,15
"' what is the use of repeating all that stuff , ' the mock turtle interrupted , ' if you do n't explain it as you go on ? it 's by far the most confusing thing i ever heard ! '",38
"be assured that i am devoted to both these all - powerful masters , and that my earnest endeavors have no other aim than the service of the king , and also the cardinal -- one of the most illustrious geniuses that france has ever produced .",44
"did you ever see her furious ? """,2
this new adventure engaged them more deeply than ever in philosophical disputations .,8
""" well then , i think -- and i do n't mean ' i hope'--that your promising opportunity wo n't ever arise . """,20
"as to the other , he knows me , he fears me , and knows what he has to expect of me if ever i escape from his hands . it is useless , then , to attempt anything with him .",23
""" to women who please me only by their faces , i am the very devil when i find out they have neither souls nor hearts -- when they open to me a perspective of flatness , triviality , and perhaps imbecility , coarseness , and ill - temper : but to the clear eye and eloquent tongue , to the soul made of fire , and the character that bends but does not break -- at once supple and stable , tractable and consistent -- i am ever tender and true . """,88
""" had you ever experience of such a character , sir ? did you ever love such an one ? """,3
""" had you ever experience of such a character , sir ? did you ever love such an one ? """,14
no artist is ever morbid . the artist can express everything .,3
""" poor mr . edward ! "" he ejaculated , "" i little thought ever to have seen it !",14
""" it is your best work , basil , the best thing you have ever done , "" said lord henry languidly . "" you must certainly send it next year to the grosvenor . the academy is too large and too vulgar . whenever i have gone there , there have been either so many people that i have not been able to see the pictures , which was dreadful , or so many pictures that i have not been able to see the people , which was worse . the grosvenor is really the only place . """,14
"lord henry elevated his eyebrows and looked at him in amazement through the thin blue wreaths of smoke that curled up in such fanciful whorls from his heavy , opium - tainted cigarette . "" not send it anywhere ? my dear fellow , why ? have you any reason ? what odd chaps you painters are ! you do anything in the world to gain a reputation . as soon as you have one , you seem to want to throw it away . it is silly of you , for there is only one thing in the world worse than being talked about , and that is not being talked about . a portrait like this would set you far above all the young men in england , and make the old men quite jealous , if old men are ever capable of any emotion . """,142
""" you do n't understand me , harry , "" answered the artist . "" of course i am not like him . i know that perfectly well . indeed , i should be sorry to look like him . you shrug your shoulders ? i am telling you the truth . there is a fatality about all physical and intellectual distinction , the sort of fatality that seems to dog through history the faltering steps of kings . it is better not to be different from one 's fellows . the ugly and the stupid have the best of it in this world . they can sit at their ease and gape at the play . if they know nothing of victory , they are at least spared the knowledge of defeat . they live as we all should live -- undisturbed , indifferent , and without disquiet . they neither bring ruin upon others , nor ever receive it from alien hands . your rank and wealth , harry ; my brains , such as they are -- my art , whatever it may be worth ; dorian gray 's good looks -- we shall all suffer for what the gods have given us , suffer terribly . """,158
"accordingly , our speed was twenty - five miles ( that is , twelve four - kilometer leagues ) per hour . needless to say , ned land had to give up his escape plans , much to his distress . swept along at the rate of twelve to thirteen meters per second , he could hardly make use of the skiff . leaving the nautilus under these conditions would have been like jumping off a train racing at this speed , a rash move if there ever was one . moreover , to renew our air supply , the submersible rose to the surface of the waves only at night , and relying solely on compass and log , it steered by dead reckoning .",87
"certainly , if ever a question was necessary to be made , it was that one !",3
"but the result of this discovery of the chest was , that it was now more than ever necessary to explore the island thoroughly .",17
"why , then , should we ever sink overwhelmed with distress , when life is so soon over , and death is so certain an entrance to happiness -- to glory ? """,6
""" the world is full of obvious things which nobody by any chance ever observes . where do you think that i have been ? """,13
