text,ind
"often these chains of barren rocks made a dip towards the sea , and encroached upon the scanty pasturage : but there was always enough room to pass . besides , our horses instinctively chose the easiest places without ever slackening their pace . my uncle was refused even the satisfaction of stirring up his beast with whip or voice . he had no excuse for being impatient . i could not help smiling to see so tall a man on so small a pony , and as his long legs nearly touched the ground he looked like a six - legged centaur .",39
"not a human being that ever lived could wish to be loved better than i was loved ; and him who thus loved me i absolutely worshipped : and i must renounce love and idol . one drear word comprised my intolerable duty--""depart ! """,5
""" what ! we must give up seeing our homeland , friends , and relatives ever again ? """,15
"although athos was scarcely thirty years old , and was of great personal beauty and intelligence of mind , no one knew whether he had ever had a mistress .",25
""" now , allow me to finish what i have to tell you . i 've heard of you , professor aronnax . you , if not your companions , wo n't perhaps complain too much about the stroke of fate that has brought us together . among the books that make up my favorite reading , you 'll find the work you 've published on the great ocean depths . i 've pored over it . you 've taken your studies as far as terrestrial science can go . but you do n't know everything because you have n't seen everything . let me tell you , professor , you wo n't regret the time you spend aboard my vessel . you 're going to voyage through a land of wonders . stunned amazement will probably be your habitual state of mind . it will be a long while before you tire of the sights constantly before your eyes . i 'm going to make another underwater tour of the world-- perhaps my last , who knows?--and i 'll review everything i 've studied in the depths of these seas that i 've crossed so often , and you can be my fellow student . starting this very day , you 'll enter a new element , you 'll see what no human being has ever seen before-- since my men and i no longer count -- and thanks to me , you 're going to learn the ultimate secrets of our planet . """,226
"but the picture ? what was he to say of that ? it held the secret of his life , and told his story . it had taught him to love his own beauty . would it teach him to loathe his own soul ? would he ever look at it again ?",47
""" i was absorbed , sir : yes , and i was happy . to paint them , in short , was to enjoy one of the keenest pleasures i have ever known . """,31
"then he rose from the table , lit a cigarette , and flung himself down on a luxuriously cushioned couch that stood facing the screen . the screen was an old one , of gilt spanish leather , stamped and wrought with a rather florid louis - quatorze pattern . he scanned it curiously , wondering if ever before it had concealed the secret of a man 's life .",57
civilization never recedes ; the law of necessity ever forces it onwards .,8
"one thing , however , he felt that it had done for him . it had made him conscious how unjust , how cruel , he had been to sibyl vane . it was not too late to make reparation for that . she could still be his wife . his unreal and selfish love would yield to some higher influence , would be transformed into some nobler passion , and the portrait that basil hallward had painted of him would be a guide to him through life , would be to him what holiness is to some , and conscience to others , and the fear of god to us all . there were opiates for remorse , drugs that could lull the moral sense to sleep . but here was a visible symbol of the degradation of sin . here was an ever - present sign of the ruin men brought upon their souls .",144
"we were both swift runners and in fairly good training , but we soon found that we had no chance of overtaking him . we saw him for a long time in the moonlight until he was only a small speck moving swiftly among the boulders upon the side of a distant hill . we ran and ran until we were completely blown , but the space between us grew ever wider . finally we stopped and sat panting on two rocks , while we watched him disappearing in the distance .",70
""" yes , harry , i know what you are going to say . something dreadful about marriage . do n't say it . do n't ever say things of that kind to me again . two days ago i asked sibyl to marry me . i am not going to break my word to her . she is to be my wife . """,26
"october 16th.--a dull and foggy day with a drizzle of rain . the house is banked in with rolling clouds , which rise now and then to show the dreary curves of the moor , with thin , silver veins upon the sides of the hills , and the distant boulders gleaming where the light strikes upon their wet faces . it is melancholy outside and in . the baronet is in a black reaction after the excitements of the night . i am conscious myself of a weight at my heart and a feeling of impending danger -- ever present danger , which is the more terrible because i am unable to define it .",99
""" i shall never do that , "" i answered ; "" you have brought detection as near an exact science as it ever will be brought in this world . """,23
"perhaps you had a spy at your heels ; and your visit , if it should ever be known to the cardinal , will thus seem legitimate . """,16
""" 12,000 , professor aronnax . they 're my sole remaining ties with dry land . but i was done with the shore the day my nautilus submerged for the first time under the waters . that day i purchased my last volumes , my last pamphlets , my last newspapers , and ever since i 've chosen to believe that humanity no longer thinks or writes . in any event , professor , these books are at your disposal , and you may use them freely . """,53
""" i was thinking of that . ever since we arrived at stapi i have been occupied with the important question you have just opened , for we must not be guilty of imprudence . """,7
""" so i have murdered sibyl vane , "" said dorian gray , half to himself , "" murdered her as surely as if i had cut her little throat with a knife . yet the roses are not less lovely for all that . the birds sing just as happily in my garden . and to - night i am to dine with you , and then go on to the opera , and sup somewhere , i suppose , afterwards . how extraordinarily dramatic life is ! if i had read all this in a book , harry , i think i would have wept over it . somehow , now that it has happened actually , and to me , it seems far too wonderful for tears . here is the first passionate love - letter i have ever written in my life . strange , that my first passionate love - letter should have been addressed to a dead girl . can they feel , i wonder , those white silent people we call the dead ? sibyl ! can she feel , or know , or listen ? oh , harry , how i loved her once ! it seems years ago to me now . she was everything to me .",141
""" my dear dorian , "" answered lord henry , taking a cigarette from his case and producing a gold - latten matchbox , "" the only way a woman can ever reform a man is by boring him so completely that he loses all possible interest in life . if you had married this girl , you would have been wretched . of course , you would have treated her kindly . one can always be kind to people about whom one cares nothing . but she would have soon found out that you were absolutely indifferent to her . and when a woman finds that out about her husband , she either becomes dreadfully dowdy , or wears very smart bonnets that some other woman 's husband has to pay for . i say nothing about the social mistake , which would have been abject -- which , of course , i would not have allowed-- but i assure you that in any case the whole thing would have been an absolute failure . """,31
"nevertheless , he never borrowed a sou of his companions , although his purse was ever at their service ; and when he had played upon honor , he always awakened his creditor by six o’clock the next morning to pay the debt of the preceding evening .",15
"around this basin , inside elegant glass cases fastened with copper bands , there were classified and labeled the most valuable marine exhibits ever put before the eyes of a naturalist . my professorial glee may easily be imagined .",23
""" i do n't feel up to it , "" said dorian listlessly . "" but i am awfully obliged to you for all that you have said to me . you are certainly my best friend . no one has ever understood me as you have . """,41
"captain nemo , we , whom you have succored , shall ever mourn your loss . """,11
"for there would be a real pleasure in watching it . he would be able to follow his mind into its secret places . this portrait would be to him the most magical of mirrors . as it had revealed to him his own body , so it would reveal to him his own soul . and when winter came upon it , he would still be standing where spring trembles on the verge of summer . when the blood crept from its face , and left behind a pallid mask of chalk with leaden eyes , he would keep the glamour of boyhood . not one blossom of his loveliness would ever fade . not one pulse of his life would ever weaken . like the gods of the greeks , he would be strong , and fleet , and joyous . what did it matter what happened to the coloured image on the canvas ? he would be safe . that was everything .",112
"for there would be a real pleasure in watching it . he would be able to follow his mind into its secret places . this portrait would be to him the most magical of mirrors . as it had revealed to him his own body , so it would reveal to him his own soul . and when winter came upon it , he would still be standing where spring trembles on the verge of summer . when the blood crept from its face , and left behind a pallid mask of chalk with leaden eyes , he would keep the glamour of boyhood . not one blossom of his loveliness would ever fade . not one pulse of his life would ever weaken . like the gods of the greeks , he would be strong , and fleet , and joyous . what did it matter what happened to the coloured image on the canvas ? he would be safe . that was everything .",122
"did you ever suffer from a strain , athos ? "" "" never ! though i remember , in our affair of the rue ferou , i received a sword wound which at the end of fifteen or eighteen days produced the same effect . """,2
"they were then seen following the water - barrier which everywhere presented itself before them , uttering short neighs , then galloping through the grass , and becoming calmer , they would remain entire hours gazing at the woods , from which they were cut off for ever !",47
"supper was rapidly devoured , and the little company housed themselves as best they could . the bed was hard , the shelter not very substantial , and our position an anxious one , at five thousand feet above the sea level . yet i slept particularly well ; it was one of the best nights i had ever had , and i did not even dream .",58
"the painter stared at him . "" my dear boy , what nonsense ! "" he cried . "" do you mean to say you do n't like what i did of you ? where is it ? why have you pulled the screen in front of it ? let me look at it . it is the best thing i have ever done . do take the screen away , dorian . it is simply disgraceful of your servant hiding my work like that . i felt the room looked different as i came in . """,62
"agouties , peccaries , capybaras , kangaroos , game of all sorts , actually swarmed there , and spilett and herbert were too good marksmen ever to throw away their shot uselessly .",25
"the painter shuddered in spite of himself . "" dorian , if i told you , you might like me less than you do , and you would certainly laugh at me . i could not bear your doing either of those two things . if you wish me never to look at your picture again , i am content . i have always you to look at . if you wish the best work i have ever done to be hidden from the world , i am satisfied . your friendship is dearer to me than any fame or reputation . """,77
"even now i can not help feeling that it is a mistake to think that the passion one feels in creation is ever really shown in the work one creates . art is always more abstract than we fancy . form and colour tell us of form and colour -- that is all . it often seems to me that art conceals the artist far more completely than it ever reveals him . and so when i got this offer from paris , i determined to make your portrait the principal thing in my exhibition . it never occurred to me that you would refuse . i see now that you were right . the picture can not be shown . you must not be angry with me , dorian , for what i have told you . as i said to harry , once , you are made to be worshipped . """,22
"even now i can not help feeling that it is a mistake to think that the passion one feels in creation is ever really shown in the work one creates . art is always more abstract than we fancy . form and colour tell us of form and colour -- that is all . it often seems to me that art conceals the artist far more completely than it ever reveals him . and so when i got this offer from paris , i determined to make your portrait the principal thing in my exhibition . it never occurred to me that you would refuse . i see now that you were right . the picture can not be shown . you must not be angry with me , dorian , for what i have told you . as i said to harry , once , you are made to be worshipped . """,69
"dorian gray drew a long breath . the colour came back to his cheeks , and a smile played about his lips . the peril was over . he was safe for the time . yet he could not help feeling infinite pity for the painter who had just made this strange confession to him , and wondered if he himself would ever be so dominated by the personality of a friend . lord henry had the charm of being very dangerous . but that was all . he was too clever and too cynical to be really fond of . would there ever be some one who would fill him with a strange idolatry ? was that one of the things that life had in store ?",62
"dorian gray drew a long breath . the colour came back to his cheeks , and a smile played about his lips . the peril was over . he was safe for the time . yet he could not help feeling infinite pity for the painter who had just made this strange confession to him , and wondered if he himself would ever be so dominated by the personality of a friend . lord henry had the charm of being very dangerous . but that was all . he was too clever and too cynical to be really fond of . would there ever be some one who would fill him with a strange idolatry ? was that one of the things that life had in store ?",103
""" have you ever met him ? """,3
"nothing was heard but that , and jup without ever being disconcerted , replied to every one , watched for everything , and he shook his head in a knowing way when pencroft , referring to his joke of the first day , said to him,--",9
""" did you ever write to sir charles asking him to meet you ? "" i continued .",3
""" ' no good can ever come of falsehood , mother , ' she said . ' let us be frank with this gentleman . we did see mr . drebber again . '",5
""" well , axel , what do you say to it ? "" cried my uncle , rubbing his hands . "" did you ever spend a quieter night in our little house at königsberg ? no noise of cart wheels , no cries of basket women , no boatmen shouting ! """,24
""" were the accomplices of ravaillac or of jacques clement ever known ? """,10
is he still as stingy as ever ?,6
""" dorian ! what an extraordinary piece of luck ! i have been waiting for you in your library ever since nine o'clock . finally i took pity on your tired servant and told him to go to bed , as he let me out . i am off to paris by the midnight train , and i particularly wanted to see you before i left . i thought it was you , or rather your fur coat , as you passed me . but i was n't quite sure . did n't you recognize me ? """,19
"with their life in the open air , on this salubrious soil , under that temperate zone , working both with head and hands , they could not suppose that illness would ever attack them .",32
""" how ? know you again ? did you ever see that man before ? """,9
"with a perfect shriek of delight he rushed to the box , cut the other pill in two , dissolved it , added milk , and presented it to the terrier . the unfortunate creature 's tongue seemed hardly to have been moistened in it before it gave a convulsive shiver in every limb , and lay as rigid and lifeless as if it had been struck by lightning . sherlock holmes drew a long breath , and wiped the perspiration from his forehead . "" i should have more faith , "" he said ; "" i ought to know by this time that when a fact appears to be opposed to a long train of deductions , it invariably proves to be capable of bearing some other interpretation . of the two pills in that box one was of the most deadly poison , and the other was entirely harmless . i ought to have known that before ever i saw the box at all . """,160
""" see ! "" the harpooner exclaimed . "" there 's nothing to see , nothing we 'll ever see from this sheet - iron prison ! we 're simply running around blindfolded-- """,18
""" less quickly than the women , it seems to me , "" replied porthos ; "" for i , madame , i may say i was your victim , when wounded , dying , i was abandoned by the surgeons . i , the offspring of a noble family , who placed reliance upon your friendship -- i was near dying of my wounds at first , and of hunger afterward , in a beggarly inn at chantilly , without you ever deigning once to reply to the burning letters i addressed to you . """,82
"there was a full complement of passengers on board , among them english , many americans , a large number of coolies on their way to california , and several east indian officers , who were spending their vacation in making the tour of the world . nothing of moment happened on the voyage ; the steamer , sustained on its large paddles , rolled but little , and the pacific almost justified its name . mr . fogg was as calm and taciturn as ever . his young companion felt herself more and more attached to him by other ties than gratitude ; his silent but generous nature impressed her more than she thought ; and it was almost unconsciously that she yielded to emotions which did not seem to have the least effect upon her protector . aouda took the keenest interest in his plans , and became impatient at any incident which seemed likely to retard his journey .",85
""" nobody will ever make me believe , "" ned land said , "" that such animals exist . """,3
""" yikes ! who in hades ever believed in them ? "" the canadian exclaimed .",6
""" my dear cyrus , have you ever , since you possessed the sextant found in the case , again taken the position of our island ? """,7
"again the agonized cry swept through the silent night , louder and much nearer than ever . and a new sound mingled with it , a deep , muttered rumble , musical and yet menacing , rising and falling like the low , constant murmur of the sea .",15
"he knows well that it would risk the brig , if the sea got up ever so little !",15
""" yet , "" i reflected , "" she has been young once ; her youth would be contemporary with her master 's : mrs . fairfax told me once , she had lived here many years . i do n't think she can ever have been pretty ; but , for aught i know , she may possess originality and strength of character to compensate for the want of personal advantages .",44
"anxious as ever to avoid discovery , i had before resolved to assume an _ alias _ .",2
"yes , a dangerous matter — so dangerous that even the most saintly dared only whisper their religious opinions with bated breath , lest something which fell from their lips might be misconstrued , and bring down a swift retribution upon them . the victims of persecution had now turned persecutors on their own account , and persecutors of the most terrible description . not the inquisition of seville , nor the german vehm - gericht , nor the secret societies of italy , were ever able to put a more formidable machinery in motion than that which cast a cloud over the state of utah .",85
"and then she had such a fine head of hair ; raven - black and so becomingly arranged : a crown of thick plaits behind , and in front the longest , the glossiest curls i ever saw .",36
"through the beds of schist , coloured with delicate shades of green , ran in winding course threads of copper and manganese , with traces of platinum and gold . i thought , what riches are here buried at an unapproachable depth in the earth , hidden for ever from the covetous eyes of the human race ! these treasures have been buried at such a profound depth by the convulsions of primeval times that they run no chance of ever being molested by the pickaxe or the spade .",48
"through the beds of schist , coloured with delicate shades of green , ran in winding course threads of copper and manganese , with traces of platinum and gold . i thought , what riches are here buried at an unapproachable depth in the earth , hidden for ever from the covetous eyes of the human race ! these treasures have been buried at such a profound depth by the convulsions of primeval times that they run no chance of ever being molested by the pickaxe or the spade .",80
""" did you ever go a - begging afore you came here ? """,3
"when i reopened them i saw my two companions motionless and rolled up in their coverings . were they asleep ? as for me , i could not get one moment 's sleep . i was suffering too keenly , and what embittered my thoughts was that there was no remedy . my uncle 's last words echoed painfully in my ears : "" it 's all over ! "" for in such a fearful state of debility it was madness to think of ever reaching the upper world again .",84
""" here , laporte , "" said buckingham , "" these are the only tokens i ever received from her -- this silver casket and these two letters .",16
"there he stopped , feeling afraid to turn round , and his eyes fixed themselves on the intricacies of the pattern before him . he heard campbell bringing in the heavy chest , and the irons , and the other things that he had required for his dreadful work . he began to wonder if he and basil hallward had ever met , and , if so , what they had thought of each other .",60
""" found dead without a mark upon him . you and i know that he died of sheer fright , and we know also what frightened him ; but how are we to get twelve stolid jurymen to know it ? what signs are there of a hound ? where are the marks of its fangs ? of course we know that a hound does not bite a dead body and that sir charles was dead before ever the brute overtook him . but we have to prove all this , and we are not in a position to do it . """,77
"meanwhile we went ever onward , and these vast plains of sand seemed endless . my hands parted liquid curtains that closed again behind me , and my footprints faded swiftly under the water 's pressure .",3
""" of course it is true , lord henry . if we women did not love you for your defects , where would you all be ? not one of you would ever be married . you would be a set of unfortunate bachelors . not , however , that that would alter you much . nowadays all the married men live like bachelors , and all the bachelors like married men . """,32
"captain nemo continued to plummet into the dark depths of this forest , whose shrubbery grew ever more sparse . i observed that vegetable life was disappearing more quickly than animal life . the open - sea plants had already left behind the increasingly arid seafloor , where a prodigious number of animals were still swarming : zoophytes , articulates , mollusks , and fish .",16
""" who has denied you that right ? "" captain nemo replied . "" did i ever try to bind you with your word of honor ? "" the captain stared at me , crossing his arms .",16
""" it was nearer one than twelve , and a wild , bleak night , blowing hard and raining in torrents . dismal as it was outside , i was glad within — so glad that i could have shouted out from pure exultation . if any of you gentlemen have ever pined for a thing , and longed for it during twenty long years , and then suddenly found it within your reach , you would understand my feelings . i lit a cigar , and puffed at it to steady my nerves , but my hands were trembling , and my temples throbbing with excitement . as i drove , i could see old john ferrier and sweet lucy looking at me out of the darkness and smiling at me , just as plain as i see you all in this room . all the way they were ahead of me , one on each side of the horse until i pulled up at the house in the brixton road .",51
"on this occasion i witnessed one of the finest gunshots ever to thrill the marrow of a hunter . a large bird with a wide wingspan , quite clearly visible , approached and hovered over us . when it was just a few meters above the waves , captain nemo 's companion took aim and fired . the animal dropped , electrocuted , and its descent brought it within reach of our adroit hunter , who promptly took possession of it . it was an albatross of the finest species , a wonderful specimen of these open - sea fowl .",10
"it is my way -- it always was my way , by instinct -- ever to meet the brief with brevity , the direct with plainness .",14
""" there , "" he added , "" out there lies true existence ! and i can imagine the founding of nautical towns , clusters of underwater households that , like the nautilus , would return to the surface of the sea to breathe each morning , free towns if ever there were , independent cities ! then again , who knows whether some tyrant . . . """,50
""" for god 's sake do n't talk to me , "" cried dorian , stamping his foot on the ground . "" what do you want ? money ? here it is . do n't ever talk to me again . """,36
