text,ind
"well , did anybody ever dream of calling aramis a coward ?",4
"do n't let him know she liked them best , for this must ever be a secret , kept from all the rest , between yourself and me . '",13
""" there lies our problem . there are indications that the man was crazed with fear before ever he began to run . """,17
""" i think you are wrong , basil , but i wo n't argue with you . it is only the intellectually lost who ever argue . tell me , is dorian gray very fond of you ? """,24
"whereupon i told her not to mind his badinage ; and she , on her part , evinced a fund of genuine french scepticism : denominating mr . rochester "" un vrai menteur , "" and assuring him that she made no account whatever of his "" contes de fee , "" and that "" du reste , il n'y avait pas de fees , et quand meme il y en avait : "" she was sure they would never appear to him , nor ever give him rings , or offer to live with him in the moon .",85
"i examined , too , in thought , the possibility of my ever being able to translate currently a certain little french story which madame pierrot had that day shown me ; nor was that problem solved to my satisfaction ere i fell sweetly asleep .",12
""" really , mr . holmes , this exceeds anything which i could have imagined , "" said dr . mortimer , gazing at my friend in amazement . "" i could understand anyone saying that the words were from a newspaper ; but that you should name which , and add that it came from the leading article , is really one of the most remarkable things which i have ever known . how did you do it ? """,71
"ayrton had no further news of his friends , and relinquished all hope of ever seeing them again .",14
""" see , "" he went on , both asking the questions and supplying the answers . "" is n't it a beauty ? yes ; splendid ! did you ever see such a binding ? does n't the book open easily ? yes ; it stops open anywhere . but does it shut equally well ? yes ; for the binding and the leaves are flush , all in a straight line , and no gaps or openings anywhere . and look at its back , after seven hundred years . why , bozerian , closs , or purgold might have been proud of such a binding ! """,30
""" the truest love that ever heart felt at its kindled core , did through each vein , in quickened start , the tide of being pour .",5
"it was for other traces than those of animals that he searched the thickets of the vast forest , but nothing suspicious ever appeared .",22
"neither top nor jup , who accompanied him , ever betrayed by their behavior that there was anything strange there , and yet more than once again the dog barked at the mouth of the well , which the engineer had before explored without result .",9
"as to the settlers , they had despaired of ever seeing ayrton again , and had been convinced that the convicts had ruthlessly murdered him .",9
""" well , i seem to have come into an inheritance with a vengeance , "" said he when the long narrative was finished . "" of course , i 've heard of the hound ever since i was in the nursery . it 's the pet story of the family , though i never thought of taking it seriously before . but as to my uncle 's death -- well , it all seems boiling up in my head , and i ca n't get it clear yet . you do n't seem quite to have made up your mind whether it 's a case for a policeman or a clergyman . """,35
""" always ! that is a dreadful word . it makes me shudder when i hear it . women are so fond of using it . they spoil every romance by trying to make it last for ever . it is a meaningless word , too . the only difference between a caprice and a lifelong passion is that the caprice lasts a little longer . """,37
"more restless than ever , when i had completed these arrangements i could not sit still , nor even remain in the house : a little time - piece in the room and the old clock in the hall simultaneously struck ten .",3
"it was a great sorrow to them , and they often talked together of these things , without ever doubting however that the cause of the north must triumph , for the honor of the american confederation .",18
""" there now ! "" said holmes bitterly as he emerged panting and white with vexation from the tide of vehicles . "" was ever such bad luck and such bad management , too ? watson , watson , if you are an honest man you will record this also and set it against my successes ! """,24
"they had been talking of america , of their native country , which they had so little hope of ever seeing again .",19
""" harry , i ca n't quarrel with my two best friends at once , but between you both you have made me hate the finest piece of work i have ever done , and i will destroy it . what is it but canvas and colour ? i will not let it come across our three lives and mar them . """,31
""" i adore simple pleasures , "" said lord henry . "" they are the last refuge of the complex . but i do n't like scenes , except on the stage . what absurd fellows you are , both of you ! i wonder who it was defined man as a rational animal . it was the most premature definition ever given . man is many things , but he is not rational . i am glad he is not , after all-- though i wish you chaps would not squabble over the picture . you had much better let me have it , basil . this silly boy does n't really want it , and i really do . """,61
my vacations had all been spent at school : mrs . reed had never sent for me to gateshead ; neither she nor any of her family had ever been to visit me .,28
"it did not appear that the foot of man had ever before trodden these ancient passages , or that his arm had ever displaced one of these blocks , which remained as the volcano had cast them up above the waters , at the time of the submersion of the island .",10
"it did not appear that the foot of man had ever before trodden these ancient passages , or that his arm had ever displaced one of these blocks , which remained as the volcano had cast them up above the waters , at the time of the submersion of the island .",22
"but what can they intend to do with the poor creature , and how shall i ever meet her again ? """,16
"between them and the mountain , the ground is considerably depressed , and if the lava should ever take a course towards the lake , it would be cast on the downs and the neighboring parts of shark gulf . """,17
""" i just do n't attempt to explain it . it seems the very maddest , queerest thing that ever happened to me . """,19
""" he talks little , sir : what he does say is ever to the point .",12
"here , bridges were thrown from one rock to another ; there , arches like those of a wave , into the depths of which the eye could not penetrate ; in one place , large vaulted excavations presented a monumental aspect ; in another , a crowd of columns , spires , and arches , such as no gothic cathedral ever possessed .",61
"assuredly , if the monster ever had to deal with ned land 's harpoon , i would n't bet on the monster .",5
""" no , miss jane , not exactly : you are genteel enough ; you look like a lady , and it is as much as ever i expected of you : you were no beauty as a child . """,26
"there was something i wanted to ask you . have you ever heard anything from your father 's kinsfolk , the eyres ? """,11
""" you had a little cottage near the school , you say : did he ever come there to see you ? """,15
""" no , sir , "" i answered with conviction . "" not even angel - wing clams or salps have ever given off such a powerful light . that glow is basically electric in nature . besides . . . look , look ! it 's shifting ! it 's moving back and forth ! it 's darting at us ! """,21
"so ned land had good reason to worry . in these wide seas empty of islands , it was no longer feasible to jump ship . nor did we have any way to counter captain nemo 's whims . we had no choice but to acquiesce ; but if we could n't attain our end through force or cunning , i liked to think we might achieve it through persuasion . once this voyage was over , might not captain nemo consent to set us free in return for our promise never to reveal his existence ? our word of honor , which we sincerely would have kept . however , this delicate question would have to be negotiated with the captain . but how would he receive our demands for freedom ? at the very outset and in no uncertain terms , had n't he declared that the secret of his life required that we be permanently imprisoned on board the nautilus ? would n't he see my four - month silence as a tacit acceptance of this situation ? would my returning to this subject arouse suspicions that could jeopardize our escape plans , if we had promising circumstances for trying again later on ? i weighed all these considerations , turned them over in my mind , submitted them to conseil , but he was as baffled as i was . in short , although i 'm not easily discouraged , i realized that my chances of ever seeing my fellow men again were shrinking by the day , especially at a time when captain nemo was recklessly racing toward the south atlantic !",250
"some big dogfish also passed by , a voracious species of shark if there ever was one . with some justice , fishermen 's yarns are n't to be trusted , but here 's what a few of them relate . inside the corpse of one of these animals there were found a buffalo head and a whole calf ; in another , two tuna and a sailor in uniform ; in yet another , a soldier with his saber ; in another , finally , a horse with its rider . in candor , none of these sounds like divinely inspired truth . but the fact remains that not a single dogfish let itself get caught in the nautilus 's nets , so i ca n't vouch for their voracity .",14
"ah , good heaven ! there is the hullabaloo louder than ever ! """,11
""" i beg your pardon , it is the literal truth : he asked me more than once , and was as stiff about urging his point as ever you could be . """,28
""" what an experience ! "" i exclaimed . "" traveling these deep regions where no man has ever ventured before ! look , captain ! look at these magnificent rocks , these uninhabited caves , these last global haunts where life is no longer possible ! what unheard - of scenery , and why are we reduced to preserving it only as a memory ? """,18
""" well , then , "" i said , "" i am forced to admit that saknussemm 's sentence is clear , and leaves no room for doubt . i will even allow that the document bears every mark and evidence of authenticity . that learned philosopher did get to the bottom of sneffels , he has seen the shadow of scartaris touch the edge of the crater before the kalends of july ; he may even have heard the legendary stories told in his day about that crater reaching to the centre of the world ; but as for reaching it himself , as for performing the journey , and returning , if he ever went , i say no -- he never , never did that . """,115
"mr . spilett , "" replied the sailor , "" i agree that it is too large for the ' bonadventure , ' but if the fleets of the union were in want of a harbor in the pacific , i do n't think they would ever find a better place than this ! """,46
""" jane , i ever like your tone of voice : it still renews hope , it sounds so truthful . when i hear it , it carries me back a year . i forget that you have formed a new tie .",4
"it was not my habit to be disregardful of appearance or careless of the impression i made : on the contrary , i ever wished to look as well as i could , and to please as much as my want of beauty would permit .",23
"all my heart is yours , sir : it belongs to you ; and with you it would remain , were fate to exile the rest of me from your presence for ever . """,32
"a typical american order if i ever heard one . it would have sounded just fine during some mississippi paddle - wheeler race , to "" outstrip the competition ! """,6
"he paused , as the custom is . when is the pause after that sentence ever broken by reply ? not , perhaps , once in a hundred years .",15
"i did not like her the worse for that ; on the contrary , i felt better pleased than ever .",19
"as for her , she returned to her place with a smile of savage contempt upon her lips , and repeated , blaspheming , that terrible name of god , by whom she had just sworn without ever having learned to know him .",37
"cyrus harding even observed that if by chance the communication between the unknown and the tenants of granite house had ever been established through the granite , and if top 's instinct had as it were felt it , there was no further sign of it during this period .",20
""" mr . rochester , if ever i did a good deed in my life -- if ever i thought a good thought -- if ever i prayed a sincere and blameless prayer -- if ever i wished a righteous wish,--i am rewarded now .",6
""" mr . rochester , if ever i did a good deed in my life -- if ever i thought a good thought -- if ever i prayed a sincere and blameless prayer -- if ever i wished a righteous wish,--i am rewarded now .",17
""" mr . rochester , if ever i did a good deed in my life -- if ever i thought a good thought -- if ever i prayed a sincere and blameless prayer -- if ever i wished a righteous wish,--i am rewarded now .",25
""" mr . rochester , if ever i did a good deed in my life -- if ever i thought a good thought -- if ever i prayed a sincere and blameless prayer -- if ever i wished a righteous wish,--i am rewarded now .",35
""" how could a whale fisherman forget his old trade , sir ? who could ever get tired of such exciting hunting ? """,15
"i do n't know what i expected , but i went out and wandered eastward , soon losing my way in a labyrinth of grimy streets and black grassless squares . about half - past eight i passed by an absurd little theatre , with great flaring gas - jets and gaudy play - bills . a hideous jew , in the most amazing waistcoat i ever beheld in my life , was standing at the entrance , smoking a vile cigar . he had greasy ringlets , and an enormous diamond blazed in the centre of a soiled shirt . 'have a box , my lord ? ' he said , when he saw me , and he took off his hat with an air of gorgeous servility .",66
"but juliet ! harry , imagine a girl , hardly seventeen years of age , with a little , flowerlike face , a small greek head with plaited coils of dark - brown hair , eyes that were violet wells of passion , lips that were like the petals of a rose . she was the loveliest thing i had ever seen in my life . you said to me once that pathos left you unmoved , but that beauty , mere beauty , could fill your eyes with tears . i tell you , harry , i could hardly see this girl for the mist of tears that came across me .",60
"ordinary women never appeal to one 's imagination . they are limited to their century . no glamour ever transfigures them . one knows their minds as easily as one knows their bonnets . one can always find them . there is no mystery in any of them . they ride in the park in the morning and chatter at tea - parties in the afternoon . they have their stereotyped smile and their fashionable manner . they are quite obvious . but an actress ! how different an actress is ! harry ! why did n't you tell me that the only thing worth loving is an actress ? """,18
""" yes , harry , i believe that is true . i can not help telling you things . you have a curious influence over me . if i ever did a crime , i would come and confess it to you . you would understand me . """,29
""" because in those days their tails moved side to side , like those on fish , in other words , their tails were straight up , thrashing the water from left to right , right to left . but spotting that they swam too fast , our creator twisted their tails , and ever since they 've been thrashing the waves up and down , at the expense of their speed . """,54
"it was difficult to fancy that any human creature had ever passed there , but yet top went backward and forward , not like a dog who searches at random , but like a dog being endowed with a mind , who is following up an idea .",10
""" no ; they occupy a range of smaller apartments to the back ; no one ever sleeps here : one would almost say that , if there were a ghost at thornfield hall , this would be its haunt . """,16
""" none that i ever heard of , "" returned mrs . fairfax , smiling .",4
""" basil , my dear boy , puts everything that is charming in him into his work . the consequence is that he has nothing left for life but his prejudices , his principles , and his common sense . the only artists i have ever known who are personally delightful are bad artists . good artists exist simply in what they make , and consequently are perfectly uninteresting in what they are . a great poet , a really great poet , is the most unpoetical of all creatures . but inferior poets are absolutely fascinating . the worse their rhymes are , the more picturesque they look . the mere fact of having published a book of second - rate sonnets makes a man quite irresistible . he lives the poetry that he can not write . the others write the poetry that they dare not realize . """,45
""" all the same , captain , "" said the sailor , "" if we ever decide to leave the island , it wo n't be in a balloon , will it ?",15
"as he left the room , lord henry 's heavy eyelids drooped , and he began to think . certainly few people had ever interested him so much as dorian gray , and yet the lad 's mad adoration of some one else caused him not the slightest pang of annoyance or jealousy . he was pleased by it . it made him a more interesting study . he had been always enthralled by the methods of natural science , but the ordinary subject - matter of that science had seemed to him trivial and of no import .",23
"he began to wonder whether we could ever make psychology so absolute a science that each little spring of life would be revealed to us . as it was , we always misunderstood ourselves and rarely understood others . experience was of no ethical value . it was merely the name men gave to their mistakes . moralists had , as a rule , regarded it as a mode of warning , had claimed for it a certain ethical efficacy in the formation of character , had praised it as something that taught us what to follow and showed us what to avoid . but there was no motive power in experience . it was as little of an active cause as conscience itself . all that it really demonstrated was that our future would be the same as our past , and that the sin we had done once , and with loathing , we would do many times , and with joy .",7
the canadian did n't even bother shrugging his shoulders . attacking cetaceans with thrusts from a spur ! who ever heard of such malarkey !,19
"ah , monsieur bonacieux , i never did love you much , but now it is worse than ever . i hate you , and on my word you shall pay for this ! """,18
"he slipped more cautiously than ever through the brush , followed by his companions ; the silence around was only broken by the low murmuring of the wind among the branches .",5
""" as for me , "" said the sailor , "" if i ever grumble at work , my name 's not jack pencroft , and if you like , captain , we will make a little america of this island !",13
"the time seemed long ; the guide ever and anon left them to take an observation on the edge of the wood , but the guards watched steadily by the glare of the torches , and a dim light crept through the windows of the pagoda .",7
"by her grateful attention to me and mine , she has long since well repaid any little kindness i ever had it in my power to offer her .",19
i hold myself supremely blest -- blest beyond what language can express ; because i am my husband 's life as fully as he is mine . no woman was ever nearer to her mate than i am : ever more absolutely bone of his bone and flesh of his flesh .,30
i hold myself supremely blest -- blest beyond what language can express ; because i am my husband 's life as fully as he is mine . no woman was ever nearer to her mate than i am : ever more absolutely bone of his bone and flesh of his flesh .,39
"will you ever forgive me ? """,2
i had hardly ever seen a handsome youth ; never in my life spoken to one .,3
""" well , perhaps it was . did you ever hear a bittern booming ? """,9
""" it 's the weirdest , strangest thing that ever i heard in my life . """,9
""" was it ever known who this miserable fellow was ? """,3
"it then dawned on me to ask captain nemo if he had already discovered this pole , which no human being had ever trod underfoot .",22
""" i wish i had , for as sure as there is a god in heaven , if he ever does you any wrong , i shall kill him . """,19
""" for ever , too ! """,2
""" no , no . i remember the thrill in your voice . i remember the look in your eyes . please , please , be frank with me , miss stapleton , for ever since i have been here i have been conscious of shadows all round me . life has become like that great grimpen mire , with little green patches everywhere into which one may sink and with no guide to point the track . tell me then what it was that you meant , and i will promise to convey your warning to sir henry . """,34
""" i ask only minutes . jane , did you ever hear or know that i was not the eldest son of my house : that i had once a brother older than i ? """,10
"do you think i ever sleep , then ?",4
""" and did you ever hear that my father was an avaricious , grasping man ? """,4
""" yes ; one of the most curious volcanoes , and the crater of which has scarcely ever been visited . """,17
"during the night the ship might disappear and leave for ever , and , this ship gone , would another ever return to the waters of lincoln island ?",20
""" quite serious , basil . i should be miserable if i thought i should ever be more serious than i am at the present moment . """,15
"i sat in the dingy box absolutely enthralled . i forgot that i was in london and in the nineteenth century . i was away with my love in a forest that no man had ever seen . after the performance was over , i went behind and spoke to her . as we were sitting together , suddenly there came into her eyes a look that i had never seen there before . my lips moved towards hers . we kissed each other . i ca n't describe to you what i felt at that moment . it seemed to me that all my life had been narrowed to one perfect point of rose - coloured joy . she trembled all over and shook like a white narcissus . then she flung herself on her knees and kissed my hands . i feel that i should not tell you all this , but i ca n't help it . of course , our engagement is a dead secret . she has not even told her own mother . i do n't know what my guardians will say . lord radley is sure to be furious . i do n't care . i shall be of age in less than a year , and then i can do what i like . i have been right , basil , have n't i , to take my love out of poetry and to find my wife in shakespeare 's plays ? lips that shakespeare taught to speak have whispered their secret in my ear . i have had the arms of rosalind around me , and kissed juliet on the mouth . """,35
"she and the surgeon , carter ( who dressed mason 's wounds that night he was stabbed and worried ) , are the only two i have ever admitted to my confidence . mrs . fairfax may indeed have suspected something , but she could have gained no precise knowledge as to facts .",27
"lord henry shrugged his shoulders . "" my dear fellow , mediaeval art is charming , but mediaeval emotions are out of date . one can use them in fiction , of course . but then the only things that one can use in fiction are the things that one has ceased to use in fact . believe me , no civilized man ever regrets a pleasure , and no uncivilized man ever knows what a pleasure is . """,63
"lord henry shrugged his shoulders . "" my dear fellow , mediaeval art is charming , but mediaeval emotions are out of date . one can use them in fiction , of course . but then the only things that one can use in fiction are the things that one has ceased to use in fact . believe me , no civilized man ever regrets a pleasure , and no uncivilized man ever knows what a pleasure is . """,72
""" did he ever strike you as being crazy -- this brother of hers ? """,3
""" i ca n't say that he ever did . """,7
""" i have none . "" "" nor ever had , i suppose : do you remember them ? "" "" no . """,8
""" as well and as punctual as ever , not a day behind time ! but , monsieur fix , you do n't know that we have a young lady with us . """,7
""" nothing is ever quite true , "" said lord henry .",3
"i do n't think either summer or harvest , or winter moon , will ever shine on their revels more . "" mrs . fairfax had dropped her knitting , and , with raised eyebrows , seemed wondering what sort of talk this was .",14
""" no ; none that i ever saw . "" "" and your home ? "" "" i have none . """,6
""" i 'm not sure about whether i shall go . i am the most incurably lazy devil that ever stood in shoe leather — that is , when the fit is on me , for i can be spry enough at times . """,19
"a quarter of an hour afterwards , amidst an extraordinary turmoil of applause , sibyl vane stepped on to the stage . yes , she was certainly lovely to look at-- one of the loveliest creatures , lord henry thought , that he had ever seen . there was something of the fawn in her shy grace and startled eyes . a faint blush , like the shadow of a rose in a mirror of silver , came to her cheeks as she glanced at the crowded enthusiastic house . she stepped back a few paces and her lips seemed to tremble . basil hallward leaped to his feet and began to applaud . motionless , and as one in a dream , sat dorian gray , gazing at her . lord henry peered through his glasses , murmuring , "" charming ! charming ! """,44
"employed in houses , they can wait at table , sweep rooms , brush clothes , clean boots , handle a knife , fork , and spoon properly , and even drink wine ... doing everything as well as the best servant that ever walked upon two legs .",43
