text,ind
""" what shocking conduct , miss eyre , to strike a young gentleman , your benefactress 's son !",12
"turning from bessie ( though her presence was far less obnoxious to me than that of abbot , for instance , would have been ) , i scrutinised the face of the gentleman : i knew him ; it was mr . lloyd , an apothecary , sometimes called in by mrs . reed when the servants were ailing : for herself and the children she employed a physician .",32
""" and i renew my promise . be easy , i am a gentleman .",13
""" my son , "" said the old gascon gentleman , in that pure bearn patois of which henry iv could never rid himself , "" this horse was born in the house of your father about thirteen years ago , and has remained in it ever since , which ought to make you love it .",9
"now , as at the moment in which d’artagnan fixed his eyes upon the gentleman in the violet doublet , the gentleman made one of his most knowing and profound remarks respecting the bearnese pony , his two auditors laughed even louder than before , and he himself , though contrary to his custom , allowed a pale smile ( if i may allowed to use such an expression ) to stray over his countenance .",21
"in uttering these words i looked up : he seemed to me a tall gentleman ; but then i was very little ; his features were large , and they and all the lines of his frame were equally harsh and prim .",14
""" in truth , my young friend , you will act rightly , "" said the gentleman , pressing the gascon ’s hand with an affection almost paternal ; "" and god grant that this woman , who has scarcely entered into your life , may not leave a terrible trace in it ! """,16
"that which would now be considered as disgraceful to a gentleman was at that time quite a simple and natural affair , and the younger sons of the best families were frequently supported by their mistresses .",10
""" what is this gentleman ’s name ? "" asked the commissary .",4
""" it is impossible a gentleman could have written such a letter to a woman . """,5
""" base coward ! false gentleman ! "" cried d’artagnan , springing forward , in his turn , after the servant .",5
""" lord , who can say , monsieur ? with some gentleman who was traveling this way , to whom he proposed a game of lansquenet . """,11
""" do you say , "" resumed d’artagnan , "" that you suspect that impertinent gentleman ? """,15
""" i tell you i am sure of it , "" continued the host . "" when i informed him that your lordship was the protege of monsieur de treville , and that you even had a letter for that illustrious gentleman , he appeared to be very much disturbed , and asked me where that letter was , and immediately came down into the kitchen , where he knew your doublet was . """,41
""" even to his horse , monsieur ; for when the gentleman was about to set out , we perceived that his lackey was saddling monsieur porthos ’s horse , as well as his master ’s .",11
"m de troisville , as his family was still called in gascony , or m. de treville , as he has ended by styling himself in paris , had really commenced life as d’artagnan now did ; that is to say , without a sou in his pocket , but with a fund of audacity , shrewdness , and intelligence which makes the poorest gascon gentleman often derive more in his hope from the paternal inheritance than the richest perigordian or berrichan gentleman derives in reality from his .",65
"m de troisville , as his family was still called in gascony , or m. de treville , as he has ended by styling himself in paris , had really commenced life as d’artagnan now did ; that is to say , without a sou in his pocket , but with a fund of audacity , shrewdness , and intelligence which makes the poorest gascon gentleman often derive more in his hope from the paternal inheritance than the richest perigordian or berrichan gentleman derives in reality from his .",82
"the greatest part of the gamesters , who did not understand a syllable of this discourse , amused themselves with drinking , while martin reasoned with the learned gentleman and candide entertained the lady of the house with a part of his adventures .",28
"on one of those immense staircases , upon whose space modern civilization would build a whole house , ascended and descended the office seekers of paris , who ran after any sort of favor -- gentlemen from the provinces anxious to be enrolled , and servants in all sorts of liveries , bringing and carrying messages between their masters and m. de treville .",35
""" different benevolent - minded ladies and gentlemen in this neighbourhood and in london . """,7
our best - born and richest gentlemen sometimes solicit it without being able to obtain it .,6
""" i mean the present gentleman , mr . edward 's father , "" he explained .",5
"i breathed again : my blood resumed its flow . fully assured by these words that mr . edward--_my _ mr . rochester ( god bless him , wherever he was!)--was at least alive : was , in short , "" the present gentleman . """,43
"are you too proud to accept it , young gentleman ? """,9
"i never saw her myself ; but i 've heard leah , the house - maid , tell of her . leah liked her well enough . mr . rochester was about forty , and this governess not twenty ; and you see , when gentlemen of his age fall in love with girls , they are often like as if they were bewitched .",45
""" yes . on the death of sir charles we inquired for this young gentleman and found that he had been farming in canada . from the accounts which have reached us he is an excellent fellow in every way . i speak not as a medical man but as a trustee and executor of sir charles 's will . """,14
""" yes , efficacious grace has touched you , as that gentleman said just now . """,11
""" no , no ; it is one of my friends who loves her -- monsieur athos , this gentleman here . """,19
