text,ind
"_ from the 1st of october to the 24th_.—all these days entirely spent in many several voyages to get all i could out of the ship , which i brought on shore every tide of flood upon rafts . much rain also in the days , though with some intervals of fair weather ; but it seems this was the rainy season .",18
"_ oct . _ 20.—i overset my raft , and all the goods i had got upon it ; but , being in shoal water , and the things being chiefly heavy , i recovered many of them when the tide was out .",15
"_ nov . _ 5.—this day went abroad with my gun and my dog , and killed a wild cat ; her skin pretty soft , but her flesh good for nothing ; every creature that i killed i took of the skins and preserved them . coming back by the sea - shore , i saw many sorts of sea - fowls , which i did not understand ; but was surprised , and almost frightened , with two or three seals , which , while i was gazing at , not well knowing what they were , got into the sea , and escaped me for that time .",99
""" sell one of the horses , "" replied the old woman . "" i will get up behind miss cunegund , though i have only one buttock to ride on , and we shall reach cadiz . """,16
"_ dec _ . 11.—this day i went to work with it accordingly , and got two shores or posts pitched upright to the top , with two pieces of boards across over each post ; this i finished the next day ; and setting more posts up with boards , in about a week more i had the roof secured , and the posts , standing in rows , served me for partitions to part off the house .",15
"candide , cunegund , and the old woman , after passing through lucina , chellas , and letrixa , arrived at length at cadiz . a fleet was then getting ready , and troops were assembling in order to induce the reverend fathers , jesuits of paraguay , who were accused of having excited one of the indian tribes in the neighborhood of the town of the holy sacrament , to revolt against the kings of spain and portugal .",29
"and in fact two liquid columns were rising to a considerable height above the sea . we stood amazed , thunderstruck , at the presence of such a herd of marine monsters . they were of supernatural dimensions ; the smallest of them would have crunched our raft , crew and all , at one snap of its huge jaws . hans wants to tack to get away from this dangerous neighbourhood ; but he sees on the other hand enemies not less terrible ; a tortoise forty feet long , and a serpent of thirty , lifting its fearful head and gleaming eyes above the flood .",66
"i worked excessive hard these three or four months to get my wall done ; and the 14th of april i closed it up , contriving to go into it , not by a door but over the wall , by a ladder , that there might be no sign on the outside of my habitation .",10
"he got up , held it close to my eyes : and i read , traced in indian ink , in my own handwriting , the words "" jane eyre""--the work doubtless of some moment of abstraction .",1
"i remark upon this to my uncle , who replies doubtfully : "" yes , i am convinced that i am right . "" are we , then , speeding forward to some cataract which will cast us down an abyss ? this method of getting on may please the professor , because it is vertical ; but for my part i prefer the more ordinary modes of horizontal progression .",45
"_ may _ 6.—worked on the wreck ; got several iron bolts out of her and other pieces of ironwork . worked very hard , and came home very much tired , and had thoughts of giving it over .",8
"i could not forget his look and his paleness when he whispered : "" jane , i have got a blow -- i have got a blow , jane . """,18
"i could not forget his look and his paleness when he whispered : "" jane , i have got a blow -- i have got a blow , jane . """,24
"_ may _ 10–14.—went every day to the wreck ; and got a great many pieces of timber , and boards , or plank , and two or three hundredweight of iron .",11
"_ may _ 16.—it had blown hard in the night , and the wreck appeared more broken by the force of the water ; but i stayed so long in the woods , to get pigeons for food , that the tide prevented my going to the wreck that day .",34
"let us set to work , but first come and get a store of fuel .",10
""" now , carter , be on the alert , "" he said to this last : "" i give you but half - an - hour for dressing the wound , fastening the bandages , getting the patient downstairs and all . """,36
""" she bit me , "" he murmured . "" she worried me like a tigress , when rochester got the knife from her . """,19
"_ june _ 26.—better ; and having no victuals to eat , took my gun , but found myself very weak . however , i killed a she - goat , and with much difficulty got it home , and broiled some of it , and ate , i would fain have stewed it , and made some broth , but had no pot .",35
"just then the chief officer drew the captain 's attention anew . the latter interrupted his strolling and aimed his spyglass at the point indicated . he observed it a good while . as for me , deeply puzzled , i went below to the lounge and brought back an excellent long - range telescope i habitually used . leaning my elbows on the beacon housing , which jutted from the stern of the platform , i got set to scour that whole stretch of sky and sea . but no sooner had i peered into the eyepiece than the instrument was snatched from my hands .",77
""" let us get a supply , "" replied herbert , who immediately set to work .",3
"it might be truly said , that now i worked for my bread . i believe few people have thought much upon the strange multitude of little things necessary in the providing , producing , curing , dressing , making , and finishing this one article of bread . i , that was reduced to a mere state of nature , found this to my daily discouragement ; and was made more sensible of it every hour , even after i had got the first handful of seed - corn , which , as i have said , came up unexpectedly , and indeed to a surprise .",82
"but when i had done this , i was unable to stir it up again , or to get under it , much less to move it forward towards the water ; so i was forced to give it over ; and yet , though i gave over the hopes of the boat , my desire to venture over for the main increased , rather than decreased , as the means for it seemed impossible .",18
"i was not quite sure whether they had locked the door ; and when i dared move , i got up and went to see .",19
""" you will when you are out of the country : when you get back to spanish town , you may think of her as dead and buried -- or rather , you need not think of her at all . """,13
"another reflection was of great use to me , and doubtless would be so to any one that should fall into such distress as mine was ; and this was , to compare my present condition with what i at first expected it would be ; nay , with what it would certainly have been , if the good providence of god had not wonderfully ordered the ship to be cast up nearer to the shore , where i not only could come at her , but could bring what i got out of her to the shore , for my relief and comfort ; without which , i had wanted for tools to work , weapons for defence , and gunpowder and shot for getting my food .",91
"another reflection was of great use to me , and doubtless would be so to any one that should fall into such distress as mine was ; and this was , to compare my present condition with what i at first expected it would be ; nay , with what it would certainly have been , if the good providence of god had not wonderfully ordered the ship to be cast up nearer to the shore , where i not only could come at her , but could bring what i got out of her to the shore , for my relief and comfort ; without which , i had wanted for tools to work , weapons for defence , and gunpowder and shot for getting my food .",125
"let us get the raft ready . """,2
"ned land tried to lodge a complaint , but the only answer he got was a door shut in his face .",13
"alice was beginning to get very tired of sitting by her sister on the bank , and of having nothing to do : once or twice she had peeped into the book her sister was reading , but it had no pictures or conversations in it , ' and what is the use of a book , ' thought alice ' without pictures or conversation ? '",4
"about four o’clock in the evening , being then within a league of the island , i found the point of the rocks which occasioned this disaster stretching out , as is described before , to the southward , and casting off the current more southerly , had , of course , made another eddy to the north ; and this i found very strong , but not directly setting the way my course lay , which was due west , but almost full north . however , having a fresh gale , i stretched across this eddy , slanting north - west ; and in about an hour came within about a mile of the shore , where , it being smooth water , i soon got to land .",127
"so she was considering in her own mind ( as well as she could , for the hot day made her feel very sleepy and stupid ) , whether the pleasure of making a daisy - chain would be worth the trouble of getting up and picking the daisies , when suddenly a white rabbit with pink eyes ran close by her .",43
"in another moment down went alice after it , never once considering how in the world she was to get out again .",19
"down , down , down . would the fall never come to an end ! ' i wonder how many miles i 've fallen by this time ? ' she said aloud . ' i must be getting somewhere near the centre of the earth . let me see : that would be four thousand miles down , i think-- '",37
""" we shall get you off cannily , dick : and it will be better , both for your sake , and for that of the poor creature in yonder .",3
"alice was not a bit hurt , and she jumped up on to her feet in a moment : she looked up , but it was all dark overhead ; before her was another long passage , and the white rabbit was still in sight , hurrying down it . there was not a moment to be lost : away went alice like the wind , and was just in time to hear it say , as it turned a corner , ' oh my ears and whiskers , how late it 's getting ! ' she was close behind it when she turned the corner , but the rabbit was no longer to be seen : she found herself in a long , low hall , which was lit up by a row of lamps hanging from the roof . there were doors all round the hall , but they were all locked ; and when alice had been all the way down one side and up the other , trying every door , she walked sadly down the middle , wondering how she was ever to get out again .",93
"alice was not a bit hurt , and she jumped up on to her feet in a moment : she looked up , but it was all dark overhead ; before her was another long passage , and the white rabbit was still in sight , hurrying down it . there was not a moment to be lost : away went alice like the wind , and was just in time to hear it say , as it turned a corner , ' oh my ears and whiskers , how late it 's getting ! ' she was close behind it when she turned the corner , but the rabbit was no longer to be seen : she found herself in a long , low hall , which was lit up by a row of lamps hanging from the roof . there were doors all round the hall , but they were all locked ; and when alice had been all the way down one side and up the other , trying every door , she walked sadly down the middle , wondering how she was ever to get out again .",188
"alice opened the door and found that it led into a small passage , not much larger than a rat - hole : she knelt down and looked along the passage into the loveliest garden you ever saw . how she longed to get out of that dark hall , and wander about among those beds of bright flowers and those cool fountains , but she could not even get her head though the doorway ; ' and even if my head would go through , ' thought poor alice , ' it would be of very little use without my shoulders . oh , how i wish i could shut up like a telescope ! i think i could , if i only know how to begin . ' for , you see , so many out - of - the - way things had happened lately , that alice had begun to think that very few things indeed were really impossible . there seemed to be no use in waiting by the little door , so she went back to the table , half hoping she might find another key on it , or at any rate a book of rules for shutting people up like telescopes : this time she found a little bottle on it , ( ' which certainly was not here before , ' said alice , ) and round the neck of the bottle was a paper label , with the words ' drink me ' beautifully printed on it in large letters .",43
"alice opened the door and found that it led into a small passage , not much larger than a rat - hole : she knelt down and looked along the passage into the loveliest garden you ever saw . how she longed to get out of that dark hall , and wander about among those beds of bright flowers and those cool fountains , but she could not even get her head though the doorway ; ' and even if my head would go through , ' thought poor alice , ' it would be of very little use without my shoulders . oh , how i wish i could shut up like a telescope ! i think i could , if i only know how to begin . ' for , you see , so many out - of - the - way things had happened lately , that alice had begun to think that very few things indeed were really impossible . there seemed to be no use in waiting by the little door , so she went back to the table , half hoping she might find another key on it , or at any rate a book of rules for shutting people up like telescopes : this time she found a little bottle on it , ( ' which certainly was not here before , ' said alice , ) and round the neck of the bottle was a paper label , with the words ' drink me ' beautifully printed on it in large letters .",69
"it was all very well to say ' drink me , ' but the wise little alice was not going to do that in a hurry . ' no , i 'll look first , ' she said , ' and see whether it 's marked "" poison "" or not ' ; for she had read several nice little histories about children who had got burnt , and eaten up by wild beasts and other unpleasant things , all because they would not remember the simple rules their friends had taught them : such as , that a red - hot poker will burn you if you hold it too long ; and that if you cut your finger very deeply with a knife , it usually bleeds ; and she had never forgotten that , if you drink much from a bottle marked ' poison , ' it is almost certain to disagree with you , sooner or later .",65
"after a while , finding that nothing more happened , she decided on going into the garden at once ; but , alas for poor alice ! when she got to the door , she found she had forgotten the little golden key , and when she went back to the table for it , she found she could not possibly reach it : she could see it quite plainly through the glass , and she tried her best to climb up one of the legs of the table , but it was too slippery ; and when she had tired herself out with trying , the poor little thing sat down and cried .",29
"soon her eye fell on a little glass box that was lying under the table : she opened it , and found in it a very small cake , on which the words ' eat me ' were beautifully marked in currants . ' well , i 'll eat it , ' said alice , ' and if it makes me grow larger , i can reach the key ; and if it makes me grow smaller , i can creep under the door ; so either way i 'll get into the garden , and i do n't care which happens ! '",90
"she ate a little bit , and said anxiously to herself , ' which way ? which way ? ' , holding her hand on the top of her head to feel which way it was growing , and she was quite surprised to find that she remained the same size : to be sure , this generally happens when one eats cake , but alice had got so much into the way of expecting nothing but out - of - the - way things to happen , that it seemed quite dull and stupid for life to go on in the common way .",67
"i got this cordial at rome , of an italian charlatan -- a fellow you would have kicked , carter . it is not a thing to be used indiscriminately , but it is good upon occasion : as now , for instance .",1
"i had a mind once to try if he had any inclination for his own country again ; and having taught him english so well that he could answer me almost any question , i asked him whether the nation that he belonged to never conquered in battle ? at which he smiled , and said—“yes , yes , we always fight the better ; ” that is , he meant always get the better in fight ; and so we began the following discourse : —",72
""" no , no ! never ! "" shouted my impetuous uncle . "" never ! let the wind catch us if it will ! what i want is to get the least glimpse of rock or shore , even if our raft should be smashed into shivers ! """,30
""" oh ! i saw a light , and i thought a ghost would come . "" i had now got hold of bessie 's hand , and she did not snatch it from me .",20
and he showed his companions a grain -- a single grain -- which from a hole in his pocket had got into the lining of his waistcoat .,20
""" now i am sure you can get on your feet , "" he said--""try . """,7
""" loose bessie 's hand , child : you can not succeed in getting out by these means , be assured .",13
""" now , "" continued he , addressing planchet , "" you have eight days to get an interview with lord de winter ; you have eight days to return -- in all sixteen days . if , on the sixteenth day after your departure , at eight o’clock in the evening you are not here , no money -- even if it be but five minutes past eight . """,16
""" well , my boy , "" said pencroft , laughing , "" we 're getting on capitally , upon my word !",15
"remember , if you talk , if you babble , if you get drunk , you risk your master ’s head , who has so much confidence in your fidelity , and who answers for you .",12
"poor alice ! it was as much as she could do , lying down on one side , to look through into the garden with one eye ; but to get through was more hopeless than ever : she sat down and began to cry again .",30
"he approached the wall , and tried to climb it ; but the wall had been recently pointed , and d’artagnan could get no hold .",22
""" take care of him , "" said mr . rochester to the latter , "" and keep him at your house till he is quite well : i shall ride over in a day or two to see how he gets on .",41
"upon the whole , as i found by all his discourse a settled affection to me , and that nothing could part him from me , so i found all the foundation of his desire to go to his own country was laid in his ardent affection to the people , and his hopes of my doing them good ; a thing which , as i had no notion of myself , so i had not the least thought or intention , or desire of undertaking it . but still i found a strong inclination to attempting my escape , founded on the supposition gathered from the discourse , that there were seventeen bearded men there ; and therefore , without any more delay , i went to work with friday to find out a great tree proper to fell , and make a large periagua , or canoe , to undertake the voyage . there were trees enough in the island to have built a little fleet , not of periaguas or canoes , but even of good , large vessels ; but the main thing i looked at was , to get one so near the water that we might launch it when it was made , to avoid the mistake i committed at first .",193
"at that moment he thought of the trees , upon whose leaves the light still shone ; and as one of them drooped over the road , he thought that from its branches he might get a glimpse of the interior of the pavilion .",35
""" he will get there ! "" said the reporter .",3
""" you were serious when i told you you had got a fortune ; and now , for a matter of no moment , you are excited . """,10
"what was most pressing was to get mme . bonacieux away , and convey her to a place of safety , and there , if matters required , make her a hostage .",6
""" how did he get this wound ? "" i asked him .",4
"as she said this she looked down at her hands , and was surprised to see that she had put on one of the rabbit 's little white kid gloves while she was talking . ' how can i have done that ? ' she thought . ' i must be growing small again . ' she got up and went to the table to measure herself by it , and found that , as nearly as she could guess , she was now about two feet high , and was going on shrinking rapidly : she soon found out that the cause of this was the fan she was holding , and she dropped it hastily , just in time to avoid shrinking away altogether .",57
"so she called softly after it , ' mouse dear ! do come back again , and we wo n't talk about cats or dogs either , if you do n't like them ! ' when the mouse heard this , it turned round and swam slowly back to her : its face was quite pale ( with passion , alice thought ) , and it said in a low trembling voice , ' let us get to the shore , and then i 'll tell you my history , and you 'll understand why it is i hate cats and dogs . '",76
"when this was done , and all safe upon deck , the captain ordered the mate , with three men , to break into the round - house , where the new rebel captain lay , who , having taken the alarm , had got up , and with two men and a boy had got firearms in their hands ; and when the mate , with a crow , split open the door , the new captain and his men fired boldly among them , and wounded the mate with a musket ball , which broke his arm , and wounded two more of the men , but killed nobody . the mate , calling for help , rushed , however , into the round - house , wounded as he was , and , with his pistol , shot the new captain through the head , the bullet entering at his mouth , and came out again behind one of his ears , so that he never spoke a word more : upon which the rest yielded , and the ship was taken effectually , without any more lives lost .",44
"when this was done , and all safe upon deck , the captain ordered the mate , with three men , to break into the round - house , where the new rebel captain lay , who , having taken the alarm , had got up , and with two men and a boy had got firearms in their hands ; and when the mate , with a crow , split open the door , the new captain and his men fired boldly among them , and wounded the mate with a musket ball , which broke his arm , and wounded two more of the men , but killed nobody . the mate , calling for help , rushed , however , into the round - house , wounded as he was , and , with his pistol , shot the new captain through the head , the bullet entering at his mouth , and came out again behind one of his ears , so that he never spoke a word more : upon which the rest yielded , and the ship was taken effectually , without any more lives lost .",55
"it was high time to go , for the pool was getting quite crowded with the birds and animals that had fallen into it : there were a duck and a dodo , a lory and an eaglet , and several other curious creatures . alice led the way , and the whole party swam to the shore .",11
"at last the mouse , who seemed to be a person of authority among them , called out , ' sit down , all of you , and listen to me ! i 'll soon make you dry enough ! ' they all sat down at once , in a large ring , with the mouse in the middle . alice kept her eyes anxiously fixed on it , for she felt sure she would catch a bad cold if she did not get dry very soon .",83
""" delighted , my boy , delighted . we have got there . """,10
""" tell me where i can get you a glass of water , "" said st . john ; "" you must really make an effort to tranquillise your feelings . """,6
""" i can well believe it , "" replied d’artagnan , "" and that was why i got three crowns for him . it must have been for his hide , for , certes , the carcass is not worth eighteen livres .",17
"the mouse did not notice this question , but hurriedly went on , ' "" --found it advisable to go with edgar atheling to meet william and offer him the crown . william 's conduct at first was moderate . but the insolence of his normans-- "" how are you getting on now , my dear ? ' it continued , turning to alice as it spoke .",50
""" no ; but we have got to the end of that endless sea . now we shall go by land , and really begin to go down ! down ! down ! """,6
"' what i was going to say , ' said the dodo in an offended tone , ' was , that the best thing to get us dry would be a caucus - race . '",25
""" in the simplest way possible . when we have reached the centre of the globe , either we shall find some new way to get back , or we shall come back like decent folks the way we came . i feel pleased at the thought that it is sure not to be shut against us . """,25
"nevertheless , rapid as the movement had been , d’artagnan had had time to get a glimpse of the head of an old man .",14
"get up ! "" he continued his way toward the quai des grands augustins , while the two friends went to ring at the bell of the unfortunate porthos .",0
"alice had no idea what to do , and in despair she put her hand in her pocket , and pulled out a box of comfits , ( luckily the salt water had not got into it ) , and handed them round as prizes . there was exactly one a - piece all round . ' but she must have a prize herself , you know , ' said the mouse .",34
"' of course , ' the dodo replied very gravely . ' what else have you got in your pocket ? ' he went on , turning to alice .",16
"if the musketeers did not appear , things were to go on as had been agreed ; mme . bonacieux was to get into the carriage as if to bid her adieu , and she was to take away mme . bonacieux .",22
"' i beg your pardon , ' said alice very humbly : ' you had got to the fifth bend , i think ? '",15
"' i shall do nothing of the sort , ' said the mouse , getting up and walking away . ' you insult me by talking such nonsense ! '",14
""" no . i will retain my post of mistress till you get a substitute . """,12
