text,ind
""" amen ! "" said athos , "" and we will return to that subject later , if such be your pleasure ; but what for the moment engaged my attention most earnestly , and i am sure you will understand me , d’artagnan , was the getting from this woman a kind of carte blanche which she had extorted from the cardinal , and by means of which she could with impunity get rid of you and perhaps of us . """,73
""" if nothing breaks , "" said mudge , "" we shall get there ! """,12
""" and what does she get annoyed with you about , duchess ? """,5
""" a dog ! "" said holmes . "" by jove , a curly - haired spaniel . poor mortimer will never see his pet again . well , i do not know that this place contains any secret which we have not already fathomed . he could hide his hound , but he could not hush its voice , and hence came those cries which even in daylight were not pleasant to hear . on an emergency he could keep the hound in the out - house at merripit , but it was always a risk , and it was only on the supreme day , which he regarded as the end of all his efforts , that he dared do it . this paste in the tin is no doubt the luminous mixture with which the creature was daubed . it was suggested , of course , by the story of the family hell - hound , and by the desire to frighten old sir charles to death . no wonder the poor devil of a convict ran and screamed , even as our friend did , and as we ourselves might have done , when he saw such a creature bounding through the darkness of the moor upon his track . it was a cunning device , for , apart from the chance of driving your victim to his death , what peasant would venture to inquire too closely into such a creature should he get sight of it , as many have done , upon the moor ? i said it in london , watson , and i say it again now , that never yet have we helped to hunt down a more dangerous man than he who is lying yonder""--he swept his long arm towards the huge mottled expanse of green - splotched bog which stretched away until it merged into the russet slopes of the moor .",248
""" let us get on , "" was the engineer 's invariable reply .",3
""" you may get into trouble by what has taken place . """,3
"a train was ready to start when mr . fogg and his party reached the station , and they only had time to get into the cars . they had seen nothing of omaha ; but passepartout confessed to himself that this was not to be regretted , as they were not travelling to see the sights .",23
""" we had an example of his readiness of resource that morning when he got away from us so successfully , and also of his audacity in sending back my own name to me through the cabman . from that moment he understood that i had taken over the case in london , and that therefore there was no chance for him there . he returned to dartmoor and awaited the arrival of the baronet . """,14
"he seemed about to give up all hope , when he espied , anchored at the battery , a cable 's length off at most , a trading vessel , with a screw , well - shaped , whose funnel , puffing a cloud of smoke , indicated that she was getting ready for departure .",51
"a true northerner , thin , bony , lean , about forty - five years of age ; his close - cut hair and his beard , of which he only kept a thick mustache , were already getting gray .",38
""" let me get you some orchids , duchess , "" cried dorian , starting to his feet and walking down the conservatory .",3
""" but could n't we at least get the lay of the land ? "" ned went on . "" here 's an island . on this island there are trees . under those trees land animals loaded with cutlets and roast beef , which i 'd be happy to sink my teeth into . """,7
"on the contrary , i think in time i shall get on with my scholars very well . """,10
"but though neb had been able to make his way into richmond , it was quite another thing to get out again , for the northern prisoners were very strictly watched .",19
""" not very good , dorian . i think most of the birds have gone to the open . i dare say it will be better after lunch , when we get to new ground . """,31
his usually active mind was occupied with one sole thought -- how he might get out of richmond at any cost .,14
"herbert was in ecstasies , neb bounded with joy , pencroft nodded his great head , murmuring these words,-- "" come , our engineer gets on capitally ! """,24
"we come to the conclusion of this voyage under the seas . what happened that night , how the skiff escaped from the maelstrom 's fearsome eddies , how ned land , conseil , and i got out of that whirlpool , i 'm unable to say . but when i regained consciousness , i was lying in a fisherman 's hut on one of the lofoten islands . my two companions , safe and sound , were at my bedside clasping my hands . we embraced each other heartily .",36
"passepartout understood it all ; he was seized with mortal anxiety . the coal was giving out ! "" ah , if my master can get over that , "" muttered he , "" he 'll be a famous man ! "" he could not help imparting to fix what he had overheard .",25
""" i am afraid so , "" rejoined lord henry . "" he got the whole charge of shot in his chest . he must have died almost instantaneously . come ; let us go home . """,13
""" what is ? "" asked lord henry . "" oh ! this accident , i suppose . my dear fellow , it ca n't be helped . it was the man 's own fault . why did he get in front of the guns ? besides , it is nothing to us . it is rather awkward for geoffrey , of course . it does not do to pepper beaters . it makes people think that one is a wild shot . and geoffrey is not ; he shoots very straight . but there is no use talking about the matter . """,39
"unhappily , it is the guns which we have not got .",10
""" all right , get ready for something downright delectable ! if you do n't come back for seconds , i 'm no longer the king of harpooners ! """,4
""" a little patience , my nephew . a relapse might get us into trouble , and we have no time to lose , for the voyage may be a long one . """,11
""" captain fogg , you 've got something of the yankee about you . """,6
"wholly untaught , with faculties quite torpid , they seemed to me hopelessly dull ; and , at first sight , all dull alike : but i soon found i was mistaken . there was a difference amongst them as amongst the educated ; and when i got to know them , and they me , this difference rapidly developed itself .",47
"malaysians , who do a booming business in these birds with the chinese , have various methods for catching them that we could n't use . sometimes they set snares on the tops of the tall trees that the bird of paradise prefers to inhabit . at other times they capture it with a tenacious glue that paralyzes its movements . they will even go so far as to poison the springs where these fowl habitually drink . but in our case , all we could do was fire at them on the wing , which left us little chance of getting one . and in truth , we used up a good part of our ammunition in vain .",101
"chatting thus , pencroft , gideon spilett , and herbert got on board and looked about the deck of the "" bonadventure . """,10
""" damnation ! "" the canadian shot back . "" considering the amount of gin i 've had these past two months , you 've got nothing to complain about ! """,25
"mr . fogg called him in the morning , and told him to get aouda 's breakfast , and a cup of tea and a chop for himself . he desired aouda to excuse him from breakfast and dinner , as his time would be absorbed all day in putting his affairs to rights . in the evening he would ask permission to have a few moment 's conversation with the young lady .",13
"and as this unpleasant notion got hold of me , i surveyed with anxious scrutiny the open spaces before me ; but no living creature appeared upon the barren strand .",5
""" i should have thought they had got tired of that by this time , "" said dorian , pouring himself out some wine and frowning slightly .",7
"i took a sheet of fine card - board , and drew a careful outline . i promised myself the pleasure of colouring it ; and , as it was getting late then , i told her she must come and sit another day .",30
""" my dear boy , they have only been talking about it for six weeks , and the british public are really not equal to the mental strain of having more than one topic every three months . they have been very fortunate lately , however . they have had my own divorce - case and alan campbell 's suicide . now they have got the mysterious disappearance of an artist . scotland yard still insists that the man in the grey ulster who left for paris by the midnight train on the ninth of november was poor basil , and the french police declare that basil never arrived in paris at all . i suppose in about a fortnight we shall be told that he has been seen in san francisco . it is an odd thing , but every one who disappears is said to be seen at san francisco . it must be a delightful city , and possess all the attractions of the next world . """,64
"that renders it useless to get a pleurisy by too much haste . """,5
"the translation of a few pages of german occupied an hour ; then i got my palette and pencils , and fell to the more soothing , because easier occupation , of completing rosamond oliver 's miniature .",14
""" very surprising , indeed , "" said candide , "" but you must get cured . """,14
""" my dear boy , you are really beginning to moralize . you will soon be going about like the converted , and the revivalist , warning people against all the sins of which you have grown tired . you are much too delightful to do that . besides , it is no use . you and i are what we are , and will be what we will be . as for being poisoned by a book , there is no such thing as that . art has no influence upon action . it annihilates the desire to act . it is superbly sterile . the books that the world calls immoral are books that show the world its own shame . that is all . but we wo n't discuss literature . come round to - morrow . i am going to ride at eleven . we might go together , and i will take you to lunch afterwards with lady branksome . she is a charming woman , and wants to consult you about some tapestries she is thinking of buying . mind you come . or shall we lunch with our little duchess ? she says she never sees you now . perhaps you are tired of gladys ? i thought you would be . her clever tongue gets on one 's nerves . well , in any case , be here at eleven . """,222
""" but how are we to get down below this liquid surface ? """,6
"the sailor , whistling and swearing , cried , "" damn it , there 's something to be got here . """,18
"when the clock indicated twenty minutes past eight , andrew stuart got up , saying , "" gentlemen , in twenty minutes the time agreed upon between mr . fogg and ourselves will have expired . """,11
"the old woman 's voice had changed : her accent , her gesture , and all were familiar to me as my own face in a glass -- as the speech of my own tongue . i got up , but did not go .",37
"the sailor , defying death in the pursuit of plunder , rushed into the midst of the ruin , where he found some money , with which he got drunk , and , after he had slept himself sober he purchased the favors of the first good - natured wench that came in his way , amidst the ruins of demolished houses and the groans of half - buried and expiring persons . pangloss pulled him by the sleeve . "" friend , "" said he , "" this is not right , you trespass against the universal reason , and have mistaken your time . """,28
""" well , gentlemen , "" resumed andrew stuart , "" if phileas fogg had come in the 7:23 train , he would have got here by this time . we can , therefore , regard the bet as won . """,24
""" and how shall we get in ? "" asked the sailor .",5
""" fine , conseil ! and i agree that there are honorable cannibals who decently devour their prisoners . however , i 'm opposed to being devoured , even in all decency , so i 'll keep on my guard , especially since the nautilus 's commander seems to be taking no precautions . and now let 's get to work ! """,58
""" eh ? what happened to master ? "" conseil asked , very startled . "" did master get bitten ? """,18
"this was the only voyage which i may say was successful in all my adventures , which i owe to the integrity and honesty of my friend the captain ; under whom also i got a competent knowledge of the mathematics and the rules of navigation , learned how to keep an account of the ship ’s course , take an observation , and , in short , to understand some things that were needful to be understood by a sailor ; for , as he took delight to instruct me , i took delight to learn ; and , in a word , this voyage made me both a sailor and a merchant ; for i brought home five pounds nine ounces of gold - dust for my adventure , which yielded me in london , at my return , almost £ 300 ; and this filled me with those aspiring thoughts which have since so completed my ruin .",34
""" jane , i 've got a blow ; i 've got a blow , jane ! "" he staggered .",5
""" jane , i 've got a blow ; i 've got a blow , jane ! "" he staggered .",11
"it happened one time , that going a - fishing in a calm morning , a fog rose so thick that , though we were not half a league from the shore , we lost sight of it ; and rowing we knew not whither or which way , we laboured all day , and all the next night ; and when the morning came we found we had pulled off to sea instead of pulling in for the shore ; and that we were at least two leagues from the shore . however , we got well in again , though with a great deal of labour and some danger ; for the wind began to blow pretty fresh in the morning ; but we were all very hungry .",96
"i got all things ready as he had directed , and waited the next morning with the boat washed clean , her ancient and pendants out , and everything to accommodate his guests ; when by - and - by my patron came on board alone , and told me his guests had put off going from some business that fell out , and ordered me , with the man and boy , as usual , to go out with the boat and catch them some fish , for that his friends were to sup at his house , and commanded that as soon as i got some fish i should bring it home to his house ; all which i prepared to do .",1
"i got all things ready as he had directed , and waited the next morning with the boat washed clean , her ancient and pendants out , and everything to accommodate his guests ; when by - and - by my patron came on board alone , and told me his guests had put off going from some business that fell out , and ordered me , with the man and boy , as usual , to go out with the boat and catch them some fish , for that his friends were to sup at his house , and commanded that as soon as i got some fish i should bring it home to his house ; all which i prepared to do .",106
"this moment my former notions of deliverance darted into my thoughts , for now i found i was likely to have a little ship at my command ; and my master being gone , i prepared to furnish myself , not for fishing business , but for a voyage ; though i knew not , neither did i so much as consider , whither i should steer — anywhere to get out of that place was my desire .",70
"my first contrivance was to make a pretence to speak to this moor , to get something for our subsistence on board ; for i told him we must not presume to eat of our patron ’s bread . he said that was true ; so he brought a large basket of rusk or biscuit , and three jars of fresh water , into the boat . i knew where my patron ’s case of bottles stood , which it was evident , by the make , were taken out of some english prize , and i conveyed them into the boat while the moor was on shore , as if they had been there before for our master . i conveyed also a great lump of beeswax into the boat , which weighed about half a hundred - weight , with a parcel of twine or thread , a hatchet , a saw , and a hammer , all of which were of great use to us afterwards , especially the wax , to make candles . another trick i tried upon him , which he innocently came into also : his name was ismael , which they call muley , or moely ; so i called to him—“moely , ” said i , “ our patron ’s guns are on board the boat ; can you not get a little powder and shot ? it may be we may kill some alcamies ( a fowl like our curlews ) for ourselves , for i know he keeps the gunner ’s stores in the ship . ” “ yes , ” says he , “ i ’ll bring some ; ” and accordingly he brought a great leather pouch , which held a pound and a half of powder , or rather more ; and another with shot , that had five or six pounds , with some bullets , and put all into the boat . at the same time i had found some powder of my master ’s in the great cabin , with which i filled one of the large bottles in the case , which was almost empty , pouring what was in it into another ; and thus furnished with everything needful , we sailed out of the port to fish . the castle , which is at the entrance of the port , knew who we were , and took no notice of us ; and we were not above a mile out of the port before we hauled in our sail and set us down to fish . the wind blew from the n.n.e . , which was contrary to my desire , for had it blown southerly i had been sure to have made the coast of spain , and at least reached to the bay of cadiz ; but my resolutions were , blow which way it would , i would be gone from that horrid place where i was , and leave the rest to fate .",15
"my first contrivance was to make a pretence to speak to this moor , to get something for our subsistence on board ; for i told him we must not presume to eat of our patron ’s bread . he said that was true ; so he brought a large basket of rusk or biscuit , and three jars of fresh water , into the boat . i knew where my patron ’s case of bottles stood , which it was evident , by the make , were taken out of some english prize , and i conveyed them into the boat while the moor was on shore , as if they had been there before for our master . i conveyed also a great lump of beeswax into the boat , which weighed about half a hundred - weight , with a parcel of twine or thread , a hatchet , a saw , and a hammer , all of which were of great use to us afterwards , especially the wax , to make candles . another trick i tried upon him , which he innocently came into also : his name was ismael , which they call muley , or moely ; so i called to him—“moely , ” said i , “ our patron ’s guns are on board the boat ; can you not get a little powder and shot ? it may be we may kill some alcamies ( a fowl like our curlews ) for ourselves , for i know he keeps the gunner ’s stores in the ship . ” “ yes , ” says he , “ i ’ll bring some ; ” and accordingly he brought a great leather pouch , which held a pound and a half of powder , or rather more ; and another with shot , that had five or six pounds , with some bullets , and put all into the boat . at the same time i had found some powder of my master ’s in the great cabin , with which i filled one of the large bottles in the case , which was almost empty , pouring what was in it into another ; and thus furnished with everything needful , we sailed out of the port to fish . the castle , which is at the entrance of the port , knew who we were , and took no notice of us ; and we were not above a mile out of the port before we hauled in our sail and set us down to fish . the wind blew from the n.n.e . , which was contrary to my desire , for had it blown southerly i had been sure to have made the coast of spain , and at least reached to the bay of cadiz ; but my resolutions were , blow which way it would , i would be gone from that horrid place where i was , and leave the rest to fate .",229
""" that will do , "" said milady ; "" go into your own room , and tomorrow endeavor again to get me an answer to the letter i gave you . """,21
"“ xury , ” says i , “ you shall on shore and kill him . ” xury , looked frighted , and said , “ me kill ! he eat me at one mouth!”—one mouthful he meant . however , i said no more to the boy , but bade him lie still , and i took our biggest gun , which was almost musket - bore , and loaded it with a good charge of powder , and with two slugs , and laid it down ; then i loaded another gun with two bullets ; and the third ( for we had three pieces ) i loaded with five smaller bullets . i took the best aim i could with the first piece to have shot him in the head , but he lay so with his leg raised a little above his nose , that the slugs hit his leg about the knee and broke the bone . he started up , growling at first , but finding his leg broken , fell down again ; and then got upon three legs , and gave the most hideous roar that ever i heard . i was a little surprised that i had not hit him on the head ; however , i took up the second piece immediately , and though he began to move off , fired again , and shot him in the head , and had the pleasure to see him drop and make but little noise , but lie struggling for life . then xury took heart , and would have me let him go on shore .",182
""" we 've got to alert captain nemo , "" i said , reentering the hatch .",3
"but , alas ! for me to do wrong that never did right , was no great wonder . i hail no remedy but to go on : i had got into an employment quite remote to my genius , and directly contrary to the life i delighted in , and for which i forsook my father ’s house , and broke through all his good advice . nay , i was coming into the very middle station , or upper degree of low life , which my father advised me to before , and which , if i resolved to go on with , i might as well have stayed at home , and never have fatigued myself in the world as i had done ; and i used often to say to myself , i could have done this as well in england , among my friends , as have gone five thousand miles off to do it among strangers and savages , in a wilderness , and at such a distance as never to hear from any part of the world that had the least knowledge of me .",30
""" rather an inhospitable question to put to a visitor ; but since you ask it , i answer simply to have a little talk with you ; i got tired of my mute books and empty rooms . besides , since yesterday i have experienced the excitement of a person to whom a tale has been half - told , and who is impatient to hear the sequel . """,29
"when i came down from my apartment in the tree , i looked about me again , and the first thing i found was the boat , which lay , as the wind and the sea had tossed her up , upon the land , about two miles on my right hand . i walked as far as i could upon the shore to have got to her ; but found a neck or inlet of water between me and the boat which was about half a mile broad ; so i came back for the present , being more intent upon getting at the ship , where i hoped to find something for my present subsistence .",102
"my next care was for some ammunition and arms . there were two very good fowling - pieces in the great cabin , and two pistols . these i secured first , with some powder - horns and a small bag of shot , and two old rusty swords . i knew there were three barrels of powder in the ship , but knew not where our gunner had stowed them ; but with much search i found them , two of them dry and good , the third had taken water . those two i got to my raft with the arms . and now i thought myself pretty well freighted , and began to think how i should get to shore with them , having neither sail , oar , nor rudder ; and the least capful of wind would have overset all my navigation .",96
"my next care was for some ammunition and arms . there were two very good fowling - pieces in the great cabin , and two pistols . these i secured first , with some powder - horns and a small bag of shot , and two old rusty swords . i knew there were three barrels of powder in the ship , but knew not where our gunner had stowed them ; but with much search i found them , two of them dry and good , the third had taken water . those two i got to my raft with the arms . and now i thought myself pretty well freighted , and began to think how i should get to shore with them , having neither sail , oar , nor rudder ; and the least capful of wind would have overset all my navigation .",120
"i had three encouragements—1st , a smooth , calm sea ; 2ndly , the tide rising , and setting in to the shore ; 3rdly , what little wind there was blew me towards the land . and thus , having found two or three broken oars belonging to the boat — and , besides the tools which were in the chest , i found two saws , an axe , and a hammer ; with this cargo i put to sea . for a mile or thereabouts my raft went very well , only that i found it drive a little distant from the place where i had landed before ; by which i perceived that there was some indraft of the water , and consequently i hoped to find some creek or river there , which i might make use of as a port to get to land with my cargo .",147
"herbert , for whom it was too deep , swam like a fish , and got through capitally .",15
"and so , by dint of alternate coaxing and commanding , he contrived to get them all once more enclosed in their separate dormitories .",14
"each picture told a story ; mysterious often to my undeveloped understanding and imperfect feelings , yet ever profoundly interesting : as interesting as the tales bessie sometimes narrated on winter evenings , when she chanced to be in good humour ; and when , having brought her ironing - table to the nursery hearth , she allowed us to sit about it , and while she got up mrs . reed 's lace frills , and crimped her nightcap borders , fed our eager attention with passages of love and adventure taken from old fairy tales and other ballads ; or ( as at a later period i discovered ) from the pages of pamela , and henry , earl of moreland .",67
