text,ind
"ah , cursed gascon that i am , i get from one hobble into another .",9
""" i could not get rid of her . she brought me up to royalties , and people with stars and garters , and elderly ladies with gigantic tiaras and parrot noses . she spoke of me as her dearest friend . i had only met her once before , but she took it into her head to lionize me . i believe some picture of mine had made a great success at the time , at least had been chattered about in the penny newspapers , which is the nineteenth - century standard of immortality .",4
""" yes ; horribly unjust of you . i make a great difference between people . i choose my friends for their good looks , my acquaintances for their good characters , and my enemies for their good intellects . a man can not be too careful in the choice of his enemies . i have not got one who is a fool . they are all men of some intellectual power , and consequently they all appreciate me . is that very vain of me ? i think it is rather vain . """,57
""" the devil 's agents may be of flesh and blood , may they not ? there are two questions waiting for us at the outset . the one is whether any crime has been committed at all ; the second is , what is the crime and how was it committed ? of course , if dr . mortimer 's surmise should be correct , and we are dealing with forces outside the ordinary laws of nature , there is an end of our investigation . but we are bound to exhaust all other hypotheses before falling back upon this one . i think we 'll shut that window again , if you do n't mind . it is a singular thing , but i find that a concentrated atmosphere helps a concentration of thought . i have not pushed it to the length of getting into a box to think , but that is the logical outcome of my convictions . have you turned the case over in your mind ? """,146
""" jean , if monsieur pleases , "" replied the newcomer , "" jean passepartout , a surname which has clung to me because i have a natural aptness for going out of one business into another . i believe i 'm honest , monsieur , but , to be outspoken , i 've had several trades . i 've been an itinerant singer , a circus - rider , when i used to vault like leotard , and dance on a rope like blondin . then i got to be a professor of gymnastics , so as to make better use of my talents ; and then i was a sergeant fireman at paris , and assisted at many a big fire . but i quitted france five years ago , and , wishing to taste the sweets of domestic life , took service as a valet here in england . finding myself out of place , and hearing that monsieur phileas fogg was the most exact and settled gentleman in the united kingdom , i have come to monsieur in the hope of living with him a tranquil life , and forgetting even the name of passepartout . """,88
"hallward got up from the seat and walked up and down the garden . after some time he came back . "" harry , "" he said , "" dorian gray is to me simply a motive in art . you might see nothing in him . i see everything in him . he is never more present in my work than when no image of him is there . he is a suggestion , as i have said , of a new manner . i find him in the curves of certain lines , in the loveliness and subtleties of certain colours . that is all . """,1
"phileas fogg got up , took his hat in his left hand , put it on his head with an automatic motion , and went off without a word .",2
"miss temple got up , took her hand and examined her pulse ; then she returned to her own seat : as she resumed it , i heard her sigh low .",2
"and her clothes , they will wear out : how can she get new ones ? """,12
"' it was a curious dream , dear , certainly : but now run in to your tea ; it 's getting late . ' so alice got up and ran off , thinking while she ran , as well she might , what a wonderful dream it had been .",21
"' it was a curious dream , dear , certainly : but now run in to your tea ; it 's getting late . ' so alice got up and ran off , thinking while she ran , as well she might , what a wonderful dream it had been .",27
""" she is far better as she is , "" concluded adele , after musing some time : "" besides , she would get tired of living with only you in the moon .",23
"first , she dreamed of little alice herself , and once again the tiny hands were clasped upon her knee , and the bright eager eyes were looking up into hers -- she could hear the very tones of her voice , and see that queer little toss of her head to keep back the wandering hair that would always get into her eyes -- and still as she listened , or seemed to listen , the whole place around her became alive the strange creatures of her little sister 's dream .",60
""" but you ca n't get her there ; there is no road to the moon : it is all air ; and neither you nor she can fly . """,5
""" we 'll do it this evening at nine o'clock , "" he said . "" i 've alerted conseil . by that time captain nemo will be locked in his room and probably in bed . neither the mechanics or the crewmen will be able to see us . conseil and i will go to the central companionway . as for you , professor aronnax , you 'll stay in the library two steps away and wait for my signal . the oars , mast , and sail are in the skiff . i 've even managed to stow some provisions inside . i 've gotten hold of a monkey wrench to unscrew the nuts bolting the skiff to the nautilus 's hull . so everything 's ready . i 'll see you this evening . """,106
""" admitted , "" the canadian replied , "" but we 've got to risk it . freedom is worth paying for . besides , the longboat 's solidly built , and a few miles with the wind behind us is no big deal . by tomorrow , who knows if this ship wo n't be 100 leagues out to sea ? if circumstances are in our favor , between ten and eleven this evening we 'll be landing on some piece of solid ground , or we 'll be dead . so we 're in god 's hands , and i 'll see you this evening ! """,12
""" but have you got the robber 's description ? "" asked stuart .",4
""" we agreed to wait for the right circumstances , "" ned land went on . "" now we 've got those circumstances . this evening we 'll be just a few miles off the coast of spain . it 'll be cloudy tonight . the wind 's blowing toward shore . you gave me your promise , professor aronnax , and i 'm counting on you . """,20
"so i had to resign myself to my fate and get ready to escape . my baggage was n't heavy . my notes , nothing more .",10
"during one of these excursions , gideon spilett managed to get hold of two couples of living gallinaceae .",10
""" and also why the thief can get away more easily . """,7
""" well , now ; do n't you see it yet ? why i have got a priceless treasure , that i found his morning , in rummaging in old hevelius 's shop , the jew . """,15
"the painter laughed . "" i do n't think there will be any difficulty about that . sit down again , harry . and now , dorian , get up on the platform , and do n't move about too much , or pay any attention to what lord henry says . he has a very bad influence over all his friends , with the single exception of myself . """,28
"my favourite seat was a smooth and broad stone , rising white and dry from the very middle of the beck , and only to be got at by wading through the water ; a feat i accomplished barefoot .",26
"she had a turn for narrative , i for analysis ; she liked to inform , i to question ; so we got on swimmingly together , deriving much entertainment , if not much improvement , from our mutual intercourse .",22
"he wished to get up , and with their assistance he did so . they then proceeded together towards the little stream .",3
"every impulse that we strive to strangle broods in the mind and poisons us . the body sins once , and has done with its sin , for action is a mode of purification . nothing remains then but the recollection of a pleasure , or the luxury of a regret . the only way to get rid of a temptation is to yield to it . resist it , and your soul grows sick with longing for the things it has forbidden to itself , with desire for what its monstrous laws have made monstrous and unlawful . it has been said that the great events of the world take place in the brain . it is in the brain , and the brain only , that the great sins of the world take place also .",56
"when we got back , it was after moonrise : a pony , which we knew to be the surgeon 's , was standing at the garden door . mary ann remarked that she supposed some one must be very ill , as mr . bates had been sent for at that time of the evening .",2
""" all right then ! imagine this weapon to be ten times stronger and the animal ten times more powerful , launch it at a speed of twenty miles per hour , multiply its mass times its velocity , and you get just the collision we need to cause the specified catastrophe .",41
"but , as it always happens , just when a decision had been made to chase the monster , the monster put in no further appearances . for two months nobody heard a word about it . not a single ship encountered it . apparently the unicorn had gotten wise to these plots being woven around it . people were constantly babbling about the creature , even via the atlantic cable ! accordingly , the wags claimed that this slippery rascal had waylaid some passing telegram and was making the most of it .",48
""" certainly , harry . just touch the bell , and when parker comes i will tell him what you want . i have got to work up this background , so i will join you later on . do n't keep dorian too long . i have never been in better form for painting than i am to - day . this is going to be my masterpiece . it is my masterpiece as it stands . """,24
"let us get ready , gentlemen . """,2
""" well , mislaid it , anyhow . i put them both outside my door last night , and there was only one in the morning . i could get no sense out of the chap who cleans them . the worst of it is that i only bought the pair last night in the strand , and i have never had them on . """,29
"i am afraid he sent that soup to where it would boil away to nothing , and martha took to her heels for safety . i followed her , and hardly knowing how i got there i found myself seated in my usual place .",34
"but conseil had one flaw . he was a fanatic on formality , and he only addressed me in the third person -- to the point where it got tiresome .",28
"for caresses , too , i now got grimaces ; for a pressure of the hand , a pinch on the arm ; for a kiss on the cheek , a severe tweak of the ear . it was all right : at present i decidedly preferred these fierce favours to anything more tender .",7
"i got on to her crib and kissed her : her forehead was cold , and her cheek both cold and thin , and so were her hand and wrist ; but she smiled as of old .",1
"if the last hypothesis is correct , it will be easy enough to get home again .",13
""" yes , my boy . get my things ready , get yours ready . we 're departing in two hours . """,6
""" yes , my boy . get my things ready , get yours ready . we 're departing in two hours . """,11
""" bah ! you will get me out if they put me there , "" said d’artagnan .",5
""" well , i seem to have come into an inheritance with a vengeance , "" said he when the long narrative was finished . "" of course , i 've heard of the hound ever since i was in the nursery . it 's the pet story of the family , though i never thought of taking it seriously before . but as to my uncle 's death -- well , it all seems boiling up in my head , and i ca n't get it clear yet . you do n't seem quite to have made up your mind whether it 's a case for a policeman or a clergyman . """,85
""" here is the fine season getting on , and we must not forget that we have a voyage to make . """,6
""" why ? why ? how can i tell ? did not galileo do the same by saturn ? we shall see . i will get at the secret of this document , and i will neither sleep nor eat until i have found it out . """,25
"i bowed , and letting the commander attend to getting under way , i was taken to the cabin that had been set aside for me .",9
i left conseil to the proper stowing of our luggage and climbed on deck to watch the preparations for getting under way .,19
"here we are at thornfield : now let me get down . """,9
""" what a pity we did not get the number ! """,7
""" my dear watson , clumsy as i have been , you surely do not seriously imagine that i neglected to get the number ? no . 2704 is our man . but that is no use to us for the moment . """,21
"as we moved forward , i heard a kind of pitter - patter above my head . sometimes this noise increased and became a continuous crackle . i soon realized the cause . it was a heavy rainfall rattling on the surface of the waves . instinctively i worried that i might get soaked ! by water in the midst of water ! i could n't help smiling at this outlandish notion . but to tell the truth , wearing these heavy diving suits , you no longer feel the liquid element , you simply think you 're in the midst of air a little denser than air on land , that 's all .",52
our path was getting brighter and brighter . the red glow had turned white and was radiating from a mountain peak about 800 feet high . but what i saw was simply a reflection produced by the crystal waters of these strata . the furnace that was the source of this inexplicable light occupied the far side of the mountain .,3
"as for the crew , they only wanted to encounter the unicorn , harpoon it , haul it on board , and carve it up . they surveyed the sea with scrupulous care . besides , commander farragut had mentioned that a certain sum of $ 2,000.00 was waiting for the man who first sighted the animal , be he cabin boy or sailor , mate or officer . i 'll let the reader decide whether eyes got proper exercise aboard the abraham lincoln .",77
how do people do to get a new place ?,5
"if there was game there this was not the time to discuss how it was to be cooked , but rather , how they were to get hold of it .",26
""" four hours ; long enough to get in her coal . it is thirteen hundred and ten miles from suez to aden , at the other end of the red sea , and she has to take in a fresh coal supply . """,7
"feverish with vain labour , i got up and took a turn in the room ; undrew the curtain , noted a star or two , shivered with cold , and again crept to bed .",6
""" good ! "" said fix . "" if the robber is on board he will no doubt get off at suez , so as to reach the dutch or french colonies in asia by some other route . he ought to know that he would not be safe an hour in india , which is english soil . """,18
"the next day , february 20 , i overslept . i was so exhausted from the night before , i did n't get up until eleven o'clock . i dressed quickly . i hurried to find out the nautilus 's heading . the instruments indicated that it was running southward at a speed of twenty miles per hour and a depth of 100 meters .",22
"would he return in triumph or in discouragement ? which would get the upper hand , he or the secret ? i was thus asking myself questions , and mechanically taking between my fingers the sheet of paper mysteriously disfigured with the incomprehensible succession of letters i had written down ; and i repeated to myself "" what does it all mean ? """,11
""" seems to me they are playing me for a sucker in this hotel , "" he cried . "" they 'll find they 've started in to monkey with the wrong man unless they are careful . by thunder , if that chap ca n't find my missing boot there will be trouble . i can take a joke with the best , mr . holmes , but they 've got a bit over the mark this time . """,71
""" still , i must keep this man here until i can get a warrant to arrest him from london . """,12
"this testimonial i accordingly received in about a month , forwarded a copy of it to mrs . fairfax , and got that lady 's reply , stating that she was satisfied , and fixing that day fortnight as the period for my assuming the post of governess in her house .",21
""" pure family affection , i assure you , uncle george . i want to get something out of you . """,15
"they said kelso got some rascally adventurer , some belgian brute , to insult his son- in - law in public -- paid him , sir , to do it , paid him-- and that the fellow spitted his man as if he had been a pigeon . the thing was hushed up , but , egad , kelso ate his chop alone at the club for some time afterwards . he brought his daughter back with him , i was told , and she never spoke to him again . oh , yes ; it was a bad business . the girl died , too , died within a year . so she left a son , did she ? i had forgotten that . what sort of boy is he ? if he is like his mother , he must be a good - looking chap . """,3
""" well , and how do they all get on ?",8
"was this done on purpose ? or was it a mistake ? did he want to reduce us by famine ? this seemed like going rather too far ! what ! should martha and i be victims of a position of things in which we had not the smallest interest ? it was a fact that a few years before this , whilst my uncle was working at his great classification of minerals , he was forty - eight hours without eating , and all his household were obliged to share in this scientific fast . as for me , what i remember is , that i got severe cramps in my stomach , which hardly suited the constitution of a hungry , growing lad .",107
""" who are her people ? "" grumbled the old gentleman . "" has she got any ? """,15
""" i took then , in conformity with the orders of the authorities , who sent me a reinforcement of six men , such measures as i thought necessary to get possession of the persons of the pretended coiners . """,30
"in fact , at one of the doors which opened into the queen ’s apartment appeared the pretty mme . bonacieux . she had been engaged in arranging the dresses and linen in a closet when the king entered ; she could not get out and had heard all .",43
""" bah ! "" he replied . "" nothing 's out there , professor aronnax , and if there is some animal , what chance would we have of spotting it ? ca n't you see we 're just wandering around at random ? people say they 've sighted this slippery beast again in the pacific high seas-- i 'm truly willing to believe it , but two months have already gone by since then , and judging by your narwhale 's personality , it hates growing moldy from hanging out too long in the same waterways ! it 's blessed with a terrific gift for getting around . now , professor , you know even better than i that nature does n't violate good sense , and she would n't give some naturally slow animal the ability to move swiftly if it had n't a need to use that talent . so if the beast does exist , it 's already long gone ! """,106
""" i will show you an excellent shop for getting what you want . """,9
""" we have time to get everything ready for the fine season , "" remarked the engineer , who was consulting with pencroft about these matters .",5
""" get up ! get up ! "" shouted the fine lad .",1
""" get up ! get up ! "" shouted the fine lad .",4
i told him very humbly -- for i could not conceal from myself the scrape i had got into by laying hands on one of his majesty ’s musketeers -- i told him i was quite ready to submit to his conditions .,17
"i got back on my feet . like a torrent the sea was rushing into our retreat , and since we definitely were not mollusks , we had to clear out .",1
""" oh ! but i have seen specimens of the inhabitants , "" answered the duchess vaguely . "" i must confess that most of them are extremely pretty . and they dress well , too . they get all their dresses in paris . i wish i could afford to do the same . """,38
"i am afraid that it will be very difficult to get in , having both wind and tide against us . """,10
""" not quite , my friends ! "" i replied . "" it was the tide , merely the tide , which wellnigh caught us by surprise just as it did sir walter scott 's hero ! the ocean outside is rising , and by a perfectly natural law of balance , the level of this lake is also rising . we 've gotten off with a mild dunking . let 's go change clothes on the nautilus . """,63
""" how long shall we be before we get there ? """,8
"i wonder if she lives alone except this little girl ; if so , and if she is in any degree amiable , i shall surely be able to get on with her ; i will do my best ; it is a pity that doing one 's best does not always answer .",29
"some big dogfish also passed by , a voracious species of shark if there ever was one . with some justice , fishermen 's yarns are n't to be trusted , but here 's what a few of them relate . inside the corpse of one of these animals there were found a buffalo head and a whole calf ; in another , two tuna and a sailor in uniform ; in yet another , a soldier with his saber ; in another , finally , a horse with its rider . in candor , none of these sounds like divinely inspired truth . but the fact remains that not a single dogfish let itself get caught in the nautilus 's nets , so i ca n't vouch for their voracity .",115
"captain nemo decided to take his nautilus down to the lowest depths in order to double - check these different soundings . i got ready to record the results of this experiment . the panels in the lounge opened , and maneuvers began for reaching those strata so prodigiously far removed .",23
""" let me get within four harpoon lengths of it , "" the canadian shot back , "" and it had better listen ! """,3
""" but to get near it , "" the commander went on , "" i 'd have to put a whaleboat at your disposal ? """,3
""" exactly . i have wired to get his name and address from the official registry . i should not be surprised if this were an answer to my question . """,7
""" then commit them over again , "" he said gravely . "" to get back one 's youth , one has merely to repeat one 's follies . """,14
""" i got a message from the head office that a gent at this address had been inquiring for 2704 , "" said he . "" i 've driven my cab this seven years and never a word of complaint . i came here straight from the yard to ask you to your face what you had against me . """,2
""" no doubt , "" returned the sailor , "" since the wind has only that narrow entrance between the two capes to get in by , and , besides , the north cape protects that of the south in a way which would make the entrance of gusts very difficult .",23
""" is john getting the carriage ready ? """,3
""" well , then , "" i said , "" i am forced to admit that saknussemm 's sentence is clear , and leaves no room for doubt . i will even allow that the document bears every mark and evidence of authenticity . that learned philosopher did get to the bottom of sneffels , he has seen the shadow of scartaris touch the edge of the crater before the kalends of july ; he may even have heard the legendary stories told in his day about that crater reaching to the centre of the world ; but as for reaching it himself , as for performing the journey , and returning , if he ever went , i say no -- he never , never did that . """,48
""" and mr . fogg is getting on well ? "" asked fix , in the most natural tone in the world .",6
"driven forward by its powerful propeller , the abraham lincoln headed straight for the animal . unconcerned , the latter let us come within half a cable length ; then , not bothering to dive , it got up a little speed , retreated , and was content to keep its distance .",37
""" a touch , watson -- an undeniable touch ! "" said he . "" i feel a foil as quick and supple as my own . he got home upon me very prettily that time . so his name was sherlock holmes , was it ? """,28
"my lackey and i will have three shots at you , and you will get as many from the cellar . you will then have our swords , with which , i can assure you , my friend and i can play tolerably well .",14
""" stoke up more steam , sir , if you can . as for me , with your permission i 'll go perch on the bobstays under the bowsprit , and if we can get within a harpoon length , i 'll harpoon the brute . """,34
"while the sailor was preparing his hearth with stones which he put to this use , neb and herbert occupied themselves with getting a supply of fuel .",22
""" you thought it was my husband . it is only his wife . you must let me introduce myself . i know you quite well by your photographs . i think my husband has got seventeen of them . """,35
"before taking any rest , he wished to know if it was possible to get round the base of the cone in the case of its sides being too steep and its summit being inaccessible .",14
"also , if the summit of the mountain could not be reached on one side , and if , on the other , they could not get round the base of the cone , it would be impossible to survey the western part of the country , and their object in making the ascent would in part be altogether unattained .",26
""" ah ! that is one of harry 's views , is n't it , mr . gray ? i always hear harry 's views from his friends . it is the only way i get to know of them . but you must not think i do n't like good music . i adore it , but i am afraid of it . it makes me too romantic . i have simply worshipped pianists-- two at a time , sometimes , harry tells me . i do n't know what it is about them . perhaps it is that they are foreigners . they all are , ai n't they ? even those that are born in england become foreigners after a time , do n't they ? it is so clever of them , and such a compliment to art . makes it quite cosmopolitan , does n't it ?",35
