text,ind
"then i took a childish pleasure in exploring the city ; my uncle let me take him with me , but he took notice of nothing , neither the insignificant king 's palace , nor the pretty seventeenth century bridge , which spans the canal before the museum , nor that immense cenotaph of thorwaldsen 's , adorned with horrible mural painting , and containing within it a collection of the sculptor 's works , nor in a fine park the toylike chateau of rosenberg , nor the beautiful renaissance edifice of the exchange , nor its spire composed of the twisted tails of four bronze dragons , nor the great windmill on the ramparts , whose huge arms dilated in the sea breeze like the sails of a ship .",51
"but there was no question now . we were stretched out on the back of some kind of underwater boat that , as far as i could judge , boasted the shape of an immense steel fish . ned land had clear views on the issue . conseil and i could only line up behind him .",34
""" because the sea , my boy , may be considered as an immense reservoir , in which is stored the heat of the summer .",13
"meanwhile captain nemo strolled from one end of the platform to the other , not glancing at me , perhaps not even seeing me . his step was firm but less regular than usual . sometimes he would stop , cross his arms over his chest , and observe the sea . what could he be looking for over that immense expanse ? by then the nautilus lay hundreds of miles from the nearest coast !",60
"as i said , captain nemo wept while staring at the waves . his grief was immense . this was the second companion he had lost since we had come aboard . and what a way to die ! smashed , strangled , crushed by the fearsome arms of a devilfish , ground between its iron mandibles , this friend would never rest with his companions in the placid waters of their coral cemetery !",16
"on the declivity of the atlantic basin the first streams , branches of the north platte river , already appeared . the whole northern and eastern horizon was bounded by the immense semi - circular curtain which is formed by the southern portion of the rocky mountains , the highest being laramie peak . between this and the railway extended vast plains , plentifully irrigated . on the right rose the lower spurs of the mountainous mass which extends southward to the sources of the arkansas river , one of the great tributaries of the missouri .",31
"again i ran , and again returned , bearing an immense mantle lined and edged with fur .",10
it might have been said that an immense cartload of rocks had been emptied out there .,7
"we were walking on sand that was fine - grained and smooth , not wrinkled like beach sand , which preserves the impressions left by the waves . this dazzling carpet was a real mirror , throwing back the sun 's rays with startling intensity . the outcome : an immense vista of reflections that penetrated every liquid molecule . will anyone believe me if i assert that at this thirty - foot depth , i could see as if it was broad daylight ?",50
"the town extends along a low and marshy level , between two hills . an immense bed of lava bounds it on one side , and falls gently towards the sea . on the other extends the vast bay of faxa , shut in at the north by the enormous glacier of the snæfell , and of which the _ valkyria _ was for the time the only occupant . usually the english and french conservators of fisheries moor in this bay , but just then they were cruising about the western coasts of the island .",15
"but there was an immense quantity of it ; the tongue alone yielded six thousand pounds of oil , and the lower lip four thousand .",4
"we had finally arrived on the outskirts of this forest , surely one of the finest in captain nemo 's immense domains . he regarded it as his own and had laid the same claim to it that , in the first days of the world , the first men had to their forests on land . besides , who else could dispute his ownership of this underwater property ? what other , bolder pioneer would come , ax in hand , to clear away its dark underbrush ?",20
"it was therefore decided that neb and pencroft should go to port balloon , and that there , at nightfall , they should light an immense fire , the blaze of which would necessarily attract the attention of the brig .",25
"the grotto was an immense apartment . along its granite floor ran our faithful stream . at this distance from its spring the water was scarcely tepid , and we drank of it with pleasure .",4
"such immense caves exist in various parts of the world , natural crypts dating from the geological epoch of the globe .",1
"such is fingal 's cave , in the island of staffa , one of the hebrides ; such are the caves of morgat , in the bay of douarnenez , in brittany , the caves of bonifacio , in corsica , those of lyse - fjord , in norway ; such are the immense mammoth caverns in kentucky , 500 feet in height , and more than twenty miles in length !",53
"after leaving these delightful islands to the protection of the french flag , the nautilus covered about 2,000 miles from december 4 to the 11th . its navigating was marked by an encounter with an immense school of squid , unusual mollusks that are near neighbors of the cuttlefish . french fishermen give them the name "" cuckoldfish , "" and they belong to the class cephalopoda , family dibranchiata , consisting of themselves together with cuttlefish and argonauts . the naturalists of antiquity made a special study of them , and these animals furnished many ribald figures of speech for soapbox orators in the greek marketplace , as well as excellent dishes for the tables of rich citizens , if we 're to believe athenaeus , a greek physician predating galen .",35
"i stood amazed . my uncle had uplifted his long arms to the vault which was our sky ; his mouth gaping wide , his eyes flashing behind his shining spectacles , his head balancing with an up - and - down motion , his whole attitude denoted unlimited astonishment . here he stood facing an immense collection of scattered leptotheria , mericotheria , lophiodia , anoplotheria , megatheria , mastodons , protopithecæ , pterodactyles , and all sorts of extinct monsters here assembled together for his special satisfaction . fancy an enthusiastic bibliomaniac suddenly brought into the midst of the famous alexandrian library burnt by omar and restored by a miracle from its ashes ! just such a crazed enthusiast was my uncle , professor liedenbrock .",56
