text,ind
"when the nautilus returned to the surface of the ocean , i could take in reao island over its whole flat , wooded expanse . obviously its madreporic rocks had been made fertile by tornadoes and thunderstorms . one day , carried off by a hurricane from neighboring shores , some seed fell onto these limestone beds , mixing with decomposed particles of fish and marine plants to form vegetable humus . propelled by the waves , a coconut arrived on this new coast . its germ took root . its tree grew tall , catching steam off the water . a brook was born . little by little , vegetation spread . tiny animals -- worms , insects -- rode ashore on tree trunks snatched from islands to windward . turtles came to lay their eggs . birds nested in the young trees . in this way animal life developed , and drawn by the greenery and fertile soil , man appeared . and that 's how these islands were formed , the immense achievement of microscopic animals .",174
"an immense saloon -- a sort of museum , in which were heaped up , with all the treasures of the mineral world , works of art , marvels of industry -- appeared before the eyes of the colonists , who almost thought themselves suddenly transported into a land of enchantment .",1
"she allowed , therefore , half an hour to pass away ; and as at that moment all was silence in the old castle , as nothing was heard but the eternal murmur of the waves -- that immense breaking of the ocean -- with her pure , harmonious , and powerful voice , she began the first couplet of the psalm then in great favor with the puritans :",38
"the vapor whirled in the air to an immeasurable height , as if the valves of an immense boiler had been suddenly opened .",17
"some of these wrecked ships had perished in collisions , others from hitting granite reefs . i saw a few that had sunk straight down , their masting still upright , their rigging stiffened by the water . they looked like they were at anchor by some immense , open , offshore mooring where they were waiting for their departure time . when the nautilus passed between them , covering them with sheets of electricity , they seemed ready to salute us with their colors and send us their serial numbers ! but no , nothing but silence and death filled this field of catastrophes !",47
"where formerly stretched the calm waters of the lake now appeared an enormous mass of smoking rocks , as if an upheaving of the soil had formed immense shoals .",27
"her voice , of immense power and sublime expression , gave to the rude , unpolished poetry of these psalms a magic and an effect which the most exalted puritans rarely found in the songs of their brethren , and which they were forced to ornament with all the resources of their imagination . felton believed he heard the singing of the angel who consoled the three hebrews in the furnace .",4
"another remarkable thing . this fossil body was not the only one in this immense catacomb . we came upon other bodies at every step amongst this mortal dust , and my uncle might select the most curious of these specimens to demolish the incredulity of sceptics .",14
"this occurrence , extremely serious in itself , might perhaps have been forgotten like so many others , if three weeks later it had n't been reenacted under identical conditions . only , thanks to the nationality of the ship victimized by this new ramming , and thanks to the reputation of the company to which this ship belonged , the event caused an immense uproar .",64
"it took us two hours to reach the summit of this half - crystal , half - basalt peak . from there our eyes scanned a vast sea , which scrawled its boundary line firmly against the background of the northern sky . at our feet : dazzling tracts of white . over our heads : a pale azure , clear of mists . north of us : the sun 's disk , like a ball of fire already cut into by the edge of the horizon . from the heart of the waters : jets of liquid rising like hundreds of magnificent bouquets . far off , like a sleeping cetacean : the nautilus . behind us to the south and east : an immense shore , a chaotic heap of rocks and ice whose limits we could n't see .",125
"this lake was only , in short , an immense center basin , which was filled by degrees by the creek , and its waters must necessarily pass to the sea by some fall .",9
"meanwhile the ballast tanks filled with water and the nautilus sank slowly . at a depth of 1,000 feet , it stopped . its propeller churned the waves and it headed due north at a speed of fifteen miles per hour . near the afternoon it was already cruising under the immense frozen carapace of the ice bank .",51
"' come , my head 's free at last ! ' said alice in a tone of delight , which changed into alarm in another moment , when she found that her shoulders were nowhere to be found : all she could see , when she looked down , was an immense length of neck , which seemed to rise like a stalk out of a sea of green leaves that lay far below her .",51
"he ate the wretched food with appetite , and washed it down with a little fresh water , drawn from the river in an immense shell .",24
"then new layers of bruised pyrites were arranged so as to form an immense heap , the exterior of which was covered with earth and grass , several air - holes being left , as if it was a stack of wood which was to be carbonized to make charcoal .",13
""" yes , professor , the sea supplies all my needs . sometimes i cast my nets in our wake , and i pull them up ready to burst . sometimes i go hunting right in the midst of this element that has long seemed so far out of man 's reach , and i corner the game that dwells in my underwater forests . like the flocks of old proteus , king neptune 's shepherd , my herds graze without fear on the ocean 's immense prairies . there i own vast properties that i harvest myself , and which are forever sown by the hand of the creator of all things . """,86
""" now then , just as this decision was being handed down , english vessels arrived in the bay of vigo on october 22 , 1702 . despite his inferior forces , admiral de chateau - renault fought courageously . but when he saw that the convoy 's wealth was about to fall into enemy hands , he burned and scuttled the galleons , which went to the bottom with their immense treasures . """,71
"passepartout was crushed ; it overwhelmed him to lose the boat by three - quarters of an hour . it was his fault , for , instead of helping his master , he had not ceased putting obstacles in his path ! and when he recalled all the incidents of the tour , when he counted up the sums expended in pure loss and on his own account , when he thought that the immense stake , added to the heavy charges of this useless journey , would completely ruin mr . fogg , he overwhelmed himself with bitter self - accusations . mr . fogg , however , did not reproach him ; and , on leaving the cunard pier , only said : "" we will consult about what is best to - morrow . come . """,74
"mr . fogg left the hotel alone , after giving passepartout instructions to await his return , and inform aouda to be ready at an instant 's notice . he proceeded to the banks of the hudson , and looked about among the vessels moored or anchored in the river , for any that were about to depart . several had departure signals , and were preparing to put to sea at morning tide ; for in this immense and admirable port there is not one day in a hundred that vessels do not set out for every quarter of the globe . but they were mostly sailing vessels , of which , of course , phileas fogg could make no use .",78
""" yes , there is your ' boite ' at last : take it into a corner , you genuine daughter of paris , and amuse yourself with disembowelling it , "" said the deep and rather sarcastic voice of mr . rochester , proceeding from the depths of an immense easy - chair at the fireside .",50
"here is what those circumstances entailed . two miles to starboard lay gueboroa island , its coastline curving north to west like an immense arm . to the south and east , heads of coral were already on display , left uncovered by the ebbing waters . we had run aground at full tide and in one of those seas whose tides are moderate , an inconvenient state of affairs for floating the nautilus off . however , the ship had n't suffered in any way , so solidly joined was its hull . but although it could neither sink nor split open , it was in serious danger of being permanently attached to these reefs , and that would have been the finish of captain nemo 's submersible .",23
"captain nemo stopped on these last words , perhaps sorry that he had said too much . but i had guessed . whatever motives had driven him to seek independence under the seas , he remained a human being before all else ! his heart still throbbed for suffering humanity , and his immense philanthropy went out both to downtrodden races and to individuals !",53
"just then captain nemo opened a door facing the one by which i had entered the library , and i passed into an immense , splendidly lit lounge .",23
"i looked down upon the plain . an immense column of pulverized pumice , sand and dust was rising with a whirling circular motion like a waterspout ; the wind was lashing it on to that side of snæfell where we were holding on ; this dense veil , hung across the sun , threw a deep shadow over the mountain . if that huge revolving pillar sloped down , it would involve us in its whirling eddies . this phenomenon , which is not unfrequent when the wind blows from the glaciers , is called in icelandic ' mistour . '",8
"suddenly , after a space of time that i could not measure , i felt a shock . the raft had not struck against any hard resistance , but had suddenly been checked in its fall . a waterspout , an immense liquid column , was beating upon the surface of the waters . i was suffocating ! i was drowning !",41
"the chief thing was to hinder these plunderers from reaching the plateau , for the garden and the poultry - yard would then have been at their mercy , and immense , perhaps irreparable mischief , would inevitably be the result , especially with regard to the corn - field .",30
"i looked back down the side we had just cleared . there the mountain rose only 700 to 800 feet above the plains ; but on its far slope it crowned the receding bottom of this part of the atlantic by a height twice that . my eyes scanned the distance and took in a vast area lit by intense flashes of light . in essence , this mountain was a volcano . fifty feet below its peak , amid a shower of stones and slag , a wide crater vomited torrents of lava that were dispersed in fiery cascades into the heart of the liquid mass . so situated , this volcano was an immense torch that lit up the lower plains all the way to the horizon .",115
"one day solon was conversing with some elderly wise men in the egyptian capital of sais , a town already 8,000 years of age , as documented by the annals engraved on the sacred walls of its temples . one of these elders related the history of another town 1,000 years older still . this original city of athens , ninety centuries old , had been invaded and partly destroyed by the atlanteans . these atlanteans , he said , resided on an immense continent greater than africa and asia combined , taking in an area that lay between latitude 12 degrees and 40 degrees north . their dominion extended even to egypt . they tried to enforce their rule as far as greece , but they had to retreat before the indomitable resistance of the hellenic people . centuries passed . a cataclysm occurred -- floods , earthquakes . a single night and day were enough to obliterate this atlantis , whose highest peaks ( madeira , the azores , the canaries , the cape verde islands ) still emerge above the waves .",83
"oh , why was i so short of time ! i would have gone down the steep slopes of this mountain , crossed this entire immense continent , which surely connects africa with america , and visited its great prehistoric cities . under my eyes there perhaps lay the warlike town of makhimos or the pious village of eusebes , whose gigantic inhabitants lived for whole centuries and had the strength to raise blocks of stone that still withstood the action of the waters . one day perhaps , some volcanic phenomenon will bring these sunken ruins back to the surface of the waves ! numerous underwater volcanoes have been sighted in this part of the ocean , and many ships have felt terrific tremors when passing over these turbulent depths . a few have heard hollow noises that announced some struggle of the elements far below , others have hauled in volcanic ash hurled above the waves . as far as the equator this whole seafloor is still under construction by plutonic forces . and in some remote epoch , built up by volcanic disgorgings and successive layers of lava , who knows whether the peaks of these fire - belching mountains may reappear above the surface of the atlantic !",25
"just then the moon appeared for an instant through the watery mass , casting a few pale rays over this submerged continent . it was only a fleeting glimmer , but its effect was indescribable . the captain stood up and took one last look at these immense plains ; then his hand signaled me to follow him .",47
"work began immediately and was carried on with tireless tenacity . instead of digging all around the nautilus , which would have entailed even greater difficulties , captain nemo had an immense trench outlined on the ice , eight meters from our port quarter . then his men simultaneously staked it off at several points around its circumference . soon their picks were vigorously attacking this compact matter , and huge chunks were loosened from its mass . these chunks weighed less than the water , and by an unusual effect of specific gravity , each chunk took wing , as it were , to the roof of the tunnel , which thickened above by as much as it diminished below . but this hardly mattered so long as the lower surface kept growing thinner .",31
"this stream of electricity dazzled my eyes , and after momentarily shutting them , i looked around . the nautilus was stationary . it was floating next to an embankment shaped like a wharf . as for the water now buoying the ship , it was a lake completely encircled by an inner wall about two miles in diameter , hence six miles around . its level -- as indicated by the pressure gauge -- would be the same as the outside level , because some connection had to exist between this lake and the sea . slanting inward over their base , these high walls converged to form a vault shaped like an immense upside - down funnel that measured 500 or 600 meters in height . at its summit there gaped the circular opening through which i had detected that faint glimmer , obviously daylight .",114
"during the night , in line with my forecasts , a new one - meter slice was removed from this immense socket . but in the morning , wearing my diving suit , i was crossing through the liquid mass in a temperature of -6 degrees to -7 degrees centigrade , when i noted that little by little the side walls were closing in on each other . the liquid strata farthest from the trench , not warmed by the movements of workmen and tools , were showing a tendency to solidify . in the face of this imminent new danger , what would happen to our chances for salvation , and how could we prevent this liquid medium from solidifying , then cracking the nautilus 's hull like glass ?",20
the word cavern does not convey any idea of this immense space ; words of human tongue are inadequate to describe the discoveries of him who ventures into the deep abysses of earth .,10
""" it 's one of the many islets with which this sea is strewn . for ships a mere reef , for us an immense cavern . i discovered it by chance , and chance served me well . """,24
"if the grotto of guachara , in colombia , visited by humboldt , had not given up the whole of the secret of its depth to the philosopher , who investigated it to the depth of 2,500 feet , it probably did not extend much farther . the immense mammoth cave in kentucky is of gigantic proportions , since its vaulted roof rises five hundred feet [ 1 ] above the level of an unfathomable lake and travellers have explored its ramifications to the extent of forty miles . but what were these cavities compared to that in which i stood with wonder and admiration , with its sky of luminous vapours , its bursts of electric light , and a vast sea filling its bed ? my imagination fell powerless before such immensity .",48
"a square table , covered with books and papers , upon which was unrolled an immense plan of the city of la rochelle , occupied the center of the room .",15
"on one of those immense staircases , upon whose space modern civilization would build a whole house , ascended and descended the office seekers of paris , who ran after any sort of favor -- gentlemen from the provinces anxious to be enrolled , and servants in all sorts of liveries , bringing and carrying messages between their masters and m. de treville .",4
""" you are right , my uncle . providence seems to have preserved in this immense conservatory the antediluvian plants which the wisdom of philosophers has so sagaciously put together again . """,15
"at an elevation of about thirty meters , the nature of the terrain changed without becoming any easier . pudding stones and trachyte gave way to black basaltic rock : here , lying in slabs all swollen with blisters ; there , shaped like actual prisms and arranged into a series of columns that supported the springings of this immense vault , a wonderful sample of natural architecture . then , among this basaltic rock , there snaked long , hardened lava flows inlaid with veins of bituminous coal and in places covered by wide carpets of sulfur . the sunshine coming through the crater had grown stronger , shedding a hazy light over all the volcanic waste forever buried in the heart of this extinct mountain .",59
"the mountain was composed of two cones ; the first , truncated at a height of about two thousand five hundred feet , was sustained by buttresses , which appeared to branch out like the talons of an immense claw set on the ground .",38
"two cable lengths off the abraham lincoln 's starboard quarter , the sea seemed to be lit up from underneath . this was no mere phosphorescent phenomenon , that much was unmistakable . submerged some fathoms below the surface of the water , the monster gave off that very intense but inexplicable glow that several captains had mentioned in their reports . this magnificent radiance had to come from some force with a great illuminating capacity . the edge of its light swept over the sea in an immense , highly elongated oval , condensing at the center into a blazing core whose unbearable glow diminished by degrees outward .",88
"i was carried into an inn , where the guard wanted me to have some dinner ; but , as i had no appetite , he left me in an immense room with a fireplace at each end , a chandelier pendent from the ceiling , and a little red gallery high up against the wall filled with musical instruments .",30
"as he was reflecting in this wise , his eyes fell upon an immense placard which a sort of clown was carrying through the streets . this placard , which was in english , read as follows :",13
"there , a mile and a half from the frigate , a long blackish body emerged a meter above the waves . quivering violently , its tail was creating a considerable eddy . never had caudal equipment thrashed the sea with such power . an immense wake of glowing whiteness marked the animal 's track , sweeping in a long curve .",45
"if we accept the hypotheses of the microbiologist ehrenberg-- who believes that these underwater depths are lit up by phosphorescent organisms -- nature has certainly saved one of her most prodigious sights for residents of the sea , and i could judge for myself from the thousandfold play of the light . on both sides i had windows opening over these unexplored depths . the darkness in the lounge enhanced the brightness outside , and we stared as if this clear glass were the window of an immense aquarium .",87
""" well , captain , what the ancients hesitated to undertake , mr . de lesseps is now finishing up ; his joining of these two seas will shorten the route from cadiz to the east indies by 9,000 kilometers , and he 'll soon change africa into an immense island . """,49
"but now the vapors were replaced by a thick smoke , rising in the form of a grayish column , more than three hundred feet in width at its base , and which spread like an immense mushroom to a height of from seven to eight hundred feet above the summit of the mountain .",36
"before three o'clock the large shed was invaded by the spectators , comprising europeans and natives , chinese and japanese , men , women and children , who precipitated themselves upon the narrow benches and into the boxes opposite the stage . the musicians took up a position inside , and were vigorously performing on their gongs , tam - tams , flutes , bones , tambourines , and immense drums .",69
"about twelve , immense shoals of seaweeds came in sight . i was aware of the great powers of vegetation that characterise these plants , which grow at a depth of twelve thousand feet , reproduce themselves under a pressure of four hundred atmospheres , and sometimes form barriers strong enough to impede the course of a ship . but never , i think , were such seaweeds as those which we saw floating in immense waving lines upon the sea of liedenbrock .",3
"about twelve , immense shoals of seaweeds came in sight . i was aware of the great powers of vegetation that characterise these plants , which grow at a depth of twelve thousand feet , reproduce themselves under a pressure of four hundred atmospheres , and sometimes form barriers strong enough to impede the course of a ship . but never , i think , were such seaweeds as those which we saw floating in immense waving lines upon the sea of liedenbrock .",75
""" you have saved my life : i have a pleasure in owing you so immense a debt . i can not say more .",15
"many a time , nevertheless , during the evening she despaired of fate and of herself . she did not invoke god , we very well know , but she had faith in the genius of evil -- that immense sovereignty which reigns in all the details of human life , and by which , as in the arabian fable , a single pomegranate seed is sufficient to reconstruct a ruined world .",39
"these rocks were hung with huge weeds , immense sea tangle , gigantic fucus-- a genuine trellis of water plants fit for a world of giants .",8
"immense whirlwinds of vapor obscured the sky , through which glimmered a few stars .",0
"its immense weight caused an unusually sharp , grating sound , as it moved upon its hinges .",1
"at the age of the world which preceded the secondary period , the earth was clothed with immense vegetable forms , the product of the double influence of tropical heat and constant moisture ; a vapoury atmosphere surrounded the earth , still veiling the direct rays of the sun .",17
"thus were formed those immense coalfields , which nevertheless , are not inexhaustible , and which three centuries at the present accelerated rate of consumption will exhaust unless the industrial world will devise a remedy .",4
"all the immense woods , to which the name of the forests of the far west had been given , were not explored .",2
""" the executioner may kill , without being on that account an assassin , "" said the man in the red cloak , rapping upon his immense sword . "" this is the last judge ; that is all . nachrichter , as say our neighbors , the germans . """,26
"d’artagnan looked for some tapestry behind which he might hide himself , and felt an immense inclination to crawl under the table .",15
"the light and active boy then sprang on the first branches , the arrangement of which made the ascent of the kauri easy , and in a few minutes he arrived at the summit , which emerged from the immense plain of verdure .",39
""" actually he 's right , "" i said . "" i 've heard about that picture . but the subject it portrays is taken from a legend , and you know how to rate legends in matters of natural history ! besides , when it 's an issue of monsters , the human imagination always tends to run wild . people not only claimed these devilfish could drag ships under , but a certain olaus magnus tells of a cephalopod a mile long that looked more like an island than an animal . there 's also the story of how the bishop of trondheim set up an altar one day on an immense rock . after he finished saying mass , this rock started moving and went back into the sea . the rock was a devilfish . """,113
"the sea , indeed , formed an immense circular sheet of water all around them !",7
the stranger possessed immense strength and activity .,3
over all this immense space the ocean alone was visible -- the island occupied the center of a circumference which appeared to be infinite .,3
"truly , it did not appear large in the midst of the immense ocean .",12
"immense waves threatened to overwhelm the island , and certainly any vessel anchored near the shore would have been dashed to pieces .",0
"like true settlers , the colonists spared the largest and most beautiful trees , which would besides have cost immense labor to fell , and the small ones only were sacrificed , but the result was that the road took a very winding direction , and lengthened itself by numerous detours .",19
