text,ind
""" quite ready , james , "" she answered , keeping her eyes on her work . for some months past she had felt ill at ease when she was alone with this rough stern son of hers . her shallow secret nature was troubled when their eyes met . she used to wonder if he suspected anything . the silence , for he made no other observation , became intolerable to her . she began to complain . women defend themselves by attacking , just as they attack by sudden and strange surrenders . "" i hope you will be contented , james , with your sea - faring life , "" she said . "" you must remember that it is your own choice . you might have entered a solicitor 's office . solicitors are a very respectable class , and in the country often dine with the best families . """,10
""" sublime madman ! "" i said , "" no doubt you would approve of our expedition . perhaps you would keep us company to the centre of the globe , to find the solution of your eternal doubts . """,21
"shall we keep the name of the chimneys for our first encampment , captain ? """,2
"the _ valkyria _ kept at some distance from the coast , taking a westerly course amidst great shoals of whales and sharks . soon we came in sight of an enormous perforated rock , through which the sea dashed furiously . the westman islets seemed to rise out of the ocean like a group of rocks in a liquid plain . from that time the schooner took a wide berth and swept at a great distance round cape rejkianess , which forms the western point of iceland .",4
"you have as good as said that i am a married man -- as a married man you will shun me , keep out of my way : just now you have refused to kiss me .",22
"then recommending me , by an impressive gesture , to keep silence , he went into the boat which awaited him . i followed , and presently we were treading the soil of iceland .",10
"indeed , despite its efforts , despite the powerful methods it used to split this ice , the nautilus was reduced to immobility . ordinarily , when someone ca n't go any farther , he still has the option of returning in his tracks . but here it was just as impossible to turn back as to go forward , because every passageway had closed behind us , and if our submersible remained even slightly stationary , it would be frozen in without delay . which is exactly what happened near two o'clock in the afternoon , and fresh ice kept forming over the ship 's sides with astonishing speed . i had to admit that captain nemo 's leadership had been most injudicious .",100
"he consequently kept it as a piece of evidence , and being in safety behind the angle of the trench , he began to interrogate the wounded man .",2
their uneasiness led one or other of them also to go out every few minutes to see if top was keeping good watch .,20
""" to the pole ! "" i exclaimed , unable to keep back a movement of disbelief .",11
""" where do you keep your eight thousand volumes ? for my part-- """,4
""" me , i 'm out like a light ! "" ned land replied . my two companions lay down on the cabin 's carpeting and were soon deep in slumber . as for me , i gave in less readily to this intense need for sleep . too many thoughts had piled up in my mind , too many insoluble questions had arisen , too many images were keeping my eyelids open ! where were we ? what strange power was carrying us along ? i felt -- or at least i thought i did -- the submersible sinking toward the sea 's lower strata . intense nightmares besieged me . in these mysterious marine sanctuaries , i envisioned hosts of unknown animals , and this underwater boat seemed to be a blood relation of theirs : living , breathing , just as fearsome . . . ! then my mind grew calmer , my imagination melted into hazy drowsiness , and i soon fell into an uneasy slumber .",69
""" very well , keep it thus .",4
"here a question popped into my head . how did the commander of this aquatic residence go about it ? did he obtain air using chemical methods , releasing the oxygen contained in potassium chlorate by heating it , meanwhile absorbing the carbon dioxide with potassium hydroxide ? if so , he would have to keep up some kind of relationship with the shore , to come by the materials needed for such an operation . did he simply limit himself to storing the air in high - pressure tanks and then dispense it according to his crew 's needs ? perhaps . or , proceeding in a more convenient , more economical , and consequently more probable fashion , was he satisfied with merely returning to breathe at the surface of the water like a cetacean , renewing his oxygen supply every twenty - four hours ? in any event , whatever his method was , it seemed prudent to me that he use this method without delay .",55
"but i also kept my word with him , and i neither ate nor drank . i was , as i told him , resolved to die of hunger .",3
"and ned land reentered his cabin , "" to keep from doing something desperate , "" he said as he left me .",9
""" oh , at six o'clock : he keeps early hours in the country .",8
"for part of the night , the novelty of our circumstances kept conseil and me at the lounge window . the sea was lit by our beacon 's electric rays . but the depths were deserted . fish did n't linger in these imprisoned waters . here they found merely a passageway for going from the antarctic ocean to open sea at the pole . our progress was swift . you could feel it in the vibrations of the long steel hull .",11
"near two o'clock in the morning , i went to snatch a few hours of sleep . conseil did likewise . i did n't encounter captain nemo while going down the gangways . i assumed that he was keeping to the pilothouse .",38
""" well , "" replied my uncle , who was frantically locking his legs together to keep himself from jumping up in the air , "" that is where i mean to begin my geological studies , there on that seffel -- fessel -- what do you call it ? """,16
"if you have not had any report within the last few days it is because up to to - day there was nothing of importance to relate . then a very surprising circumstance occurred , which i shall tell you in due course . but , first of all , i must keep you in touch with some of the other factors in the situation .",52
"my eyes did n't leave the pressure gauge . we kept rising on a diagonal , going along this shiny surface that sparkled beneath our electric rays . above and below , the ice bank was subsiding in long gradients . mile after mile it was growing thinner .",10
"but whatever the true explanation of barrymore 's movements might be , i felt that the responsibility of keeping them to myself until i could explain them was more than i could bear . i had an interview with the baronet in his study after breakfast , and i told him all that i had seen . he was less surprised than i had expected .",18
""" complaining does n't have to do good , it just feels good ! and if these pirates -- i say pirates out of consideration for the professor 's feelings , since he does n't want us to call them cannibals-- if these pirates think they 're going to smother me in this cage without hearing what cusswords spice up my outbursts , they 've got another think coming ! look here , professor aronnax , speak frankly . how long do you figure they 'll keep us in this iron box ? """,86
""" unless they recruit us to serve on the crew , "" conseil said , "" and keep us here-- """,17
"in a few moments , the engineer , gideon spilett , and herbert had rejoined their two companions , and like them , they kept out of sight behind the heaps of basalt .",24
""" every animal may be overstating it , but in truth i doubt we could keep our canadian friend from harpooning some of these magnificent cetaceans . which would be an affront to captain nemo , since he hates to slay harmless beasts needlessly . """,15
""" do n't ask me , sir henry -- don't ask me ! i give you my word , sir , that it is not my secret , and that i can not tell it . if it concerned no one but myself i would not try to keep it from you . """,48
""" well , well , but keep whole ; that will be better , and you will be more useful to me .",6
"i kept quiet , with good reason . what was the use of debating such a proposition , when superior force can wipe out the best arguments ?",1
""" if master 's legs would kindly adopt a wider stance , master will keep his balance . """,14
""" no , sir , it 's an act of mercy ! you 're my prisoners of war ! i 've cared for you when , with a single word , i could plunge you back into the ocean depths ! you attacked me ! you 've just stumbled on a secret no living man must probe , the secret of my entire existence ! do you think i 'll send you back to a world that must know nothing more of me ? never ! by keeping you on board , it is n't you whom i care for , it 's me ! """,87
"he threw himself into a chair and began to think . suddenly there flashed across his mind what he had said in basil hallward 's studio the day the picture had been finished . yes , he remembered it perfectly . he had uttered a mad wish that he himself might remain young , and the portrait grow old ; that his own beauty might be untarnished , and the face on the canvas bear the burden of his passions and his sins ; that the painted image might be seared with the lines of suffering and thought , and that he might keep all the delicate bloom and loveliness of his then just conscious boyhood . surely his wish had not been fulfilled ? such things were impossible . it seemed monstrous even to think of them . and , yet , there was the picture before him , with the touch of cruelty in the mouth .",103
""" keep your secret , young man , and tell me what you wish . """,1
"the thermometer marked -12 degrees centigrade , and a fresh breeze left a sharp nip in the air . ice floes were increasing over the open water . the sea was starting to congeal everywhere . numerous blackish patches were spreading over its surface , announcing the imminent formation of fresh ice . obviously this southernmost basin froze over during its six - month winter and became utterly inaccessible . what happened to the whales during this period ? no doubt they went beneath the ice bank to find more feasible seas . as for seals and walruses , they were accustomed to living in the harshest climates and stayed on in these icy waterways . these animals know by instinct how to gouge holes in the ice fields and keep them continually open ; they go to these holes to breathe . once the birds have migrated northward to escape the cold , these marine mammals remain as sole lords of the polar continent .",130
"my uncle and i treated this little tribe with kindness ; and in a very short time we each had three or four of these brats on our shoulders , as many on our laps , and the rest between our knees . those who could speak kept repeating "" _ sællvertu , _ "" in every conceivable tone ; those that could not speak made up for that want by shrill cries .",47
"i will keep the law given by god ; sanctioned by man . i will hold to the principles received by me when i was sane , and not mad -- as i am now .",2
"the old gentleman was fond of money , and anxious to keep the family estate together .",11
"instead of doing this he kept them prisoners , and during seven months they were enabled to behold all the wonders of a voyage of twenty thousand leagues under the sea .",5
""" god bless you , my dear master ! "" i said . "" god keep you from harm and wrong -- direct you , solace you -- reward you well for your past kindness to me . """,15
"then came that dreadful night -- was it really only last night?-- when she played so badly , and my heart almost broke . she explained it all to me . it was terribly pathetic . but i was not moved a bit . i thought her shallow . suddenly something happened that made me afraid . i ca n't tell you what it was , but it was terrible . i said i would go back to her . i felt i had done wrong . and now she is dead . my god ! my god ! harry , what shall i do ? you do n't know the danger i am in , and there is nothing to keep me straight . she would have done that for me . she had no right to kill herself . it was selfish of her . """,121
"indeed , the nautilus kept the same heel to starboard . no doubt it would straighten up once the block came to a halt . but before that happened , who knew if we might not hit the underbelly of the ice bank and be hideously squeezed between two frozen surfaces ?",4
""" see here , "" replied fix ; "" i have tracked mr . fogg to this place , but as yet i have failed to receive the warrant of arrest for which i sent to london . you must help me to keep him here in hong kong-- """,43
"the bed , which she had kept from prudence and that they might believe her seriously wounded , burned her like a bed of fire .",6
"lastly , the time had come for turning the balloon - case to use , by cutting it up to make shirts and other articles ; for as to keeping it in its present form , and risking themselves in a balloon filled with gas , above a sea of the limits of which they had no idea , it was not to be thought of .",29
""" ah , then , "" said lord henry , rising to go , "" then , my dear dorian , you would have to fight for your victories . as it is , they are brought to you . no , you must keep your good looks . we live in an age that reads too much to be wise , and that thinks too much to be beautiful . we can not spare you . and now you had better dress and drive down to the club . we are rather late , as it is . """,44
"then the panels in the lounge closed . we kept our hands over our eyes , which were utterly saturated with those concentric gleams that swirl before the retina when sunlight strikes it too intensely . it took some time to calm our troubled vision .",9
"for there would be a real pleasure in watching it . he would be able to follow his mind into its secret places . this portrait would be to him the most magical of mirrors . as it had revealed to him his own body , so it would reveal to him his own soul . and when winter came upon it , he would still be standing where spring trembles on the verge of summer . when the blood crept from its face , and left behind a pallid mask of chalk with leaden eyes , he would keep the glamour of boyhood . not one blossom of his loveliness would ever fade . not one pulse of his life would ever weaken . like the gods of the greeks , he would be strong , and fleet , and joyous . what did it matter what happened to the coloured image on the canvas ? he would be safe . that was everything .",99
"i must admit that my uncle kept as close to me as he could ; he never lost sight of me , and in many straits his arm furnished me with a powerful support . he himself seemed to possess an instinct for equilibrium , for he never stumbled . the icelanders , though burdened with our loads , climbed with the agility of mountaineers .",6
"d’artagnan , although he was not a musketeer , performed the duty of one with remarkable punctuality . he went on guard because he always kept company with whoever of his friends was on duty .",25
"they also reckoned the days they had passed on lincoln island , and from that time kept a regular account .",16
"i strolled for a little while from the lounge into the library . my companions kept their seats and did n't move . soon i threw myself down on a couch and picked up a book , which my eyes skimmed mechanically .",15
"no one slept that night , all watching carefully to keep up the fire .",10
"the hours passed . i often studied the instruments hanging on the lounge wall . the pressure gauge indicated that the nautilus stayed at a constant depth of 300 meters , the compass that it kept heading south , the log that it was traveling at a speed of twenty miles per hour , an excessive speed in such a cramped area . but captain nemo knew that by this point there was no such thing as too fast , since minutes were now worth centuries .",35
"consequently , above , below , and around the nautilus , there were impenetrable frozen walls . we were the ice bank 's prisoners ! the canadian banged a table with his fearsome fist . conseil kept still . i stared at the captain . his face had resumed its usual emotionlessness . he crossed his arms . he pondered . the nautilus did not stir .",36
""" yes ; i do n't suppose you will object to that . georges petit is going to collect all my best pictures for a special exhibition in the rue de seze , which will open the first week in october . the portrait will only be away a month . i should think you could easily spare it for that time . in fact , you are sure to be out of town . and if you keep it always behind a screen , you ca n't care much about it . """,78
"the three musketeers passed behind his eminence , who again enveloped his face in his cloak , and put his horse in motion , keeping from eight to ten paces in advance of his four companions .",24
""" and i , "" said aramis , "" imagined that i had given almost my last sou to the church of montdidier and the jesuits of amiens , with whom i had made engagements which i ought to have kept . i have ordered masses for myself , and for you , gentlemen , which will be said , gentlemen , for which i have not the least doubt you will be marvelously benefited . """,40
""" i hardly expected you would . you must keep on until you do . here are your wages . "" he handed each of them a shilling . "" now , off you go , and come back with a better report next time . """,9
"work began immediately and was carried on with tireless tenacity . instead of digging all around the nautilus , which would have entailed even greater difficulties , captain nemo had an immense trench outlined on the ice , eight meters from our port quarter . then his men simultaneously staked it off at several points around its circumference . soon their picks were vigorously attacking this compact matter , and huge chunks were loosened from its mass . these chunks weighed less than the water , and by an unusual effect of specific gravity , each chunk took wing , as it were , to the roof of the tunnel , which thickened above by as much as it diminished below . but this hardly mattered so long as the lower surface kept growing thinner .",132
"for several hours that day , i wielded my pick doggedly . the work kept me going . besides , working meant leaving the nautilus , which meant breathing the clean oxygen drawn from the air tanks and supplied by our equipment , which meant leaving the thin , foul air behind .",14
""" no , "" said she ; "" we do not keep a servant . """,11
""" ' at eight o'clock , ' she said , gulping in her throat to keep down her agitation . ' his secretary , mr . stangerson , said that there were two trains — one at 9.15 and one at 11 . he was to catch the first .",15
"still we kept descending . it seemed to me that the falling stones were meeting with an earlier resistance , and that the concussion gave a more abrupt and deadened sound .",2
"but there was no other place in the house so secure from prying eyes as this . he had the key , and no one else could enter it . beneath its purple pall , the face painted on the canvas could grow bestial , sodden , and unclean . what did it matter ? no one could see it . he himself would not see it . why should he watch the hideous corruption of his soul ? he kept his youth-- that was enough . and , besides , might not his nature grow finer , after all ? there was no reason that the future should be so full of shame . some love might come across his life , and purify him , and shield him from those sins that seemed to be already stirring in spirit and in flesh-- those curious unpictured sins whose very mystery lent them their subtlety and their charm . perhaps , some day , the cruel look would have passed away from the scarlet sensitive mouth , and he might show to the world basil hallward 's masterpiece .",80
"by the next day , march 27 , six meters of ice had been torn from the socket . only four meters were left to be removed . that still meant forty - eight hours of work . the air could n't be renewed in the nautilus 's interior . accordingly , that day it kept getting worse .",55
""" bring it in , mr . hubbard , please , "" he said , wearily , turning round . "" i am sorry i kept you so long . i was thinking of something else . """,25
"an unbearable heaviness weighed me down . near three o'clock in the afternoon , this agonizing sensation affected me to an intense degree . yawns dislocated my jaws . my lungs were gasping in their quest for that enkindling elastic fluid required for breathing , now growing scarcer and scarcer . my mind was in a daze . i lay outstretched , strength gone , nearly unconscious . my gallant conseil felt the same symptoms , suffered the same sufferings , yet never left my side . he held my hand , he kept encouraging me , and i even heard him mutter :",93
""" you acknowledge then that you made an appointment with sir charles at the very hour and place at which he met his death , but you deny that you kept the appointment . """,30
"dorian started . "" it would not interest you , mr . hubbard , "" he said , keeping his eye on the man . he felt ready to leap upon him and fling him to the ground if he dared to lift the gorgeous hanging that concealed the secret of his life . "" i sha n't trouble you any more now . i am much obliged for your kindness in coming round . """,18
so the tankadere kept steadily on her northward track .,3
""" ' i will like it , ' said i ; ' i dare like it ; ' and "" ( he subjoined moodily ) "" i will keep my word ; i will break obstacles to happiness , to goodness -- yes , goodness .",28
""" away ! "" he cried harshly ; "" keep at a distance , child ; or go in to sophie ! """,9
"all on board feared that it could not be done , and every one -- phileas fogg , no doubt , excepted -- felt his heart beat with impatience . the boat must keep up an average of nine miles an hour , and the wind was becoming calmer every moment ! it was a capricious breeze , coming from the coast , and after it passed the sea became smooth . still , the tankadere was so light , and her fine sails caught the fickle zephyrs so well , that , with the aid of the currents john bunsby found himself at six o'clock not more than ten miles from the mouth of shanghai river . shanghai itself is situated at least twelve miles up the stream . at seven they were still three miles from shanghai . the pilot swore an angry oath ; the reward of two hundred pounds was evidently on the point of escaping him . he looked at mr . fogg . mr . fogg was perfectly tranquil ; and yet his whole fortune was at this moment at stake .",33
"it was passepartout ; and what had happened to him was as follows : shortly after fix left the opium den , two waiters had lifted the unconscious passepartout , and had carried him to the bed reserved for the smokers . three hours later , pursued even in his dreams by a fixed idea , the poor fellow awoke , and struggled against the stupefying influence of the narcotic . the thought of a duty unfulfilled shook off his torpor , and he hurried from the abode of drunkenness . staggering and holding himself up by keeping against the walls , falling down and creeping up again , and irresistibly impelled by a kind of instinct , he kept crying out , "" the carnatic ! the carnatic ! """,97
"it was passepartout ; and what had happened to him was as follows : shortly after fix left the opium den , two waiters had lifted the unconscious passepartout , and had carried him to the bed reserved for the smokers . three hours later , pursued even in his dreams by a fixed idea , the poor fellow awoke , and struggled against the stupefying influence of the narcotic . the thought of a duty unfulfilled shook off his torpor , and he hurried from the abode of drunkenness . staggering and holding himself up by keeping against the walls , falling down and creeping up again , and irresistibly impelled by a kind of instinct , he kept crying out , "" the carnatic ! the carnatic ! """,119
"he discovered wonderful stories , also , about jewels . in alphonso 's clericalis disciplina a serpent was mentioned with eyes of real jacinth , and in the romantic history of alexander , the conqueror of emathia was said to have found in the vale of jordan snakes "" with collars of real emeralds growing on their backs . "" there was a gem in the brain of the dragon , philostratus told us , and "" by the exhibition of golden letters and a scarlet robe "" the monster could be thrown into a magical sleep and slain . according to the great alchemist , pierre de boniface , the diamond rendered a man invisible , and the agate of india made him eloquent . the cornelian appeased anger , and the hyacinth provoked sleep , and the amethyst drove away the fumes of wine . the garnet cast out demons , and the hydropicus deprived the moon of her colour . the selenite waxed and waned with the moon , and the meloceus , that discovers thieves , could be affected only by the blood of kids . leonardus camillus had seen a white stone taken from the brain of a newly killed toad , that was a certain antidote against poison . the bezoar , that was found in the heart of the arabian deer , was a charm that could cure the plague . in the nests of arabian birds was the aspilates , that , according to democritus , kept the wearer from any danger by fire .",254
the first words i pronounced were words of appreciation and gratitude to my two companions . ned and conseil had kept me alive during the final hours of our long death throes . but no expression of thanks could repay them fully for such devotion .,20
"a gunrack had been made for the firearms , which were kept with extreme care , and neither tables nor cupboards were left incomplete .",11
"i wished i had kept my candle burning : the night was drearily dark ; my spirits were depressed . i rose and sat up in bed , listening . the sound was hushed .",4
