text,ind
"try and keep mr . rochester at a distance : distrust yourself as well as him . gentlemen in his station are not accustomed to marry their governesses . """,2
"conseil kept especially busy observing mollusks and articulates , and although his catalog is a little dry , i would n't want to wrong the gallant lad by leaving out his personal observations .",1
"do n't let him know she liked them best , for this must ever be a secret , kept from all the rest , between yourself and me . '",18
"the tide was already strong , for in three days the moon would be full , and it was enough to keep the boat in the center of the current , where it floated swiftly along between the high banks without its being necessary to increase its speed by the aid of the oars .",21
"first , she dreamed of little alice herself , and once again the tiny hands were clasped upon her knee , and the bright eager eyes were looking up into hers -- she could hear the very tones of her voice , and see that queer little toss of her head to keep back the wandering hair that would always get into her eyes -- and still as she listened , or seemed to listen , the whole place around her became alive the strange creatures of her little sister 's dream .",52
"lastly , she pictured to herself how this same little sister of hers would , in the after - time , be herself a grown woman ; and how she would keep , through all her riper years , the simple and loving heart of her childhood : and how she would gather about her other little children , and make their eyes bright and eager with many a strange tale , perhaps even with the dream of wonderland of long ago : and how she would feel with all their simple sorrows , and find a pleasure in all their simple joys , remembering her own child - life , and the happy summer days .",31
""" hum ! someone seems to be very deeply interested in your movements . "" out of the envelope he took a half - sheet of foolscap paper folded into four . this he opened and spread flat upon the table . across the middle of it a single sentence had been formed by the expedient of pasting printed words upon it . it ran : "" as you value your life or your reason keep away from the moor . "" the word "" moor "" only was printed in ink .",75
"as for captain nemo , i wondered what he would make of our escaping , what concern or perhaps what distress it might cause him , and what he would do in the twofold event of our attempt either failing or being found out ! certainly i had no complaints to register with him , on the contrary . never was hospitality more wholehearted than his . yet in leaving him i could n't be accused of ingratitude . no solemn promises bound us to him . in order to keep us captive , he had counted only on the force of circumstances and not on our word of honor . but his avowed intention to imprison us forever on his ship justified our every effort .",90
"then i began to wonder if this eccentric individual was even on board . since that night when the skiff had left the nautilus on some mysterious mission , my ideas about him had subtly changed . in spite of everything , i thought that captain nemo must have kept up some type of relationship with the shore . did he himself never leave the nautilus ? whole weeks had often gone by without my encountering him . what was he doing all the while ? during all those times i 'd thought he was convalescing in the grip of some misanthropic fit , was he instead far away from the ship , involved in some secret activity whose nature still eluded me ?",49
all these ideas and a thousand others assaulted me at the same time . in these strange circumstances the scope for conjecture was unlimited . i felt an unbearable queasiness . this day of waiting seemed endless . the hours struck too slowly to keep up with my impatience .,44
"as usual , dinner was served me in my stateroom . full of anxiety , i ate little . i left the table at seven o'clock . 120 minutes-- i was keeping track of them -- still separated me from the moment i was to rejoin ned land . my agitation increased . my pulse was throbbing violently . i could n't stand still . i walked up and down , hoping to calm my troubled mind with movement . the possibility of perishing in our reckless undertaking was the least of my worries ; my heart was pounding at the thought that our plans might be discovered before we had left the nautilus , at the thought of being hauled in front of captain nemo and finding him angered , or worse , saddened by my deserting him .",31
""" might i trouble you for it -- the inside page , please , with the leading articles ? "" he glanced swiftly over it , running his eyes up and down the columns . "" capital article this on free trade . permit me to give you an extract from it . ' you may be cajoled into imagining that your own special trade or your own industry will be encouraged by a protective tariff , but it stands to reason that such legislation must in the long run keep away wealth from the country , diminish the value of our imports , and lower the general conditions of life in this island . ' what do you think of that , watson ? "" cried holmes in high glee , rubbing his hands together with satisfaction . "" do n't you think that is an admirable sentiment ? """,90
"the few who continued well were allowed almost unlimited license ; because the medical attendant insisted on the necessity of frequent exercise to keep them in health : and had it been otherwise , no one had leisure to watch or restrain them .",23
"while rapidly making these comments my uncle kept opening and shutting the old tome . i really could do no less than ask a question about its contents , although i did not feel the slightest interest .",7
""" if we do not know every one of them , if nature still keeps ichthyological secrets from us , nothing is more admissible than to accept the existence of fish or cetaceans of new species or even new genera , animals with a basically ' cast - iron ' constitution that inhabit strata beyond the reach of our soundings , and which some development or other , an urge or a whim if you prefer , can bring to the upper level of the ocean for long intervals .",14
""" indeed ; "" i cried , keeping up wonderfully , "" of course it is a german translation ? """,7
""" certainly , harry . just touch the bell , and when parker comes i will tell him what you want . i have got to work up this background , so i will join you later on . do n't keep dorian too long . i have never been in better form for painting than i am to - day . this is going to be my masterpiece . it is my masterpiece as it stands . """,41
""" and , now , gentlemen , "" said the baronet with decision , "" it seems to me that i have spoken quite enough about the little that i know . it is time that you kept your promise and gave me a full account of what we are all driving at . """,37
"anne of austria took one step backward , became so pale that it might be said she was dying , and leaning with her left hand upon a table behind her to keep herself from falling , she with her right hand drew the paper from her bosom and held it out to the keeper of the seals .",32
""" what does it all mean ? "" he kept repeating mechanically .",9
""" the hotel will keep them for us . """,4
i had expected his arrival before tea ; now it was dark : what could keep him ?,15
"he quickened his pace until we had decreased the distance which divided us by about half . then , still keeping a hundred yards behind , we followed into oxford street and so down regent street . once our friends stopped and stared into a shop window , upon which holmes did the same . an instant afterwards he gave a little cry of satisfaction , and , following the direction of his eager eyes , i saw that a hansom cab with a man inside which had halted on the other side of the street was now proceeding slowly onward again .",20
""" i warn you , this will be an exhausting stroll . we 'll need to walk long hours and scale a mountain . the roads are n't terribly well kept up . """,30
"d’artagnan , who , foreseeing such an event , had kept his eye on him , sprang toward him , caught him in his arms , and assisted him to his chamber .",10
"side by side , captain nemo and i walked directly toward this conspicuous flame . the level seafloor rose imperceptibly . we took long strides , helped by our alpenstocks ; but in general our progress was slow , because our feet kept sinking into a kind of slimy mud mixed with seaweed and assorted flat stones .",42
""" oh , ours is a theological quarrel , "" replied aramis , making a sign to d’artagnan to keep secret the cause of their duel .",19
""" i did ; and i will keep my promise , for an hour or two at least : i have no wish to go to bed . """,7
"the noble and distinguished air of athos , those flashes of greatness which from time to time broke out from the shade in which he voluntarily kept himself , that unalterable equality of temper which made him the most pleasant companion in the world , that forced and cynical gaiety , that bravery which might have been termed blind if it had not been the result of the rarest coolness -- such qualities attracted more than the esteem , more than the friendship of d’artagnan ; they attracted his admiration .",26
"a short gallop brought them to the road of chaillot ; the day began to decline , carriages were passing and repassing . d’artagnan , keeping at some distance from his friends , darted a scrutinizing glance into every carriage that appeared , but saw no face with which he was acquainted .",25
""" he wo n't like you the better for keeping your promises . he always breaks his own . i beg you not to go . """,9
""" so , mr . naturalist , "" ned land continued in a bantering tone , "" you 'll just keep on believing in the existence of some enormous cetacean . . . ? """,20
"top was upon it in a bound , and kept it from plunging again .",9
"but this work did not succeed in absorbing all my attention . that old document kept working in my brain . my head throbbed with excitement , and i felt an undefined uneasiness . i was possessed with a presentiment of coming evil .",15
"master jup was ordered to keep him company , and made no remonstrance .",5
""" still , i must keep this man here until i can get a warrant to arrest him from london . """,5
"pencroft set sail at break of day , and by going on the larboard tack they could keep close to the shore .",17
"the ground rose appreciably as it moved away from the sand flats by the waves , and we soon arrived at some long , winding gradients , genuinely steep paths that allowed us to climb little by little ; but we had to tread cautiously in the midst of pudding stones that were n't cemented together , and our feet kept skidding on glassy trachyte , made of feldspar and quartz crystals .",60
"the authorities had terrified me , and you know that an innkeeper must keep on good terms with the authorities . """,13
"ned land still kept up the most tenacious skepticism ; beyond his spells on watch , he pretended that he never even looked at the surface of the waves , at least while no whales were in sight . and yet the marvelous power of his vision could have performed yeoman service . but this stubborn canadian spent eight hours out of every twelve reading or sleeping in his cabin . a hundred times i chided him for his unconcern .",3
"on july 20 we cut the tropic of capricorn at longitude 105 degrees , and by the 27th of the same month , we had cleared the equator on the 110th meridian . these bearings determined , the frigate took a more decisive westward heading and tackled the seas of the central pacific . commander farragut felt , and with good reason , that it was best to stay in deep waters and keep his distance from continents or islands , whose neighborhoods the animal always seemed to avoid--""no doubt , "" our bosun said , "" because there is n't enough water for him ! "" so the frigate kept well out when passing the tuamotu , marquesas , and hawaiian islands , then cut the tropic of cancer at longitude 132 degrees and headed for the seas of china .",73
"on july 20 we cut the tropic of capricorn at longitude 105 degrees , and by the 27th of the same month , we had cleared the equator on the 110th meridian . these bearings determined , the frigate took a more decisive westward heading and tackled the seas of the central pacific . commander farragut felt , and with good reason , that it was best to stay in deep waters and keep his distance from continents or islands , whose neighborhoods the animal always seemed to avoid--""no doubt , "" our bosun said , "" because there is n't enough water for him ! "" so the frigate kept well out when passing the tuamotu , marquesas , and hawaiian islands , then cut the tropic of cancer at longitude 132 degrees and headed for the seas of china .",110
"we were finally in the area of the monster 's latest antics ! and in all honesty , shipboard conditions became life - threatening . hearts were pounding hideously , gearing up for futures full of incurable aneurysms . the entire crew suffered from a nervous excitement that it 's beyond me to describe . nobody ate , nobody slept . twenty times a day some error in perception , or the optical illusions of some sailor perched in the crosstrees , would cause intolerable anguish , and this emotion , repeated twenty times over , kept us in a state of irritability so intense that a reaction was bound to follow .",96
"i will add that by sawing the bamboo in two at the joint , keeping for the bottom the part of the transverse film which forms the joint , useful cups are obtained , which are much in use among the chinese .",14
"he was a marvellous type , too , this lad , whom by so curious a chance he had met in basil 's studio , or could be fashioned into a marvellous type , at any rate . grace was his , and the white purity of boyhood , and beauty such as old greek marbles kept for us . there was nothing that one could not do with him . he could be made a titan or a toy . what a pity it was that such beauty was destined to fade ! . . .",56
""" i am told , on excellent authority , that her father keeps an american dry - goods store , "" said sir thomas burdon , looking supercilious .",12
"by then we were forced to go back down to the beach because the ridge had become impossible . above us , the yawning crater looked like the wide mouth of a well . from where we stood , the sky was pretty easy to see , and i watched clouds race by , disheveled by the west wind , letting tatters of mist trail over the mountain 's summit . proof positive that those clouds kept at a moderate altitude , because this volcano did n't rise more than 1,800 feet above the level of the ocean .",76
"half an hour after the canadian 's latest exploits , we were back on the inner beach . there the local flora was represented by a wide carpet of samphire , a small umbelliferous plant that keeps quite nicely , which also boasts the names glasswort , saxifrage , and sea fennel . conseil picked a couple bunches . as for the local fauna , it included thousands of crustaceans of every type : lobsters , hermit crabs , prawns , mysid shrimps , daddy longlegs , rock crabs , and a prodigious number of seashells , such as cowries , murex snails , and limpets .",36
""" no , mr . holmes , i have not . i 've had no time , for it was only yesterday that i learned how matters stood . but in any case i feel that the money should go with the title and estate . that was my poor uncle 's idea . how is the owner going to restore the glories of the baskervilles if he has not money enough to keep up the property ? house , land , and dollars must go together . """,73
""" what , you scoundrel ! have you kept him in the cellar all this time ? """,8
"the nautilus did n't change direction . for the time being , then , we had to set aside any hope of returning to european seas . captain nemo kept his prow pointing south . where was he taking us ? i was afraid to guess .",29
""" i shall try to keep in the offing until the flood , that is to say , till about seven in the evening , and if there is still light enough i will try to enter the gulf ; if not , we must stand off and on during the night , and we will enter to - morrow at sunrise . """,5
"i see you would ask why i keep such a woman in my house : when we have been married a year and a day , i will tell you ; but not now .",7
"so ned land had good reason to worry . in these wide seas empty of islands , it was no longer feasible to jump ship . nor did we have any way to counter captain nemo 's whims . we had no choice but to acquiesce ; but if we could n't attain our end through force or cunning , i liked to think we might achieve it through persuasion . once this voyage was over , might not captain nemo consent to set us free in return for our promise never to reveal his existence ? our word of honor , which we sincerely would have kept . however , this delicate question would have to be negotiated with the captain . but how would he receive our demands for freedom ? at the very outset and in no uncertain terms , had n't he declared that the secret of his life required that we be permanently imprisoned on board the nautilus ? would n't he see my four - month silence as a tacit acceptance of this situation ? would my returning to this subject arouse suspicions that could jeopardize our escape plans , if we had promising circumstances for trying again later on ? i weighed all these considerations , turned them over in my mind , submitted them to conseil , but he was as baffled as i was . in short , although i 'm not easily discouraged , i realized that my chances of ever seeing my fellow men again were shrinking by the day , especially at a time when captain nemo was recklessly racing toward the south atlantic !",107
"at lowood , indeed , i took that resolution , kept it , and succeeded in pleasing ; but with mrs . reed , i remember my best was always spurned with scorn .",10
""" right , "" the commander replied . "" and if it has their power to electrocute , it 's surely the most dreadful animal ever conceived by our creator . that 's why i 'll keep on my guard , sir . """,36
"infuriated , commander farragut kept twisting the thick tuft of hair that flourished below his chin .",4
""" but i 'll not keep you sitting up late to - night , "" said she ; "" it is on the stroke of twelve now , and you have been travelling all day : you must feel tired .",5
"with a word , d’artagnan reassured them ; and planchet ran to inform the other sentinels that it was useless to keep guard longer , as his master had come out safe from the palais - cardinal .",21
""" go to it , ned , "" commander farragut replied . "" engineer , "" he called , "" keep the pressure mounting ! """,20
"for the next hour our frigate kept up this pace without gaining a fathom ! this was humiliating for one of the fastest racers in the american navy . the crew were working up into a blind rage . sailor after sailor heaved insults at the monster , which could n't be bothered with answering back . commander farragut was no longer content simply to twist his goatee ; he chewed on it .",6
"during the night of march 13 - 14 , the nautilus resumed its southward heading . once it was abreast of cape horn , i thought it would strike west of the cape , make for pacific seas , and complete its tour of the world . it did nothing of the sort and kept moving toward the southernmost regions . so where was it bound ? the pole ? that was insanity . i was beginning to think that the captain 's recklessness more than justified ned land 's worst fears .",54
""" keep stoking the furnaces . """,1
"linen was plentiful also , and besides , they kept it with extreme care .",9
""" most certainly . keep your revolver near you night and day , and never relax your precautions . """,4
""" you have always kept together , i presume ? """,4
"the train entered the defiles of the sutpour mountains , which separate the khandeish from bundelcund , towards evening . the next day sir francis cromarty asked passepartout what time it was ; to which , on consulting his watch , he replied that it was three in the morning . this famous timepiece , always regulated on the greenwich meridian , which was now some seventy - seven degrees westward , was at least four hours slow . sir francis corrected passepartout 's time , whereupon the latter made the same remark that he had done to fix ; and upon the general insisting that the watch should be regulated in each new meridian , since he was constantly going eastward , that is in the face of the sun , and therefore the days were shorter by four minutes for each degree gone over , passepartout obstinately refused to alter his watch , which he kept at london time . it was an innocent delusion which could harm no one .",157
"mr . rochester asked me if i would like to go and live with him in england , and i said yes ; for i knew mr . rochester before i knew madame frederic , and he was always kind to me and gave me pretty dresses and toys : but you see he has not kept his word , for he has brought me to england , and now he is gone back again himself , and i never see him . """,56
""" fasten it into your girdle , janet , and keep it henceforward : i have no use for it . """,10
""" very well ; get me my purse back and keep the sixty pistoles . """,10
""" i recommend you therefore to keep the strictest watch .",6
""" in what order you keep these rooms , mrs . fairfax ! "" said i.",5
"the journey was resumed at six in the morning ; the guide hoped to reach allahabad by evening . in that case , mr . fogg would only lose a part of the forty - eight hours saved since the beginning of the tour . kiouni , resuming his rapid gait , soon descended the lower spurs of the vindhias , and towards noon they passed by the village of kallenger , on the cani , one of the branches of the ganges . the guide avoided inhabited places , thinking it safer to keep the open country , which lies along the first depressions of the basin of the great river . allahabad was now only twelve miles to the north - east . they stopped under a clump of bananas , the fruit of which , as healthy as bread and as succulent as cream , was amply partaken of and appreciated .",94
""" why , miss eyre , though mr . rochester 's visits here are rare , they are always sudden and unexpected ; and as i observed that it put him out to find everything swathed up , and to have a bustle of arrangement on his arrival , i thought it best to keep the rooms in readiness . """,54
"what he had clearly gained in all this was the diamond , worth five or six thousand livres , which he wore on his finger ; and even this diamond -- supposing that d’artagnan , in his projects of ambition , wished to keep it , to make it someday a pledge for the gratitude of the queen -- had not in the meanwhile , since he could not part with it , more value than the gravel he trod under his feet .",43
the parsee made a motion to keep silence .,6
"near one o'clock in the morning , i was overcome with tremendous exhaustion . my limbs stiffened in the grip of intense cramps . conseil had to keep me going , and attending to our self - preservation became his sole responsibility . i soon heard the poor lad gasping ; his breathing became shallow and quick . i did n't think he could stand such exertions for much longer .",27
"i drew aside my curtains before i went to bed and looked out from my window . it opened upon the grassy space which lay in front of the hall door . beyond , two copses of trees moaned and swung in a rising wind . a half moon broke through the rifts of racing clouds . in its cold light i saw beyond the trees a broken fringe of rocks , and the long , low curve of the melancholy moor . i closed the curtain , feeling that my last impression was in keeping with the rest .",95
ned land did n't understand . he no longer even heard me . that baleen whale kept coming closer . his eyes devoured it .,16
"mrs . poole advanced . "" keep out of the way , "" said mr . rochester , thrusting her aside : "" she has no knife now , i suppose , and i 'm on my guard . """,6
"i kept these things then , and pondered them in my heart .",1
"nevertheless , conseil kept towing me . sometimes he looked up , stared straight ahead , and shouted a request for directions , which was answered by a voice that was getting closer and closer . i could barely hear it . i was at the end of my strength ; my fingers gave out ; my hands were no help to me ; my mouth opened convulsively , filling with brine ; its coldness ran through me ; i raised my head one last time , then i collapsed . . . .",3
"we went first to kongens - nye - torw , an irregular square in which are two innocent - looking guns , which need not alarm any one . close by , at no . 5 , there was a french "" restaurant , "" kept by a cook of the name of vincent , where we had an ample breakfast for four marks each ( 2_s _ . 4_d _ . ) .",45
"meanwhile that monstrous herd kept coming closer . it had seen the baleen whales and was preparing to attack . you could tell in advance that the sperm whales would be victorious , not only because they were better built for fighting than their harmless adversaries , but also because they could stay longer underwater before returning to breathe at the surface .",4
"from that day on , i noted with some uneasiness that ned land 's attitudes toward captain nemo grew worse and worse , and i decided to keep a close watch on the canadian 's movements and activities .",27
"he kept himself upright and dreamed , without sleeping .",1
