text,ind
"the worthy fellow had certainly taken good care to eat as hearty a breakfast as possible before leaving the carnatic ; but , as he had been walking about all day , the demands of hunger were becoming importunate . he observed that the butchers stalls contained neither mutton , goat , nor pork ; and , knowing also that it is a sacrilege to kill cattle , which are preserved solely for farming , he made up his mind that meat was far from plentiful in yokohama -- nor was he mistaken ; and , in default of butcher 's meat , he could have wished for a quarter of wild boar or deer , a partridge , or some quails , some game or fish , which , with rice , the japanese eat almost exclusively . but he found it necessary to keep up a stout heart , and to postpone the meal he craved till the following morning . night came , and passepartout re - entered the native quarter , where he wandered through the streets , lit by vari - coloured lanterns , looking on at the dancers , who were executing skilful steps and boundings , and the astrologers who stood in the open air with their telescopes . then he came to the harbour , which was lit up by the resin torches of the fishermen , who were fishing from their boats .",145
""" it is about yourself , "" answered hallward in his grave deep voice , "" and i must say it to you . i shall only keep you half an hour . """,27
""" i do n’t know ; the secret has been well kept . """,11
"but i resisted all his solicitations and succeeded in dissuading him from his announced intention of walking home with me . i kept the road as long as his eye was on me , and then i struck off across the moor and made for the stony hill over which the boy had disappeared . everything was working in my favour , and i swore that it should not be through lack of energy or perseverance that i should miss the chance which fortune had thrown in my way .",22
""" i 'm unable to answer you , mr . land . and trust me on this : for the time being , get rid of these notions of taking over the nautilus or escaping from it . this boat is a masterpiece of modern technology , and i 'd be sorry to have missed it ! many people would welcome the circumstances that have been handed us , just to walk in the midst of these wonders . so keep calm , and let 's see what 's happening around us . """,80
"if there was one report there might be others , so i looked round the hut in search of them . there was no trace , however , of anything of the kind , nor could i discover any sign which might indicate the character or intentions of the man who lived in this singular place , save that he must be of spartan habits and cared little for the comforts of life . when i thought of the heavy rains and looked at the gaping roof i understood how strong and immutable must be the purpose which had kept him in that inhospitable abode . was he our malignant enemy , or was he by chance our guardian angel ? i swore that i would not leave the hut until i knew .",99
"we did n't leave these patagonian waterways until april 3 , sometimes cruising under the ocean , sometimes on its surface . the nautilus passed the wide estuary formed by the mouth of the rio de la plata , and on april 4 we lay abreast of uruguay , albeit fifty miles out . keeping to its northerly heading , it followed the long windings of south america . by then we had fared 16,000 leagues since coming on board in the seas of japan .",54
"as long as he remained in the boat which conveyed him to land , he kept his face toward milady , who , standing on the deck , followed him with her eyes .",15
"this "" et cetera "" wo n't keep me from mentioning one more fish that conseil , with good reason , will long remember .",7
""" what , when we have nothing to do but keep going down ! """,10
""" well then , "" cried the sailor , "" i am quite ready to be captain -- as soon as you can make a craft that 's able to keep at sea ! """,30
"an exclamation of horror broke from the painter 's lips as he saw in the dim light the hideous face on the canvas grinning at him . there was something in its expression that filled him with disgust and loathing . good heavens ! it was dorian gray 's own face that he was looking at ! the horror , whatever it was , had not yet entirely spoiled that marvellous beauty . there was still some gold in the thinning hair and some scarlet on the sensual mouth . the sodden eyes had kept something of the loveliness of their blue , the noble curves had not yet completely passed away from chiselled nostrils and from plastic throat . yes , it was dorian himself . but who had done it ? he seemed to recognize his own brushwork , and the frame was his own design . the idea was monstrous , yet he felt afraid .",94
"i had better have kept my observations to myself . but my geological instinct was stronger than my prudence , and uncle liedenbrock heard my exclamation .",4
"they understood , then , from the few words which escaped from d’artagnan , what affair was in hand , and as they thought that overtaking his man , or losing sight of him , d’artagnan would return to his rooms , they kept on their way .",43
""" ugh ! "" the canadian put in with distinct scorn . "" you can keep the freshwater fish ! """,15
""" but why keep me in the dark ? """,3
""" he desired me to tell your grace , "" replied felton , "" that he very much regretted not having that honor , but that he was prevented by the guard he is obliged to keep at the castle . """,36
"for some days the nautilus kept veering away from the american coast . it obviously did n't want to frequent the waves of the gulf of mexico or the caribbean sea . yet there was no shortage of water under its keel , since the average depth of these seas is 1,800 meters ; but these waterways , strewn with islands and plowed by steamers , probably did n't agree with captain nemo .",5
"the canadian , conseil , and i had a pretty long conversation on this subject . for six months we had been prisoners aboard the nautilus . we had fared 17,000 leagues , and as ned land put it , there was no end in sight . so he made me a proposition i had n't anticipated . we were to ask captain nemo this question straight out : did the captain mean to keep us on board his vessel permanently ?",74
""" not a lick of it , conseil my friend , "" the harpooner replied . "" but keep going , because you fill me with fascination . """,18
"so i begged ned to let me think about it before taking action . if this measure proved fruitless , it could arouse the captain 's suspicions , make our circumstances even more arduous , and jeopardize the canadian 's plans . i might add that i could hardly use our state of health as an argument . except for that grueling ordeal under the ice bank at the south pole , we had never felt better , neither ned , conseil , nor i. the nutritious food , life - giving air , regular routine , and uniform temperature kept illness at bay ; and for a man who did n't miss his past existence on land , for a captain nemo who was at home here , who went where he wished , who took paths mysterious to others if not himself in attaining his ends , i could understand such a life . but we ourselves had n't severed all ties with humanity . for my part , i did n't want my new and unusual research to be buried with my bones . i had now earned the right to pen the definitive book on the sea , and sooner or later i wanted that book to see the light of day .",100
"it happened also , on the 23rd of november , that passepartout made a joyful discovery . it will be remembered that the obstinate fellow had insisted on keeping his famous family watch at london time , and on regarding that of the countries he had passed through as quite false and unreliable . now , on this day , though he had not changed the hands , he found that his watch exactly agreed with the ship 's chronometers . his triumph was hilarious . he would have liked to know what fix would say if he were aboard !",28
""" the rogue told me a lot of stories , "" repeated passepartout , "" about the meridians , the sun , and the moon ! moon , indeed ! moonshine more likely ! if one listened to that sort of people , a pretty sort of time one would keep ! i was sure that the sun would some day regulate itself by my watch ! """,50
""" yes , "" said aramis , "" impart it to us , my dear friend , unless the honor of any lady be hazarded by this confidence ; in that case you would do better to keep it to yourself . """,37
"when he reached the library , he saw the bag and coat in the corner . they must be hidden away somewhere . he unlocked a secret press that was in the wainscoting , a press in which he kept his own curious disguises , and put them into it . he could easily burn them afterwards . then he pulled out his watch . it was twenty minutes to two .",39
""" no , "" replied fix coldly , "" i think him a rascal . sh ! do n't budge , and let me speak . as long as mr . fogg was on english ground , it was for my interest to detain him there until my warrant of arrest arrived . i did everything i could to keep him back . i sent the bombay priests after him , i got you intoxicated at hong kong , i separated you from him , and i made him miss the yokohama steamer . """,59
"suddenly daylight appeared in the lounge . the sheet - iron panels slid shut . the magical vision disappeared . but for a good while i kept dreaming away , until the moment my eyes focused on the instruments hanging on the wall . the compass still showed our heading as east - northeast , the pressure gauge indicated a pressure of five atmospheres ( corresponding to a depth of fifty meters ) , and the electric log gave our speed as fifteen miles per hour .",26
"as soon as i was dressed , i made my way to the main lounge . it was deserted . i dove into studying the conchological treasures amassed inside the glass cases . i also investigated the huge plant albums that were filled with the rarest marine herbs , which , although they were pressed and dried , still kept their wonderful colors . among these valuable water plants , i noted various seaweed : some cladostephus verticillatus , peacock 's tails , fig - leafed caulerpa , grain - bearing beauty bushes , delicate rosetangle tinted scarlet , sea colander arranged into fan shapes , mermaid 's cups that looked like the caps of squat mushrooms and for years had been classified among the zoophytes ; in short , a complete series of algae .",59
"however , one chance yet remained ; it was that bob harvey , after all , would not venture his ship into the channel , and that he would keep outside the islet .",29
"the nautilus kept to an east - northeasterly heading , a speed of twelve miles per hour , and a depth between fifty and sixty meters .",2
"but after all , as conseil noted , we enjoyed complete freedom , we were daintily and abundantly fed . our host had kept to the terms of his agreement . we could n't complain , and moreover the very uniqueness of our situation had such generous rewards in store for us , we had no grounds for criticism .",23
"the whole of venice was in those two lines . he remembered the autumn that he had passed there , and a wonderful love that had stirred him to mad delightful follies . there was romance in every place . but venice , like oxford , had kept the background for romance , and , to the true romantic , background was everything , or almost everything . basil had been with him part of the time , and had gone wild over tintoret . poor basil ! what a horrible way for a man to die !",47
it was useless to try to keep pace on foot with a carriage drawn by two powerful horses .,6
""" yes , my poor boy , i knew that as soon as you arrived at these cross roads you would drop half dead , and i kept my last drop of water to reanimate you . """,27
""" stop , gray . i do n't want to know anything further . whether what you have told me is true or not true does n't concern me . i entirely decline to be mixed up in your life . keep your horrible secrets to yourself . they do n't interest me any more . """,41
"passepartout was waiting for his master , armed with half a dozen six - barrelled revolvers . when he perceived fix , he knit his brows ; but aouda having , in a few words , told him of their adventure , his countenance resumed its placid expression . fix evidently was no longer an enemy , but an ally ; he was faithfully keeping his word .",64
"having completed her task , she rose to draw down the blind , which she had hitherto kept up , by way , i suppose , of making the most of daylight , though dusk was now fast deepening into total obscurity .",17
""" monsieur athos , "" said richelieu , "" receive my thanks for the good guard you have kept . gentlemen , we are arrived ; take the gate on the left . the watchword is , ’ king and re . ’ """,18
i stared in my turn and could n't keep back a movement of revulsion . before my eyes there quivered a horrible monster worthy of a place among the most farfetched teratological legends .,8
"i continued sketching . these monsters kept pace in our waters with such precision , they seemed to be standing still , and i could have traced their outlines in miniature on the window . but we were moving at a moderate speed .",6
"from this point the road , running along humboldt river , passed northward for several miles by its banks ; then it turned eastward , and kept by the river until it reached the humboldt range , nearly at the extreme eastern limit of nevada .",26
""" we will keep a sharp lookout for them ; and if we lay hands on them his eminence may be assured they will be reconducted to paris under a good escort . """,3
"thus day followed day ; and as sure as morning came he found that his unseen enemies had kept their register , and had marked up in some conspicuous position how many days were still left to him out of the month of grace . sometimes the fatal numbers appeared upon the walls , sometimes upon the floors , occasionally they were on small placards stuck upon the garden gate or the railings . with all his vigilance john ferrier could not discover whence these daily warnings proceeded . a horror which was almost superstitious came upon him at the sight of them . he became haggard and restless , and his eyes had the troubled look of some hunted creature . he had but one hope in life now , and that was for the arrival of the young hunter from nevada .",18
"i derived benefit from the task : it had kept my head and hands employed , and had given force and fixedness to the new impressions i wished to stamp indelibly on my heart .",9
""" patrick , "" said the due , "" bring me the casket in which the diamond studs were kept . """,19
""" whatever can not ye keep yourself for , then ? """,5
""" i have kept myself ; and , i trust , shall keep myself again .",3
""" i have kept myself ; and , i trust , shall keep myself again .",12
"as for me , what had harrowed my heart in the thick of this struggle was the despairing yell given by this unfortunate man . forgetting his regulation language , this poor frenchman had reverted to speaking his own mother tongue to fling out one supreme plea ! among the nautilus 's crew , allied body and soul with captain nemo and likewise fleeing from human contact , i had found a fellow countryman ! was he the only representative of france in this mysterious alliance , obviously made up of individuals from different nationalities ? this was just one more of those insoluble problems that kept welling up in my mind !",106
"captain nemo reentered his stateroom , and i saw no more of him for a good while . but how sad , despairing , and irresolute he must have felt , to judge from this ship whose soul he was , which reflected his every mood ! the nautilus no longer kept to a fixed heading . it drifted back and forth , riding with the waves like a corpse . its propeller had been disentangled but was barely put to use . it was navigating at random . it could n't tear itself away from the setting of this last struggle , from this sea that had devoured one of its own !",51
"gentlemen , once more , take him to prison , and keep him under key as long as possible ; that will give me time to pay him . """,11
""" i keep coming back to my idea . we 've got to talk to the captain . when we were in your own country 's seas , you did n't say a word . now that we 're in mine , i intend to speak up . before a few days are out , i figure the nautilus will lie abreast of nova scotia , and from there to newfoundland is the mouth of a large gulf , and the st . lawrence empties into that gulf , and the st . lawrence is my own river , the river running by quebec , my hometown-- and when i think about all this , my gorge rises and my hair stands on end ! honestly , sir , i 'd rather jump overboard ! i ca n't stay here any longer ! i 'm suffocating ! """,2
"the first fear of the king of england , charles i , on learning of the death of the duke , was that such terrible news might discourage the rochellais ; he tried , says richelieu in his memoirs , to conceal it from them as long as possible , closing all the ports of his kingdom , and carefully keeping watch that no vessel should sail until the army which buckingham was getting together had gone , taking upon himself , in default of buckingham , to superintend the departure .",60
""" if there 's a vacant place for a chief of the police , i reckon you are the man for it , "" he said , gazing with undisguised admiration at my fellow - lodger . "" the way you kept on my trail was a caution . """,41
"i allowed adele to sit up much later than usual ; for she declared she could not possibly go to sleep while the doors kept opening and shutting below , and people bustling about .",24
"you see these bones , my friends ; well , when it freezes , i will bend them , and then wet them with water till they are entirely covered with ice , which will keep them bent , and i will strew them on the snow , having previously covered them with fat .",35
""" because we have very important matters to communicate to one another , and it was impossible to talk five minutes in that inn without being annoyed by all those importunate fellows , who keep coming in , saluting you , and addressing you . here at least , "" said athos , pointing to the bastion , "" they will not come and disturb us . """,34
the duke walked so fast that d’artagnan had some trouble in keeping up with him .,11
""" yes , sir , and that 's the subject on which i wanted to confer with you . for seven months we 've been aboard your vessel , and i ask you today , in the name of my companions as well as myself , if you intend to keep us here forever . """,50
"a few paces away , a monstrous , meter - high sea spider was staring at me with beady eyes , poised to spring at me . although my diving suit was heavy enough to protect me from this animal 's bites , i could n't keep back a shudder of horror . just then conseil woke up , together with the nautilus 's sailor . captain nemo alerted his companion to this hideous crustacean , which a swing of the rifle butt quickly brought down , and i watched the monster 's horrible legs writhing in dreadful convulsions .",46
"the seafloor kept sinking , and its significantly steeper slope took us to greater depths . it must have been nearly three o'clock when we reached a narrow valley gouged between high , vertical walls and located 150 meters down . thanks to the perfection of our equipment , we had thus gone ninety meters below the limit that nature had , until then , set on man 's underwater excursions .",2
"while we were walking , i thought the lights of our ruhmkorff devices would automatically attract some inhabitants of these dark strata . but if they did approach us , at least they kept at a distance regrettable from the hunter 's standpoint . several times i saw captain nemo stop and take aim with his rifle ; then , after sighting down its barrel for a few seconds , he would straighten up and resume his walk .",33
""" i suppose he thought we had come to the hotel that he had mentioned , for he got out without another word , and followed me down the garden . i had to walk beside him to keep him steady , for he was still a little top - heavy . when we came to the door , i opened it , and led him into the front room . i give you my word that all the way , the father and the daughter were walking in front of us .",38
"the raging sea was swept with huge tattered clouds drenched by the waves . i saw no more of the small intervening billows that form in the troughs of the big crests . just long , soot - colored undulations with crests so compact they did n't foam . they kept growing taller . they were spurring each other on . the nautilus , sometimes lying on its side , sometimes standing on end like a mast , rolled and pitched frightfully .",50
"on thursday , at 8 a.m. , we started afresh . the granite tunnel winding from side to side , earned us past unexpected turns , and seemed almost to form a labyrinth ; but , on the whole , its direction seemed to be south - easterly . my uncle never ceased to consult his compass , to keep account of the ground gone over .",59
"the nautilus kept descending . i thought it would find calm again at fifteen meters down . no . the upper strata were too violently agitated . it needed to sink to fifty meters , searching for a resting place in the bowels of the sea .",2
"you must share your gratitude with herbert , who recognized the plant , with cyrus , who prepared it , and with neb , who took a great deal of trouble to keep our secret . """,32
"on the 6th and 7th of july we kept following the spiral curves of this singular well , penetrating in actual distance no more than two leagues ; but being carried to a depth of five leagues below the level of the sea . but on the 8th , about noon , the fault took , towards the south - east , a much gentler slope , one of about forty - five degrees .",8
""" which , if you like , you have , in my opinion , a right to keep , both from st . john and every other questioner , "" remarked diana .",17
"but the nautilus kept gravitating southward . on may 30 , in sight of land 's end , it passed between the lowermost tip of england and the scilly islands , which it left behind to starboard .",3
"the nautilus kept to its southeasterly heading . on december 1 it cut the equator at longitude 142 degrees , and on the 4th of the same month , after a quick crossing marked by no incident , we raised the marquesas islands . three miles off , in latitude 8 degrees 57 ' south and longitude 139 degrees 32 ' west , i spotted martin point on nuku hiva , chief member of this island group that belongs to france . i could make out only its wooded mountains on the horizon , because captain nemo hated to hug shore . there our nets brought up some fine fish samples : dolphinfish with azure fins , gold tails , and flesh that 's unrivaled in the entire world , wrasse from the genus hologymnosus that were nearly denuded of scales but exquisite in flavor , knifejaws with bony beaks , yellowish albacore that were as tasty as bonito , all fish worth classifying in the ship 's pantry .",2
""" come on , come on ! "" said d’artagnan ; "" let us keep that paper carefully , perhaps i have not thrown away my half - pistole .",14
""" his family will care much about such a trifle as that ! his family will inherit fifteen thousand louis a year from him . keep the purse for your lackeys . """,25
"the next day , june 1 , the nautilus kept to the same tack . it was obviously trying to locate some precise spot in the ocean . just as on the day before , captain nemo came to take the altitude of the sun . the sea was smooth , the skies clear . eight miles to the east , a big steamship was visible on the horizon line . no flag was flapping from the gaff of its fore - and - aft sail , and i could n't tell its nationality .",9
""" i have come prepared to do so , "" said holmes , drawing several papers from his pocket . "" here is a photograph of the couple taken in york four years ago . it is indorsed ' mr . and mrs . vandeleur , ' but you will have no difficulty in recognizing him , and her also , if you know her by sight . here are three written descriptions by trustworthy witnesses of mr . and mrs . vandeleur , who at that time kept st . oliver 's private school . read them and see if you can doubt the identity of these people . """,88
"you pay her , of course ; i should think it quite as expensive,--more so ; for you have them both to keep in addition . """,22
""" keep quiet , "" said the man . "" if you stir , i shoot you . """,1
"i feel more inclination to put you in the way of keeping yourself , and shall endeavour to do so ; but observe , my sphere is narrow .",11
""" and then after you had sent the letter he dissuaded you from keeping the appointment ? """,13
"soon the canadian announced that the craft was a big battleship , a double - decker ironclad complete with ram . dark , dense smoke burst from its two funnels . its furled sails merged with the lines of its yardarms . the gaff of its fore - and - aft sail flew no flag . its distance still kept us from distinguishing the colors of its pennant , which was fluttering like a thin ribbon .",59
"you will say that i keep it . """,5
"i did n't reply to the canadian 's proposition but kept watching the ship , which was looming larger on the horizon . whether it was english , french , american , or russian , it would surely welcome us aboard if we could just get to it .",10
"let us keep our remarks to ourselves , and continue our work . """,2
