text,ind
"' if you did n't sign it , ' said the king , ' that only makes the matter worse . you must have meant some mischief , or else you 'd have signed your name like an honest man . '",35
""" when you go in , "" said i , "" tell your master that a person wishes to speak to him , but do not give my name . """,28
""" exactly . i fancy the yew alley , though not marked under that name , must stretch along this line , with the moor , as you perceive , upon the right of it . this small clump of buildings here is the hamlet of grimpen , where our friend dr . mortimer has his headquarters . within a radius of five miles there are , as you see , only a very few scattered dwellings . here is lafter hall , which was mentioned in the narrative . there is a house indicated here which may be the residence of the naturalist -- stapleton , if i remember right , was his name . here are two moorland farm - houses , high tor and foulmire . then fourteen miles away the great convict prison of princetown . between and around these scattered points extends the desolate , lifeless moor . this , then , is the stage upon which tragedy has been played , and upon which we may help to play it again . """,114
""" you are a frenchman , i believe , "" asked phileas fogg , "" and your name is john ? """,17
""" jean , if monsieur pleases , "" replied the newcomer , "" jean passepartout , a surname which has clung to me because i have a natural aptness for going out of one business into another . i believe i 'm honest , monsieur , but , to be outspoken , i 've had several trades . i 've been an itinerant singer , a circus - rider , when i used to vault like leotard , and dance on a rope like blondin . then i got to be a professor of gymnastics , so as to make better use of my talents ; and then i was a sergeant fireman at paris , and assisted at many a big fire . but i quitted france five years ago , and , wishing to taste the sweets of domestic life , took service as a valet here in england . finding myself out of place , and hearing that monsieur phileas fogg was the most exact and settled gentleman in the united kingdom , i have come to monsieur in the hope of living with him a tranquil life , and forgetting even the name of passepartout . """,196
"that study of his was a museum , and nothing else . specimens of everything known in mineralogy lay there in their places in perfect order , and correctly named , divided into inflammable , metallic , and lithoid minerals .",29
""" really , mr . holmes , this exceeds anything which i could have imagined , "" said dr . mortimer , gazing at my friend in amazement . "" i could understand anyone saying that the words were from a newspaper ; but that you should name which , and add that it came from the leading article , is really one of the most remarkable things which i have ever known . how did you do it ? """,47
for form ’s sake the chancellor paid a visit to the pieces of furniture named ; but he well knew that it was not in a piece of furniture that the queen would place the important letter she had written that day .,14
certainly their presence would have been enough for a botanist to name without hesitation the parallel which traversed lincoln island .,11
""" and i may add , "" said herbert , "" that the eucalyptus belongs to a family which comprises many useful members ; the guava - tree , from whose fruit guava jelly is made ; the clove - tree , which produces the spice ; the pomegranate - tree , which bears pomegranates ; the eugeacia cauliflora , the fruit of which is used in making a tolerable wine ; the ugui myrtle , which contains an excellent alcoholic liquor ; the caryophyllus myrtle , of which the bark forms an esteemed cinnamon ; the eugenia pimenta , from whence comes jamaica pepper ; the common myrtle , from whose buds and berries spice is sometimes made ; the eucalyptus manifera , which yields a sweet sort of manna ; the guinea eucalyptus , the sap of which is transformed into beer by fermentation ; in short , all those trees known under the name of gum - trees or iron - bark trees in australia , belong to this family of the myrtaceae , which contains forty - six genera and thirteen hundred species ! """,156
""" this very evening , "" returned phileas fogg . he took out and consulted a pocket almanac , and added , "" as today is wednesday , the 2nd of october , i shall be due in london in this very room of the reform club , on saturday , the 21st of december , at a quarter before nine p.m. ; or else the twenty thousand pounds , now deposited in my name at baring 's , will belong to you , in fact and in right , gentlemen . here is a cheque for the amount . """,74
""" arne saknussemm ! "" he cried in triumph . "" why that is the name of another icelander , a savant of the sixteenth century , a celebrated alchemist ! """,15
""" my faith ! "" replied d’artagnan , "" you are well named , gentlemen ; and my adventure , if it should make any noise , will prove at least that your union is not founded upon contrasts . """,12
"then turning his eyes from milady to the paper , he read : "" ’ order to conduct-- ’ the name is blank , "" interrupted lord de winter .",20
""" ’ order to conduct to -- the person named charlotte backson , branded by the justice of the kingdom of france , but liberated after chastisement . she is to dwell in this place without ever going more than three leagues from it .",9
""" no , sir , indeed i have not . you saved my good name , and perhaps my life . """,14
"have you a name , then ? """,3
""" my dear fellow , you exaggerate . i have some recollection , wilson , that you had among your boys a lad named cartwright , who showed some ability during the investigation . """,23
"just as the moment of the supreme experiment arrived the professor 's eyes flashed right through his spectacles . there was a quivering in his fingers as he grasped the old parchment . he was deeply moved . at last he gave a preliminary cough , and with profound gravity , naming in succession the first , then the second letter of each word , he dictated me the following :",51
""" even less likely , ned . the devilfish is merely a mollusk , and even this name hints at its semiliquid flesh , because it 's latin meaning soft one . the devilfish does n't belong to the vertebrate branch , and even if it were 500 feet long , it would still be utterly harmless to ships like the scotia or the abraham lincoln . consequently , the feats of krakens or other monsters of that ilk must be relegated to the realm of fiction . """,17
"the book showed that two names had been added after that of baskerville . one was theophilus johnson and family , of newcastle ; the other mrs . oldmore and maid , of high lodge , alton .",5
""" name it , my boy , "" said the engineer , addressing the lad .",1
""" ah , that settles it . mrs . oldmore , too ; i seem to remember the name . excuse my curiosity , but often in calling upon one friend one finds another . """,18
""" he is : a frenchman , named passepartout . """,7
""" what is your name , my brave fellow ? "" said athos .",4
"near three o'clock in the afternoon on july 6 , fifteen miles south of shore , the abraham lincoln doubled that solitary islet at the tip of the south american continent , that stray rock dutch seamen had named cape horn after their hometown of hoorn . our course was set for the northwest , and the next day our frigate 's propeller finally churned the waters of the pacific .",38
"you believe , and yet you deliver me up to him who fills and defiles the world with his heresies and debaucheries -- to that infamous sardanapalus whom the blind call the duke of buckingham , and whom believers name antichrist ! """,39
"monsieur the governor was all astonishment . he told me he knew nothing about the matter , that the orders i had received did not come from him , and that if i had the audacity to mention his name as being concerned in this disturbance he would have me hanged .",39
"they took advantage of the opening already made on their last excursion to form a practicable road , which they named the far west road , and the trees were carried to the chimneys , where the dockyard was established .",20
""" is your name eyre , miss ? """,3
""" well , in the first place , i wish to ask what are this jokul , this sneffels , and this scartaris , names which i have never heard before ? """,24
""" exactly . i have wired to get his name and address from the official registry . i should not be surprised if this were an answer to my question . """,9
"varens is the name of your future pupil . """,3
""" he mentioned his name . """,4
"holmes cast a swift glance of triumph at me . "" oh , he mentioned his name , did he ? that was imprudent . what was the name that he mentioned ? """,16
"holmes cast a swift glance of triumph at me . "" oh , he mentioned his name , did he ? that was imprudent . what was the name that he mentioned ? """,28
""" his name , "" said the cabman , "" was mr . sherlock holmes . """,2
""" a touch , watson -- an undeniable touch ! "" said he . "" i feel a foil as quick and supple as my own . he got home upon me very prettily that time . so his name was sherlock holmes , was it ? """,39
""" yes , sir , that was the gentleman 's name . """,10
"you know how difficult it is to discover the truth ; and unless a man be endowed with that admirable instinct which causes louis xiii to be named the just-- """,27
""" but i have to tell you that the highest names have come to the support of my views . do you remember a visit paid to me by the celebrated chemist , humphry davy , in 1825 ? """,10
""" well , eighteen , then . and i saw you with him the other night at the opera . "" she laughed nervously as she spoke , and watched him with her vague forget - me - not eyes . she was a curious woman , whose dresses always looked as if they had been designed in a rage and put on in a tempest . she was usually in love with somebody , and , as her passion was never returned , she had kept all her illusions . she tried to look picturesque , but only succeeded in being untidy . her name was victoria , and she had a perfect mania for going to church .",105
"the young girl stopped , rather frightened perhaps to hear her name called after her on the high road . ten yards more , and i had joined her .",11
""" her name is sibyl vane . """,2
""" my name is briggs , a solicitor of --- street , london . """,2
"and mademoiselle -- what is your name ? """,6
""" no , by god ! i took care that none should hear of it -- or of her under that name . """,21
""" what is your name ? """,4
"i now inform you that she is my wife , whom i married fifteen years ago,--bertha mason by name ; sister of this resolute personage , who is now , with his quivering limbs and white cheeks , showing you what a stout heart men may bear .",18
"it is fortunate for you , although your name is bernajoux , to have only to deal with an apprentice musketeer . never mind ; be content , i will do my best .",8
""" you will , i am sure , excuse my presumption , dr . watson , "" said he , as he came panting up to where i stood . "" here on the moor we are homely folk and do not wait for formal introductions . you may possibly have heard my name from our mutual friend , mortimer . i am stapleton , of merripit house . """,53
"we went first to kongens - nye - torw , an irregular square in which are two innocent - looking guns , which need not alarm any one . close by , at no . 5 , there was a french "" restaurant , "" kept by a cook of the name of vincent , where we had an ample breakfast for four marks each ( 2_s _ . 4_d _ . ) .",51
"mr . eyre mentioned the intelligence ; for he knew that my client here was acquainted with a gentleman of the name of rochester . mr . mason , astonished and distressed as you may suppose , revealed the real state of matters .",21
"the worthy indian then gave some account of the victim , who , he said , was a celebrated beauty of the parsee race , and the daughter of a wealthy bombay merchant . she had received a thoroughly english education in that city , and , from her manners and intelligence , would be thought an european . her name was aouda . left an orphan , she was married against her will to the old rajah of bundelcund ; and , knowing the fate that awaited her , she escaped , was retaken , and devoted by the rajah 's relatives , who had an interest in her death , to the sacrifice from which it seemed she could not escape .",60
"how st . john received the news , i do n't know : he never answered the letter in which i communicated it : yet six months after he wrote to me , without , however , mentioning mr . rochester 's name or alluding to my marriage .",42
""" one minute , my friends , "" said the engineer . "" it seems to me it would be a good thing to give a name to this island , as well as to , the capes , promontories , and watercourses , which we can see .",26
""" you do n't know his name , though , "" said the lad harshly .",6
""" let us give them names , as the robinsons did , whose story herbert has often read to me ; providence bay , whale point , cape disappointment ! """,5
""" my name ! "" cried neb , showing his sparkling white teeth .",2
"we might give to that vast bay on the east the name of union bay , for example ; to that large hollow on the south , washington bay ; to the mountain upon which we are standing , that of mount franklin ; to that lake which is extended under our eyes , that of lake grant ; nothing could be better , my friends .",11
"the island was spread out under their eyes like a map , and they had only to give names to all its angles and points .",18
"first , they named the two bays and the mountain , union bay , washington bay , and mount franklin , as the engineer had suggested .",3
""" now , "" said the reporter , "" to this peninsula at the southwest of the island , i propose to give the name of serpentine peninsula , and that of reptile - end to the bent tail which terminates it , for it is just like a reptile 's tail . """,24
""" capital ! "" cried pencroft , "" and we can complete the resemblance by naming the two parts of the jaws mandible cape . """,15
""" there is only the point at the southeastern extremity of the island to be named , "" said pencroft .",15
"in truth , neb had found an excellent name , for this cape was very like the powerful claw of the fantastic animal which this singularly - shaped island represented .",8
"cyrus harding alone waited with his habitual patience , although his strong mind was exasperated at being confronted with such an inexplicable fact , and he was provoked at himself for allowing a feeling to which he could not give a name , to gain an influence over him .",41
""" no , no , "" said i. "" only a humble commoner , but his friend . my name is dr . watson . """,19
i will restore you to liberty this moment ; i will proclaim you a piece of immaculate virtue ; i will name you the lucretia of england . ’,21
"planchet , very proud of being raised to the dignity of landlord , thought he would make all ready , like an intelligent man ; and with this view called in the assistance of the lackey of one of his master ’s guests , named fourreau , and the false soldier who had tried to kill d’artagnan and who , belonging to no corps , had entered into the service of d’artagnan , or rather of planchet , after d’artagnan had saved his life .",44
""" i knew that barrymore walked about nights , and i had a mind to speak to him about it , "" said he . "" two or three times i have heard his steps in the passage , coming and going , just about the hour you name . """,48
""" she did not name madame de chevreuse , the duke of buckingham , or madame de vernet ? """,4
""" what , brother ! "" cried milady , "" must i name him again ? have you not yet divined who he is ? """,12
""" master is well aware , "" conseil replied , "" that i 'm not seasoned in practical application . when master has told me these animals ' names . . . """,28
"milady concealed her face in her hands , as if she could not endure the shame which this name recalled to her .",18
"bonacieux called a long time ; but as such cries , on account of their frequency , brought nobody in the rue des fossoyeurs , and as lately the mercer ’s house had a bad name , finding that nobody came , he went out continuing to call , his voice being heard fainter and fainter as he went in the direction of the rue du bac .",35
"the noble carriage of this gentleman , for whom he believed himself to be engaged , had won planchet -- that was the name of the picard . he felt a slight disappointment , however , when he saw that this place was already taken by a compeer named mousqueton , and when porthos signified to him that the state of his household , though great , would not support two servants , and that he must enter into the service of d’artagnan .",48
"the girl smiled . "" dorian , "" she answered , lingering over his name with long - drawn music in her voice , as though it were sweeter than honey to the red petals of her mouth . "" dorian , you should have understood . but you understand now , do n't you ? """,14
"mousqueton was a norman , whose pacific name of boniface his master had changed into the infinitely more sonorous name of mousqueton .",19
""" in my own name , sir ! """,4
""" ah , "" said he , "" here we are , at the last act of the tragedy . you see , felton , the drama has gone through all the phases i named ; but be easy , no blood will flow . """,34
"an envoy of the duke of buckingham , named montague , was taken , and proof was obtained of a league between the german empire , spain , england , and lorraine .",8
""" you have done too many foolish things during the last fortnight to be entitled to give yourself that name , dorian , "" answered lord henry with his sweet melancholy smile .",19
""" and the woman 's name ? """,5
""" i ca n't give you the name , sir , but i can give you the initials . her initials were l. l. """,7
"i asked where it was going : the driver named a place a long way off , and where i was sure mr . rochester had no connections .",9
""" exactly . she married an artist named lyons , who came sketching on the moor . he proved to be a blackguard and deserted her . the fault from what i hear may not have been entirely on one side . her father refused to have anything to do with her because she had married without his consent , and perhaps for one or two other reasons as well . so , between the old sinner and the young one the girl has had a pretty bad time . """,7
"dorian shook his head , and a look of annoyance passed over his face at the mention of the word "" inquest . "" there was something so crude and vulgar about everything of the kind . "" they do n't know my name , "" he answered .",43
""" only my christian name , and that i am quite sure she never mentioned to any one . she told me once that they were all rather curious to learn who i was , and that she invariably told them my name was prince charming . it was pretty of her . you must do me a drawing of sibyl , basil . i should like to have something more of her than the memory of a few kisses and some broken pathetic words . """,4
""" only my christian name , and that i am quite sure she never mentioned to any one . she told me once that they were all rather curious to learn who i was , and that she invariably told them my name was prince charming . it was pretty of her . you must do me a drawing of sibyl , basil . i should like to have something more of her than the memory of a few kisses and some broken pathetic words . """,42
""" look at sir charles 's death ! that was bad enough , for all that the coroner said . look at the noises on the moor at night . there 's not a man would cross it after sundown if he was paid for it . look at this stranger hiding out yonder , and watching and waiting ! what 's he waiting for ? what does it mean ? it means no good to anyone of the name of baskerville , and very glad i shall be to be quit of it all on the day that sir henry 's new servants are ready to take over the hall . """,79
""" and his name is ? """,3
""" each part of it , professor aronnax , came from a different spot on the globe and reached me at a cover address . its keel was forged by creusot in france , its propeller shaft by pen & co. in london , the sheet - iron plates for its hull by laird 's in liverpool , its propeller by scott 's in glasgow . its tanks were manufactured by cail & co. in paris , its engine by krupp in prussia , its spur by the motala workshops in sweden , its precision instruments by hart bros . in new york , etc . ; and each of these suppliers received my specifications under a different name . """,118
""" i think nothing ; i quote a fact , that is all . only i say that if i were named madame de montpensier , or the queen marie de medicis , i should use less precautions than i take , being simply called milady clarik . """,21
"he descended to the saloon . mr . fogg was not there . passepartout had only , however , to ask the purser the number of his master 's state - room . the purser replied that he did not know any passenger by the name of fogg .",45
""" it seemed to me that my sudden appearance might shake his nerves and lead him to say something unguarded . the boots volunteered to show me the room : it was on the second floor , and there was a small corridor leading up to it . the boots pointed out the door to me , and was about to go downstairs again when i saw something that made me feel sickish , in spite of my twenty years ' experience . from under the door there curled a little red ribbon of blood , which had meandered across the passage and formed a little pool along the skirting at the other side . i gave a cry , which brought the boots back . he nearly fainted when he saw it . the door was locked on the inside , but we put our shoulders to it , and knocked it in . the window of the room was open , and beside the window , all huddled up , lay the body of a man in his nightdress . he was quite dead , and had been for some time , for his limbs were rigid and cold . when we turned him over , the boots recognized him at once as being the same gentleman who had engaged the room under the name of joseph stangerson . the cause of death was a deep stab in the left side , which must have penetrated the heart . and now comes the strangest part of the affair . what do you suppose was above the murdered man ? """,226
""" your eminence is right , "" replied milady ; "" and i have been wrong in seeing in the mission with which you honor me anything but that which it really is -- that is , to announce to his grace , on the part of your eminence , that you are acquainted with the different disguises by means of which he succeeded in approaching the queen during the fete given by madame the constable ; that you have proofs of the interview granted at the louvre by the queen to a certain italian astrologer who was no other than the duke of buckingham ; that you have ordered a little romance of a satirical nature to be written upon the adventures of amiens , with a plan of the gardens in which those adventures took place , and portraits of the actors who figured in them ; that montague is in the bastille , and that the torture may make him say things he remembers , and even things he has forgotten ; that you possess a certain letter from madame de chevreuse , found in his grace ’s lodging , which singularly compromises not only her who wrote it , but her in whose name it was written .",207
""" in the first place , there is a little intrigante named bonacieux . """,11
""" they must interest you , dorian . every gentleman is interested in his good name . you do n't want people to talk of you as something vile and degraded . of course , you have your position , and your wealth , and all that kind of thing . but position and wealth are not everything . mind you , i do n't believe these rumours at all . at least , i ca n't believe them when i see you . sin is a thing that writes itself across a man 's face . it can not be concealed . people talk sometimes of secret vices . there are no such things . if a wretched man has a vice , it shows itself in the lines of his mouth , the droop of his eyelids , the moulding of his hands even .",15
""" safe and sound , as true as my name ’s jack butler . """,9
"the captain replied by ordering the necessary maneuvers , and toward seven o’clock in the morning the little vessel cast anchor in the bay that had been named .",27
"mr . gregson , who had listened to this address with considerable impatience , could contain himself no longer . "" look here , mr . sherlock holmes , "" he said , "" we are all ready to acknowledge that you are a smart man , and that you have your own methods of working . we want something more than mere theory and preaching now , though . it is a case of taking the man . i have made my case out , and it seems i was wrong . young charpentier could not have been engaged in this second affair . lestrade went after his man , stangerson , and it appears that he was wrong too . you have thrown out hints here , and hints there , and seem to know more than we do , but the time has come when we feel that we have a right to ask you straight how much you do know of the business . can you name the man who did it ? """,170
