text,ind
"the nautilus passed over these lush , luxuriant depths with tremendous speed . near evening it approached the falkland islands , whose rugged summits i recognized the next day . the sea was of moderate depth . so not without good reason , i assumed that these two islands , plus the many islets surrounding them , used to be part of the magellan coastline . the falkland islands were probably discovered by the famous navigator john davis , who gave them the name davis southern islands . later sir richard hawkins called them the maidenland , after the blessed virgin . subsequently , at the beginning of the 18th century , they were named the malouines by fishermen from saint - malo in brittany , then finally dubbed the falklands by the english , to whom they belong today .",114
"felton named lord de winter ; the unknown would not name anybody , and pretended that it was to the duke alone he would make himself known .",10
""" well , i am glad from my heart that you are here , for indeed the responsibility and the mystery were both becoming too much for my nerves . but how in the name of wonder did you come here , and what have you been doing ? i thought that you were in baker street working out that case of blackmailing . """,34
"passepartout did not change countenance on hearing this name . he thought that the time had not yet arrived to divulge to his master what had taken place between the detective and himself ; and , in the account he gave of his absence , he simply excused himself for having been overtaken by drunkenness , in smoking opium at a tavern in hong kong .",8
""" my lord , "" said felton , "" the baron de winter wrote to you the other day to request you to sign an order of embarkation relative to a young woman named charlotte backson . """,33
"there once more , through the panels opening into these caribbean waters ten meters below the surface of the waves , i found so many fascinating exhibits to describe in my daily notes ! among other zoophytes there were portuguese men - of - war known by the name physalia pelagica , like big , oblong bladders with a pearly sheen , spreading their membranes to the wind , letting their blue tentacles drift like silken threads ; to the eye delightful jellyfish , to the touch actual nettles that ooze a corrosive liquid . among the articulates there were annelid worms one and a half meters long , furnished with a pink proboscis , equipped with 1,700 organs of locomotion , snaking through the waters , and as they went , throwing off every gleam in the solar spectrum . from the fish branch there were manta rays , enormous cartilaginous fish ten feet long and weighing 600 pounds , their pectoral fin triangular , their midback slightly arched , their eyes attached to the edges of the face at the front of the head ; they floated like wreckage from a ship , sometimes fastening onto our windows like opaque shutters . there were american triggerfish for which nature has ground only black and white pigments , feather - shaped gobies that were long and plump with yellow fins and jutting jaws , sixteen - decimeter mackerel with short , sharp teeth , covered with small scales , and related to the albacore species . next came swarms of red mullet corseted in gold stripes from head to tail , their shining fins all aquiver , genuine masterpieces of jewelry , formerly sacred to the goddess diana , much in demand by rich romans , and about which the old saying goes : "" he who catches them does n't eat them ! "" finally , adorned with emerald ribbons and dressed in velvet and silk , golden angelfish passed before our eyes like courtiers in the paintings of veronese ; spurred gilthead stole by with their swift thoracic fins ; thread herring fifteen inches long were wrapped in their phosphorescent glimmers ; gray mullet thrashed the sea with their big fleshy tails ; red salmon seemed to mow the waves with their slicing pectorals ; and silver moonfish , worthy of their name , rose on the horizon of the waters like the whitish reflections of many moons .",395
""" that 's regrettable , "" conseil answered . "" i 'd like to come face to face with one of those devilfish i 've heard so much about , which can drag ships down into the depths . those beasts go by the name of krake-- """,44
""" my name is john ferrier , "" the wanderer explained ; "" me and that little un are all that 's left o ' twenty - one people . the rest is all dead o ' thirst and hunger away down in the south . """,2
""" well , conseil my friend , identify them ! start naming them ! "" ned land exclaimed .",11
""" because he so far forgot himself as to tell you a true piece of autobiography upon the occasion when he first met you , and i dare say he has many a time regretted it since . he was once a schoolmaster in the north of england . now , there is no one more easy to trace than a schoolmaster . there are scholastic agencies by which one may identify any man who has been in the profession . a little investigation showed me that a school had come to grief under atrocious circumstances , and that the man who had owned it -- the name was different -- had disappeared with his wife . the descriptions agreed . when i learned that the missing man was devoted to entomology the identification was complete . """,107
"the name of nauvoo evidently recalled recollections to john ferrier . "" i see , "" he said , "" you are the mormons . """,1
"i felt i could speak , and i answered--""my name is jane elliott . """,9
""" an indisputable event , my gallant ned . accordingly , people have proposed naming this devilfish bouguer 's squid . """,14
""" yes ; by a lackey named lubin . """,6
""" yes , "" said dorian . "" and i am afraid , francis , that i have another errand for you . what is the name of the man at richmond who supplies selby with orchids ? """,26
"the confidence with which d’artagnan spoke convinced patrick , which was the name of this minister of the minister .",12
in twenty minutes they were on the spot named .,8
""" the name , then , of that gentleman , is mr . st . john rivers ? """,2
""" aye ; st . john is like his kirstened name . """,10
""" then to yours , monsieur -- what is your name ? """,10
""" to yours , my gentlemen ! what is your name , in your turn , if you please ? """,10
"for five days he toiled footsore and weary through the defiles which he had already traversed on horseback . at night he flung himself down among the rocks , and snatched a few hours of sleep ; but before daybreak he was always well on his way . on the sixth day , he reached the eagle cañon , from which they had commenced their ill - fated flight . thence he could look down upon the home of the saints . worn and exhausted , he leaned upon his rifle and shook his gaunt hand fiercely at the silent widespread city beneath him . as he looked at it , he observed that there were flags in some of the principal streets , and other signs of festivity . he was still speculating as to what this might mean when he heard the clatter of horse 's hoofs , and saw a mounted man riding towards him . as he approached , he recognized him as a mormon named cowper , to whom he had rendered services at different times . he therefore accosted him when he got up to him , with the object of finding out what lucy ferrier 's fate had been .",169
"passepartout found that he could not avoid telling his master what had occurred , and , with hanging head , he was turning towards the car , when the engineer , a true yankee , named forster called out , "" gentlemen , perhaps there is a way , after all , to get over . """,35
""" do you know the names ? """,5
"i assented gladly , and we all descended together . our prisoner made no attempt at escape , but stepped calmly into the cab which had been his , and we followed him . lestrade mounted the box , whipped up the horse , and brought us in a very short time to our destination . we were ushered into a small chamber where a police inspector noted down our prisoner 's name and the names of the men with whose murder he had been charged . the official was a white - faced unemotional man , who went through his duties in a dull mechanical way . "" the prisoner will be put before the magistrates in the course of the week , "" he said ; "" in the mean time , mr . jefferson hope , have you anything that you wish to say ? i must warn you that your words will be taken down , and may be used against you . """,72
"i assented gladly , and we all descended together . our prisoner made no attempt at escape , but stepped calmly into the cab which had been his , and we followed him . lestrade mounted the box , whipped up the horse , and brought us in a very short time to our destination . we were ushered into a small chamber where a police inspector noted down our prisoner 's name and the names of the men with whose murder he had been charged . the official was a white - faced unemotional man , who went through his duties in a dull mechanical way . "" the prisoner will be put before the magistrates in the course of the week , "" he said ; "" in the mean time , mr . jefferson hope , have you anything that you wish to say ? i must warn you that your words will be taken down , and may be used against you . """,75
""" but after all , "" said lord de winter , when the three friends had been named , "" we do not know who you are . we can not fight with such names ; they are names of shepherds . """,17
""" you played very willingly with us without knowing our names , "" said athos , "" by the same token that you won our horses . """,10
""" having left the house , i proceeded to do what gregson had neglected . i telegraphed to the head of the police at cleveland , limiting my enquiry to the circumstances connected with the marriage of enoch drebber . the answer was conclusive . it told me that drebber had already applied for the protection of the law against an old rival in love , named jefferson hope , and that this same hope was at present in europe . i knew now that i held the clue to the mystery in my hand , and all that remained was to secure the murderer .",66
""" if he had been one there was no reason to believe that he had ceased to be . on the contrary , from his point of view , any sudden change would be likely to draw attention to himself . he would , probably , for a time at least , continue to perform his duties . there was no reason to suppose that he was going under an assumed name . why should he change his name in a country where no one knew his original one ? i therefore organized my street arab detective corps , and sent them systematically to every cab proprietor in london until they ferreted out the man that i wanted . how well they succeeded , and how quickly i took advantage of it , are still fresh in your recollection . the murder of stangerson was an incident which was entirely unexpected , but which could hardly in any case have been prevented . through it , as you know , i came into possession of the pills , the existence of which i had already surmised . you see the whole thing is a chain of logical sequences without a break or flaw . """,78
""" the name of the place where , and of the person with whom i lived , is my secret , "" i replied concisely .",2
""" you will take this train to town , cartwright . the moment you arrive you will send a wire to sir henry baskerville , in my name , to say that if he finds the pocket - book which i have dropped he is to send it by registered post to baker street . """,27
i gave an involuntary half start at hearing the _ alias _ : i had forgotten my new name .,18
"it was not a lamantin , but one of that species of the order of cetaceans , which bear the name of the "" dugong , "" for its nostrils were open at the upper part of its snout .",20
""" you said your name was jane elliott ? "" he observed .",4
"name to me such of your workmen as you need , and point out the tools they must bring . "" the goldsmith knew the duke .",0
"as to the goldsmith , he wrote to his wife , sending her the order for the thousand pistoles , and charging her to send him , in exchange , his most skillful apprentice , an assortment of diamonds , of which he gave the names and the weight , and the necessary tools .",45
""" ah , his name ? i do not know that . """,4
"by december 15 we had left the alluring society islands in the west , likewise elegant tahiti , queen of the pacific . in the morning i spotted this island 's lofty summits a few miles to leeward . its waters supplied excellent fish for the tables on board : mackerel , bonito , albacore , and a few varieties of that sea serpent named the moray eel .",64
this name was magic ! it was the name of those islets where vessels under the count de la pérouse had miscarried . i straightened suddenly .,1
""" but i do n't want to be rechristened , harry , "" rejoined the duchess , looking up at him with her wonderful eyes . "" i am quite satisfied with my own name , and i am sure mr . gray should be satisfied with his . """,34
""" my dear gladys , i would not alter either name for the world . they are both perfect . i was thinking chiefly of flowers . yesterday i cut an orchid , for my button - hole . it was a marvellous spotted thing , as effective as the seven deadly sins . in a thoughtless moment i asked one of the gardeners what it was called . he told me it was a fine specimen of robinsoniana , or something dreadful of that kind . it is a sad truth , but we have lost the faculty of giving lovely names to things . names are everything . i never quarrel with actions . my one quarrel is with words . that is the reason i hate vulgar realism in literature . the man who could call a spade a spade should be compelled to use one . it is the only thing he is fit for . """,10
""" my dear gladys , i would not alter either name for the world . they are both perfect . i was thinking chiefly of flowers . yesterday i cut an orchid , for my button - hole . it was a marvellous spotted thing , as effective as the seven deadly sins . in a thoughtless moment i asked one of the gardeners what it was called . he told me it was a fine specimen of robinsoniana , or something dreadful of that kind . it is a sad truth , but we have lost the faculty of giving lovely names to things . names are everything . i never quarrel with actions . my one quarrel is with words . that is the reason i hate vulgar realism in literature . the man who could call a spade a spade should be compelled to use one . it is the only thing he is fit for . """,102
""" my dear gladys , i would not alter either name for the world . they are both perfect . i was thinking chiefly of flowers . yesterday i cut an orchid , for my button - hole . it was a marvellous spotted thing , as effective as the seven deadly sins . in a thoughtless moment i asked one of the gardeners what it was called . he told me it was a fine specimen of robinsoniana , or something dreadful of that kind . it is a sad truth , but we have lost the faculty of giving lovely names to things . names are everything . i never quarrel with actions . my one quarrel is with words . that is the reason i hate vulgar realism in literature . the man who could call a spade a spade should be compelled to use one . it is the only thing he is fit for . """,106
""" my lord , i have not named her ! "" interrupted the young man , warmly .",7
""" his name is prince paradox , "" said dorian .",2
"dillon returned to calcutta . there he was able to interest the asiatic society and the east india company in his discovery . a ship named after the search was placed at his disposal , and he departed on january 23 , 1827 , accompanied by a french deputy .",25
""" the name of that port ? """,2
"so captain dumont d'urville had put to sea in command of a vessel named after the astrolabe , and just two months after dillon had left vanikoro , dumont d'urville dropped anchor before hobart . there he heard about dillon 's findings , and he further learned that a certain james hobbs , chief officer on the union out of calcutta , had put to shore on an island located in latitude 8 degrees 18 ' south and longitude 156 degrees 30 ' east , and had noted the natives of those waterways making use of iron bars and red fabrics .",13
"opposite the tower of london he found the vessel that had been named to him , delivered his letter to the captain , who after having it examined by the governor of the port made immediate preparations to sail .",12
""" my inquiries show beyond all question that the family portrait did not lie , and that this fellow was indeed a baskerville . he was a son of that rodger baskerville , the younger brother of sir charles , who fled with a sinister reputation to south america , where he was said to have died unmarried . he did , as a matter of fact , marry , and had one child , this fellow , whose real name is the same as his father 's . he married beryl garcia , one of the beauties of costa rica , and , having purloined a considerable sum of public money , he changed his name to vandeleur and fled to england , where he established a school in the east of yorkshire . his reason for attempting this special line of business was that he had struck up an acquaintance with a consumptive tutor upon the voyage home , and that he had used this man 's ability to make the undertaking a success . fraser , the tutor , died however , and the school which had begun well sank from disrepute into infamy . the vandeleurs found it convenient to change their name to stapleton , and he brought the remains of his fortune , his schemes for the future , and his taste for entomology to the south of england . i learned at the british museum that he was a recognized authority upon the subject , and that the name of vandeleur has been permanently attached to a certain moth which he had , in his yorkshire days , been the first to describe .",116
""" my inquiries show beyond all question that the family portrait did not lie , and that this fellow was indeed a baskerville . he was a son of that rodger baskerville , the younger brother of sir charles , who fled with a sinister reputation to south america , where he was said to have died unmarried . he did , as a matter of fact , marry , and had one child , this fellow , whose real name is the same as his father 's . he married beryl garcia , one of the beauties of costa rica , and , having purloined a considerable sum of public money , he changed his name to vandeleur and fled to england , where he established a school in the east of yorkshire . his reason for attempting this special line of business was that he had struck up an acquaintance with a consumptive tutor upon the voyage home , and that he had used this man 's ability to make the undertaking a success . fraser , the tutor , died however , and the school which had begun well sank from disrepute into infamy . the vandeleurs found it convenient to change their name to stapleton , and he brought the remains of his fortune , his schemes for the future , and his taste for entomology to the south of england . i learned at the british museum that he was a recognized authority upon the subject , and that the name of vandeleur has been permanently attached to a certain moth which he had , in his yorkshire days , been the first to describe .",206
""" my inquiries show beyond all question that the family portrait did not lie , and that this fellow was indeed a baskerville . he was a son of that rodger baskerville , the younger brother of sir charles , who fled with a sinister reputation to south america , where he was said to have died unmarried . he did , as a matter of fact , marry , and had one child , this fellow , whose real name is the same as his father 's . he married beryl garcia , one of the beauties of costa rica , and , having purloined a considerable sum of public money , he changed his name to vandeleur and fled to england , where he established a school in the east of yorkshire . his reason for attempting this special line of business was that he had struck up an acquaintance with a consumptive tutor upon the voyage home , and that he had used this man 's ability to make the undertaking a success . fraser , the tutor , died however , and the school which had begun well sank from disrepute into infamy . the vandeleurs found it convenient to change their name to stapleton , and he brought the remains of his fortune , his schemes for the future , and his taste for entomology to the south of england . i learned at the british museum that he was a recognized authority upon the subject , and that the name of vandeleur has been permanently attached to a certain moth which he had , in his yorkshire days , been the first to describe .",255
"at ten o’clock in the morning the sieur de la coste , ensign in the king ’s guards , followed by two officers and several archers of that body , came to the city registrar , named clement , and demanded of him all the keys of the rooms and offices of the hotel .",36
""" name a few of those whom you know , and you will see if they are my friends . """,1
"the novice let her speak , then seeing that she paused , she said , "" do n’t you know a gentleman named athos ? """,22
". . . . i put my ear to the wall , and as soon as the name ' axel ' came i immediately replied "" axel , "" then waited .",17
"his name was nebuchadnezzar , but he only answered to the familiar abbreviation of neb .",1
the maelstrom ! could a more frightening name have rung in our ears under more frightening circumstances ? were we lying in the dangerous waterways off the norwegian coast ? was the nautilus being dragged into this whirlpool just as the skiff was about to detach from its plating ?,7
"but what happened to the nautilus ? did it withstand the maelstrom 's clutches ? is captain nemo alive ? is he still under the ocean pursuing his frightful program of revenge , or did he stop after that latest mass execution ? will the waves someday deliver that manuscript that contains his full life story ? will i finally learn the man 's name ? will the nationality of the stricken warship tell us the nationality of captain nemo ?",64
""" oh , i only came home from s- "" ( she mentioned the name of a large town some twenty miles distant ) "" this afternoon .",14
""" how could you be aware of the existence of lincoln island ? "" inquired cyrus harding , "" it is not even named in the charts . """,23
"a river there was called the mercy , a mountain took the name of mount franklin , a small lake was named lake grant , and the forests became the forests of the far west .",21
""" what is her brother - in - law ’s name ? """,10
""" yes , "" my uncle replied , "" the liedenbrock sea ; and i do n't suppose any other discoverer will ever dispute my claim to name it after myself as its first discoverer . """,27
"there , to conclude , all were happy , united in the present as they had been in the past ; but never could they forget that island upon which they had arrived poor and friendless , that island which , during four years had supplied all their wants , and of which there remained but a fragment of granite washed by the waves of the pacific , the tomb of him who had borne the name of captain nemo .",76
"his face was the true index of his mind . he had a solid judgment joined to the most unaffected simplicity ; and hence , i presume , he had his name of candide .",31
""" i arrest you in the queen 's name ! """,8
""" some money , sir -- not much , and a six - shooter . there was no name of any kind . a decent - looking man , sir , but rough - like . a sort of sailor we think . """,18
"i had rushed upon these remains , formed of indestructible phosphates of lime , and without hesitation i named these monstrous bones , which lay scattered about like decayed trunks of trees .",18
"this bird belonged to the finest of the eight species credited to papua and its neighboring islands . it was a "" great emerald , "" one of the rarest birds of paradise . it measured three decimeters long . its head was comparatively small , and its eyes , placed near the opening of its beak , were also small . but it offered a wonderful mixture of hues : a yellow beak , brown feet and claws , hazel wings with purple tips , pale yellow head and scruff of the neck , emerald throat , the belly and chest maroon to brown . two strands , made of a horn substance covered with down , rose over its tail , which was lengthened by long , very light feathers of wonderful fineness , and they completed the costume of this marvelous bird that the islanders have poetically named "" the sun bird . """,150
""" however that may be , "" said the sailor , "" as sure as my name is bonadventure pencroft , of the vineyard , our ' bonadventure ' has sailed without us ! """,16
""" what are their names ? """,4
"at the moment of leaving the harbour , my uncle , who was tenaciously fond of naming his new discoveries , wanted to give it a name , and proposed mine amongst others .",16
""" his name is mason , sir ; and he comes from the west indies ; from spanish town , in jamaica , i think . """,2
