text,ind,sense,label
"your mysterious young friend , whose name you have never told me , but whose picture really fascinates me , never thinks . i feel quite sure of that . he is some brainless beautiful creature who should be always here in winter when we have no flowers to look at , and always here in summer when we want something to chill our intelligence . do n't flatter yourself , basil : you are not in the least like him . """,20,"('never', 'jamais', 'nunca')",0
""" oh , i ca n't explain . when i like people immensely , i never tell their names to any one . it is like surrendering a part of them . i have grown to love secrecy . it seems to be the one thing that can make modern life mysterious or marvellous to us . the commonest thing is delightful if one only hides it . when i leave town now i never tell my people where i am going . if i did , i would lose all my pleasure . it is a silly habit , i dare say , but somehow it seems to bring a great deal of romance into one 's life . i suppose you think me awfully foolish about it ? """,15,"('never', 'ne', 'nunca')",1
""" oh , i ca n't explain . when i like people immensely , i never tell their names to any one . it is like surrendering a part of them . i have grown to love secrecy . it seems to be the one thing that can make modern life mysterious or marvellous to us . the commonest thing is delightful if one only hides it . when i leave town now i never tell my people where i am going . if i did , i would lose all my pleasure . it is a silly habit , i dare say , but somehow it seems to bring a great deal of romance into one 's life . i suppose you think me awfully foolish about it ? """,74,"('never', 'ne', 'nunca')",1
""" i hate the way you talk about your married life , harry , "" said basil hallward , strolling towards the door that led into the garden . "" i believe that you are really a very good husband , but that you are thoroughly ashamed of your own virtues . you are an extraordinary fellow . you never say a moral thing , and you never do a wrong thing . your cynicism is simply a pose . """,59,"('never', 'ne', 'nunca')",1
""" i hate the way you talk about your married life , harry , "" said basil hallward , strolling towards the door that led into the garden . "" i believe that you are really a very good husband , but that you are thoroughly ashamed of your own virtues . you are an extraordinary fellow . you never say a moral thing , and you never do a wrong thing . your cynicism is simply a pose . """,67,"('never', 'ne', 'nunca')",1
""" never ! """,1,"('never', 'jamais', 'nunca')",0
