text,ind,sense,label
""" i am afraid i never shall do that . """,5,"('never', 'jamais', 'nunca')",0
"your rescue , the case stranded on the sand , top 's adventure , and lastly this bottle ... shall we never have the answer to these enigmas ? """,21,"('never', 'jamais', 'nunca')",0
"hallward got up from the seat and walked up and down the garden . after some time he came back . "" harry , "" he said , "" dorian gray is to me simply a motive in art . you might see nothing in him . i see everything in him . he is never more present in my work than when no image of him is there . he is a suggestion , as i have said , of a new manner . i find him in the curves of certain lines , in the loveliness and subtleties of certain colours . that is all . """,55,"('never', 'jamais', 'nunca')",0
""" because , without intending it , i have put into it some expression of all this curious artistic idolatry , of which , of course , i have never cared to speak to him . he knows nothing about it . he shall never know anything about it . but the world might guess it , and i will not bare my soul to their shallow prying eyes . my heart shall never be put under their microscope . there is too much of myself in the thing , harry -- too much of myself ! """,29,"('never', 'jamais', 'nunca')",0
"he was so exact that he was never in a hurry , was always ready , and was economical alike of his steps and his motions . he never took one step too many , and always went to his destination by the shortest cut ; he made no superfluous gestures , and was never seen to be moved or agitated . he was the most deliberate person in the world , yet always reached his destination at the exact moment . he lived alone , and , so to speak , outside of every social relation ; and as he knew that in this world account must be taken of friction , and that friction retards , he never rubbed against anybody .",7,"('never', 'jamais', 'nunca')",0
"he was so exact that he was never in a hurry , was always ready , and was economical alike of his steps and his motions . he never took one step too many , and always went to his destination by the shortest cut ; he made no superfluous gestures , and was never seen to be moved or agitated . he was the most deliberate person in the world , yet always reached his destination at the exact moment . he lived alone , and , so to speak , outside of every social relation ; and as he knew that in this world account must be taken of friction , and that friction retards , he never rubbed against anybody .",28,"('never', 'ne', 'nunca')",1
"he was so exact that he was never in a hurry , was always ready , and was economical alike of his steps and his motions . he never took one step too many , and always went to his destination by the shortest cut ; he made no superfluous gestures , and was never seen to be moved or agitated . he was the most deliberate person in the world , yet always reached his destination at the exact moment . he lived alone , and , so to speak , outside of every social relation ; and as he knew that in this world account must be taken of friction , and that friction retards , he never rubbed against anybody .",54,"('never', 'jamais', 'jamás')",2
""" this ring would certainly only recall very bitter remembrances ; then we shall never be masters of three hundred pistoles to redeem it , so that we really should lose two hundred pistoles by the bargain .",14,"('never', 'jamais', 'nunca')",0
""" stay , harry , to oblige dorian , and to oblige me , "" said hallward , gazing intently at his picture . "" it is quite true , i never talk when i am working , and never listen either , and it must be dreadfully tedious for my unfortunate sitters . i beg you to stay . """,31,"('never', 'ne', 'nunca')",1
"people are afraid of themselves , nowadays . they have forgotten the highest of all duties , the duty that one owes to one 's self . of course , they are charitable . they feed the hungry and clothe the beggar . but their own souls starve , and are naked . courage has gone out of our race . perhaps we never really had it . the terror of society , which is the basis of morals , the terror of god , which is the secret of religion -- these are the two things that govern us . and yet-- """,63,"('never', 'jamais', 'nunca')",0
""" ah ! this is practical -- this is real ! "" he cried : "" i should never dream that .",18,"('never', 'jamais', 'nunca')",0
""" certainly , harry . just touch the bell , and when parker comes i will tell him what you want . i have got to work up this background , so i will join you later on . do n't keep dorian too long . i have never been in better form for painting than i am to - day . this is going to be my masterpiece . it is my masterpiece as it stands . """,48,"('never', 'jamais', 'nunca')",0
""" i never lie , madame . """,2,"('never', 'ne', 'nunca')",1
"to be sure , i had confidence in this devoted lad . ordinarily , i never asked whether or not it suited him to go with me on my journeys ; but this time an expedition was at issue that could drag on indefinitely , a hazardous undertaking whose purpose was to hunt an animal that could sink a frigate as easily as a walnut shell ! there was good reason to stop and think , even for the world 's most emotionless man . what would conseil say ?",15,"('never', 'ne', 'nunca')",1
""" well , i seem to have come into an inheritance with a vengeance , "" said he when the long narrative was finished . "" of course , i 've heard of the hound ever since i was in the nursery . it 's the pet story of the family , though i never thought of taking it seriously before . but as to my uncle 's death -- well , it all seems boiling up in my head , and i ca n't get it clear yet . you do n't seem quite to have made up your mind whether it 's a case for a policeman or a clergyman . """,54,"('never', 'jamais', 'nunca')",0
""" never ? "" cried the reporter .",1,"('never', 'jamais', 'nunca')",0
""" you say ' never , ' my dear cyrus ? """,4,"('never', 'jamais', 'nunca')",0
""" i never take supper . """,2,"('never', 'ne', 'nunca')",1
""" doubtless ! are you not aware that we are never seen one without the others , and that we are called among the musketeers and the guards , at court and in the city , athos , porthos , and aramis , or the three inseparables ?",10,"('never', 'jamais', 'jamás')",2
""" no , but i thought you would never come . i could not bear to wait in the house for you , especially with this rain and wind . """,8,"('never', 'jamais', 'nunca')",0
"hallward turned pale and caught his hand . "" dorian ! dorian ! "" he cried , "" do n't talk like that . i have never had such a friend as you , and i shall never have such another . you are not jealous of material things , are you?-- you who are finer than any of them ! """,37,"('never', 'jamais', 'nunca')",0
""" what ! i make the first advances ? "" said the king . "" never ! """,15,"('never', 'jamais', 'jamás')",2
"she placed herself before the glass , and regarded herself attentively ; never had she appeared more beautiful .",12,"('never', 'jamais', 'jamás')",2
""" if you let any one have it but me , basil , i shall never forgive you ! "" cried dorian gray ; "" and i do n't allow people to call me a silly boy . """,15,"('never', 'jamais', 'nunca')",0
"milady trembled ; she thought felton had told all . perhaps never in her life had this woman , who had experienced so many opposite and powerful emotions , felt her heart beat so violently .",11,"('never', 'jamais', 'nunca')",0
""" yes , "" murmured lord henry , settling his button - hole in his coat ; "" and when they grow older they know it . but i do n't want money . it is only people who pay their bills who want that , uncle george , and i never pay mine . credit is the capital of a younger son , and one lives charmingly upon it . besides , i always deal with dartmoor 's tradesmen , and consequently they never bother me . what i want is information : not useful information , of course ; useless information . """,51,"('never', 'ne', 'nunca')",1
""" yes , "" murmured lord henry , settling his button - hole in his coat ; "" and when they grow older they know it . but i do n't want money . it is only people who pay their bills who want that , uncle george , and i never pay mine . credit is the capital of a younger son , and one lives charmingly upon it . besides , i always deal with dartmoor 's tradesmen , and consequently they never bother me . what i want is information : not useful information , of course ; useless information . """,84,"('never', 'jamais', 'nunca')",0
"they said kelso got some rascally adventurer , some belgian brute , to insult his son- in - law in public -- paid him , sir , to do it , paid him-- and that the fellow spitted his man as if he had been a pigeon . the thing was hushed up , but , egad , kelso ate his chop alone at the club for some time afterwards . he brought his daughter back with him , i was told , and she never spoke to him again . oh , yes ; it was a bad business . the girl died , too , died within a year . so she left a son , did she ? i had forgotten that . what sort of boy is he ? if he is like his mother , he must be a good - looking chap . """,85,"('never', 'jamais', 'nunca')",0
"surely he was not going out , to shut us in again ! no , never !",15,"('never', 'jamais', 'nunca')",0
"the professor stared at me over his spectacles ; no doubt he saw something unusual in the expression of my countenance ; for he laid hold of my arm , and speechlessly questioned me with his eyes . yes , never was a question more forcibly put .",40,"('never', 'jamais', 'jamás')",2
""" fearful and ghastly to me -- oh , sir , i never saw a face like it !",12,"('never', 'jamais', 'nunca')",0
""" i may say , pencroft , that the bark of the bamboo , cut into flexible laths , is used for making baskets ; that this bark , mashed into a paste , is used for the manufacture of chinese paper ; that the stalks furnish , according to their size , canes and pipes and are used for conducting water ; that large bamboos make excellent material for building , being light and strong , and being never attacked by insects .",79,"('never', 'jamais', 'nunca')",0
""" i regulate my watch ? never ! """,6,"('never', 'jamais', 'jamás')",2
""" do n't mind him , my dear , "" whispered lady agatha . "" he never means anything that he says . """,16,"('never', 'jamais', 'nunca')",0
""" i wish to goodness it never had been discovered at all ! "" she exclaimed . "" really , our girls have no chance nowadays . it is most unfair . """,6,"('never', 'ne', 'nunca')",1
""" dear me ! "" said lady agatha , "" how you men argue ! i am sure i never can make out what you are talking about . oh ! harry , i am quite vexed with you . why do you try to persuade our nice mr . dorian gray to give up the east end ? i assure you he would be quite invaluable . they would love his playing . """,19,"('never', 'jamais', 'nunca')",0
""" well , in the first place , i wish to ask what are this jokul , this sneffels , and this scartaris , names which i have never heard before ? """,28,"('never', 'jamais', 'nunca')",0
""" often , sir , but never a whale like this , whose sighting earned me $ 2,000.00 . """,6,"('never', 'jamais', 'nunca')",0
""" i got a message from the head office that a gent at this address had been inquiring for 2704 , "" said he . "" i 've driven my cab this seven years and never a word of complaint . i came here straight from the yard to ask you to your face what you had against me . """,35,"('never', 'jamais', 'nunca')",0
"there , a mile and a half from the frigate , a long blackish body emerged a meter above the waves . quivering violently , its tail was creating a considerable eddy . never had caudal equipment thrashed the sea with such power . an immense wake of glowing whiteness marked the animal 's track , sweeping in a long curve .",33,"('never', 'jamais', 'jamás')",2
"long as we have been parted , hot tears as i have wept over our separation , i never thought that while i was mourning her , she was loving another !",18,"('never', 'jamais', 'nunca')",0
"this chase dragged on for about three - quarters of an hour without the frigate gaining two fathoms on the cetacean . at this rate , it was obvious that we would never catch up with it .",32,"('never', 'jamais', 'nunca')",0
""" but i never see your master on deck . """,3,"('never', 'jamais', 'nunca')",0
""" never ; he has n't the least curiosity . """,1,"('never', 'jamais', 'nunca')",0
"i attach a print of the positive . in it you can view these primordial rocks that have never seen the light of day , this nether granite that forms the powerful foundation of our globe , the deep caves cut into the stony mass , the outlines of incomparable distinctness whose far edges stand out in black as if from the brush of certain flemish painters . in the distance is a mountainous horizon , a wondrously undulating line that makes up the background of this landscape . the general effect of these smooth rocks is indescribable : black , polished , without moss or other blemish , carved into strange shapes , sitting firmly on a carpet of sand that sparkled beneath our streams of electric light .",18,"('never', 'jamais', 'jamás')",2
never have i seen my friend more completely taken aback than by the cabman 's reply . for an instant he sat in silent amazement . then he burst into a hearty laugh .,0,"('never', 'jamais', 'nunca')",0
""" well , eighteen , then . and i saw you with him the other night at the opera . "" she laughed nervously as she spoke , and watched him with her vague forget - me - not eyes . she was a curious woman , whose dresses always looked as if they had been designed in a rage and put on in a tempest . she was usually in love with somebody , and , as her passion was never returned , she had kept all her illusions . she tried to look picturesque , but only succeeded in being untidy . her name was victoria , and she had a perfect mania for going to church .",81,"('never', 'jamais', 'nunca')",0
"nothing can be done to prevent that , and men , pencroft , however learned they may be , can never change anything of the cosmographical order established by god himself . """,20,"('never', 'jamais', 'jamás')",2
"dorian smiled and shook his head : "" i am afraid i do n't think so , lady henry . i never talk during music -- at least , during good music . if one hears bad music , it is one 's duty to drown it in conversation . """,21,"('never', 'ne', 'nunca')",1
"of course i did not -- i had never heard of him before ; but the old lady seemed to regard his existence as a universally understood fact , with which everybody must be acquainted by instinct .",8,"('never', 'jamais', 'jamás')",2
"not at all . i am dead drunk , that ’s all , and never did a man more strongly set about getting so . by the lord , my good host !",14,"('never', 'jamais', 'jamás')",2
"the present mr . rochester 's mother was a fairfax , and second cousin to my husband : but i never presume on the connection -- in fact , it is nothing to me ; i consider myself quite in the light of an ordinary housekeeper : my employer is always civil , and i expect nothing more . """,20,"('never', 'jamais', 'nunca')",0
"by then i thought our expedition had come to an end , that we would never see this fantastic animal again . i was mistaken .",15,"('never', 'jamais', 'nunca')",0
"but could he be sure that this was all that was to be said about this enigma , and that he should never arrive at a solution ?",22,"('never', 'jamais', 'jamás')",2
"athos invited d’artagnan to follow them ; and although ignorant of the game , which he had never played , he accepted , not knowing what to do with his time from nine o’clock in the morning , as it then scarcely was , till twelve .",17,"('never', 'jamais', 'nunca')",0
""" you 've never fished these seas , ned ? """,3,"('never', 'jamais', 'nunca')",0
""" i 've been over a good part of the world since i left it , dr . watson , "" said he ; "" but i have never seen a place to compare with it . """,28,"('never', 'jamais', 'nunca')",0
""" which means , "" the canadian went on , "" since i 've never fished these waterways , i do n't know the whales that frequent them ? """,14,"('never', 'jamais', 'nunca')",0
""" at thornfield hall ! "" ejaculated the clergyman . "" impossible ! i am an old resident in this neighbourhood , sir , and i never heard of a mrs . rochester at thornfield hall . """,26,"('never', 'jamais', 'jamás')",2
""" what a beautiful room ! "" i exclaimed , as i looked round ; for i had never before seen any half so imposing .",18,"('never', 'jamais', 'nunca')",0
""" i feel that also , sir , and so does my wife . but to tell the truth , sir , we were both very much attached to sir charles , and his death gave us a shock and made these surroundings very painful to us . i fear that we shall never again be easy in our minds at baskerville hall . """,53,"('never', 'jamais', 'nunca')",0
""" that is the reason , i suppose , that you never dine with me now . i thought you must have some curious romance on hand . you have ; but it is not quite what i expected . """,11,"('never', 'jamais', 'nunca')",0
"never would they abandon this colony , founded with so much labor and with such success , and to which a communication with america would afford a fresh impetus .",0,"('never', 'jamais', 'jamás')",2
""" of death , perhaps , "" muttered back passepartout , "" but of love -- that ugly old hag ? never ! """,21,"('never', 'jamais', 'nunca')",0
""" leave master behind ? "" he replied . "" never ! i 'll drown before he does ! """,10,"('never', 'jamais', 'nunca')",0
"the access to these hunting - grounds was easy ; besides , whether they reached them by the road to port balloon , after having passed the mercy bridge , or by turning the rocks from flotsam point , the hunters were never distant from granite house more than two or three miles .",42,"('never', 'jamais', 'nunca')",0
my ideas are never so clear as when i have had plenty of wine .,3,"('never', 'jamais', 'nunca')",0
""" you always say trifles , my dear athos ! "" said d’artagnan , "" and that come very ill from you , who have never loved . """,25,"('never', 'jamais', 'nunca')",0
""" that ’s true , "" said he , quietly , "" for my part i have never loved . """,17,"('never', 'jamais', 'nunca')",0
""" except you , athos , who never had one . """,7,"('never', 'jamais', 'nunca')",0
"ah , monsieur bonacieux , i never did love you much , but now it is worse than ever . i hate you , and on my word you shall pay for this ! """,6,"('never', 'ne', 'nunca')",1
""" that ’s true , "" said athos , after a moment ’s silence , "" that ’s true ! i never had one !",21,"('never', 'jamais', 'nunca')",0
""" it is a wonderful place , the moor , "" said he , looking round over the undulating downs , long green rollers , with crests of jagged granite foaming up into fantastic surges . "" you never tire of the moor . you can not think the wonderful secrets which it contains . it is so vast , and so barren , and so mysterious . """,38,"('never', 'jamais', 'nunca')",0
i had hardly ever seen a handsome youth ; never in my life spoken to one .,9,"('never', 'jamais', 'nunca')",0
""" the peasants say it is the hound of the baskervilles calling for its prey . i 've heard it once or twice before , but never quite so loud . """,26,"('never', 'jamais', 'nunca')",0
""" since you have lost sight of that woman and she is now in safety in the convent , which you should never have allowed her to reach , try , at least , not to miss the man . if you do , you know that my hand stretches far , and that you shall pay very dearly for the hundred louis you have from me . """,22,"('never', 'jamais', 'nunca')",0
""" i can not explain . "" she spoke in a low , eager voice , with a curious lisp in her utterance . "" but for god 's sake do what i ask you . go back and never set foot upon the moor again . """,39,"('never', 'jamais', 'nunca')",0
""" no , sir , "" he answered me , "" but we 'll discover it together . where others have failed , i 'll succeed . never before has my nautilus cruised so far into these southernmost seas , but i repeat : it will go farther still . """,27,"('never', 'jamais', 'nunca')",0
""" oh , do n't be so serious , jim . you are like one of the heroes of those silly melodramas mother used to be so fond of acting in . i am not going to quarrel with you . i have seen him , and oh ! to see him is perfect happiness . we wo n't quarrel . i know you would never harm any one i love , would you ? """,65,"('never', 'jamais', 'nunca')",0
""" i had a school , "" said stapleton . "" it was in the north country . the work to a man of my temperament was mechanical and uninteresting , but the privilege of living with youth , of helping to mould those young minds , and of impressing them with one 's own character and ideals , was very dear to me . however , the fates were against us . a serious epidemic broke out in the school and three of the boys died . it never recovered from the blow , and much of my capital was irretrievably swallowed up . and yet , if it were not for the loss of the charming companionship of the boys , i could rejoice over my own misfortune , for , with my strong tastes for botany and zoology , i find an unlimited field of work here , and my sister is as devoted to nature as i am . all this , dr . watson , has been brought upon your head by your expression as you surveyed the moor out of our window . """,89,"('never', 'jamais', 'nunca')",0
""" except in america , "" rejoined lord henry languidly . "" but i did n't say he was married . i said he was engaged to be married . there is a great difference . i have a distinct remembrance of being married , but i have no recollection at all of being engaged . i am inclined to think that i never was engaged . """,63,"('never', 'jamais', 'nunca')",0
""" my bride 's mother i had never seen : i understood she was dead .",7,"('never', 'jamais', 'nunca')",0
""" my dear harry , my dear basil , you must both congratulate me ! "" said the lad , throwing off his evening cape with its satin - lined wings and shaking each of his friends by the hand in turn . "" i have never been so happy . of course , it is sudden-- all really delightful things are . and yet it seems to me to be the one thing i have been looking for all my life . "" he was flushed with excitement and pleasure , and looked extraordinarily handsome .",46,"('never', 'jamais', 'nunca')",0
""" what ineffable twaddle ! "" i cried , slapping the magazine down on the table , "" i never read such rubbish in my life . """,19,"('never', 'jamais', 'jamás')",2
"lord henry looked across the table . "" dorian is never annoyed with me , "" he answered . "" i asked the question for the best reason possible , for the only reason , indeed , that excuses one for asking any question-- simple curiosity . i have a theory that it is always the women who propose to us , and not we who propose to the women . except , of course , in middle - class life . but then the middle classes are not modern . """,10,"('never', 'jamais', 'nunca')",0
"nevertheless , they soon came to understand each other . neither looked at the amount of the payment : the one was ready to accept whatever was offered ; the other was ready to give whatever was demanded . never was bargain more readily concluded .",39,"('never', 'jamais', 'jamás')",2
""" he ca n't object to my worldly position , so it must be myself that he has this down on . what has he against me ? i never hurt man or woman in my life that i know of . and yet he would not so much as let me touch the tips of her fingers . """,29,"('never', 'jamais', 'nunca')",0
"when this crisis was past , when milady appeared to have resumed her self - possession , which she had never lost ; when felton had seen her recover with the veil of chastity those treasures of love which were only concealed from him to make him desire them the more ardently , he said , "" ah , now !",20,"('never', 'jamais', 'nunca')",0
""" what nonsense you talk , harry ! "" cried the lad , taking a light from a fire - breathing silver dragon that the waiter had placed on the table . "" let us go down to the theatre . when sibyl comes on the stage you will have a new ideal of life . she will represent something to you that you have never known . """,65,"('never', 'jamais', 'nunca')",0
"during the five or six years that he had lived in the strictest intimacy with his companions , porthos and aramis , they could remember having often seen him smile , but had never heard him laugh .",33,"('never', 'jamais', 'jamás')",2
he never spoke of women .,1,"('never', 'jamais', 'jamás')",2
""" this ? that ’s another matter . never , never ! """,8,"('never', 'jamais', 'nunca')",0
""" this ? that ’s another matter . never , never ! """,10,"('never', 'jamais', 'nunca')",0
""" no , sir , it 's an act of mercy ! you 're my prisoners of war ! i 've cared for you when , with a single word , i could plunge you back into the ocean depths ! you attacked me ! you 've just stumbled on a secret no living man must probe , the secret of my entire existence ! do you think i 'll send you back to a world that must know nothing more of me ? never ! by keeping you on board , it is n't you whom i care for , it 's me ! """,84,"('never', 'jamais', 'jamás')",2
"some fragments of past splendor appeared here and there upon the walls of this modest lodging ; a sword , for example , richly embossed , which belonged by its make to the times of francis i , the hilt of which alone , encrusted with precious stones , might be worth two hundred pistoles , and which , nevertheless , in his moments of greatest distress athos had never pledged or offered for sale .",69,"('never', 'jamais', 'nunca')",0
