text,ind,sense,label
""" true : no doubt he may appear so to a stranger , but i am so accustomed to his manner , i never think of it ; and then , if he has peculiarities of temper , allowance should be made . "" "" why ? """,23,"('never', 'jamais', 'nunca')",0
"but he was never to be found at home ; he never invited anybody to go up with him , and no one could form an idea of what his sumptuous apartment contained in the shape of real riches .",3,"('never', 'jamais', 'jamás')",2
"but he was never to be found at home ; he never invited anybody to go up with him , and no one could form an idea of what his sumptuous apartment contained in the shape of real riches .",11,"('never', 'jamais', 'jamás')",2
"these attempts did not prevent the cardinal , to whom his most inveterate detractors have never denied personal bravery , from making nocturnal excursions , sometimes to communicate to the duc d’angouleme important orders , sometimes to confer with the king , and sometimes to have an interview with a messenger whom he did not wish to see at home .",15,"('never', 'jamais', 'jamás')",2
"ordinary women always console themselves . some of them do it by going in for sentimental colours . never trust a woman who wears mauve , whatever her age may be , or a woman over thirty - five who is fond of pink ribbons . it always means that they have a history . others find a great consolation in suddenly discovering the good qualities of their husbands . they flaunt their conjugal felicity in one 's face , as if it were the most fascinating of sins . religion consoles some . its mysteries have all the charm of a flirtation , a woman once told me , and i can quite understand it . besides , nothing makes one so vain as being told that one is a sinner . conscience makes egotists of us all . yes ; there is really no end to the consolations that women find in modern life . indeed , i have not mentioned the most important one . """,18,"('never', 'jamais', 'nunca')",0
""" i am afraid that women appreciate cruelty , downright cruelty , more than anything else . they have wonderfully primitive instincts . we have emancipated them , but they remain slaves looking for their masters , all the same . they love being dominated . i am sure you were splendid . i have never seen you really and absolutely angry , but i can fancy how delightful you looked . and , after all , you said something to me the day before yesterday that seemed to me at the time to be merely fanciful , but that i see now was absolutely true , and it holds the key to everything . """,55,"('never', 'jamais', 'nunca')",0
"nevertheless , he never borrowed a sou of his companions , although his purse was ever at their service ; and when he had played upon honor , he always awakened his creditor by six o’clock the next morning to pay the debt of the preceding evening .",3,"('never', 'jamais', 'jamás')",2
""" never ! "" replied passepartout , who tried to rise , but fell back , exhausted in mind and body .",1,"('never', 'jamais', 'jamás')",2
""" mr . fix , "" he stammered , "" even should what you say be true -- if my master is really the robber you are seeking for -- which i deny -- i have been , am , in his service ; i have seen his generosity and goodness ; and i will never betray him -- not for all the gold in the world . i come from a village where they do n't eat that kind of bread ! """,55,"('never', 'jamais', 'jamás')",2
"at this athos would smile , with his charming , melancholy smile , which so became his noble countenance , and porthos would drink , swearing that aramis would never be anything but a village cure .",29,"('never', 'jamais', 'nunca')",0
"gentle reader , may you never feel what i then felt !",5,"('never', 'jamais', 'nunca')",0
"may your eyes never shed such stormy , scalding , heart - wrung tears as poured from mine .",3,"('never', 'jamais', 'nunca')",0
"may you never appeal to heaven in prayers so hopeless and so agonised as in that hour left my lips ; for never may you , like me , dread to be the instrument of evil to what you wholly love .",2,"('never', 'jamais', 'nunca')",0
""" i am sure , sir , i should never mistake informality for insolence : one i rather like , the other nothing free - born would submit to , even for a salary . """,9,"('never', 'jamais', 'nunca')",0
""" only my christian name , and that i am quite sure she never mentioned to any one . she told me once that they were all rather curious to learn who i was , and that she invariably told them my name was prince charming . it was pretty of her . you must do me a drawing of sibyl , basil . i should like to have something more of her than the memory of a few kisses and some broken pathetic words . """,13,"('never', 'jamais', 'nunca')",0
""" yes , sir . mixed with mercury , it forms an amalgam that takes the place of zinc in bunsen cells . the mercury is never depleted . only the sodium is consumed , and the sea itself gives me that . beyond this , i 'll mention that sodium batteries have been found to generate the greater energy , and their electro - motor strength is twice that of zinc batteries . """,26,"('never', 'jamais', 'nunca')",0
"hallward was thunderstruck . he looked at dorian gray in absolute amazement . he had never seen him like this before . the lad was actually pallid with rage . his hands were clenched , and the pupils of his eyes were like disks of blue fire . he was trembling all over .",15,"('never', 'jamais', 'nunca')",0
"in fact , four men such as they were -- four men devoted to one another , from their purses to their lives ; four men always supporting one another , never yielding , executing singly or together the resolutions formed in common ; four arms threatening the four cardinal points , or turning toward a single point -- must inevitably , either subterraneously , in open day , by mining , in the trench , by cunning , or by force , open themselves a way toward the object they wished to attain , however well it might be defended , or however distant it may seem .",31,"('never', 'jamais', 'nunca')",0
""" not at all , professor , "" the captain answered me after a slight hesitation , "" since you 'll never leave this underwater boat . come into the lounge . it 's actually our work room , and there you 'll learn the full story about the nautilus ! """,21,"('never', 'jamais', 'nunca')",0
"do you never laugh , miss eyre ?",2,"('never', 'ne', 'nunca')",1
"she looked at me with evident suspicion : "" nay , she never sold stuff i ' that way . """,12,"('never', 'jamais', 'nunca')",0
"no,--i exaggerate ; i never thought there was any consecrating virtue about her : it was rather a sort of pastille perfume she had left ; a scent of musk and amber , than an odour of sanctity .",4,"('never', 'jamais', 'nunca')",0
""" you never felt jealousy , did you , miss eyre ?",2,"('never', 'jamais', 'nunca')",0
"there they talked , they instructed each other , they made plans , and the rough good - humor of the sailor always amused this little world , in which the most perfect harmony had never ceased to reign .",35,"('never', 'jamais', 'nunca')",0
"for years , dorian gray could not free himself from the influence of this book . or perhaps it would be more accurate to say that he never sought to free himself from it . he procured from paris no less than nine large - paper copies of the first edition , and had them bound in different colours , so that they might suit his various moods and the changing fancies of a nature over which he seemed , at times , to have almost entirely lost control . the hero , the wonderful young parisian in whom the romantic and the scientific temperaments were so strangely blended , became to him a kind of prefiguring type of himself . and , indeed , the whole book seemed to him to contain the story of his own life , written before he had lived it .",27,"('never', 'jamais', 'nunca')",0
"the worship of the senses has often , and with much justice , been decried , men feeling a natural instinct of terror about passions and sensations that seem stronger than themselves , and that they are conscious of sharing with the less highly organized forms of existence . but it appeared to dorian gray that the true nature of the senses had never been understood , and that they had remained savage and animal merely because the world had sought to starve them into submission or to kill them by pain , instead of aiming at making them elements of a new spirituality , of which a fine instinct for beauty was to be the dominant characteristic .",63,"('never', 'jamais', 'nunca')",0
"at the moment of becoming engulfed in this dark gallery , i raised my head , and saw for the last time through the length of that vast tube the sky of iceland , which i was never to behold again .",37,"('never', 'jamais', 'jamás')",2
""" with good old jup there is never any quarreling , "" often repeated pencroft , "" never any improper reply .",7,"('never', 'jamais', 'jamás')",2
"dorian shrugged his shoulders . "" i believe he married lady radley 's maid , and has established her in paris as an english dressmaker . anglomanie is very fashionable over there now , i hear . it seems silly of the french , does n't it ? but -- do you know?--he was not at all a bad servant . i never liked him , but i had nothing to complain about . one often imagines things that are quite absurd . he was really very devoted to me and seemed quite sorry when he went away . have another brandy - and - soda ? or would you like hock - and - seltzer ? i always take hock - and - seltzer myself . there is sure to be some in the next room . """,62,"('never', 'jamais', 'nunca')",0
""" a servant ! "" cried mr . batulcar , caressing the thick grey beard which hung from his chin . "" i already have two who are obedient and faithful , have never left me , and serve me for their nourishment and here they are , "" added he , holding out his two robust arms , furrowed with veins as large as the strings of a bass - viol .",33,"('never', 'jamais', 'nunca')",0
""" i never believe in anything i have not seen , and as i never have seen apparitions , i do n’t believe in them . """,14,"('never', 'jamais', 'nunca')",0
"so i begged ned to let me think about it before taking action . if this measure proved fruitless , it could arouse the captain 's suspicions , make our circumstances even more arduous , and jeopardize the canadian 's plans . i might add that i could hardly use our state of health as an argument . except for that grueling ordeal under the ice bank at the south pole , we had never felt better , neither ned , conseil , nor i. the nutritious food , life - giving air , regular routine , and uniform temperature kept illness at bay ; and for a man who did n't miss his past existence on land , for a captain nemo who was at home here , who went where he wished , who took paths mysterious to others if not himself in attaining his ends , i could understand such a life . but we ourselves had n't severed all ties with humanity . for my part , i did n't want my new and unusual research to be buried with my bones . i had now earned the right to pen the definitive book on the sea , and sooner or later i wanted that book to see the light of day .",74,"('never', 'jamais', 'jamás')",2
""" i disremember them , "" he answered . "" i hain't said none since i was half the height o ' that gun . i guess it 's never too late . you say them out , and i 'll stand by and come in on the choruses . """,29,"('never', 'jamais', 'nunca')",0
""" i never heard tell on him , "" said the wanderer . "" he appears to have chosen a fair crowd of ye . """,2,"('never', 'jamais', 'nunca')",0
"our wonderment stayed at an all - time fever pitch . our exclamations were endless . ned identified the fish , conseil classified them , and as for me , i was in ecstasy over the verve of their movements and the beauty of their forms . never before had i been given the chance to glimpse these animals alive and at large in their native element .",47,"('never', 'jamais', 'nunca')",0
""" i never jest . """,2,"('never', 'jamais', 'nunca')",0
""" never ! "" repeated pencroft , "" bob harvey will never , if he is a good seaman , enter that channel !",1,"('never', 'jamais', 'jamás')",2
""" never ! "" repeated pencroft , "" bob harvey will never , if he is a good seaman , enter that channel !",11,"('never', 'jamais', 'jamás')",2
""" no , an islet lost in the pacific , and which perhaps has never been visited . """,14,"('never', 'jamais', 'nunca')",0
""" the brute ! the brute ! "" i cried with clenched hands . "" oh holmes , i shall never forgive myself for having left him to his fate . """,20,"('never', 'jamais', 'nunca')",0
""" never . """,1,"('never', 'jamais', 'jamás')",2
""" never ? """,1,"('never', 'jamais', 'jamás')",2
""" oh , quite well ! i never felt better . """,7,"('never', 'jamais', 'nunca')",0
""" should i renounce this expedition just when we have the fairest chance of success ! never ! """,16,"('never', 'jamais', 'jamás')",2
"the exploration of these dense masses of wood was difficult in the extreme , and the reporter never ventured there without the pocket - compass , for the sun scarcely pierced through the thick foliage and it would have been very difficult for them to retrace their way .",17,"('never', 'jamais', 'nunca')",0
""" oh , my lord ! "" cried the baron , "" i shall never console myself . """,14,"('never', 'jamais', 'nunca')",0
""" professor , when i proposed that you go hunting in my crespo forests , you thought i was contradicting myself . when i informed you that it was an issue of underwater forests , you thought i 'd gone insane . professor , you must never make snap judgments about your fellow man . """,46,"('never', 'jamais', 'nunca')",0
"that a greater fool than jane eyre had never breathed the breath of life ; that a more fantastic idiot had never surfeited herself on sweet lies , and swallowed poison as if it were nectar .",8,"('never', 'jamais', 'nunca')",0
"never had mineralogists found themselves in so marvellous a situation to study nature in situ . what the boring machine , an insensible , inert instrument , was unable to bring to the surface of the inner structure of the globe , we were able to peruse with our own eyes and handle with our own hands .",0,"('never', 'jamais', 'jamás')",2
""" and this , "" added elder william hitch , "" this is why the jealousy of congress has been aroused against us ! why have the soldiers of the union invaded the soil of utah ? why has brigham young , our chief , been imprisoned , in contempt of all justice ? shall we yield to force ? never ! driven from vermont , driven from illinois , driven from ohio , driven from missouri , driven from utah , we shall yet find some independent territory on which to plant our tents . and you , my brother , "" continued the elder , fixing his angry eyes upon his single auditor , "" will you not plant yours there , too , under the shadow of our flag ? """,60,"('never', 'jamais', 'jamás')",2
""" we 're at close grips at last , "" said holmes as we walked together across the moor . "" what a nerve the fellow has ! how he pulled himself together in the face of what must have been a paralyzing shock when he found that the wrong man had fallen a victim to his plot . i told you in london , watson , and i tell you now again , that we have never had a foeman more worthy of our steel . """,77,"('never', 'jamais', 'nunca')",0
""" have it your way , sir , "" the harpooner replied , shrugging his shoulders . "" but speaking for myself , i 'll never get into those things unless they force me ! """,25,"('never', 'jamais', 'nunca')",0
""" mr . spilett ! "" exclaimed the sailor , seizing the reporter , and clasping him to his breast with such a squeeze that he had never felt anything like it before .",27,"('never', 'jamais', 'jamás')",2
"he began to reassure aouda , telling her that blusterers were never to be feared , and begged fix to be his second at the approaching duel , a request which the detective could not refuse . mr . fogg resumed the interrupted game with perfect calmness .",11,"('never', 'jamais', 'nunca')",0
"the car , which was some fifty feet long , was very convenient for their purpose . the adversaries might march on each other in the aisle , and fire at their ease . never was duel more easily arranged . mr . fogg and colonel proctor , each provided with two six - barrelled revolvers , entered the car . the seconds , remaining outside , shut them in . they were to begin firing at the first whistle of the locomotive . after an interval of two minutes , what remained of the two gentlemen would be taken from the car .",34,"('never', 'jamais', 'nunca')",0
"however , the mystery which enveloped its strange destruction would doubtless never have been cleared away if , on the 30th of november , neb , strolling on the beach , had not found a piece of a thick iron cylinder , bearing traces of explosion .",11,"('never', 'jamais', 'jamás')",2
""" i have not considered the subject , "" said he indifferently , looking straight before him . "" no , you men never do consider economy and common sense .",23,"('never', 'jamais', 'nunca')",0
"dorian gray grew sick with fear . "" i never knew her , "" he stammered . "" i never heard of her . you are mad . """,19,"('never', 'jamais', 'nunca')",0
""" but i can never escape , "" said d’artagnan , "" with such enemies .",4,"('never', 'jamais', 'nunca')",0
"sometimes herbert accompanied them , but never pencroft , who could not bear to look upon the prospect of the island now so utterly devastated .",6,"('never', 'jamais', 'nunca')",0
""" you need not be afraid . our countrymen never recognize a description . """,9,"('never', 'ne', 'nunca')",1
""" ye gods , "" conseil replied , "" i hardly know what to tell master . we 're certainly seeing some unusual things , and for two months we 've had no time for boredom . the latest wonder is always the most astonishing , and if this progression keeps up , i ca n't imagine what its climax will be . in my opinion , we 'll never again have such an opportunity . """,69,"('never', 'jamais', 'nunca')",0
"when i returned to partial life my face was wet with tears . how long that state of insensibility had lasted i can not say . i had no means now of taking account of time . never was solitude equal to this , never had any living being been so utterly forsaken .",37,"('never', 'jamais', 'jamás')",2
"when i returned to partial life my face was wet with tears . how long that state of insensibility had lasted i can not say . i had no means now of taking account of time . never was solitude equal to this , never had any living being been so utterly forsaken .",44,"('never', 'jamais', 'nunca')",0
"but more than that we were never destined to know , though there was much which we might surmise . there was no chance of finding footsteps in the mire , for the rising mud oozed swiftly in upon them , but as we at last reached firmer ground beyond the morass we all looked eagerly for them . but no slightest sign of them ever met our eyes . if the earth told a true story , then stapleton never reached that island of refuge towards which he struggled through the fog upon that last night . somewhere in the heart of the great grimpen mire , down in the foul slime of the huge morass which had sucked him in , this cold and cruel - hearted man is forever buried .",80,"('never', 'ne', 'nunca')",1
""" however , i think that in making the experiment , we ought to employ , not the ordinary powder , the supply of which , i think , should remain untouched , but the pyroxyle which will never fail us . """,38,"('never', 'ne', 'nunca')",1
""" ah ! then , you never really love , mr . gray , "" answered the duchess with mock sadness .",6,"('never', 'jamais', 'nunca')",0
"at that moment a little accident supervened , which seemed decreed by fate purposely to prove the truth of the adage , that "" misfortunes never come singly , "" and to add to their distresses the vexing one of the slip between the cup and the lip .",25,"('never', 'jamais', 'nunca')",0
""" harry is never wrong , duchess . """,3,"('never', 'jamais', 'nunca')",0
""" it was my game to watch stapleton . it was evident , however , that i could not do this if i were with you , since he would be keenly on his guard . i deceived everybody , therefore , yourself included , and i came down secretly when i was supposed to be in london . my hardships were not so great as you imagined , though such trifling details must never interfere with the investigation of a case . i stayed for the most part at coombe tracey , and only used the hut upon the moor when it was necessary to be near the scene of action . cartwright had come down with me , and in his disguise as a country boy he was of great assistance to me . i was dependent upon him for food and clean linen . when i was watching stapleton , cartwright was frequently watching you , so that i was able to keep my hand upon all the strings .",74,"('never', 'jamais', 'nunca')",0
""" i have never searched for happiness . who wants happiness ? i have searched for pleasure . """,3,"('never', 'jamais', 'nunca')",0
""" no passengers . never have passengers . too much in the way . """,4,"('never', 'jamais', 'nunca')",0
"he was never married , and had no near kindred but ourselves and one other person , not more closely related than we .",2,"('never', 'jamais', 'nunca')",0
""" it 's more than just bread , "" the canadian added . "" it 's a dainty pastry . you 've never eaten any , sir ? """,22,"('never', 'jamais', 'nunca')",0
that is more than time enough for us to devise a plan . if we go from this place we shall never find another so suitable .,21,"('never', 'jamais', 'nunca')",0
""" papa says you never come to see us now , "" continued miss oliver , looking up . "" you are quite a stranger at vale hall .",4,"('never', 'jamais', 'nunca')",0
"there , to conclude , all were happy , united in the present as they had been in the past ; but never could they forget that island upon which they had arrived poor and friendless , that island which , during four years had supplied all their wants , and of which there remained but a fragment of granite washed by the waves of the pacific , the tomb of him who had borne the name of captain nemo .",22,"('never', 'jamais', 'jamás')",2
""" has he never been jealous ? """,3,"('never', 'jamais', 'nunca')",0
"candide listened attentively and believed implicitly , for he thought miss cunegund excessively handsome , though he never had the courage to tell her so .",17,"('never', 'jamais', 'nunca')",0
"surely , man had never before so terribly altered , in so brief a period , as had roderick usher !",4,"('never', 'jamais', 'jamás')",2
""" wonderful , magnificent , splendid ! "" cried my uncle . "" here is the entire flora of the second period of the world -- the transition period . these , humble garden plants with us , were tall trees in the early ages . look , axel , and admire it all . never had botanist such a feast as this ! """,55,"('never', 'jamais', 'jamás')",2
"but you need not fear . she will not hear what we say ; she never goes to bed before midnight . """,15,"('never', 'jamais', 'jamás')",2
""" money , sir ! "" said one of the blues to him , "" young persons of your appearance and merit never pay anything ; why , are not you five feet five inches high ? """,22,"('never', 'jamais', 'nunca')",0
"never was anything so gallant , so well accoutred , so brilliant , and so finely disposed as the two armies . the trumpets , fifes , hautboys , drums , and cannon made such harmony as never was heard in hell itself .",37,"('never', 'jamais', 'nunca')",0
"i came back to breakfast with a good appetite . hans was a good caterer for our little household ; he had water and fire at his disposal , so that he was able to vary our bill of fare now and then . for dessert he gave us a few cups of coffee , and never was coffee so delicious .",56,"('never', 'jamais', 'jamás')",2
""" what if we never return to it ? "" ned land added .",4,"('never', 'jamais', 'nunca')",0
""" i forget , "" said dorian . "" i suppose i did . but i never really liked it . i am sorry i sat for it . the memory of the thing is hateful to me . why do you talk of it ? it used to remind me of those curious lines in some play -- hamlet , i think -- how do they run?--",16,"('never', 'jamais', 'nunca')",0
""" alas , "" cried candide , "" i have had some knowledge of love myself , this sovereign of hearts , this soul of souls ; yet it never cost me more than a kiss and twenty kicks on the backside .",29,"('never', 'jamais', 'nunca')",0
""" i will never help you in that , monsieur chevalier , "" said kitty , warmly .",3,"('never', 'jamais', 'jamás')",2
"there are moments when the odour of lilas blanc passes suddenly across me , and i have to live the strangest month of my life over again . i wish i could change places with you , dorian . the world has cried out against us both , but it has always worshipped you . it always will worship you . you are the type of what the age is searching for , and what it is afraid it has found . i am so glad that you have never done anything , never carved a statue , or painted a picture , or produced anything outside of yourself ! life has been your art . you have set yourself to music . your days are your sonnets . """,89,"('never', 'jamais', 'nunca')",0
""" i will never confess that but to the man -- who should read to the bottom of my soul ! """,3,"('never', 'jamais', 'nunca')",0
""" do stay . you have never played so well as to - night . there was something in your touch that was wonderful . it had more expression than i had ever heard from it before . """,6,"('never', 'jamais', 'nunca')",0
