text,ind,sense,label
"either the engineer had been able to save himself , and had already found a refuge on some point of the coast , or he was lost for ever !",18,"('point', 'point', 'punto')",0
"it took more than half an hour to cross from the islet to the land , and he reached the shore several hundred feet from the place which was opposite to the point from which he had started .",32,"('point', 'point', 'punto')",0
"the opposite coast formed one vast bay , terminating on the south by a very sharp point , which was destitute of all vegetation , and was of a very wild aspect .",16,"('point', 'pointe', 'punta')",2
this point abutted on the shore in a grotesque outline of high granite rocks .,1,"('point', 'pointe', 'punta')",2
"herbert was deadly pale , and his pulse so feeble that spilett only felt it beat at long intervals , as if it was on the point of stopping .",26,"('point', 'point', 'punto')",0
"a whirlwind had apparently collected its force in our vicinity ; for there were frequent and violent alterations in the direction of the wind ; and the exceeding density of the clouds ( which hung so low as to press upon the turrets of the house ) did not prevent our perceiving the life - like velocity with which they flew careering from all points against each other , without passing away into the distance .",64,"('point', 'point', 'punto')",0
"an hour after their departure they arrived on the southern point of the islet , terminated by a sharp cape , and proceeded towards the north along the western coast , equally formed by sand and rocks , the background bordered with thick woods .",10,"('point', 'pointe', 'punta')",2
"from this point its course was pursued through a forest of magnificent trees . these trees still retained their verdure , notwithstanding the advanced season , for they belonged to the family of "" coniferae , "" which is spread over all the regions of the globe , from northern climates to the tropics .",2,"('point', 'point', 'punto')",0
"suddenly hans rises , and pointing with his finger at the menacing object , he says :",5,"('point', 'montrer', 'señalar')",1
"just then the chief officer drew the captain 's attention anew . the latter interrupted his strolling and aimed his spyglass at the point indicated . he observed it a good while . as for me , deeply puzzled , i went below to the lounge and brought back an excellent long - range telescope i habitually used . leaning my elbows on the beacon housing , which jutted from the stern of the platform , i got set to scour that whole stretch of sky and sea . but no sooner had i peered into the eyepiece than the instrument was snatched from my hands .",23,"('point', 'point', 'punto')",0
no ! i was n't the subject of his hate because he was n't even looking at me ; his eyes stayed stubbornly focused on that inscrutable point of the horizon .,27,"('point', 'point', 'punto')",0
"this was the wisest course , and it was about to be followed when herbert , pointing to a confused mass among the trees , exclaimed,--",16,"('point', 'montrer', 'mostrar')",3
"d’artagnan was on the point of telling athos all ; but one consideration restrained him . athos was a gentleman , punctilious in points of honor ; and there were in the plan which our lover had devised for milady , he was sure , certain things that would not obtain the assent of this puritan . he was therefore silent ; and as athos was the least inquisitive of any man on earth , d’artagnan ’s confidence stopped there .",4,"('point', 'point', 'punto')",0
"beyond that hedge , that garden , and that cottage , a dark mist enveloped with its folds that immensity where paris slept -- a vast void from which glittered a few luminous points , the funeral stars of that hell !",33,"('point', 'point', 'punto')",0
"he must have reached some point of the shore ; do n't you think so , pencroft ? """,5,"('point', 'point', 'punto')",0
"at the point where the sailor had left his raft of wood , it began to run between the two high granite walls ; but if on the left bank the wall remained clear and abrupt , on the right bank , on the contrary , it sank gradually , the massive sides changed to isolated rocks , the rocks to stones , the stones to shingle running to the extremity of the point .",2,"('point', 'point', 'punto')",0
"now , this point was settled ; mme . bonacieux , without any suspicion , accompanied her . once concealed with her at armentieres , it would be easy to make her believe that d’artagnan had not come to bethune .",3,"('point', 'point', 'punto')",0
"' but who is to give the prizes ? ' quite a chorus of voices asked . ' why , she , of course , ' said the dodo , pointing to alice with one finger ; and the whole party at once crowded round her , calling out in a confused way , ' prizes ! prizes ! '",30,"('point', 'montrer', 'señalar')",1
"from this point , by following the right bank of the watercourse , they would arrive at the spurs of mount franklin , among which they would naturally seek a retreat , and they could not have been long in discovering the corral , then uninhabited .",2,"('point', 'point', 'punto')",0
""" very well , "" answered my uncle ; "" let us start from that point and count four days ' storm , during which our rate can not have been less than eighty leagues in the twenty - four hours . """,15,"('point', 'point', 'punto')",0
""" are they good to eat ? "" asked pencroft , who only regarded the representatives of the fauna in the island from one special point of view .",25,"('point', 'point', 'punto')",0
"after having turned the point , the settlers saw a long beach washed by the open sea .",4,"('point', 'pointe', 'punta')",2
to the left the edge of the marsh was abruptly ended by a little point .,14,"('point', 'pointe', 'punta')",2
"when this species of summons was made the officer inquired aloud the point of the brig ’s departure , its route , its landings ; and to all these questions the captain replied without difficulty and without hesitation .",12,"('point', 'point', 'punto')",0
porthos wept ; aramis pointed toward heaven ; athos made the sign of the cross .,4,"('point', 'montrer', 'mostrar')",3
""" you see ! "" said athos , pointing to mme . bonacieux dead , and to d’artagnan , whom porthos and aramis were trying to recall to life .",8,"('point', 'montrer', 'señalar')",1
""" and that 's just the point , "" added pencroft , "" i do n't know if we have done right to bring him here . """,6,"('point', 'point', 'punto')",0
""" this one ? "" conseil said , pointing to a magnificent jewel in its glass case .",8,"('point', 'montrer', 'mostrar')",3
it would be wrong to judge the actions of one period from the point of view of another .,13,"('point', 'point', 'punto')",0
"athos repeated to him the same question he had asked the first person he met . the night watch evinced the same terror , refused , in his turn , to accompany athos , and only pointed with his hand to the road he was to take .",36,"('point', 'montrer', 'mostrar')",3
"arrived at the angle of a street , he pointed to a small house , isolated , solitary , and dismal . athos went toward the house , while the mendicant , who had received his reward , left as fast as his legs could carry him .",9,"('point', 'montrer', 'mostrar')",3
"at the point of the lake which projected to the north , they had discovered an osier - bed in which grew a large number of purple osiers .",2,"('point', 'pointe', 'punta')",2
"and he pointed to a thick smoke rising from the mill , the sheds , and the buildings at the poultry - yard .",2,"('point', 'montrer', 'mostrar')",3
"and , indeed , the poor creature was on the point of springing into the creek which separated him from the forest , and his legs were bent for an instant as if for a spring , but almost immediately he stepped back , half sank down , and a large tear fell from his eyes .",10,"('point', 'point', 'punto')",0
""" my friend the cardinal ! "" cried milady , seeing that on this point as on the other lord de winter seemed well instructed .",14,"('point', 'point', 'punto')",0
at this moment a man who had been crouching in a ditch jumped up and came towards them . it was mousqueton . he pointed his finger to the lighted window .,24,"('point', 'montrer', 'señalar')",1
"the stranger placed the point of his sword at his throat ; and monsieur porthos , finding himself at the mercy of his adversary , acknowledged himself conquered .",4,"('point', 'pointe', 'punta')",2
"i was convinced that when captain nemo reached this point , he would back out again ; but i was mistaken , and much to my surprise , he did nothing of the sort .",9,"('point', 'point', 'punto')",0
"the red sea : that great lake so famous in biblical traditions , seldom replenished by rains , fed by no important rivers , continually drained by a high rate of evaporation , its water level dropping a meter and a half every year ! if it were fully landlocked like a lake , this odd gulf might dry up completely ; on this score it 's inferior to its neighbors , the caspian sea and the dead sea , whose levels lower only to the point where their evaporation exactly equals the amounts of water they take to their hearts .",86,"('point', 'point', 'punto')",0
this point can only be cleared up later .,1,"('point', 'point', 'punto')",0
"suddenly pencroft , uttering a cry , pointed to the table . on it lay a little oblong box , of which the cover bore these words:--""sulphate of quinine . """,7,"('point', 'montrer', 'mostrar')",3
"ere i had gathered my wits , the classes were again seated : but as all eyes were now turned to one point , mine followed the general direction , and encountered the personage who had received me last night .",22,"('point', 'point', 'punto')",0
"leaning against the sides of the skiff , we were chatting of one thing and another , when ned land stretched his hand toward a point in the water , saying to me :",25,"('point', 'point', 'punto')",0
"immediately m. de treville opened and pointed the way to porthos and aramis , who bore their comrade in their arms .",6,"('point', 'montrer', 'mostrar')",3
grimaud contented himself with pointing d’artagnan out to his master with his finger .,4,"('point', 'montrer', 'mostrar')",3
""" you arrive in good time , monsieur , "" said the king , who , when his passions were raised to a certain point , could not dissemble ; "" i have learned some fine things concerning your musketeers . """,24,"('point', 'point', 'punto')",0
""" this gentleman , who is my friend , has just escaped from a serious danger , "" continued aramis , with unction , pointing to d’artagnan with his hand , and addressing the two ecclesiastics .",24,"('point', 'montrer', 'señalar')",1
"pencroft soon brought the canoe to the shore by a narrow passage among the rocks , and it was agreed that they should make a trial of the boat that day by following the shore as far as the first point at which the rocks of the south ended .",40,"('point', 'pointe', 'punta')",2
"the sailor first crossed the channel , and steered close to the southern point of the islet .",13,"('point', 'pointe', 'punta')",2
"this point , of which the distance was increased by the irregularity of the coast , was nearly three miles from the mercy .",1,"('point', 'pointe', 'punta')",2
the cliff gradually sloped away from the mouth of the river to the point .,13,"('point', 'pointe', 'punta')",2
"in the meantime , after a voyage of three - quarters of an hour , the canoe reached the extremity of the point , and pencroft was preparing to return , when herbert , rising , pointed to a black object , saying,--",22,"('point', 'pointe', 'punta')",2
"in the meantime , after a voyage of three - quarters of an hour , the canoe reached the extremity of the point , and pencroft was preparing to return , when herbert , rising , pointed to a black object , saying,--",36,"('point', 'montrer', 'señalar')",1
all eyes turned towards the point indicated .,5,"('point', 'point', 'punto')",0
"before she went to bed she had pondered , analyzed , turned on all sides , examined on all points , the words , the steps , the gestures , the signs , and even the silence of her interlocutors ; and of this profound , skillful , and anxious study the result was that felton , everything considered , appeared the more vulnerable of her two persecutors .",19,"('point', 'point', 'punto')",0
""" you approach that famous point of free will which is a mortal rock .",5,"('point', 'point', 'punto')",0
"vice and virtue are to the artist materials for an art . from the point of view of form , the type of all the arts is the art of the musician . from the point of view of feeling , the actor 's craft is the type .",14,"('point', 'point', 'punto')",0
"vice and virtue are to the artist materials for an art . from the point of view of form , the type of all the arts is the art of the musician . from the point of view of feeling , the actor 's craft is the type .",35,"('point', 'point', 'punto')",0
"pencroft and neb then dug away the sand with their oars , so as to facilitate the moving of the chest , towing which the boat soon began to double the point , to which the name of flotsam point was given .",31,"('point', 'pointe', 'punta')",2
"this point settled , there was nothing to be done but to return to the cart , where they would consult .",1,"('point', 'point', 'punto')",0
"the same with the bible printed in english , in quarto , remarkable from a typographic point of view , and which appeared to have been often used .",16,"('point', 'point', 'punto')",0
