text,ind
"it was real enjoyment to the settlers when in their room , well lighted with candles , well warmed with coal , after a good dinner , elderberry coffee smoking in the cups , the pipes giving forth an odoriferous smoke , they could hear the storm howling without .",40
"d’artagnan threw down a yet - smoking pistol which he held in his hand , and fell on his knees before his mistress . athos replaced his in his belt ; porthos and aramis , who held their drawn swords in their hands , returned them to their scabbards .",6
"before i could reply , white smoke streamed from the battleship 's bow . then , a few seconds later , the waters splashed astern of the nautilus , disturbed by the fall of a heavy object . soon after , an explosion struck my ears .",6
"there were only two men in the room , sir henry and stapleton . they sat with their profiles towards me on either side of the round table . both of them were smoking cigars , and coffee and wine were in front of them . stapleton was talking with animation , but the baronet looked pale and distrait . perhaps the thought of that lonely walk across the ill - omened moor was weighing heavily upon his mind .",33
""" they are both simply forms of imitation , "" remarked lord henry . "" but do let us go . dorian , you must not stay here any longer . it is not good for one 's morals to see bad acting . besides , i do n't suppose you will want your wife to act , so what does it matter if she plays juliet like a wooden doll ? she is very lovely , and if she knows as little about life as she does about acting , she will be a delightful experience . there are only two kinds of people who are really fascinating-- people who know absolutely everything , and people who know absolutely nothing . good heavens , my dear boy , do n't look so tragic ! the secret of remaining young is never to have an emotion that is unbecoming . come to the club with basil and myself . we will smoke cigarettes and drink to the beauty of sibyl vane . she is beautiful . what more can you want ? """,161
""" ah , my dear basil , that is exactly why i can feel it . those who are faithful know only the trivial side of love : it is the faithless who know love 's tragedies . "" and lord henry struck a light on a dainty silver case and began to smoke a cigarette with a self - conscious and satisfied air , as if he had summed up the world in a phrase .",53
"breathing that sea breeze , so much more invigorating and balsamic as the land is approached , contemplating all the power of those preparations she was commissioned to destroy , all the power of that army which she was to combat alone -- she , a woman with a few bags of gold -- milady compared herself mentally to judith , the terrible jewess , when she penetrated the camp of the assyrians and beheld the enormous mass of chariots , horses , men , and arms , which a gesture of her hand was to dissipate like a cloud of smoke .",101
"by nine o'clock we had pulled up to shore . the sky was growing brighter . clouds were fleeing to the south . mists were rising from the cold surface of the water . captain nemo headed toward the peak , which he no doubt planned to make his observatory . it was an arduous climb over sharp lava and pumice stones in the midst of air often reeking with sulfurous fumes from the smoke holes . for a man out of practice at treading land , the captain scaled the steepest slopes with a supple agility i could n't equal , and which would have been envied by hunters of pyrenees mountain goats .",74
"' you 'll get used to it in time , ' said the caterpillar ; and it put the hookah into its mouth and began smoking again .",25
""" then smoke these cigars whenever you like , without debating their origin . they bear no government seal of approval , but i imagine they 're none the worse for it . """,2
"this game was eaten fresh , but they preserved some capybara hams , by smoking them above a fire of green wood , after having perfumed them with sweet - smelling leaves .",14
"smoke away , old boy , smoke away ! """,0
"smoke away , old boy , smoke away ! """,6
""" i liked bonbons too in those days , miss eyre , and i was _ croquant_--(overlook the barbarism)--_croquant _ chocolate comfits , and smoking alternately , watching meantime the equipages that rolled along the fashionable streets towards the neighbouring opera - house , when in an elegant close carriage drawn by a beautiful pair of english horses , and distinctly seen in the brilliant city - night , i recognised the ' voiture ' i had given celine .",24
""" what ! "" i shouted . "" are we being taken up in an eruption ? our fate has flung us here among burning lavas , molten rocks , boiling waters , and all kinds of volcanic matter ; we are going to be pitched out , expelled , tossed up , vomited , spit out high into the air , along with fragments of rock , showers of ashes and scoria , in the midst of a towering rush of smoke and flames ; and it is the best thing that could happen to us ! """,82
"naturally enough , the canadian wanted to lay in a supply of honey , and it would have been ill - mannered of me to say no . he mixed sulfur with some dry leaves , set them on fire with a spark from his tinderbox , and proceeded to smoke the bees out . little by little the buzzing died down and the disemboweled hive yielded several pounds of sweet honey . ned land stuffed his haversack with it .",50
"soon lurid lights began to penetrate the vertical gallery which widened as we went up . right and left i could see deep channels , like huge tunnels , out of which escaped dense volumes of smoke ; tongues of fire lapped the walls , which crackled and sputtered under the intense heat .",36
the kangaroo soup was smoking on the table .,4
"the next day , april 1 , when the nautilus rose to the surface of the waves a few minutes before noon , we raised land to the west . it was tierra del fuego , the land of fire , a name given it by early navigators after they saw numerous curls of smoke rising from the natives ' huts . this land of fire forms a huge cluster of islands over thirty leagues long and eighty leagues wide , extending between latitude 53 degrees and 56 degrees south , and between longitude 67 degrees 50 ' and 77 degrees 15 ' west . its coastline looked flat , but high mountains rose in the distance . i even thought i glimpsed mt . sarmiento , whose elevation is 2,070 meters above sea level : a pyramid - shaped block of shale with a very sharp summit , which , depending on whether it 's clear or veiled in vapor , "" predicts fair weather or foul , "" as ned land told me .",54
"something creaked : it was a door ajar ; and that door was mr . rochester 's , and the smoke rushed in a cloud from thence .",20
"almost immediately a louder report was heard , a cloud of smoke issued from the brig 's side , and a ball , striking the summit of the rock which sheltered ayrton and pencroft , made it fly in splinters , but the two marksmen remained unhurt .",11
"it seems to me that the giant is not content with breathing ; he must smoke ! """,15
"but then , what splendid fires blazed continually on the hearths of granite house , the smoke marking the granite wall with long , zebra - like streaks !",16
""" supernatural ! "" exclaimed the sailor , emitting a volume of smoke from his mouth .",12
"sophie is my nurse ; she came with me over the sea in a great ship with a chimney that smoked -- how it did smoke!--and i was sick , and so was sophie , and so was mr . rochester .",20
"let mount franklin smoke , groan , bellow , or spout forth fire and flame as much as it pleases , that is no reason why we should be idle !",3
"it was already dark , and the obscurity would permit them to ascertain if flames or incandescent matter thrown up by the volcano were mingled with the vapor and smoke accumulated at the mouth of the crater .",29
"but at last , if all indication of an encampment escaped herbert 's sight could he not even catch a glimpse of smoke , the faintest trace of which would be easily discernible in the pure atmosphere ?",22
i laughed incredulously as sherlock holmes leaned back in his settee and blew little wavering rings of smoke up to the ceiling .,17
"perhaps the winds which blew directly against the facade would make the chimney smoke , but these winds were rare , and besides , master neb , the cook , was not so very particular about that .",13
"snow began to fall an hour after they started , a fine snow , however , which happily could not obstruct the train ; nothing could be seen from the windows but a vast , white sheet , against which the smoke of the locomotive had a greyish aspect .",41
"it will be so , if we can make a fireplace in the left passage and keep an opening for the smoke . """,21
"he still sought ; but his eyes , darkened by death , encountered only the knife which had fallen from the hand of felton , still smoking with the blood spread over its blade .",26
"besides this , i arrived at an unexpected perfection in my earthenware , and contrived well enough to make them with a wheel , which i found infinitely easier and better ; because i made things round and shaped , which before were filthy things indeed to look on . but i think i was never more vain of my own performance , or more joyful for anything i found out , than for my being able to make a tobacco - pipe ; and though it was a very ugly , clumsy thing when it was done , and only burned red , like other earthenware , yet as it was hard and firm , and would draw the smoke , i was exceedingly comforted with it , for i had been always used to smoke ; and there were pipes in the ship , but i forgot them at first , not thinking there was tobacco in the island ; and afterwards , when i searched the ship again , i could not come at any pipes .",120
"besides this , i arrived at an unexpected perfection in my earthenware , and contrived well enough to make them with a wheel , which i found infinitely easier and better ; because i made things round and shaped , which before were filthy things indeed to look on . but i think i was never more vain of my own performance , or more joyful for anything i found out , than for my being able to make a tobacco - pipe ; and though it was a very ugly , clumsy thing when it was done , and only burned red , like other earthenware , yet as it was hard and firm , and would draw the smoke , i was exceedingly comforted with it , for i had been always used to smoke ; and there were pipes in the ship , but i forgot them at first , not thinking there was tobacco in the island ; and afterwards , when i searched the ship again , i could not come at any pipes .",136
"a small fly or moth had fluttered across our path , and in an instant stapleton was rushing with extraordinary energy and speed in pursuit of it . to my dismay the creature flew straight for the great mire , and my acquaintance never paused for an instant , bounding from tuft to tuft behind it , his green net waving in the air . his gray clothes and jerky , zigzag , irregular progress made him not unlike some huge moth himself . i was standing watching his pursuit with a mixture of admiration for his extraordinary activity and fear lest he should lose his footing in the treacherous mire , when i heard the sound of steps , and turning round found a woman near me upon the path . she had come from the direction in which the plume of smoke indicated the position of merripit house , but the dip of the moor had hid her until she was quite close .",143
""" never mind , lady narborough . i smoke a great deal too much . i am going to limit myself , for the future . """,8
""" i always smoke ' ship 's ' myself , "" i answered .",3
"from the corner of the divan of persian saddle - bags on which he was lying , smoking , as was his custom , innumerable cigarettes , lord henry wotton could just catch the gleam of the honey - sweet and honey- coloured blossoms of a laburnum , whose tremulous branches seemed hardly able to bear the burden of a beauty so flamelike as theirs ; and now and then the fantastic shadows of birds in flight flitted across the long tussore - silk curtains that were stretched in front of the huge window , producing a kind of momentary japanese effect , and making him think of those pallid , jade - faced painters of tokio who , through the medium of an art that is necessarily immobile , seek to convey the sense of swiftness and motion .",17
""" i doubt it , "" replied the sailor , shaking his head , "" for neither neb nor captain harding smoke , and i believe that mr . spilett would rather keep his note - book than his match - box . """,21
