text,ind
"his softened voice announced that he was subdued ; so i , in my turn , became calm .",14
"little things recall us to earth ; the clock struck in the hall ; that sufficed ; i turned from moon and stars , opened a side- door , and went in .",18
""" by the way , "" i asked suddenly , stopping and turning upon stamford , "" how the deuce did he know that i had come from afghanistan ? """,12
"that night my sleep was fitful . hope and fear besieged me by turns . i got up several times . the nautilus continued groping . near three o'clock in the morning , i observed that we encountered the ice bank 's underbelly at a depth of only fifty meters . so only 150 feet separated us from the surface of the water . little by little the ice bank was turning into an ice field again . the mountains were changing back into plains .",13
"that night my sleep was fitful . hope and fear besieged me by turns . i got up several times . the nautilus continued groping . near three o'clock in the morning , i observed that we encountered the ice bank 's underbelly at a depth of only fifty meters . so only 150 feet separated us from the surface of the water . little by little the ice bank was turning into an ice field again . the mountains were changing back into plains .",71
""" my dear harry , my dear basil , you must both congratulate me ! "" said the lad , throwing off his evening cape with its satin - lined wings and shaking each of his friends by the hand in turn . "" i have never been so happy . of course , it is sudden-- all really delightful things are . and yet it seems to me to be the one thing i have been looking for all my life . "" he was flushed with excitement and pleasure , and looked extraordinarily handsome .",41
"barrymore was crouching at the window with the candle held against the glass . his profile was half turned towards me , and his face seemed to be rigid with expectation as he stared out into the blackness of the moor . for some minutes he stood watching intently . then he gave a deep groan and with an impatient gesture he put out the light . instantly i made my way back to my room , and very shortly came the stealthy steps passing once more upon their return journey . long afterwards when i had fallen into a light sleep i heard a key turn somewhere in a lock , but i could not tell whence the sound came . what it all means i can not guess , but there is some secret business going on in this house of gloom which sooner or later we shall get to the bottom of . i do not trouble you with my theories , for you asked me to furnish you only with facts . i have had a long talk with sir henry this morning , and we have made a plan of campaign founded upon my observations of last night . i will not speak about it just now , but it should make my next report interesting reading .",18
"barrymore was crouching at the window with the candle held against the glass . his profile was half turned towards me , and his face seemed to be rigid with expectation as he stared out into the blackness of the moor . for some minutes he stood watching intently . then he gave a deep groan and with an impatient gesture he put out the light . instantly i made my way back to my room , and very shortly came the stealthy steps passing once more upon their return journey . long afterwards when i had fallen into a light sleep i heard a key turn somewhere in a lock , but i could not tell whence the sound came . what it all means i can not guess , but there is some secret business going on in this house of gloom which sooner or later we shall get to the bottom of . i do not trouble you with my theories , for you asked me to furnish you only with facts . i have had a long talk with sir henry this morning , and we have made a plan of campaign founded upon my observations of last night . i will not speak about it just now , but it should make my next report interesting reading .",106
""" yes , i have a turn both for observation and for deduction . the theories which i have expressed there , and which appear to you to be so chimerical are really extremely practical — so practical that i depend upon them for my bread and cheese . """,6
it was now athos who turned pale .,5
""" you may guess , finding the luck turned , that i again staked the diamond . """,8
"the lad was not joking in saying this , for he knew how this intelligent race could be turned to account .",18
""" now he is gone , it is your turn to get out , "" said mme . bonacieux . "" courage , my friend , but above all , prudence , and think what you owe to the queen . """,9
"he flung himself down on the sofa and turned away his face . "" you have killed my love , "" he muttered .",8
it was d’artagnan who now shook his head in his turn .,10
"she wept silently , and made no answer , but crept nearer . her little hands stretched blindly out , and appeared to be seeking for him . he turned on his heel and left the room . in a few moments he was out of the theatre .",29
"during the day the bodies of the apes were carried into the wood , where they were buried ; then the settlers busied themselves in repairing the disorder caused by the intruders , disorder but not damage , for although they had turned everything in the rooms topsy - turvy , yet they had broken nothing .",42
"he had doublets cut out of his old clothes and cast - off cloaks for mousqueton , and thanks to a very intelligent tailor , who made his clothes look as good as new by turning them , and whose wife was suspected of wishing to make porthos descend from his aristocratic habits , mousqueton made a very good figure when attending on his master .",35
"this was true : and while he spoke my very conscience and reason turned traitors against me , and charged me with crime in resisting him .",13
milady plainly perceived that it was now her turn to take part in the scene .,8
"the western border of the plateau now remained between the turn of the river and the southern angle of the lake , a distance of about a mile , which was open to all comers .",10
"we had no time to watch these phenomena ; we had to proceed on our way . soon at the foot of the mountains the boggy land reappeared , intersected by little lakes . our route now lay westward ; we had turned the great bay of faxa , and the twin peaks of snæfell rose white into the cloudy sky at the distance of at least five miles .",42
""" shall we turn back ? """,3
he turned away ; he threw himself on his face on the sofa .,1
""" an enormous block of ice , an entire mountain , has toppled over , "" he answered me . "" when an iceberg is eroded at the base by warmer waters or by repeated collisions , its center of gravity rises . then it somersaults , it turns completely upside down . that 's what happened here . when it overturned , one of these blocks hit the nautilus as it was cruising under the waters . sliding under our hull , this block then raised us with irresistible power , lifting us into less congested strata where we now lie on our side . """,48
"with a few broken words of gratitude the man turned , but he hesitated and then came back .",9
"now , one evening when d’artagnan , who was in the trenches , was not able to accompany them , athos , porthos , and aramis , mounted on their battle steeds , enveloped in their war cloaks , with their hands upon their pistol butts , were returning from a drinking place called the red dovecot , which athos had discovered two days before upon the route to jarrie , following the road which led to the camp and quite on their guard , as we have stated , for fear of an ambuscade , when , about a quarter of a league from the village of boisnau , they fancied they heard the sound of horses approaching them . they immediately all three halted , closed in , and waited , occupying the middle of the road . in an instant , and as the moon broke from behind a cloud , they saw at a turning of the road two horsemen who , on perceiving them , stopped in their turn , appearing to deliberate whether they should continue their route or go back .",173
""" well , sir henry , your uncle had a letter that morning . he had usually a great many letters , for he was a public man and well known for his kind heart , so that everyone who was in trouble was glad to turn to him . but that morning , as it chanced , there was only this one letter , so i took the more notice of it . it was from coombe tracey , and it was addressed in a woman 's hand . """,46
""" who are you ? "" said the same voice , in the same commanding tone . "" answer in your turn , or you may repent of your disobedience . """,21
"lastly , the time had come for turning the balloon - case to use , by cutting it up to make shirts and other articles ; for as to keeping it in its present form , and risking themselves in a balloon filled with gas , above a sea of the limits of which they had no idea , it was not to be thought of .",7
ned was right . it was too beautiful . all at once a yell from conseil made me turn around .,18
"i was hateful in my own eyes . still i could not turn , nor retrace one step .",12
""" i do n't know what you mean , basil , "" he exclaimed , turning round . "" i do n't know what you want . what do you want ? """,15
""" it is indeed a pressure gauge . it 's placed in contact with the water , and it indicates the outside pressure on our hull , which in turn gives me the depth at which my submersible is sitting . """,29
"porthos succeeded him ; and thanks to one of those disappearances to which he was accustomed , he was able to provide for the wants of all for a fortnight . at last it became aramis ’s turn , who performed it with a good grace and who succeeded -- as he said , by selling some theological books -- in procuring a few pistoles .",37
"and then he thought of his preservers -- those who had made him again a man , and an honest mm , those to whom he owed all -- murdered without pity , their works destroyed , their island turned into a pirates ' den !",39
"mr . fogg turned to aouda and asked her ,",3
""" all right then ; limpid , salubrious : no gush of bilge water had turned it to fetid puddle .",15
"when fate wronged me , i had not the wisdom to remain cool : i turned desperate ; then i degenerated .",15
""" old woman be damned ! "" said sherlock holmes , sharply . "" we were the old women to be so taken in . it must have been a young man , and an active one , too , besides being an incomparable actor . the get - up was inimitable . he saw that he was followed , no doubt , and used this means of giving me the slip . it shows that the man we are after is not as lonely as i imagined he was , but has friends who are ready to risk something for him . now , doctor , you are looking done - up . take my advice and turn in . """,118
""" that depends on how it turns out . """,6
""" he wo n't turn down your assistance . come along , ned . """,4
"two men , whom you will find at the door on going out , will serve you as escort . you will allow me to leave first ; then , after half an hour , you can go away in your turn . """,41
"the next day , march 26 , i returned to my miner 's trade , working to remove the fifth meter . the ice bank 's side walls and underbelly had visibly thickened . obviously they would come together before the nautilus could break free . for an instant i was gripped by despair . my pick nearly slipped from my hands . what was the point of this digging if i was to die smothered and crushed by this water turning to stone , a torture undreamed of by even the wildest savages ! i felt like i was lying in the jaws of a fearsome monster , jaws irresistibly closing .",81
""" very well , now it is our turn . """,8
""" a terrible change came over the woman 's face as i asked the question . her features turned perfectly livid . it was some seconds before she could get out the single word ' yes'—and when it did come it was in a husky unnatural tone .",18
""" tell him also that i am acquainted with all the details of the adventure at amiens ; that i will have a little romance made of it , wittily turned , with a plan of the garden and portraits of the principal actors in that nocturnal romance . """,30
""" in order to steer this boat to port or starboard , in short , to make turns on a horizontal plane , i use an ordinary , wide - bladed rudder that 's fastened to the rear of the sternpost and worked by a wheel and tackle . but i can also move the nautilus upward and downward on a vertical plane by the simple method of slanting its two fins , which are attached to its sides at its center of flotation ; these fins are flexible , able to assume any position , and can be operated from inside by means of powerful levers . if these fins stay parallel with the boat , the latter moves horizontally . if they slant , the nautilus follows the angle of that slant and , under its propeller 's thrust , either sinks on a diagonal as steep as it suits me , or rises on that diagonal . and similarly , if i want to return more swiftly to the surface , i throw the propeller in gear , and the water 's pressure makes the nautilus rise vertically , as an air balloon inflated with hydrogen lifts swiftly into the skies . """,17
"instinctively i turned my face again to the village ; i found the shop again , and i went in ; and though others were there besides the woman i ventured the request--""would she give me a roll for this handkerchief ? """,2
""" bring it in , mr . hubbard , please , "" he said , wearily , turning round . "" i am sorry i kept you so long . i was thinking of something else . """,17
""" if i should be killed , one of you must take it , and continue the route ; if he be killed , it will be another ’s turn , and so on -- provided a single one arrives , that is all that is required . """,29
""" ' i do not know , ' she answered , turning white to her very lips .",11
"his eye fell on the yellow book that lord henry had sent him . what was it , he wondered . he went towards the little , pearl - coloured octagonal stand that had always looked to him like the work of some strange egyptian bees that wrought in silver , and taking up the volume , flung himself into an arm - chair and began to turn over the leaves . after a few minutes he became absorbed . it was the strangest book that he had ever read . it seemed to him that in exquisite raiment , and to the delicate sound of flutes , the sins of the world were passing in dumb show before him . things that he had dimly dreamed of were suddenly made real to him . things of which he had never dreamed were gradually revealed .",67
"i almost expected a rebuff for this hardly well - timed question , but , on the contrary , waking out of his scowling abstraction , he turned his eyes towards me , and the shade seemed to clear off his brow .",27
"to the hill , then , i turned . i reached it .",7
"and now , thanks to the knowledge of their captain , and their own intelligence , they were regular colonists , furnished with arms , tools , and instruments ; they had been able to turn to their profit the animals , plants , and minerals of the island , that is to say , the three kingdoms of nature .",35
"then she cried , "" ahem ! "" under cover of the mea culpa , striking her breast so vigorously that everybody , even the lady with the red cushion , turned round toward her . porthos paid no attention . nevertheless , he understood it all , but was deaf .",31
"i sought in her countenance and features a likeness to mr . rochester , but found none : no trait , no turn of expression announced relationship .",22
"then he turned his attention to embroideries and to the tapestries that performed the office of frescoes in the chill rooms of the northern nations of europe . as he investigated the subject-- and he always had an extraordinary faculty of becoming absolutely absorbed for the moment in whatever he took up -- he was almost saddened by the reflection of the ruin that time brought on beautiful and wonderful things . he , at any rate , had escaped that . summer followed summer , and the yellow jonquils bloomed and died many times , and nights of horror repeated the story of their shame , but he was unchanged . no winter marred his face or stained his flowerlike bloom .",2
"i meditated wonderingly on this incident ; but gradually quitting it , as i found it for the present inexplicable , i turned to the consideration of my master 's manner to myself .",22
"when she was only about three steps from him , he turned his head round , fixing his eyes steadfastly upon the lady with the red cushion , who had risen and was approaching , followed by her black boy and her woman .",11
""" it seemed to me that my sudden appearance might shake his nerves and lead him to say something unguarded . the boots volunteered to show me the room : it was on the second floor , and there was a small corridor leading up to it . the boots pointed out the door to me , and was about to go downstairs again when i saw something that made me feel sickish , in spite of my twenty years ' experience . from under the door there curled a little red ribbon of blood , which had meandered across the passage and formed a little pool along the skirting at the other side . i gave a cry , which brought the boots back . he nearly fainted when he saw it . the door was locked on the inside , but we put our shoulders to it , and knocked it in . the window of the room was open , and beside the window , all huddled up , lay the body of a man in his nightdress . he was quite dead , and had been for some time , for his limbs were rigid and cold . when we turned him over , the boots recognized him at once as being the same gentleman who had engaged the room under the name of joseph stangerson . the cause of death was a deep stab in the left side , which must have penetrated the heart . and now comes the strangest part of the affair . what do you suppose was above the murdered man ? """,204
"the engineer made a turning - lathe , with which he turned several articles both for the toilet and the kitchen , particularly buttons , the want of which was greatly felt .",11
"he was walking home about eleven o'clock from lord henry 's , where he had been dining , and was wrapped in heavy furs , as the night was cold and foggy . at the corner of grosvenor square and south audley street , a man passed him in the mist , walking very fast and with the collar of his grey ulster turned up . he had a bag in his hand . dorian recognized him . it was basil hallward . a strange sense of fear , for which he could not account , came over him . he made no sign of recognition and went on quickly in the direction of his own house .",63
"they sawed , they planed , they filed , they turned ; and during the whole of this bad season , nothing was heard but the grinding of tools or the humming of the turning - lathe which responded to the growling of the thunder .",10
"he brushed their clothes , he turned the spit , he waited at table , he swept the rooms , he gathered wood , and he performed another admirable piece of service which delighted pencroft -- he never went to sleep without first coming to tuck up the worthy sailor in his bed .",6
"as he spoke he turned the contents of the wine glass into a saucer and placed it in front of the terrier , who speedily licked it dry . sherlock holmes ' earnest demeanour had so far convinced us that we all sat in silence , watching the animal intently , and expecting some startling effect . none such appeared , however . the dog continued to lie stretched upon the cushion , breathing in a laboured way , but apparently neither the better nor the worse for its draught .",4
"i wo n't tell you that i do n't want to preach to you . i remember harry saying once that every man who turned himself into an amateur curate for the moment always began by saying that , and then proceeded to break his word . i do want to preach to you . i want you to lead such a life as will make the world respect you . i want you to have a clean name and a fair record . i want you to get rid of the dreadful people you associate with . do n't shrug your shoulders like that . do n't be so indifferent . you have a wonderful influence . let it be for good , not for evil . they say that you corrupt every one with whom you become intimate , and that it is quite sufficient for you to enter a house for shame of some kind to follow after . i do n't know whether it is so or not . how should i know ? but it is said of you . i am told things that it seems impossible to doubt .",24
""" to see my soul ! "" muttered dorian gray , starting up from the sofa and turning almost white from fear .",17
""" seeing you constantly surrounded by musketeers of a very superb appearance , and knowing that these musketeers belong to monsieur de treville , and were consequently enemies of the cardinal , i thought that you and your friends , while rendering justice to your poor queen , would be pleased to play his eminence an ill turn . """,57
""" just give me a help with this buckle , cabman , "" he said , kneeling over his task , and never turning his head .",23
"he turned round . "" what i have to say is this , "" he cried . "" you must give me some answer to these horrible charges that are made against you . if you tell me that they are absolutely untrue from beginning to end , i shall believe you . deny them , dorian , deny them ! ca n't you see what i am going through ? my god ! do n't tell me that you are bad , and corrupt , and shameful . """,1
"when they reached the top landing , dorian set the lamp down on the floor , and taking out the key , turned it in the lock . "" you insist on knowing , basil ? "" he asked in a low voice .",22
""" it is evident , "" i cried , "" the marine deposits formed in the second period , these shales , limestones , and sandstones . we are turning away from the primary granite . we are just as if we were people of hamburg going to lübeck by way of hanover ! """,29
"he took the money which athos offered to him , and after turning and turning it over and over in his hands , suddenly cried out that it was bad , and that he would have him and his companions arrested as forgers .",12
"he took the money which athos offered to him , and after turning and turning it over and over in his hands , suddenly cried out that it was bad , and that he would have him and his companions arrested as forgers .",14
"pencroft had asked to be allowed to "" blow "" in his turn , and it was great fun for him ; but he blew so hard that his productions took the most ridiculous shapes , which he admired immensely .",12
""" but i must die if i am turned away . """,8
""" perhaps there may be some valuable substance in this volcano , which it will spout forth , and which we may turn to good account ! """,22
"the sun had set and dusk was settling over the moor . the air had turned chill and we withdrew into the hut for warmth . there , sitting together in the twilight , i told holmes of my conversation with the lady . so interested was he that i had to repeat some of it twice before he was satisfied .",15
"at the noise he made in pushing the bolt , milady turned round .",11
"the cart , or rather a sort of light carriole which had replaced it , made frequent journeys to the corral , and when it was pencroft 's turn to go he took jup , and let him drive , and jup , cracking his whip , acquitted himself with his customary intelligence .",28
"he was awaiting one of two events , either the appearance of a vertical well opening before his feet , down which our descent might be resumed , or that of some obstacle which should effectually turn us back on our own footsteps . but evening came and neither wish was gratified .",36
"then he remembered the lamp . it was a rather curious one of moorish workmanship , made of dull silver inlaid with arabesques of burnished steel , and studded with coarse turquoises . perhaps it might be missed by his servant , and questions would be asked . he hesitated for a moment , then he turned back and took it from the table . he could not help seeing the dead thing . how still it was ! how horribly white the long hands looked ! it was like a dreadful wax image .",56
"mount franklin , distant about six miles , now appeared like a gigantic torch , around the summit of which turned fuliginous flames .",20
a terrible scream -- a prolonged yell of horror and anguish -- burst out of the silence of the moor . that frightful cry turned the blood to ice in my veins .,24
"he turned round , and leaning upon his elbow , began to sip his chocolate . the mellow november sun came streaming into the room . the sky was bright , and there was a genial warmth in the air . it was almost like a morning in may .",1
""" and the sago ? "" "" never mind it at present : i shall be coming down before teatime : i 'll make it myself . "" the cook here turned to me , saying that mrs . fairfax was waiting for me : so i departed .",31
""" a seal hunt ! "" cried the sailor , turning towards gideon spilett .",10
at last the door opened and his servant entered . he turned glazed eyes upon him .,11
"yes , a dangerous matter — so dangerous that even the most saintly dared only whisper their religious opinions with bated breath , lest something which fell from their lips might be misconstrued , and bring down a swift retribution upon them . the victims of persecution had now turned persecutors on their own account , and persecutors of the most terrible description . not the inquisition of seville , nor the german vehm - gericht , nor the secret societies of italy , were ever able to put a more formidable machinery in motion than that which cast a cloud over the state of utah .",49
