text,ind
""" i had intended never to enter your house again , gray . but you said it was a matter of life and death . "" his voice was hard and cold . he spoke with slow deliberation . there was a look of contempt in the steady searching gaze that he turned on dorian . he kept his hands in the pockets of his astrakhan coat , and seemed not to have noticed the gesture with which he had been greeted .",52
"with feverish haste we had turned the body over , and that dripping beard was pointing up to the cold , clear moon . there could be no doubt about the beetling forehead , the sunken animal eyes . it was indeed the same face which had glared upon me in the light of the candle from over the rock -- the face of selden , the criminal .",5
"-""i will trust you . if i were a masterless and stray dog , i know that you would not turn me from your hearth to - night : as it is , i really have no fear .",20
"he was passing through the door , when he turned , with flushed face and flashing eyes . "" it were better for you , john ferrier , "" he thundered , "" that you and she were now lying blanched skeletons upon the sierra blanco , than that you should put your weak wills against the orders of the holy four ! "" with a threatening gesture of his hand , he turned from the door , and ferrier heard his heavy step scrunching along the shingly path .",9
"he was passing through the door , when he turned , with flushed face and flashing eyes . "" it were better for you , john ferrier , "" he thundered , "" that you and she were now lying blanched skeletons upon the sierra blanco , than that you should put your weak wills against the orders of the holy four ! "" with a threatening gesture of his hand , he turned from the door , and ferrier heard his heavy step scrunching along the shingly path .",73
""" you must have something to do with it . wait , wait a moment ; listen to me . only listen , alan . all i ask of you is to perform a certain scientific experiment . you go to hospitals and dead - houses , and the horrors that you do there do n't affect you . if in some hideous dissecting - room or fetid laboratory you found this man lying on a leaden table with red gutters scooped out in it for the blood to flow through , you would simply look upon him as an admirable subject . you would not turn a hair . you would not believe that you were doing anything wrong . on the contrary , you would probably feel that you were benefiting the human race , or increasing the sum of knowledge in the world , or gratifying intellectual curiosity , or something of that kind .",106
"there were few or no bridges or tunnels on the route . the railway turned around the sides of the mountains , and did not attempt to violate nature by taking the shortest cut from one point to another .",14
"after two or three minutes of terrible silence , dorian turned round and came and stood behind him , putting his hand upon his shoulder .",10
"from this point the road , running along humboldt river , passed northward for several miles by its banks ; then it turned eastward , and kept by the river until it reached the humboldt range , nearly at the extreme eastern limit of nevada .",22
""" yes , it is my turn to dictate terms , alan . you know what they are . the thing is quite simple . come , do n't work yourself into this fever . the thing has to be done . face it , and do it . """,6
"on the third day i was better ; on the fourth , i could speak , move , rise in bed , and turn .",23
"i was about again to revert to the probability of a union between mr . rochester and the beautiful blanche ; but adele came in , and the conversation was turned into another channel .",30
"as the chime struck one , campbell turned round , and looking at dorian gray , saw that his eyes were filled with tears . there was something in the purity and refinement of that sad face that seemed to enrage him . "" you are infamous , absolutely infamous ! "" he muttered .",7
""" and harpoons , sir , "" the canadian said , "" if you do n't turn down my help . """,16
my friend spoke in his frankest and most unconcerned manner . stapleton still looked hard at him . then he turned to me .,20
"thereupon she ran toward the carriage , which had turned round toward the way it came , jumped upon the step , and the carriage drove off .",9
"planchet turned and returned the billet . then , accustomed to passive obedience , he jumped down from the terrace , ran toward the lane , and at the end of twenty paces met d’artagnan , who , having seen all , was coming to him .",1
"we had above us a league and a half of terrestrial crust . the weight of it seemed to be crushing down upon my shoulders . i felt weighed down , and i exhausted myself with imaginary violent exertions to turn round upon my granite couch .",40
"there he stopped , feeling afraid to turn round , and his eyes fixed themselves on the intricacies of the pattern before him . he heard campbell bringing in the heavy chest , and the irons , and the other things that he had required for his dreadful work . he began to wonder if he and basil hallward had ever met , and , if so , what they had thought of each other .",7
"he turned and hurried out , just conscious that the dead man had been thrust back into the chair and that campbell was gazing into a glistening yellow face . as he was going downstairs , he heard the key being turned in the lock .",1
"he turned and hurried out , just conscious that the dead man had been thrust back into the chair and that campbell was gazing into a glistening yellow face . as he was going downstairs , he heard the key being turned in the lock .",41
"the charwoman was going on ; but here leah turned and perceived me , and she instantly gave her companion a nudge .",9
""" my faith , gentlemen , "" said porthos , turning round upon his chair and twisting his mustache , "" that ’s a fair bet , i hope . """,10
""" she is still décolletée , "" he answered , taking an olive in his long fingers ; "" and when she is in a very smart gown she looks like an édition de luxe of a bad french novel . she is really wonderful , and full of surprises . her capacity for family affection is extraordinary . when her third husband died , her hair turned quite gold from grief . """,67
"the cavalcade , following the sweep of the drive , quickly turned the angle of the house , and i lost sight of it .",11
"captain nemo inserted his cranium into its spherical headgear . conseil and i did the same , but not without hearing the canadian toss us a sarcastic "" happy hunting . "" on top , the suit ended in a collar of threaded copper onto which the metal helmet was screwed . three holes , protected by heavy glass , allowed us to see in any direction with simply a turn of the head inside the sphere . placed on our backs , the rouquayrol device went into operation as soon as it was in position , and for my part , i could breathe with ease .",70
""" and though , "" i continued , rather severely , "" you wished to turn me from the door , on a night when you should not have shut out a dog . """,15
""" be punished alone , for the first , miserable man ! "" said lord de winter to felton , who was being dragged away with his eyes turned toward the sea ; "" but i swear to you by the memory of my brother whom i have loved so much that your accomplice is not saved . """,28
"passepartout found that he could not avoid telling his master what had occurred , and , with hanging head , he was turning towards the car , when the engineer , a true yankee , named forster called out , "" gentlemen , perhaps there is a way , after all , to get over . """,22
""" eighty chances ! "" replied the passenger , turning his back on him .",9
""" i may never be tried , "" he answered . "" you need n't look startled . it is n't suicide i am thinking of . are you a doctor ? "" he turned his fierce dark eyes upon me as he asked this last question .",34
"in fact , in crossing the city two or three accidents of this kind happened ; but buckingham did not even turn his head to see what became of those he had knocked down . d’artagnan followed him amid cries which strongly resembled curses .",21
"with discretion d’artagnan remained behind ; but at the moment when buckingham crossed the threshold , he turned round , and seeing the hesitation of the young man , "" come in ! "" cried he , "" and if you have the good fortune to be admitted to her majesty ’s presence , tell her what you have seen . """,17
"a smile curved lord henry 's lips , and he turned round and looked at dorian .",10
"i say 150 meters , although i had no instruments for estimating this distance . but i knew that the sun 's rays , even in the clearest seas , could reach no deeper . so at precisely this point the darkness became profound . not a single object was visible past ten paces . consequently , i had begun to grope my way when suddenly i saw the glow of an intense white light . captain nemo had just activated his electric device . his companion did likewise . conseil and i followed suit . by turning a switch , i established contact between the induction coil and the glass spiral , and the sea , lit up by our four lanterns , was illuminated for a radius of twenty - five meters .",97
"but the skies became more and more threatening . there were conspicuous signs of a hurricane on the way . the atmosphere was turning white and milky . slender sheaves of cirrus clouds were followed on the horizon by layers of nimbocumulus . other low clouds fled swiftly . the sea grew towering , inflated by long swells . every bird had disappeared except a few petrels , friends of the storms . the barometer fell significantly , indicating a tremendous tension in the surrounding haze . the mixture in our stormglass decomposed under the influence of the electricity charging the air . a struggle of the elements was approaching .",23
""" exactly . this chance of the picture has supplied us with one of our most obvious missing links . we have him , watson , we have him , and i dare swear that before to - morrow night he will be fluttering in our net as helpless as one of his own butterflies . a pin , a cork , and a card , and we add him to the baker street collection ! "" he burst into one of his rare fits of laughter as he turned away from the picture . i have not heard him laugh often , and it has always boded ill to somebody .",89
""" ' we 'll soon have a light , ' i said , striking a match and putting it to a wax candle which i had brought with me . ' now , enoch drebber , ' i continued , turning to him , and holding the light to my own face , ' who am i ? '",40
"on thursday , at 8 a.m. , we started afresh . the granite tunnel winding from side to side , earned us past unexpected turns , and seemed almost to form a labyrinth ; but , on the whole , its direction seemed to be south - easterly . my uncle never ceased to consult his compass , to keep account of the ground gone over .",24
"aouda turned pale , and her blood ran cold . she seized mr . fogg 's arm and gently pulled him back . passepartout was ready to pounce upon the american , who was staring insolently at his opponent . but fix got up , and , going to colonel proctor said , "" you forget that it is i with whom you have to deal , sir ; for it was i whom you not only insulted , but struck ! """,1
i turned my face away to conceal a smile i could not suppress : there was something ludicrous as well as painful in the little parisienne 's earnest and innate devotion to matters of dress .,1
"my blood turned cold in my veins ! i saw that we were under threat from a fearsome pair of sharks . they were blue sharks , dreadful man - eaters with enormous tails , dull , glassy stares , and phosphorescent matter oozing from holes around their snouts . they were like monstrous fireflies that could thoroughly pulverize a man in their iron jaws ! i do n't know if conseil was busy with their classification , but as for me , i looked at their silver bellies , their fearsome mouths bristling with teeth , from a viewpoint less than scientific-- more as a victim than as a professor of natural history .",2
""" all right , sir , "" answered the man , "" you will be there in an hour , "" and after his fare had got in he turned his horse round and drove rapidly towards the river .",29
"the sea is of no great depth at the grand banks . a few hundred fathoms at best . but to the south there is a deep , suddenly occurring depression , a 3,000-meter pit . here the gulf stream widens . its waters come to full bloom . it loses its speed and temperature , but it turns into a sea .",58
"arrived at the bastion , the four friends turned round .",8
"where harding 's engineering qualifications now came into play was in the construction of the machine for pressing the wool ; for he knew how to turn ingeniously to profit the mechanical force , hitherto unused , which the waterfall on the beach possessed to move a fulling - mill .",26
"she was a charming woman of twenty - five or twenty - six years , with dark hair , blue eyes , and a nose slightly turned up , admirable teeth , and a complexion marbled with rose and opal .",26
""" considerable importance , "" replied the engineer ; "" for if it flows through the cliff there is probably some cavity , which it would be easy to render habitable after turning away the water . """,32
"in fact , a balloon , as a ball might be carried on the summit of a waterspout , had been taken into the circling movement of a column of air and had traversed space at the rate of ninety miles an hour , turning round and round as if seized by some aerial maelstrom .",44
"i feared -- or should i say , hoped?--the allusion to me would make mr . rochester glance my way ; and i involuntarily shrank farther into the shade : but he never turned his eyes .",33
"meanwhile , turning , the nautilus made a circle around the sinking ship , and for an instant i could read the board on its stern : the florida",2
"cyrus harding examined the cylinder attentively , then , turning to pencroft,--",9
""" you had better go home and put that pistol away , or you may get into trouble , "" said dorian , turning on his heel and going slowly down the street .",23
"not that i ever suffered much from them ; i took care to turn the tables . what tricks theodore and i used to play on our miss wilsons , and mrs . greys , and madame jouberts ! mary was always too sleepy to join in a plot with spirit .",13
""" and if i let a gust of wind or a sprinkling of rain turn me aside from these easy tasks , what preparation would such sloth be for the future i propose to myself ? """,14
""" no , never : we might do what we pleased ; ransack her desk and her workbox , and turn her drawers inside out ; and she was so good - natured , she would give us anything we asked for . """,20
""" no , sir , you shall not go alone , "" cried the captain , touched in spite of himself . "" no ! you are a brave man . thirty volunteers ! "" he added , turning to the soldiers .",38
"the young woman and the young man , without taking the trouble to shut the door after them , descended the rue des fossoyeurs rapidly , turned into the rue des fosses - monsieur - le - prince , and did not stop till they came to the place st . sulpice .",26
"the brother did not perceive this ; he had turned round to play with milady ’s favorite monkey , which had pulled him by the doublet .",9
the englishman then turned round and described the combat without omitting a single detail .,3
suddenly turning round i observed that i was alone .,1
""" and you , my boy , give us your opinion , "" said the engineer , turning to herbert .",17
the conversation took a cheerful turn .,5
"and the four friends rushed out of the fort , gained the field of battle , picked up the four muskets of the privates and the half - pike of the brigadier , and convinced that the fugitives would not stop till they reached the city , turned again toward the bastion , bearing with them the trophies of their victory .",47
""" that is well , "" said mme . bonacieux . "" now , in my turn , let me give you my instructions . """,16
"i must thus arrive at the point where i had left the stream , that fatal turn in the road . with the stream at my feet , i might hope to regain the summit of snæfell .",16
""" certainly , though i can not guarantee that i carry all the facts in my mind . intense mental concentration has a curious way of blotting out what has passed . the barrister who has his case at his fingers ' ends , and is able to argue with an expert upon his own subject finds that a week or two of the courts will drive it all out of his head once more . so each of my cases displaces the last , and mlle . carere has blurred my recollection of baskerville hall . to - morrow some other little problem may be submitted to my notice which will in turn dispossess the fair french lady and the infamous upwood . so far as the case of the hound goes , however , i will give you the course of events as nearly as i can , and you will suggest anything which i may have forgotten .",113
""" now , dent , "" continued mr . rochester , "" it is your turn . """,15
"the duchess turned and looked at dorian gray with a curious expression in her eyes . "" what do you say to that , mr . gray ? "" she inquired .",2
"the name of porthos produced its effect upon the clerks , who began to laugh ; but porthos turned sharply round , and every countenance quickly recovered its gravity .",18
""" it is a formidable difficulty , and i fear that you ask too much when you expect me to solve it . the past and the present are within the field of my inquiry , but what a man may do in the future is a hard question to answer . mrs . stapleton has heard her husband discuss the problem on several occasions . there were three possible courses . he might claim the property from south america , establish his identity before the british authorities there and so obtain the fortune without ever coming to england at all ; or he might adopt an elaborate disguise during the short time that he need be in london ; or , again , he might furnish an accomplice with the proofs and papers , putting him in as heir , and retaining a claim upon some proportion of his income . we can not doubt from what we know of him that he would have found some way out of the difficulty . and now , my dear watson , we have had some weeks of severe work , and for one evening , i think , we may turn our thoughts into more pleasant channels . i have a box for ' les huguenots . ' have you heard the de reszkes ? might i trouble you then to be ready in half an hour , and we can stop at marcini 's for a little dinner on the way ? """,200
""" even so , captain nemo , "" i went on , ignoring his ironic turn of phrase , "" the nautilus has run aground at a moment when the sea is full . now then , the tides are n't strong in the pacific , and if you ca n't unballast the nautilus , which seems impossible to me , i do n't see how it will float off . """,15
"i turned , and miss ingram darted forwards from her sofa : the others , too , looked up from their several occupations ; for at the same time a crunching of wheels and a splashing tramp of horse - hoofs became audible on the wet gravel . a post - chaise was approaching .",1
""" no -- stop ! "" interrupted colonel dent . "" do n't send her away , eshton ; we might turn the thing to account ; better consult the ladies . """,21
"at this thought , i turned my face aside from the lovely sky of eve and lonely vale of morton -- i say _ lonely _ , for in that bend of it visible to me there was no building apparent save the church and the parsonage , half - hid in trees , and , quite at the extremity , the roof of vale hall , where the rich mr . oliver and his daughter lived .",5
""" but , "" said porthos , "" i think i have an idea , in my turn . """,17
"an hour after , the henrietta passed the lighthouse which marks the entrance of the hudson , turned the point of sandy hook , and put to sea . during the day she skirted long island , passed fire island , and directed her course rapidly eastward .",17
"as you know , at the turn of the tide , the waters confined between the faroe and lofoten islands rush out with irresistible violence . they form a vortex from which no ship has ever been able to escape . monstrous waves race together from every point of the horizon . they form a whirlpool aptly called "" the ocean 's navel , "" whose attracting power extends a distance of fifteen kilometers . it can suck down not only ships but whales , and even polar bears from the northernmost regions .",6
"fix , it must be confessed , understood nothing of what was going on . the conquest of the henrietta , the bribery of the crew , fogg managing the boat like a skilled seaman , amazed and confused him . he did not know what to think . for , after all , a man who began by stealing fifty - five thousand pounds might end by stealing a vessel ; and fix was not unnaturally inclined to conclude that the henrietta under fogg 's command , was not going to liverpool at all , but to some part of the world where the robber , turned into a pirate , would quietly put himself in safety . the conjecture was at least a plausible one , and the detective began to seriously regret that he had embarked on the affair .",107
"dorian watched them as they plunged into the alder - clump , brushing the lithe swinging branches aside . in a few moments they emerged , dragging a body after them into the sunlight . he turned away in horror . it seemed to him that misfortune followed wherever he went . he heard sir geoffrey ask if the man was really dead , and the affirmative answer of the keeper . the wood seemed to him to have become suddenly alive with faces . there was the trampling of myriad feet and the low buzz of voices . a great copper- breasted pheasant came beating through the boughs overhead .",36
""" a positive feast ! "" cried m. coquenard , turning about in his chair , "" a real feast , epulce epulorum . lucullus dines with lucullus . """,10
""" you can hardly fail to be better , for you have slept quietly . hans and i watched you by turns , and we have noticed you were evidently recovering . """,21
""" ass ! "" replied the detective , shrugging his shoulders and turning on his heel .",12
"dorian put the letter into his pocket . "" tell her grace that i am coming in , "" he said , coldly . the man turned round and went rapidly in the direction of the house .",26
"{ during all that time she never turned a page : p184.jpg } meantime , mary ingram , amy and louisa eshton , declared they dared not go alone ; and yet they all wished to go .",7
"in the midst of the tumult , and while my eyes and ears were fully engaged in the scene before me , i heard a hem close at my elbow : i turned , and saw sam .",32
"he lifted his gaze , too , from the daisies , and turned it on her . an unsmiling , a searching , a meaning gaze it was .",12
""" why do n't you turn pale ? """,5
"she turned , but in a moment returned .",1
"athos waved his flag , turning his back on the guards of the city , and saluting those of the camp .",5
"and then she would pout like a disappointed child ; a pensive cloud would soften her radiant vivacity ; she would withdraw her hand hastily from his , and turn in transient petulance from his aspect , at once so heroic and so martyr - like .",29
"this promontory , of which they had turned the point , must be attached to the mainland .",7
"dorian rose up from the piano and passed his hand through his hair . "" yes , life has been exquisite , "" he murmured , "" but i am not going to have the same life , harry . and you must not say these extravagant things to me . you do n't know everything about me . i think that if you did , even you would turn from me . you laugh . do n't laugh . """,69
""" for to - morrow , monday , "" said mr . fogg , turning to aouda .",14
""" the flame flickers in the eye ; the eye shines like dew ; it looks soft and full of feeling ; it smiles at my jargon : it is susceptible ; impression follows impression through its clear sphere ; where it ceases to smile , it is sad ; an unconscious lassitude weighs on the lid : that signifies melancholy resulting from loneliness . it turns from me ; it will not suffer further scrutiny ; it seems to deny , by a mocking glance , the truth of the discoveries i have already made,--to disown the charge both of sensibility and chagrin : its pride and reserve only confirm me in my opinion .",66
"both went into the bedroom , and as the door of communication remained open , d’artagnan could hear milady for some time scolding her maid . she was at length appeased , and the conversation turned upon him while kitty was assisting her mistress .",35
"d’artagnan refused ; but thinking the opportunity a good one , he begged him to have the diamond he put into his hand valued , as he wished to turn it into money .",29
"so much has religion done for me ; turning the original materials to the best account ; pruning and training nature . but she could not eradicate nature : nor will it be eradicated ' till this mortal shall put on immortality . ' """,8
""" then , at least turn the gem inside , you silly fellow ; for everybody must be aware that a cadet from gascony does not find such stones in his mother ’s jewel case . """,5
""" turn them out of the room , sir , if i could . """,1
"the cardinal has a tenacious memory and a long arm ; you may depend upon it , he will repay you by some ill turn . """,24
pencroft and herbert took turns for a spell of two hours each at the helm .,4
""" at length to turn aside the scourge of earthquakes , and to intimidate don issachar , my lord inquisitor was pleased to celebrate an auto - da - fe .",4
