text,ind
""" the devil 's agents may be of flesh and blood , may they not ? there are two questions waiting for us at the outset . the one is whether any crime has been committed at all ; the second is , what is the crime and how was it committed ? of course , if dr . mortimer 's surmise should be correct , and we are dealing with forces outside the ordinary laws of nature , there is an end of our investigation . but we are bound to exhaust all other hypotheses before falling back upon this one . i think we 'll shut that window again , if you do n't mind . it is a singular thing , but i find that a concentrated atmosphere helps a concentration of thought . i have not pushed it to the length of getting into a box to think , but that is the logical outcome of my convictions . have you turned the case over in your mind ? """,165
"mr . rochester turned mechanically to _ see _ what the commotion was : but as he _ saw _ nothing , he returned and sighed .",3
"and so it turned out . the nautilus took full advantage of this countercurrent . it advanced swiftly through this narrow passageway . for an instant i could glimpse the wonderful ruins of the temple of hercules , buried undersea , as pliny and avianus have mentioned , together with the flat island they stand on ; and a few minutes later , we were floating on the waves of the atlantic .",3
"passepartout heard the street door shut once ; it was his new master going out . he heard it shut again ; it was his predecessor , james forster , departing in his turn .",33
"' hold your tongue ! ' said the queen , turning purple .",10
"mr . fogg 's wardrobe was amply supplied and in the best taste . each pair of trousers , coat , and vest bore a number , indicating the time of year and season at which they were in turn to be laid out for wearing ; and the same system was applied to the master 's shoes .",39
"herbert had taken the bits of wood which he had turned down , and was exerting himself to rub them .",10
"according to your idea , then , my brain is turned . and for whom - for some grisette , some chambermaid with whom i have trifled in some garrison ?",10
"the unfortunate queen , who was constantly threatened with divorce , exile , and trial even , turned pale under her rouge , and could not refrain from saying , "" but why this visit , sire ?",17
"i was left alone . but how was it possible for a man of my undecided turn of mind to argue successfully with so irascible a person as the professor ? with this persuasion i was hurrying away to my own little retreat upstairs , when the street door creaked upon its hinges ; heavy feet made the whole flight of stairs to shake ; and the master of the house , passing rapidly through the dining - room , threw himself in haste into his own sanctum . but on his rapid way he had found time to fling his hazel stick into a corner , his rough broadbrim upon the table , and these few emphatic words at his nephew :",16
"stuart , whose turn it was to deal , gathered them up , and went on :",3
""" just turn your head a little more to the right , dorian , like a good boy , "" said the painter , deep in his work and conscious only that a look had come into the lad 's face that he had never seen there before .",2
"dorian gray frowned and turned his head away . he could not help liking the tall , graceful young man who was standing by him . his romantic , olive - coloured face and worn expression interested him . there was something in his low languid voice that was absolutely fascinating . his cool , white , flowerlike hands , even , had a curious charm . they moved , as he spoke , like music , and seemed to have a language of their own .",4
"the lad was thirty years old , and his age to that of his employer was as fifteen is to twenty . please forgive me for this underhanded way of admitting i had turned forty .",33
suddenly the painter appeared at the door of the studio and made staccato signs for them to come in . they turned to each other and smiled .,21
"if a moment 's silence broke the conversation , he would turn restless , touch me , then say , "" jane . """,11
"i say that according to all probability i shall not be able to undergo the fatigues of the siege of la rochelle , and that it would be far better that you should appoint there either monsieur de conde , monsieur de bassopierre , or some valiant gentleman whose business is war , and not me , who am a churchman , and who am constantly turned aside for my real vocation to look after matters for which i have no aptitude .",66
"the canadian returned to conseil 's side . as soon as i was dressed , i went into the lounge . the compass was n't encouraging . the nautilus 's course was south - southwest . we were turning our backs on europe .",38
"for a fare of twenty francs , the vehicle went down broadway to union square , took fourth ave . to its junction with bowery st . , turned into katrin st . and halted at pier 34 . there the katrin ferry transferred men , horses , and carriage to brooklyn , that great new york annex located on the left bank of the east river , and in a few minutes we arrived at the wharf next to which the abraham lincoln was vomiting torrents of black smoke from its two funnels .",28
"hallward turned pale and caught his hand . "" dorian ! dorian ! "" he cried , "" do n't talk like that . i have never had such a friend as you , and i shall never have such another . you are not jealous of material things , are you?-- you who are finer than any of them ! """,1
"at that instant i was aware of a bushy black beard and a pair of piercing eyes turned upon us through the side window of the cab . instantly the trapdoor at the top flew up , something was screamed to the driver , and the cab flew madly off down regent street . holmes looked eagerly round for another , but no empty one was in sight . then he dashed in wild pursuit amid the stream of the traffic , but the start was too great , and already the cab was out of sight .",17
""" i know it , monsieur ; everything is turned topsy - turvy in the world nowadays . """,9
"after half an hour of walking , the seafloor grew rocky . jellyfish , microscopic crustaceans , and sea - pen coral lit it faintly with their phosphorescent glimmers . i glimpsed piles of stones covered by a couple million zoophytes and tangles of algae . my feet often slipped on this viscous seaweed carpet , and without my alpenstock i would have fallen more than once . when i turned around , i could still see the nautilus 's whitish beacon , which was starting to grow pale in the distance .",70
""" on observing the cab i should have instantly turned and walked in the other direction . i should then at my leisure have hired a second cab and followed the first at a respectful distance , or , better still , have driven to the northumberland hotel and waited there . when our unknown had followed baskerville home we should have had the opportunity of playing his own game upon himself and seeing where he made for . as it is , by an indiscreet eagerness , which was taken advantage of with extraordinary quickness and energy by our opponent , we have betrayed ourselves and lost our man . """,9
"neb and pencroft also watched by turns , and did not spare fuel .",6
our path was getting brighter and brighter . the red glow had turned white and was radiating from a mountain peak about 800 feet high . but what i saw was simply a reflection produced by the crystal waters of these strata . the furnace that was the source of this inexplicable light occupied the far side of the mountain .,12
"the whole of the valley bordering on the cave , shaded by fir and other trees , was thoroughly explored , and on turning the point of the southwestern spur , the colonists entered a narrower gorge similar to the picturesque columns of basalt on the coast .",23
"he turned into one of the district messenger offices , where he was warmly greeted by the manager .",1
"planchet and grimaud appeared in their turn , leading their masters ’ steeds . d’artagnan and athos put themselves into saddle with their companions , and all four set forward ; athos upon a horse he owed to a woman , aramis on a horse he owed to his mistress , porthos on a horse he owed to his procurator ’s wife , and d’artagnan on a horse he owed to his good fortune -- the best mistress possible .",6
""" you will visit each of these in turn . """,8
"feverish with vain labour , i got up and took a turn in the room ; undrew the curtain , noted a star or two , shivered with cold , and again crept to bed .",11
"but scarcely had the two rapiers clashed , when a company of the guards of his eminence , commanded by m. de jussac , turned the corner of the convent .",24
"and yet this nature so distinguished , this creature so beautiful , this essence so fine , was seen to turn insensibly toward material life , as old men turn toward physical and moral imbecility .",20
"and yet this nature so distinguished , this creature so beautiful , this essence so fine , was seen to turn insensibly toward material life , as old men turn toward physical and moral imbecility .",29
"these were the historical memories that captain nemo 's scrawl sent rushing through my mind . thus , led by the strangest of fates , i was treading underfoot one of the mountains of that continent ! my hands were touching ruins many thousands of years old , contemporary with prehistoric times ! i was walking in the very place where contemporaries of early man had walked ! my heavy soles were crushing the skeletons of animals from the age of fable , animals that used to take cover in the shade of these trees now turned to stone !",96
""" there are no more , "" said she ; and i put it in my pocket and turned my face homeward : i could not open it then ; rules obliged me to be back by eight , and it was already half - past seven .",18
"to turn aside this flow , an earthquake would be necessary to change the mountain 's center of gravity . """,1
"just at sunset , the air turned cold and the sky cloudy : i went in , sophie called me upstairs to look at my wedding - dress , which they had just brought ; and under it in the box i found your present -- the veil which , in your princely extravagance , you sent for from london : resolved , i suppose , since i would not have jewels , to cheat me into accepting something as costly .",6
"turning towards athos and his friends , "" gentlemen , "" said he , "" allow me to correct your words , if you please .",0
nothing could turn him from his purpose .,2
"it resulted from these antecedents that everyone entered heartily into the purpose for which they met ; besides , it would not be unlikely that they would have an opportunity of playing either the cardinal or his people an ill turn , and for such expeditions these worthy gentlemen were always ready .",40
""" no ! no ! it shall not be , "" i declared energetically ; "" and as it is in my power to prevent the knowledge of it coming into the mind of my tyrant , i will do it . by dint of turning this document round and round , he too might discover the key . i will destroy it . """,45
"in fact , at this hour , the rising tide would have turned back the current of the creek , if its mouth had only been a few miles distant .",12
"in politics he was a tory , except when the tories were in office , during which period he roundly abused them for being a pack of radicals . he was a hero to his valet , who bullied him , and a terror to most of his relations , whom he bullied in turn . only england could have produced him , and he always said that the country was going to the dogs . his principles were out of date , but there was a good deal to be said for his prejudices .",54
""" no , professor , but it needs electricity to run , batteries to generate its electricity , sodium to feed its batteries , coal to make its sodium , and coalfields from which to dig its coal . now then , right at this spot the sea covers entire forests that sank underwater in prehistoric times ; today , turned to stone , transformed into carbon fuel , they offer me inexhaustible coal mines . """,60
"having formed this resolution , i folded my arms and waited . but i had not reckoned upon one little incident which turned up a few hours after .",22
"the heart of the young gascon beat as if it would burst through his side -- not from fear , god be thanked , he had not the shade of it , but with emulation ; he fought like a furious tiger , turning ten times round his adversary , and changing his ground and his guard twenty times .",43
"this time felton , immovable as he was , or appeared to be , could not resist the secret influence which had already taken possession of him . to see this woman , so beautiful , fair as the brightest vision , to see her by turns overcome with grief and threatening ; to resist at once the ascendancy of grief and beauty -- it was too much for a visionary ; it was too much for a brain weakened by the ardent dreams of an ecstatic faith ; it was too much for a heart furrowed by the love of heaven that burns , by the hatred of men that devours . milady saw the trouble .",46
the old gentleman growled approvingly and rang the bell for his servant . lord henry passed up the low arcade into burlington street and turned his steps in the direction of berkeley square .,24
""" you 're right , conseil , it turned out to be a foolish business after all , and we jumped into it too hastily . what a waste of time , what a futile expense of emotion ! six months ago we could have been back in france-- """,8
"at certain turns in the trail we were going along , the lake appeared in its full expanse . the ship 's beacon lit up that whole placid surface , which experienced neither ripples nor undulations . the nautilus lay perfectly still . on its platform and on the embankment , crewmen were bustling around , black shadows that stood out clearly in the midst of the luminous air .",2
"they turned the south angle and followed the left bank of the river , which was abandoned at the point where it formed an elbow towards the southwest .",1
"unluckily , the tide will be turning at that moment , and will be ebbing out of the gulf .",6
"i share maury 's view , and i was able to study the phenomenon in this exclusive setting where ships rarely go . above us , huddled among the brown weeds , there floated objects originating from all over : tree trunks ripped from the rocky mountains or the andes and sent floating down the amazon or the mississippi , numerous pieces of wreckage , remnants of keels or undersides , bulwarks staved in and so weighed down with seashells and barnacles , they could n't rise to the surface of the ocean . and the passing years will someday bear out maury 's other view that by collecting in this way over the centuries , these substances will be turned to stone by the action of the waters and will then form inexhaustible coalfields . valuable reserves prepared by farseeing nature for that time when man will have exhausted his mines on the continents .",120
"so ned land had good reason to worry . in these wide seas empty of islands , it was no longer feasible to jump ship . nor did we have any way to counter captain nemo 's whims . we had no choice but to acquiesce ; but if we could n't attain our end through force or cunning , i liked to think we might achieve it through persuasion . once this voyage was over , might not captain nemo consent to set us free in return for our promise never to reveal his existence ? our word of honor , which we sincerely would have kept . however , this delicate question would have to be negotiated with the captain . but how would he receive our demands for freedom ? at the very outset and in no uncertain terms , had n't he declared that the secret of his life required that we be permanently imprisoned on board the nautilus ? would n't he see my four - month silence as a tacit acceptance of this situation ? would my returning to this subject arouse suspicions that could jeopardize our escape plans , if we had promising circumstances for trying again later on ? i weighed all these considerations , turned them over in my mind , submitted them to conseil , but he was as baffled as i was . in short , although i 'm not easily discouraged , i realized that my chances of ever seeing my fellow men again were shrinking by the day , especially at a time when captain nemo was recklessly racing toward the south atlantic !",213
"he was , we repeat , handsome , young , and bold ; he spoke of love like a man who did love and was anxious to be loved in return . there was certainly enough in all this to turn a head only twenty - three years old , and mme . bonacieux had just attained that happy period of life .",40
"so i turned at the door : i saw a robed and veiled figure , so unlike my usual self that it seemed almost the image of a stranger .",2
"the baron took the young officer by the arm , and turned his head over his shoulder , so as not to lose sight of milady till he was gone out .",11
""" hallo ! "" cried pencroft , "" here is neb turning up his nose at my gulf , just as i was thinking of presenting it to america ! """,11
"lord henry had not yet come in . he was always late on principle , his principle being that punctuality is the thief of time . so the lad was looking rather sulky , as with listless fingers he turned over the pages of an elaborately illustrated edition of manon lescaut that he had found in one of the book - cases . the formal monotonous ticking of the louis quatorze clock annoyed him . once or twice he thought of going away .",39
"as he turned aside his face a minute , i saw a tear slide from under the sealed eyelid , and trickle down the manly cheek .",2
"unhappily for his master , as well as himself , his curiosity drew him unconsciously farther off than he intended to go . at last , having seen the parsee carnival wind away in the distance , he was turning his steps towards the station , when he happened to espy the splendid pagoda on malabar hill , and was seized with an irresistible desire to see its interior . he was quite ignorant that it is forbidden to christians to enter certain indian temples , and that even the faithful must not go in without first leaving their shoes outside the door . it may be said here that the wise policy of the british government severely punishes a disregard of the practices of the native religions .",39
"the clergyman looked up at the speaker and stood mute ; the clerk did the same ; mr . rochester moved slightly , as if an earthquake had rolled under his feet : taking a firmer footing , and not turning his head or eyes , he said , "" proceed . """,40
"in the meantime , grimaud appeared in his turn behind his master , with the musketoon on his shoulder , and his head shaking . like one of those drunken satyrs in the pictures of rubens .",8
"porthos received all these attentions like a man accustomed to such demonstrations , only on turning the corner of the street he lifted his hat gracefully , and waved it to her as a sign of adieu .",15
athos did not even turn his head .,4
"arriving at the faubourg st . antoine , he turned round to look gaily at the bastille ; but as it was the bastille alone he looked at , he did not observe milady , who , mounted upon a light chestnut horse , designated him with her finger to two ill - looking men who came close up to the ranks to take notice of him .",9
""" be satisfied with being a plain , straightforward citizen , and turn to that side which offers the most advantages . """,12
"d’artagnan turned round as if a serpent had stung him , and fixed his eyes intensely upon the guardsman who had just made this insolent speech .",1
"the access to these hunting - grounds was easy ; besides , whether they reached them by the road to port balloon , after having passed the mercy bridge , or by turning the rocks from flotsam point , the hunters were never distant from granite house more than two or three miles .",32
""" we must ask about this right away . "" he rang the bell and asked barrymore whether he could account for our experience . it seemed to me that the pallid features of the butler turned a shade paler still as he listened to his master 's question .",36
"the engineer , towards whom all eyes were turned , shook his head negatively .",8
""" mother , mother , i am so happy ! "" whispered the girl , burying her face in the lap of the faded , tired - looking woman who , with back turned to the shrill intrusive light , was sitting in the one arm - chair that their dingy sitting - room contained . "" i am so happy ! "" she repeated , "" and you must be happy , too ! """,33
"there , on turning round , d’artagnan perceived that the two soldiers had disappeared .",3
"the conversation , thus turned on adele , continued till we reached the light and cheerful region below .",4
"oh , never more could it turn to him ; for faith was blighted -- confidence destroyed !",6
"a longer stay in this dangerous spot would have been useless imprudence . d’artagnan and his two companions turned their backs , and commenced a retreat which resembled a flight .",18
"mrs . fairfax turned out to be what she appeared , a placid - tempered , kind - natured woman , of competent education and average intelligence .",3
"it may easily be understood , therefore , that the conversation during the whole of dinner turned upon the two checks that his eminence ’s guardsmen had received .",16
"we had come to a point where a narrow grassy path struck off from the road and wound away across the moor . a steep , boulder - sprinkled hill lay upon the right which had in bygone days been cut into a granite quarry . the face which was turned towards us formed a dark cliff , with ferns and brambles growing in its niches . from over a distant rise there floated a gray plume of smoke .",50
"my first thought was that i should be by sir henry 's side . but then i remembered the pile of papers and bills with which his study table was littered . it was certain that i could not help with those . and holmes had expressly said that i should study the neighbours upon the moor . i accepted stapleton 's invitation , and we turned together down the path .",66
"the other members of the household , viz . , john and his wife , leah the housemaid , and sophie the french nurse , were decent people ; but in no respect remarkable ; with sophie i used to talk french , and sometimes i asked her questions about her native country ; but she was not of a descriptive or narrative turn , and generally gave such vapid and confused answers as were calculated rather to check than encourage inquiry .",63
"herbert , the reporter , neb , and pencroft , embarked in turn .",12
"something brown was rolling and tossing among the green sedges . then a long , agonized , writhing neck shot upward and a dreadful cry echoed over the moor . it turned me cold with horror , but my companion 's nerves seemed to be stronger than mine .",31
the lad muttered something to himself and drummed on the window - pane with his coarse fingers . he had just turned round to say something when the door opened and sibyl ran in .,21
"in two days more we sighted the coast of scotland near peterhead , and the _ valkyria _ turned her lead towards the faroe islands , passing between the orkneys and shetlands .",18
"i started moving , groping my way . after five steps i encountered an iron wall made of riveted boilerplate . then , turning around , i bumped into a wooden table next to which several stools had been set . the floor of this prison lay hidden beneath thick , hempen matting that deadened the sound of footsteps . its naked walls did n't reveal any trace of a door or window . going around the opposite way , conseil met up with me , and we returned to the middle of this cabin , which had to be twenty feet long by ten wide . as for its height , not even ned land , with his great stature , was able to determine it .",23
"but this luminous globe had n't been turned on without good reason . consequently , i hoped that some crewmen would soon make an appearance . if you want to consign people to oblivion , you do n't light up their dungeons .",7
"indeed , despite its efforts , despite the powerful methods it used to split this ice , the nautilus was reduced to immobility . ordinarily , when someone ca n't go any farther , he still has the option of returning in his tracks . but here it was just as impossible to turn back as to go forward , because every passageway had closed behind us , and if our submersible remained even slightly stationary , it would be frozen in without delay . which is exactly what happened near two o'clock in the afternoon , and fresh ice kept forming over the ship 's sides with astonishing speed . i had to admit that captain nemo 's leadership had been most injudicious .",53
"a small fly or moth had fluttered across our path , and in an instant stapleton was rushing with extraordinary energy and speed in pursuit of it . to my dismay the creature flew straight for the great mire , and my acquaintance never paused for an instant , bounding from tuft to tuft behind it , his green net waving in the air . his gray clothes and jerky , zigzag , irregular progress made him not unlike some huge moth himself . i was standing watching his pursuit with a mixture of admiration for his extraordinary activity and fear lest he should lose his footing in the treacherous mire , when i heard the sound of steps , and turning round found a woman near me upon the path . she had come from the direction in which the plume of smoke indicated the position of merripit house , but the dip of the moor had hid her until she was quite close .",121
"and conseil , in his serene voice , described for the third time the various vicissitudes of our story . but despite our narrator 's fine accent and stylish turns of phrase , the german language met with no success .",29
