text,ind
"having deposited our mournful burden upon tressels within this region of horror , we partially turned aside the yet unscrewed lid of the coffin , and looked upon the face of the tenant .",15
"cyrus harding and gideon spilett then turned the poor boy over ; as they did so , he uttered a moan so feeble that they almost thought it was his last sigh .",6
"i could not understand him , and turned to my uncle who was entirely absorbed in his calculations . i had rather not disturb him while he is quiet . i return to the icelander . he by a snapping motion of his jaws conveys his ideas to me .",7
"it aroused him ; he uncrossed his legs , sat erect , turned to me .",12
"in the meanwhile the "" bonadventure "" entered the winding channels among the reefs , and pencroft observed every turn with extreme care .",19
"mr . miles , the master , affirmed that he would do very well if he had fewer cakes and sweetmeats sent him from home ; but the mother 's heart turned from an opinion so harsh , and inclined rather to the more refined idea that john 's sallowness was owing to over - application and , perhaps , to pining after home .",31
""" well , so be it , "" said d’artagnan . "" draw up this note for us , aramis ; but by our holy father the pope , cut it short , for i shall prune you in my turn , i warn you . """,40
""" you do n't turn sick at the sight of blood ? """,4
""" listen , my dear girl , "" said d’artagnan ; "" you can not but perceive that all this must end , some way or other . milady may discover that you gave the first billet to my lackey instead of to the count ’s ; that it is i who have opened the others which ought to have been opened by de wardes . milady will then turn you out of doors , and you know she is not the woman to limit her vengeance . """,69
""" warm and steady , "" was his remark : he turned the key and opened the door .",11
"and his turn for natural history was , more than once in the course of time , of great use , and he was not mistaken in this instance .",2
"_ april _ 22.—the next morning i begin to consider of means to put this resolve into execution ; but i was at a great loss about my tools . i had three large axes , and abundance of hatchets ( for we carried the hatchets for traffic with the indians ) ; but with much chopping and cutting knotty hard wood , they were all full of notches , and dull ; and though i had a grindstone , i could not turn it and grind my tools too . this cost me as much thought as a statesman would have bestowed upon a grand point of politics , or a judge upon the life and death of a man . at length i contrived a wheel with a string , to turn it with my foot , that i might have both my hands at liberty .",83
"_ april _ 22.—the next morning i begin to consider of means to put this resolve into execution ; but i was at a great loss about my tools . i had three large axes , and abundance of hatchets ( for we carried the hatchets for traffic with the indians ) ; but with much chopping and cutting knotty hard wood , they were all full of notches , and dull ; and though i had a grindstone , i could not turn it and grind my tools too . this cost me as much thought as a statesman would have bestowed upon a grand point of politics , or a judge upon the life and death of a man . at length i contrived a wheel with a string , to turn it with my foot , that i might have both my hands at liberty .",133
"_ april _ 28 , 29.—these two whole days i took up in grinding my tools , my machine for turning my grindstone performing very well .",20
"the river became strong almost directly between the two walls of granite , which began to sink above the mouth ; it then suddenly turned and disappeared beneath a wood of stunted trees half a mile off .",24
"on january 16 the nautilus seemed to have fallen asleep just a few meters beneath the surface of the water . its electric equipment had been turned off , and the motionless propeller let it ride with the waves . i assumed that the crew were busy with interior repairs , required by the engine 's strenuous mechanical action .",26
""" so we can , my boy , "" replied the sailor , "" and these chimneys will serve our turn .",20
miss abbot turned to divest a stout leg of the necessary ligature .,2
"herbert and pencroft left the chimneys , and , turning the angle , they began to climb the left bank of the river .",9
here was a new card turned up !,5
"and so it went , some new wonder constantly delighting us . conseil observed and classified his zoophytes , articulates , mollusks , and fish . the days passed quickly , and i no longer kept track of them . ned , as usual , kept looking for changes of pace from our standard fare . like actual snails , we were at home in our shell , and i can vouch that it 's easy to turn into a full - fledged snail .",77
"bessie answered not ; but ere long , addressing me , she said--""you ought to be aware , miss , that you are under obligations to mrs . reed : she keeps you : if she were to turn you off , you would have to go to the poorhouse . """,38
"suddenly there shot along the path a wild light , and i turned to see whence a gleam so unusual could have issued ; for the vast house and its shadows were alone behind me .",12
"my head still ached and bled with the blow and fall i had received : no one had reproved john for wantonly striking me ; and because i had turned against him to avert farther irrational violence , i was loaded with general opprobrium .",29
""" no ; to - night!--to - night ! "" and as he turned from the door , i placed myself between it and him .",13
"alice was not a bit hurt , and she jumped up on to her feet in a moment : she looked up , but it was all dark overhead ; before her was another long passage , and the white rabbit was still in sight , hurrying down it . there was not a moment to be lost : away went alice like the wind , and was just in time to hear it say , as it turned a corner , ' oh my ears and whiskers , how late it 's getting ! ' she was close behind it when she turned the corner , but the rabbit was no longer to be seen : she found herself in a long , low hall , which was lit up by a row of lamps hanging from the roof . there were doors all round the hall , but they were all locked ; and when alice had been all the way down one side and up the other , trying every door , she walked sadly down the middle , wondering how she was ever to get out again .",78
"alice was not a bit hurt , and she jumped up on to her feet in a moment : she looked up , but it was all dark overhead ; before her was another long passage , and the white rabbit was still in sight , hurrying down it . there was not a moment to be lost : away went alice like the wind , and was just in time to hear it say , as it turned a corner , ' oh my ears and whiskers , how late it 's getting ! ' she was close behind it when she turned the corner , but the rabbit was no longer to be seen : she found herself in a long , low hall , which was lit up by a row of lamps hanging from the roof . there were doors all round the hall , but they were all locked ; and when alice had been all the way down one side and up the other , trying every door , she walked sadly down the middle , wondering how she was ever to get out again .",103
"in the meantime d’artagnan , who had plunged into a bypath , continued his route and reached st . cloud ; but instead of following the main street he turned behind the chateau , reached a sort of retired lane , and found himself soon in front of the pavilion named .",29
"well , as he means to enter the church at the same time as myself , he does not despair of becoming pope in his turn , or at least a cardinal . you can understand that a man who has such views will never allow himself to be taken , or if taken , will undergo martyrdom rather than speak . "" "" very well , "" said d’artagnan , "" i consent to bazin with all my heart , but grant me planchet .",25
"milady had him one day turned out of doors , with sundry blows of a good stick to accelerate his motions . now , planchet has an excellent memory ; and i will be bound that sooner than relinquish any possible means of vengeance , he will allow himself to be beaten to death .",5
"turning from bessie ( though her presence was far less obnoxious to me than that of abbot , for instance , would have been ) , i scrutinised the face of the gentleman : i knew him ; it was mr . lloyd , an apothecary , sometimes called in by mrs . reed when the servants were ailing : for herself and the children she employed a physician .",0
"i was near two months performing this last work , viz . rigging and fitting my masts and sails ; for i finished them very complete , making a small stay , and a sail , or foresail , to it , to assist if we should turn to windward ; and , what was more than all , i fixed a rudder to the stern of her to steer with . i was but a bungling shipwright , yet as i knew the usefulness and even necessity of such a thing , i applied myself with so much pains to do it , that at last i brought it to pass ; though , considering the many dull contrivances i had for it that failed , i think it cost me almost as much labour as making the boat .",47
""" my dear d’artagnan , "" said he , "" if you please , we will join our friends ; as i am rich , we will today begin to dine together again , expecting that you will be rich in your turn . """,42
"besides , the wheels of a carriage , which appeared to have come from paris , had made a deep impression in the soft earth , which did not extend beyond the pavilion , but turned again toward paris .",35
"so she called softly after it , ' mouse dear ! do come back again , and we wo n't talk about cats or dogs either , if you do n't like them ! ' when the mouse heard this , it turned round and swam slowly back to her : its face was quite pale ( with passion , alice thought ) , and it said in a low trembling voice , ' let us get to the shore , and then i 'll tell you my history , and you 'll understand why it is i hate cats and dogs . '",42
the tide had already turned . they must now avail themselves of the ebb to take the wood to the mouth .,4
"yet , when this cherished volume was now placed in my hand -- when i turned over its leaves , and sought in its marvellous pictures the charm i had , till now , never failed to find -- all was eerie and dreary ; the giants were gaunt goblins , the pigmies malevolent and fearful imps , gulliver a most desolate wanderer in most dread and dangerous regions .",15
"we turned on our ruhmkorff devices and went along a coral shoal in the process of forming , which , given time , will someday close off this whole part of the indian ocean . our path was bordered by hopelessly tangled bushes , formed from snarls of shrubs all covered with little star - shaped , white - streaked flowers . only , contrary to plants on shore , these tree forms become attached to rocks on the seafloor by heading from top to bottom .",1
"to rush on this monster , throw him on the ground in his turn , snatch herbert from him , then bind him securely , was the work of a minute for pencroft and gideon spilett .",13
"meanwhile captain nemo had called a halt . my companions and i stopped walking , and turning around , i saw the crewmen form a semicircle around their leader . looking with greater care , i observed that four of them were carrying on their shoulders an object that was oblong in shape .",16
"' he took me for his housemaid , ' she said to herself as she ran . ' how surprised he 'll be when he finds out who i am ! but i 'd better take him his fan and gloves -- that is , if i can find them . ' as she said this , she came upon a neat little house , on the door of which was a bright brass plate with the name ' w. rabbit ' engraved upon it . she went in without knocking , and hurried upstairs , in great fear lest she should meet the real mary ann , and be turned out of the house before she had found the fan and gloves .",110
"it may be easily imagined how great was our joy when , in turning over this manuscript , our last hope , we found at the twentieth page the name of athos , at the twenty - seventh the name of porthos , and at the thirty - first the name of aramis .",13
"the professor moved towards the rock upon which hans had laid down the instruments . he was gay and full of spirits ; he rubbed his hands , he studied his attitudes . i followed him , curious to know if i was right in my estimate . as soon as we had arrived at the rock my uncle took the compass , laid it horizontally , and questioned the needle , which , after a few oscillations , presently assumed a fixed position . my uncle looked , and looked , and looked again . he rubbed his eyes , and then turned to me thunderstruck with some unexpected discovery .",103
"alice noticed with some surprise that the pebbles were all turning into little cakes as they lay on the floor , and a bright idea came into her head . ' if i eat one of these cakes , ' she thought , ' it 's sure to make some change in my size ; and as it ca n't possibly make me larger , it must make me smaller , i suppose . '",10
"he motioned to me to look . an exclamation of astonishment burst from me . the north pole of the needle was turned to what we supposed to be the south . it pointed to the shore instead of to the open sea ! i shook the box , examined it again , it was in perfect condition . in whatever position i placed the box the needle pertinaciously returned to this unexpected quarter . therefore there seemed no reason to doubt that during the storm there had been a sudden change of wind unperceived by us , which had brought our raft back to the shore which we thought we had left so long a distance behind us .",22
""" no , jane , no : this world is not the scene of fruition ; do not attempt to make it so : nor of rest ; do not turn slothful . """,30
"after having turned the point , the settlers saw a long beach washed by the open sea .",2
""" to the end of turning to profit the talents which god has committed to your keeping ; and of which he will surely one day demand a strict account .",5
"the sight of the flame seemed at first to fix the attention of the unhappy object , but soon he turned away and the look of intelligence faded .",20
"for about an hour the nautilus cruised in the midst of this school of mollusks . then , lord knows why , they were gripped with a sudden fear . as if at a signal , every sail was abruptly lowered ; arms folded , bodies contracted , shells turned over by changing their center of gravity , and the whole flotilla disappeared under the waves . it was instantaneous , and no squadron of ships ever maneuvered with greater togetherness .",49
"happy at moor house i was , and hard i worked ; and so did hannah : she was charmed to see how jovial i could be amidst the bustle of a house turned topsy - turvy -- how i could brush , and dust , and clean , and cook .",33
"' well , perhaps you have n't found it so yet , ' said alice ; ' but when you have to turn into a chrysalis -- you will some day , you know -- and then after that into a butterfly , i should think you 'll feel it a little queer , wo n't you ? '",22
"here was another puzzling question ; and as alice could not think of any good reason , and as the caterpillar seemed to be in a very unpleasant state of mind , she turned away .",33
"this sounded promising , certainly : alice turned and came back again .",7
"the schoolmaster , with a smile , flung them upon the ground , then examining candide from head to foot with an air of admiration , he turned his back and went on his way .",27
""" then , some fine day , "" said pencroft , who did not appear to be entirely convinced , "" the rest of this ancient continent may disappear in its turn , and there will be nothing between america and asia . """,31
""" does that person want you ? "" she inquired of mr . rochester ; and mr . rochester turned to see who the "" person "" was . he made a curious grimace -- one of his strange and equivocal demonstrations -- threw down his cue and followed me from the room .",19
"and i believe that centuries succeeding to centuries , and insects to insects , this pacific may one day be changed into a vast continent , which new generations will inhabit and civilize in their turn . """,35
yet you turned a back - somersault in at the door —,2
""" indeed , sir , "" continued the stranger , more calm than ever ; "" well , that is perfectly right ! "" and turning on his heel , was about to re - enter the hostelry by the front gate , beneath which d’artagnan on arriving had observed a saddled horse .",25
"he drew his sword entirely from the scabbard , and followed him , crying , "" turn , turn , master joker , lest i strike you behind ! """,16
"he drew his sword entirely from the scabbard , and followed him , crying , "" turn , turn , master joker , lest i strike you behind ! """,18
"the conversation lasted some time and turned chiefly on the form of government , their manners , their women , their public diversions , and the arts . at length , candide , who had always had a taste for metaphysics , asked whether the people of that country had any religion .",6
""" strike me ! "" said the other , turning on his heels , and surveying the young man with as much astonishment as contempt .",9
"this caused so rapid and complete a diversion from the attack that d’artagnan ’s adversary , while the latter turned round to face this shower of blows , sheathed his sword with the same precision , and instead of an actor , which he had nearly been , became a spectator of the fight -- a part in which he acquitted himself with his usual impassiveness , muttering , nevertheless , "" a plague upon these gascons !",19
"she had a turn for traffic , and a marked propensity for saving ; shown not only in the vending of eggs and chickens , but also in driving hard bargains with the gardener about flower - roots , seeds , and slips of plants ; that functionary having orders from mrs . reed to buy of his young lady all the products of her parterre she wished to sell : and eliza would have sold the hair off her head if she could have made a handsome profit thereby .",3
""" pray , d’artagnan , "" said athos , after a minute , "" either take off that ring or turn the mounting inside ; it recalls such cruel recollections that i shall have no head to converse with you .",20
""" yes , my boy . there are some shellfish that turn into real jewel coffers . they even mention one oyster , about which i remain dubious , that supposedly contained at least 150 sharks . """,11
""" who could want me ? "" i asked inwardly , as with both hands i turned the stiff door - handle , which , for a second or two , resisted my efforts .",16
"_ he _ , for it was a man , turned his head slowly towards where i stood , and having examined me with the two inquisitive - looking grey eyes which twinkled under a pair of bushy brows , said solemnly , and in a bass voice , "" her size is small : what is her age ? """,10
"when given , he viewed me to learn the result ; it was not striking : i am sure i did not blush ; perhaps i might have turned a little pale , for i felt as if this kiss were a seal affixed to my fetters .",28
"he would have been very useful to them , if they had been able to make him turn traitor !",17
"the officer leaned forward , looked at her in his turn , and appeared surprised to see that face , just before so beautiful , distorted with passion and almost hideous .",10
"she crushed the paper in her hand , and turning with flashing eyes upon kitty , she cried , "" what is this letter ? """,9
"she , with a still - smiling countenance , took his arm , and passed with him under a low arched door , which by a vaulted passage , lighted only at the farther end , led to a stone staircase around an angle of stone . they then came to a massive door , which after the introduction into the lock of a key which the young man carried with him , turned heavily upon its hinges , and disclosed the chamber destined for milady .",73
"in some places , the wind , eddying round the corners , formed the snow into tall whirling columns , resembling those waterspouts which turn round on their base , and which vessels attack with a shot from a gun .",24
"' which would not be an advantage , ' said alice , who felt very glad to get an opportunity of showing off a little of her knowledge . ' just think of what work it would make with the day and night ! you see the earth takes twenty - four hours to turn round on its axis-- '",54
"athos repeated to him the same question he had asked the first person he met . the night watch evinced the same terror , refused , in his turn , to accompany athos , and only pointed with his hand to the road he was to take .",28
""" the wind is turning woodman , let it alone , "" he repeated .",4
"the baby grunted again , and alice looked very anxiously into its face to see what was the matter with it . there could be no doubt that it had a very turn - up nose , much more like a snout than a real nose ; also its eyes were getting extremely small for a baby : altogether alice did not like the look of the thing at all . ' but perhaps it was only sobbing , ' she thought , and looked into its eyes again , to see if there were any tears .",32
"no , there were no tears . ' if you 're going to turn into a pig , my dear , ' said alice , seriously , ' i 'll have nothing more to do with you . mind now ! ' the poor little thing sobbed again ( or grunted , it was impossible to say which ) , and they went on for some while in silence .",13
"_ speak _ i must : i had been trodden on severely , and _ must _ turn : but how ?",17
"what could be the meaning of such a change ? up to this time facts had supported the theories of davy and of liedenbrock ; until now particular conditions of non - conducting rocks , electricity and magnetism , had tempered the laws of nature , giving us only a moderately warm climate , for the theory of a central fire remained in my estimation the only one that was true and explicable . were we then turning back to where the phenomena of central heat ruled in all their rigour and would reduce the most refractory rocks to the state of a molten liquid ? i feared this , and said to the professor :",77
"' it turned into a pig , ' alice quietly said , just as if it had come back in a natural way .",2
"ten minutes later , captain nemo stopped suddenly . i thought he 'd called a halt so that we could turn and start back . no . with a gesture he ordered us to crouch beside him at the foot of a wide crevice . his hand motioned toward a spot within the liquid mass , and i looked carefully .",20
"there , i had a friend 's face under my gaze ; and what did it signify that those young ladies turned their backs on me ?",21
"but there was something better to be made of it , and one day cyrus harding announced that they were going to turn into refiners .",22
"i offered to sketch their portraits ; and each , in turn , sat for a pencil outline .",11
"my uncle took the piece of meat and the few biscuits which had escaped from the general destruction . he divided them into three equal portions and gave one to each . this made about a pound of nourishment for each . the professor ate his greedily , with a kind of feverish rage . i ate without pleasure , almost with disgust ; hans quietly , moderately , masticating his small mouthfuls without any noise , and relishing them with the calmness of a man above all anxiety about the future . by diligent search he had found a flask of hollands ; he offered it to us each in turn , and this generous beverage cheered us up slightly .",111
""" ah , pardon ! i thought so ; but we will return to my lord duke presently . let us not depart from the sentimental turn our conversation had taken . you came , you say , to see me ? """,26
"the supper was like most others of its kind in paris . at first everyone was silent ; then followed a few confused murmurs , and afterwards several insipid jokes passed and repassed , with false reports , false reasonings , a little politics , and a great deal of scandal . the conversation then turned upon the new productions in literature .",55
"' have you guessed the riddle yet ? ' the hatter said , turning to alice again .",13
"when he had passed one group he began to breathe more freely ; but he could not help observing that they turned round to look at him , and for the first time in his life d’artagnan , who had till that day entertained a very good opinion of himself , felt ridiculous .",21
"arrived at the staircase , it was still worse . there were four musketeers on the bottom steps , amusing themselves with the following exercise , while ten or twelve of their comrades waited upon the landing place to take their turn in the sport .",41
""" nothing : i covered my face with the bedclothes , and turned from her to the wall . """,12
"this short dialogue reveals that in my mania for the nautilus , i was turning into the spitting image of its commander .",14
"the reporter , turning at the moment , saw pencroft , and his first words were,--",3
"i saw by his look , when he turned to me , that they were always written on the air between me and him ; whenever i spoke , they sounded in my voice to his ear , and their echo toned every answer he gave me .",8
""" do you mean to say that you turn up your nose at suckling - pig ? '",8
"and then a spasm constricted her mouth for an instant : as it passed away she turned and left the room , and so did i. neither of us had dropt a tear .",16
"the evening arrival at the great town of -- scattered these thoughts ; night gave them quite another turn : laid down on my traveller 's bed , i left reminiscence for anticipation .",18
""" your turn , my lord , "" said athos .",2
""" fortune is a courtesan ; favorable yesterday , she may turn her back tomorrow . """,11
