text,ind,sense,label
"he wished to penetrate the mystery of that submarine combat , and to ascertain what monster could have given the dugong so strange a wound .",24,"('wound', 'blessure', 'herir')",0
"they therefore waited impatiently for the moment when herbert might be moved without danger from his wound , and they were determined to make this move , although the communication through jacamar wood was very difficult .",16,"('wound', 'blessure', 'herir')",0
""" i acknowledge , "" returned spilett , "" that the wound given this creature is , at least , very strange , and i can not explain either how top was so vigorously cast up out of the water .",11,"('wound', 'blessure', 'herir')",0
"d’artagnan fought three times with rochefort , and wounded him three times .",8,"('wound', 'blesser', 'herir')",1
""" now , "" continued aramis , "" as the ladies did not see the singer come back , and as he was found in the rue payenne with a great sword wound through his body , it was supposed that i had accommodated him thus ; and the matter created some scandal which obliged me to renounce the cassock for a time .",32,"('wound', 'épée', 'estocada')",2
""" oh , "" continued milady , "" do your wounds still make you suffer ? """,10,"('wound', 'blessure', 'herir')",0
""" this wound ? bah , it is now nearly healed , and i am sure it is not that which gives you the most pain . """,2,"('wound', 'blessure', 'herir')",0
""" you have one at heart , aramis , one deeper and more painful -- a wound made by a woman . """,16,"('wound', 'blessure', 'herir')",0
"four shots replied to them almost instantaneously , but much better aimed than those of the aggressors ; three soldiers fell dead , and one of the pioneers was wounded .",29,"('wound', 'blesser', 'herir')",1
""" this wound , my dear d’artagnan , has been a warning to me from heaven . """,2,"('wound', 'blessure', 'herir')",0
they bore no apparent trace of any wound .,7,"('wound', 'blessure', 'herir')",0
""" i can send to each of them leave of absence for fifteen days , that is all -- to athos , whose wound still makes him suffer , to go to the waters of forges ; to porthos and aramis to accompany their friend , whom they are not willing to abandon in such a painful condition .",23,"('wound', 'blessure', 'herir')",0
"athos , who still suffered grievously from his wound , though it had been dressed anew by m. de treville ’s surgeon , was seated on a post and waiting for his adversary with hat in hand , his feather even touching the ground .",8,"('wound', 'blessure', 'herir')",0
""" not too much so , "" replied d’artagnan , with a bow that was not deficient in dignity , "" since you do me the honor to draw a sword with me while suffering from a wound which is very inconvenient . """,37,"('wound', 'blessure', 'herir')",0
"meanwhile , all things considered and notwithstanding his suspicions , as the wound might be serious , he immediately sent off a mounted man to find a physician .",12,"('wound', 'blessure', 'herir')",0
"as lord de winter had thought , milady ’s wound was not dangerous . so soon as she was left alone with the woman whom the baron had summoned to her assistance she opened her eyes .",9,"('wound', 'blessure', 'herir')",0
""" i have a miraculous balsam for wounds -- a balsam given to me by my mother and of which i have made a trial upon myself . """,7,"('wound', 'blessure', 'herir')",0
"several times he pressed gideon spilett , but the latter , fearing , with good reason , that herbert 's wounds , half healed , might reopen on the way , did not give the order to start .",20,"('wound', 'plaie', 'herir')",3
"toward four o’clock in the morning the doctor arrived ; but since the time milady stabbed herself , however short , the wound had closed . the doctor could therefore measure neither the direction nor the depth of it ; he only satisfied himself by milady ’s pulse that the case was not serious .",22,"('wound', 'blessure', 'herir')",0
"and hundreds of times captain harding had almost been among those who were not counted by the terrible grant ; but in these combats where he never spared himself , fortune favored him till the moment when he was wounded and taken prisoner on the field of battle near richmond .",39,"('wound', 'blesser', 'herir')",1
"good god ! "" asked the poor woman , "" have i said anything that has wounded you ? """,16,"('wound', 'blesser', 'herir')",1
"did you ever suffer from a strain , athos ? "" "" never ! though i remember , in our affair of the rue ferou , i received a sword wound which at the end of fifteen or eighteen days produced the same effect . """,30,"('wound', 'épée', 'estocada')",2
""" my friend , aramis , here , has received a slight sword wound in the arm , but not enough to prevent him , as your eminence may see , from mounting to the assault tomorrow , if your eminence orders an escalade . """,13,"('wound', 'épée', 'estocada')",2
""" your wound ? """,2,"('wound', 'blessure', 'herir')",0
""" it is very hot , "" said athos , drawing his sword in its turn , "" and yet i can not take off my doublet ; for i just now felt my wound begin to bleed again , and i should not like to annoy monsieur with the sight of blood which he has not drawn from me himself . """,34,"('wound', 'blessure', 'herir')",0
""" you shall eat , lad . the fever has left you . hans rubbed your wounds with some ointment or other of which the icelanders keep the secret , and they have healed marvellously . our hunter is a splendid fellow ! """,16,"('wound', 'plaie', 'herir')",3
"athos followed the road for some time , his eyes fixed upon the ground ; slight stains of blood , which came from the wound inflicted upon the man who accompanied the carriage as a courier , or from one of the horses , dotted the road .",24,"('wound', 'blessure', 'herir')",0
"the colonists were soon obliged to fight at close quarters , not without receiving some wounds , though happily very slight ones .",15,"('wound', 'blessure', 'herir')",0
"poor jup still held in his hand the stump of his broken cudgel , but deprived of his weapon he had been overpowered by numbers , and his chest was covered with severe wounds .",33,"('wound', 'blessure', 'herir')",0
"the shark bellowed , so to speak . blood was pouring into the waves from its wounds . the sea was dyed red , and through this opaque liquid i could see nothing else .",16,"('wound', 'blessure', 'herir')",0
"his wounds were healed , and it was evident that he would not be long in regaining his usual strength and agility .",1,"('wound', 'blessure', 'herir')",0
"in this waiting room were five or six of the cardinals guards , who recognized d’artagnan , and knowing that it was he who had wounded jussac , they looked upon him with a smile of singular meaning .",25,"('wound', 'blesser', 'herir')",1
""" because she flew into a great passion on receiving the letter , saying that monsieur porthos was a weathercock , and that she was sure it was for some woman he had received this wound . """,35,"('wound', 'épée', 'estocada')",2
"but neither of these two wounds was serious , and they only fought more earnestly .",5,"('wound', 'blessure', 'herir')",0
""" it is a wound that confines him to his bed ? """,4,"('wound', 'épée', 'estocada')",2
"though alone against all and with a wound in his thigh , bicarat wished to hold out ; but jussac , who had risen upon his elbow , cried out to him to yield .",7,"('wound', 'épée', 'estocada')",2
""" monsieur has promised me not to open his mouth about the procurator ’s wife , and not to say a word of the wound ? """,24,"('wound', 'blessure', 'herir')",0
"therefore mousqueton alone fell from his horse , not because he was severely wounded , but not being able to see the wound , he judged it to be more serious than it really was .",22,"('wound', 'blessure', 'herir')",0
"at its neck was a wound , which appeared to have been produced by a sharp blade .",5,"('wound', 'blessure', 'herir')",0
""" less quickly than the women , it seems to me , "" replied porthos ; "" for i , madame , i may say i was your victim , when wounded , dying , i was abandoned by the surgeons . i , the offspring of a noble family , who placed reliance upon your friendship -- i was near dying of my wounds at first , and of hunger afterward , in a beggarly inn at chantilly , without you ever deigning once to reply to the burning letters i addressed to you . """,64,"('wound', 'blessure', 'herir')",0
""" he who wounded jussac ! "" cried the king , "" he , a boy !",3,"('wound', 'blesser', 'herir')",1
""" you are wounded , "" said he . "" i !",3,"('wound', 'blesser', 'herir')",1
"i confess , not at all , "" replied pencroft , "" and the wound which the dugong had in its side , a wound which seemed to have been made with a sharp instrument ; that ca n't be understood , either . """,14,"('wound', 'blessure', 'herir')",0
"i confess , not at all , "" replied pencroft , "" and the wound which the dugong had in its side , a wound which seemed to have been made with a sharp instrument ; that ca n't be understood , either . """,24,"('wound', 'blessure', 'herir')",0
"athos , who was very expert in all bodily exercises , passed with d’artagnan to the opposite side and challenged them ; but at the first effort he made , although he played with his left hand , he found that his wound was yet too recent to allow of such exertion .",42,"('wound', 'blessure', 'herir')",0
""" oil is a sovereign balm for wounds ; and my poor grimaud here was obliged to dress those you had inflicted on him . """,7,"('wound', 'blessure', 'herir')",0
"the congestion of the liver had disappeared , and his wounds might be considered completely healed .",10,"('wound', 'blessure', 'herir')",0
"as , however , he did not fall , as he did not declare himself conquered , but only broke away toward the hotel of m. de la tremouille , in whose service he had a relative , d’artagnan was ignorant of the seriousness of the last wound his adversary had received , and pressing him warmly , without doubt would soon have completed his work with a third blow , when the noise which arose from the street being heard in the tennis court , two of the friends of the guardsman , who had seen him go out after exchanging some words with d’artagnan , rushed , sword in hand , from the court , and fell upon the conqueror .",47,"('wound', 'blessure', 'herir')",0
""" but pray , sir , "" continued aramis , who , seeing his captain become appeased , ventured to risk a prayer , "" do not say that athos is wounded . he would be in despair if that should come to the ears of the king ; and as the wound is very serious , seeing that after crossing the shoulder it penetrates into the chest , it is to be feared-- """,52,"('wound', 'blessure', 'herir')",0
d’artagnan had said nothing to porthos of his wound or of his procurator ’s wife .,8,"('wound', 'blessure', 'herir')",0
"however , he knew one thing , this was that he would have to prevent the inflammatory strangulation of the injured parts , then to contend with the local inflammation and fever which would result from the wound , perhaps mortal !",37,"('wound', 'blessure', 'herir')",0
"at any rate , the most important thing was that the two wounds should be dressed without delay .",12,"('wound', 'plaie', 'herir')",3
"the reporter , therefore , thought it best to simply bathe the two wounds with cold water .",13,"('wound', 'plaie', 'herir')",3
"the door had remained open , so strong was the excitement produced by the arrival of athos , whose wound , though kept as a secret , was known to all .",19,"('wound', 'blessure', 'herir')",0
""" he is in the most favorable position for the wounds in his back and chest to suppurate easily , and absolute rest is necessary . """,10,"('wound', 'plaie', 'herir')",3
""" oh , that ’s nothing ! let us attend to what is more pressing first , and then we will attend to my wound ; besides , it does not seem very dangerous . """,24,"('wound', 'blessure', 'herir')",0
"he found the duke reclining upon a sofa , with his hand pressed upon the wound .",15,"('wound', 'blessure', 'herir')",0
"spilett then explained to cyrus harding that he thought he ought first of all to stop the hemorrhage , but not close the two wounds , or cause their immediate cicatrization , for there had been internal perforation , and the suppuration must not be allowed to accumulate in the chest .",24,"('wound', 'plaie', 'herir')",3
"harding approved entirely , and it was decided that the two wounds should be dressed without attempting to close them by immediate coaptation .",11,"('wound', 'plaie', 'herir')",3
"they had cold water , that is to say , the most powerful sedative that can be employed against inflammation of wounds , the most efficacious therapeutic agent in grave cases , and the one which is now adopted by all physicians .",21,"('wound', 'plaie', 'herir')",3
"cold water has , moreover , the advantage of leaving the wound in absolute rest , and preserving it from all premature dressing , a considerable advantage , since it has been found by experience that contact with the air is dangerous during the first days .",11,"('wound', 'plaie', 'herir')",3
"compresses of linen were applied to poor herbert 's two wounds , and were kept constantly wet with cold water .",10,"('wound', 'blessure', 'herir')",0
"however , herbert scarcely suffered at all , and the cold water with which they were constantly bathed , prevented any inflammation of the wounds .",24,"('wound', 'plaie', 'herir')",3
"the union of physical pain with moral uneasiness had produced the effect so long desired . aramis , suffering at once in body and mind , had at length fixed his eyes and his thoughts upon religion , and he had considered as a warning from heaven the double accident which had happened to him ; that is to say , the sudden disappearance of his mistress and the wound in his shoulder .",69,"('wound', 'blessure', 'herir')",0
""" the wound is serious , and , perhaps , even the ball has traversed the lungs , but the perforation of this organ is not fatal . """,2,"('wound', 'blessure', 'herir')",0
""" now , carter , be on the alert , "" he said to this last : "" i give you but half - an - hour for dressing the wound , fastening the bandages , getting the patient downstairs and all . """,30,"('wound', 'blessure', 'herir')",0
""" you are wounded ? "" asked buckingham , as he opened the letter .",3,"('wound', 'blesser', 'herir')",1
""" was it not this d’artagnan who wounded jussac one day , in that unfortunate encounter which took place near the convent of the carmes - dechausses ? "" asked the king , looking at the cardinal , who colored with vexation .",7,"('wound', 'blesser', 'herir')",1
"it was a horrible wound . the cranium had been smashed open by some blunt instrument , leaving the naked brains exposed , and the cerebral matter had suffered deep abrasions . blood clots had formed in this dissolving mass , taking on the color of wine dregs . both contusion and concussion of the brain had occurred . the sick man 's breathing was labored , and muscle spasms quivered in his face . cerebral inflammation was complete and had brought on a paralysis of movement and sensation .",4,"('wound', 'blessure', 'herir')",0
""" how did he get this wound ? "" i asked him .",6,"('wound', 'blessure', 'herir')",0
d’artagnan explained the sword wound of his companion by a sortie which he improvised .,4,"('wound', 'épée', 'estocada')",2
""" oh , if this ape had wounded him ! "" exclaimed pencroft .",7,"('wound', 'blesser', 'herir')",1
"herbert 's wounds , covered with compresses and lint , were pressed neither too much nor too little , so as to cause their cicatrization without effecting any inflammatory reaction .",2,"('wound', 'plaie', 'herir')",3
"as porthos and aramis were undressing him , in the hope of finding his wound not mortal , a large purse dropped from his clothes .",14,"('wound', 'blessure', 'herir')",0
"in fact , the mystery of that last afternoon when we were locked in prison and put to sleep , the captain 's violent precaution of snatching from my grasp a spyglass poised to scour the horizon , and the fatal wound given that man during some unexplained collision suffered by the nautilus , all led me down a plain trail . no ! captain nemo was n't content simply to avoid humanity ! his fearsome submersible served not only his quest for freedom , but also , perhaps , it was used in lord - knows - what schemes of dreadful revenge .",41,"('wound', 'blessure', 'herir')",0
"thrown in the air by some unknown power , he rose ten feet above the surface of the lake , fell again into the midst of the agitated waters , and then soon gained the shore , without any severe wounds , miraculously saved .",40,"('wound', 'blessure', 'herir')",0
"as hope , however , is the last thing extinguished in the heart of man , he finished by hoping that he might survive , even though with terrible wounds , in both these duels ; and in case of surviving , he made the following reprehensions upon his own conduct :",29,"('wound', 'blessure', 'herir')",0
