text,ind
"d’artagnan began by making his most splendid toilet , then returned to athos ’s , and according to custom , related everything to him .",16
""" 192,000 years , my gallant conseil , which significantly extends the biblical days of creation . what 's more , the formation of coal-- in other words , the petrification of forests swallowed by floods-- and the cooling of basaltic rocks likewise call for a much longer period of time . i might add that those ' days ' in the bible must represent whole epochs and not literally the lapse of time between two sunrises , because according to the bible itself , the sun does n't date from the first day of creation . """,79
""" do you , then , also join in betraying me , monsieur cardinal , by thus always opposing my will ? are you also in accord with spain and england , with madame de chevreuse and the queen ? """,26
""" i should think it was , harry . but according to your category i must be merely an acquaintance . """,10
"phileas fogg was seated squarely in his armchair , his feet close together like those of a grenadier on parade , his hands resting on his knees , his body straight , his head erect ; he was steadily watching a complicated clock which indicated the hours , the minutes , the seconds , the days , the months , and the years . at exactly half - past eleven mr . fogg would , according to his daily habit , quit saville row , and repair to the reform .",75
""" did she not , then , adopt you of her own accord ? """,12
"thus , at one bound , the record of the existence of man receded far back into the history of the ages past ; he was a predecessor of the mastodon ; he was a contemporary of the southern elephant ; he lived a hundred thousand years ago , when , according to geologists , the pleiocene formation was in progress .",51
"certainly , the movement which he and neb exhibited , if it had been transformed into heat , according to the new theory , would have been enough to heat the boiler of a steamer !",18
"according to your idea , then , my brain is turned . and for whom - for some grisette , some chambermaid with whom i have trifled in some garrison ?",0
"according to him , a cavity , more or less considerable , must exist in the mass of granite which supported prospect heights , and he intended to penetrate into it .",0
"the professor was getting excited according to his wo nt , and was allowing his imagination to run away with him .",5
"the engineer therefore manifested some impatience to reach the western coast of lincoln island , which was at least five miles distant according to his estimation .",22
"as soon as the meal was over the children disappeared , and their elders gathered round the peat fire , which also burnt such miscellaneous fuel as briars , cow - dung , and fishbones . after this little pinch of warmth the different groups retired to their respective rooms . our hostess hospitably offered us her assistance in undressing , according to icelandic usage ; but on our gracefully declining , she insisted no longer , and i was able at last to curl myself up in my mossy bed .",61
""" in fact , "" said aramis , "" it is an absolution according to rule . """,13
""" according to sirr 's book , "" i replied , "" these ceylon fisheries are farmed annually for a total profit of 3,000,000 man - eaters . """,1
"according to the sailor , any animal , whatever it was , would be a lawful prize , and the rodents or carnivora which might get into the new snares would be well received at granite house .",0
"passepartout , who had conscientiously studied the programme of his duties , was more than surprised to see his master guilty of the inexactness of appearing at this unaccustomed hour ; for , according to rule , he was not due in saville row until precisely midnight .",33
"i say that according to all probability i shall not be able to undergo the fatigues of the siege of la rochelle , and that it would be far better that you should appoint there either monsieur de conde , monsieur de bassopierre , or some valiant gentleman whose business is war , and not me , who am a churchman , and who am constantly turned aside for my real vocation to look after matters for which i have no aptitude .",3
"mme . coquenard drew the dish toward her , skillfully detached the two great black feet , which she placed upon her husband ’s plate , cut off the neck , which with the head she put on one side for herself , raised the wing for porthos , and then returned the bird otherwise intact to the servant who had brought it in , who disappeared with it before the musketeer had time to examine the variations which disappointment produces upon faces , according to the characters and temperaments of those who experience it .",84
"all the rest of the furniture indicated that the dweller in this house occupied himself with the study of natural science . there were large bottles filled with serpents , ticketed according to their species ; dried lizards shone like emeralds set in great squares of black wood , and bunches of wild odoriferous herbs , doubtless possessed of virtues unknown to common men , were fastened to the ceiling and hung down in the corners of the apartment .",31
"cyrus harding 's project had succeeded , but , according to his usual habit he showed no satisfaction ; with closed lips and a fixed look , he remained motionless .",9
"as he passed among the busy crowd , fix , according to habit , scrutinised the passers - by with a keen , rapid glance .",10
"he went then to the queen , and according to custom accosted her with fresh menaces against those who surrounded her .",8
"and then commenced a roar of laughter in which they all joined , to the astonishment of poor porthos ; but when he was informed of the cause of their hilarity , he shared it vociferously according to his custom .",36
""" the world goes to the altar of its own accord , "" was the answer .",10
"according to the engineer 's calculation , the mercurial column of a fahrenheit thermometer would not have marked less than eight degrees below zero , and this intense cold , rendered still more painful by a sharp gale , lasted for several days .",0
"i knew quite well that according to the best received theories the mineral covering of the globe is never at absolute rest ; the changes brought about by the chemical decomposition of its component parts , the agitation caused by great liquid torrents , and the magnetic currents , are continually tending to disturb it -- even when living beings upon its surface may fancy that all is quiet below . a phenomenon of this kind would not have greatly alarmed me , or at any rate it would not have given rise to dreadful apprehensions .",5
"and he was right . imagine the large development attained by these plants , which prefer a warm , moist climate . i knew that the _ lycopodon giganteum _ attains , according to bulliard , a circumference of eight or nine feet ; but here were pale mushrooms , thirty to forty feet high , and crowned with a cap of equal diameter . there they stood in thousands . no light could penetrate between their huge cones , and complete darkness reigned beneath those giants ; they formed settlements of domes placed in close array like the round , thatched roofs of a central african city .",32
""" yes , monsieur l'abbe , "" answered candide , "" i must absolutely wait upon miss cunegund , "" and then the pleasure he took in talking about the object he loved , led him insensibly to relate , according to custom , part of his adventures with that illustrious westphalian beauty .",40
"john bunsby 's suspicions were confirmed . at a less advanced season of the year the typhoon , according to a famous meteorologist , would have passed away like a luminous cascade of electric flame ; but in the winter equinox it was to be feared that it would burst upon them with great violence .",18
""" i may say , pencroft , that the bark of the bamboo , cut into flexible laths , is used for making baskets ; that this bark , mashed into a paste , is used for the manufacture of chinese paper ; that the stalks furnish , according to their size , canes and pipes and are used for conducting water ; that large bamboos make excellent material for building , being light and strong , and being never attacked by insects .",48
"in five minutes three were slightly wounded , one on the hand , another on the ear , by the defender of the stair , who himself remained intact -- a piece of skill which was worth to him , according to the rules agreed upon , three turns of favor .",40
"according to the laws of dueling at that period , d’artagnan was at liberty to assist whom he pleased . while he was endeavoring to find out which of his companions stood in greatest need , he caught a glance from athos .",0
""" no doubt ; and there is a geological explanation of the fact . at a certain period the earth consisted only of an elastic crust or bark , alternately acted on by forces from above or below , according to the laws of attraction and gravitation . probably there were subsidences of the outer crust , when a portion of the sedimentary deposits was carried down sudden openings . """,39
"he discovered wonderful stories , also , about jewels . in alphonso 's clericalis disciplina a serpent was mentioned with eyes of real jacinth , and in the romantic history of alexander , the conqueror of emathia was said to have found in the vale of jordan snakes "" with collars of real emeralds growing on their backs . "" there was a gem in the brain of the dragon , philostratus told us , and "" by the exhibition of golden letters and a scarlet robe "" the monster could be thrown into a magical sleep and slain . according to the great alchemist , pierre de boniface , the diamond rendered a man invisible , and the agate of india made him eloquent . the cornelian appeased anger , and the hyacinth provoked sleep , and the amethyst drove away the fumes of wine . the garnet cast out demons , and the hydropicus deprived the moon of her colour . the selenite waxed and waned with the moon , and the meloceus , that discovers thieves , could be affected only by the blood of kids . leonardus camillus had seen a white stone taken from the brain of a newly killed toad , that was a certain antidote against poison . the bezoar , that was found in the heart of the arabian deer , was a charm that could cure the plague . in the nests of arabian birds was the aspilates , that , according to democritus , kept the wearer from any danger by fire .",100
"he discovered wonderful stories , also , about jewels . in alphonso 's clericalis disciplina a serpent was mentioned with eyes of real jacinth , and in the romantic history of alexander , the conqueror of emathia was said to have found in the vale of jordan snakes "" with collars of real emeralds growing on their backs . "" there was a gem in the brain of the dragon , philostratus told us , and "" by the exhibition of golden letters and a scarlet robe "" the monster could be thrown into a magical sleep and slain . according to the great alchemist , pierre de boniface , the diamond rendered a man invisible , and the agate of india made him eloquent . the cornelian appeased anger , and the hyacinth provoked sleep , and the amethyst drove away the fumes of wine . the garnet cast out demons , and the hydropicus deprived the moon of her colour . the selenite waxed and waned with the moon , and the meloceus , that discovers thieves , could be affected only by the blood of kids . leonardus camillus had seen a white stone taken from the brain of a newly killed toad , that was a certain antidote against poison . the bezoar , that was found in the heart of the arabian deer , was a charm that could cure the plague . in the nests of arabian birds was the aspilates , that , according to democritus , kept the wearer from any danger by fire .",250
"the wind blowing out of union bay she ran before it , and thus showed her owners , much to their satisfaction , that she possessed a remarkably fast pair of heels , according to pencroft 's mode of speaking .",33
""" we wish to judge you according to your crime , "" said athos ; "" you shall be free to defend yourself . justify yourself if you can .",6
"other zoophytes swarming near the sponges consisted chiefly of a very elegant species of jellyfish ; mollusks were represented by varieties of squid that , according to professor orbigny , are unique to the red sea ; and reptiles by virgata turtles belonging to the genus chelonia , which furnished our table with a dainty but wholesome dish .",25
""" fifty at least , monsieur , and not at all handsome , according to pathaud ’s account . """,13
""" according to your system , "" said my uncle . "" but what does the thermometer say ? """,1
"it was not the engineer who had invented this way of causing loud explosions , for , according to marco polo , the tartars have employed it for many centuries to drive away from their encampments the formidable wild beasts of central asia .",17
""" eh , eh ! "" said he , reasoning to himself according to the strangely easy morality of that gallant period , "" there is one who will be equipped in good time ! """,12
""" ay , the compass ! "" i said , greatly puzzled . "" according to the compass we have gone northward . """,14
""" shake me off , then , sir,--push me away , for i 'll not leave you of my own accord . """,20
"mr . fogg and his servant went ashore at aden to have the passport again visaed ; fix , unobserved , followed them . the visa procured , mr . fogg returned on board to resume his former habits ; while passepartout , according to custom , sauntered about among the mixed population of somalis , banyans , parsees , jews , arabs , and europeans who comprise the twenty - five thousand inhabitants of aden . he gazed with wonder upon the fortifications which make this place the gibraltar of the indian ocean , and the vast cisterns where the english engineers were still at work , two thousand years after the engineers of solomon . "" very curious , very curious , "" said passepartout to himself , on returning to the steamer . "" i see that it is by no means useless to travel , if a man wants to see something new . """,43
"a gentleman , in his opinion -- and according to d’artagnan ’s portrait of him , the stranger must be a gentleman -- would be incapable of the baseness of stealing a letter .",8
"beyond the fortifications through which athos had made a breach in order to get out , and which were composed of fagots , planks , and empty casks , heaped up according to all the rules of the strategic art , they found , swimming in puddles of oil and wine , the bones and fragments of all the hams they had eaten ; while a heap of broken bottles filled the whole left - hand corner of the cellar , and a tun , the cock of which was left running , was yielding , by this means , the last drop of its blood .",31
"the framework of the partitions was soon raised , very roughly at first , and in a short time , the cave was divided into rooms and storehouses , according to the plan agreed upon .",29
that evening the three musketeers were informed of the honor accorded them .,10
"the frame was to rest on a pivot supported with strong timbers , so that it could turn with all the machinery it contained according as the wind required it .",24
""" master will reply , my friends , that baleen whales are localized , according to species , within certain seas that they never leave . and if one of these animals went from the bering strait to the davis strait , it 's quite simply because there 's some passageway from the one sea to the other , either along the coasts of canada or siberia . """,14
"by the evening , according to calculation , it was thought that the "" bonadventure "" had accomplished a distance of a hundred and twenty miles since her departure from lincoln island , that is to say in thirty - six hours , which would give her a speed of between three and four knots an hour .",4
""" none at all , my friends , at least in those that go beyond the bounds of credibility and fly off into fable or legend . yet for the imaginings of these storytellers there had to be , if not a cause , at least an excuse . it ca n't be denied that some species of squid and other devilfish are quite large , though still smaller than cetaceans . aristotle put the dimensions of one squid at five cubits , or 3.1 meters . our fishermen frequently see specimens over 1.8 meters long . the museums in trieste and montpellier have preserved some devilfish carcasses measuring two meters . besides , according to the calculations of naturalists , one of these animals only six feet long would have tentacles as long as twenty - seven . which is enough to make a fearsome monster . """,114
"this note was in the first place a forgery ; it was likewise an indelicacy . it was even , according to our present manners , something like an infamous action ; but at that period people did not manage affairs as they do today .",20
"and there was no reason to doubt that this was tabor island , since according to the most recent charts there was no island in this part of the pacific between new zealand and the american coast .",14
""" here is the knife , "" said felton , drawing from his pocket the weapon which he had brought , according to his promise , but which he hesitated to give to his prisoner .",21
"from eight to nine o'clock , the nautilus stayed a few meters beneath the waters . according to my calculations , we had to be quite close to suez . through the panels in the lounge , i spotted rocky bottoms brightly lit by our electric rays . it seemed to me that the strait was getting narrower and narrower .",16
"athos , according to his system , neither encouraged nor dissuaded him .",2
"there was a moment of cold silence , during which everyone was affected according to his nature .",13
"on their way they met grimaud . athos made him a sign to come with them . grimaud , according to custom , obeyed in silence ; the poor lad had nearly come to the pass of forgetting how to speak .",19
"by measuring them one after the other , according to their length and breadth , the marks of five men 's feet were easily distinguished .",8
""" afterwards , take a piece of smooth ivory -- you have one prepared in your drawing - box : take your palette , mix your freshest , finest , clearest tints ; choose your most delicate camel - hair pencils ; delineate carefully the loveliest face you can imagine ; paint it in your softest shades and sweetest lines , according to the description given by mrs . fairfax of blanche ingram ; remember the raven ringlets , the oriental eye;--what ! you revert to mr . rochester as a model ! order !",61
"having once explained to them that i could not now be explicit about my plans , they kindly and wisely acquiesced in the silence with which i pursued them , according to me the privilege of free action i should under similar circumstances have accorded them .",30
"having once explained to them that i could not now be explicit about my plans , they kindly and wisely acquiesced in the silence with which i pursued them , according to me the privilege of free action i should under similar circumstances have accorded them .",44
"the latter -- a pretty girl of about twenty or twenty - two years , active and lively , the true soubrette of a great lady -- jumped from the step upon which , according to the custom of the time , she was seated , and took her way toward the terrace upon which d’artagnan had perceived lubin .",34
"under these conditions the barometer generally stayed quite low . it fell as far as 73.5 centimeters . our compass indications no longer offered any guarantees . the deranged needles would mark contradictory directions as we approached the southern magnetic pole , which does n't coincide with the south pole proper . in fact , according to the astronomer hansteen , this magnetic pole is located fairly close to latitude 70 degrees and longitude 130 degrees , or abiding by the observations of louis - isidore duperrey , in longitude 135 degrees and latitude 70 degrees 30 ' . hence we had to transport compasses to different parts of the ship , take many readings , and strike an average . often we could chart our course only by guesswork , a less than satisfactory method in the midst of these winding passageways whose landmarks change continuously .",55
"the young woman was placed in one of the waiting - rooms of the station , whilst passepartout was charged with purchasing for her various articles of toilet , a dress , shawl , and some furs ; for which his master gave him unlimited credit . passepartout started off forthwith , and found himself in the streets of allahabad , that is , the city of god , one of the most venerated in india , being built at the junction of the two sacred rivers , ganges and jumna , the waters of which attract pilgrims from every part of the peninsula . the ganges , according to the legends of the ramayana , rises in heaven , whence , owing to brahma 's agency , it descends to the earth .",108
"this was a suspension - bridge thrown over some rapids , about a mile from the place where they now were . according to the signal - man , it was in a ruinous condition , several of the iron wires being broken ; and it was impossible to risk the passage . he did not in any way exaggerate the condition of the bridge . it may be taken for granted that , rash as the americans usually are , when they are prudent there is good reason for it .",22
"pangloss composed a fine memorial , by which he proved that the baron had no right over his sister ; and that she might , according to all the laws of the empire , marry candide with the left hand . martin concluded to throw the baron into the sea ; cacambo decided that he must be delivered to the turkish captain and sent to the galleys ; after which he should be conveyed by the first ship to the father general at rome .",25
"the whale was a female , and a large quantity of milk was taken from it , which , according to the opinion of the naturalist duffenbach , might pass for cow 's milk , and , indeed , it differs from it neither in taste , color , nor density .",19
""" my friends , "" at last said cyrus harding , "" there is only one thing to be done at present ; wait for day , and then act according to circumstances .",30
"the ' duncan ' yacht was equipped for the distant voyage , in which the nobleman 's family and the captain 's children wished to take part , and the ' duncan , ' leaving glasgow , proceeded towards the atlantic , passed through the straits of magellan , and ascended the pacific as far as patagonia , where , according to a previous interpretation of the document , they supposed that captain grant was a prisoner among the indians .",60
"according to his journal , he was due at calcutta on the 25th of october , and that was the exact date of his actual arrival . he was therefore neither behind - hand nor ahead of time . the two days gained between london and bombay had been lost , as has been seen , in the journey across india . but it is not to be supposed that phileas fogg regretted them .",0
"this morning i wrote to my banker in london to send me certain jewels he has in his keeping,--heirlooms for the ladies of thornfield . in a day or two i hope to pour them into your lap : for every privilege , every attention shall be yours that i would accord a peer 's daughter , if about to marry her . """,51
""" fortunately , the day after tomorrow we leave paris . we are going according to all probability to la rochelle , and once gone-- """,14
"it appears , according to your account , that if by mischance a musketeer is arrested , france is in danger .",3
"milady was like a good general who contemplates at the same time victory and defeat , and who is quite prepared , according to the chances of the battle , to march forward or to beat a retreat .",22
""" an eternity , she tells me . i believe , according to the peerage , it is ten years , but ten years with monmouth must have been like eternity , with time thrown in . who else is coming ? """,11
"on the morning of the eighth day , bazin , fresh as ever , and smiling , according to custom , entered the cabaret of the parpaillot as the four friends were sitting down to breakfast , saying , as had been agreed upon : "" monsieur aramis , the answer from your cousin . """,17
"at that , according to his usual custom , pencroft could not reply otherwise than by a tremendous hurrah .",3
"on friday evening , the 10th of july , according to our calculations , we were thirty leagues south - east of rejkiavik , and at a depth of two leagues and a half .",9
"a silent party soon drew near to the same enclosure , entered , and joined the musketeers . then , according to foreign custom , the presentations took place .",20
"here a question popped into my head . how did the commander of this aquatic residence go about it ? did he obtain air using chemical methods , releasing the oxygen contained in potassium chlorate by heating it , meanwhile absorbing the carbon dioxide with potassium hydroxide ? if so , he would have to keep up some kind of relationship with the shore , to come by the materials needed for such an operation . did he simply limit himself to storing the air in high - pressure tanks and then dispense it according to his crew 's needs ? perhaps . or , proceeding in a more convenient , more economical , and consequently more probable fashion , was he satisfied with merely returning to breathe at the surface of the water like a cetacean , renewing his oxygen supply every twenty - four hours ? in any event , whatever his method was , it seemed prudent to me that he use this method without delay .",94
""" what ? what ? "" he said hastily . "" curiosity is a dangerous petition : it is well i have not taken a vow to accord every request-- """,27
