text,ind
"it is not mercy , then , that you are about to accord , sire , it is justice . """,12
"arrived there , he fastened , according to the orders of his master , both horse and mule to the knocker of the procurator ’s door ; then , without taking any thought for their future , he returned to porthos , and told him that his commission was completed .",6
"great blocks of that basalt , which , according to bischof , takes three hundred and fifty millions of years to cool , strewed the plain , very confused in some places .",8
in the evening he recurred to the subject of his own accord .,11
""" indeed , "" said the cardinal , "" whatever repugnance i may have to directing my mind to such a treason , your majesty compels me to think of it . madame de lannoy , whom , according to your majesty ’s command , i have frequently interrogated , told me this morning that the night before last her majesty sat up very late , that this morning she wept much , and that she was writing all day . """,38
"in an hour we had reached the islet . two hours later we had completed a full circle around it . it measured four to five miles in circumference . a narrow channel separated it from a considerable shore , perhaps a continent whose limits we could n't see . the existence of this shore seemed to bear out commander maury 's hypotheses . in essence , this ingenious american has noted that between the south pole and the 60th parallel , the sea is covered with floating ice of dimensions much greater than any found in the north atlantic . from this fact he drew the conclusion that the antarctic circle must contain considerable shores , since icebergs ca n't form on the high seas but only along coastlines . according to his calculations , this frozen mass enclosing the southernmost pole forms a vast ice cap whose width must reach 4,000 kilometers .",131
""" and here , according to the law of increasing temperature , there ought to be a heat of 2,732 ° fahr . ! """,4
"this was not the first attempt of these daring indians , for more than once they had waylaid trains on the road . a hundred of them had , according to their habit , jumped upon the steps without stopping the train , with the ease of a clown mounting a horse at full gallop .",29
"among other zoophytes present in these shallows , there were a few coral tree forms that , according to sir james clark ross , live in these antarctic seas at depths as great as 1,000 meters ; then small alcyon coral belonging to the species procellaria pelagica , also a large number of starfish unique to these climes , plus some feather stars spangling the sand .",17
""" certainly that is most in accord with your own principles , "" replied milady , frigidly .",6
"it was a delightful animal whose discovery , according to the ancients , is a sign of good luck . aristotle , athenaeus , pliny , and oppian studied its habits and lavished on its behalf all the scientific poetry of greece and italy . they called it "" nautilus "" and "" pompilius . "" but modern science has not endorsed these designations , and this mollusk is now known by the name argonaut .",8
"according to his conviction , she was some creature of the cardinal , and yet he felt himself invincibly drawn toward her by one of those sentiments for which we can not account .",0
