text,ind,sense,label
"' wake up , alice dear ! ' said her sister ; ' why , what a long sleep you 've had ! ' ' oh , i 've had such a curious dream ! ' said alice , and she told her sister , as well as she could remember them , all these strange adventures of hers that you have just been reading about ; and when she had finished , her sister kissed her , and said ,",33,"('dream', 'rêve', 'soñar')",0
"' it was a curious dream , dear , certainly : but now run in to your tea ; it 's getting late . ' so alice got up and ran off , thinking while she ran , as well she might , what a wonderful dream it had been .",5,"('dream', 'rêve', 'soñar')",0
"' it was a curious dream , dear , certainly : but now run in to your tea ; it 's getting late . ' so alice got up and ran off , thinking while she ran , as well she might , what a wonderful dream it had been .",46,"('dream', 'rêve', 'soñar')",0
"so , then , the dream in which i had had a vision of the prehistoric world , of the tertiary and post - tertiary periods , was now realised . and there we were alone , in the bowels of the earth , at the mercy of its wild inhabitants !",5,"('dream', 'rêve', 'soñar')",0
"first , she dreamed of little alice herself , and once again the tiny hands were clasped upon her knee , and the bright eager eyes were looking up into hers -- she could hear the very tones of her voice , and see that queer little toss of her head to keep back the wandering hair that would always get into her eyes -- and still as she listened , or seemed to listen , the whole place around her became alive the strange creatures of her little sister 's dream .",3,"('dream', 'rêver', 'soñar')",1
"first , she dreamed of little alice herself , and once again the tiny hands were clasped upon her knee , and the bright eager eyes were looking up into hers -- she could hear the very tones of her voice , and see that queer little toss of her head to keep back the wandering hair that would always get into her eyes -- and still as she listened , or seemed to listen , the whole place around her became alive the strange creatures of her little sister 's dream .",91,"('dream', 'rêve', 'soñar')",0
"lastly , she pictured to herself how this same little sister of hers would , in the after - time , be herself a grown woman ; and how she would keep , through all her riper years , the simple and loving heart of her childhood : and how she would gather about her other little children , and make their eyes bright and eager with many a strange tale , perhaps even with the dream of wonderland of long ago : and how she would feel with all their simple sorrows , and find a pleasure in all their simple joys , remembering her own child - life , and the happy summer days .",76,"('dream', 'songe', 'soñar')",2
these eyes in the evening star you must have seen in a dream .,12,"('dream', 'rêve', 'sueño')",3
""" and yet , "" continued lord henry , in his low , musical voice , and with that graceful wave of the hand that was always so characteristic of him , and that he had even in his eton days , "" i believe that if one man were to live out his life fully and completely , were to give form to every feeling , expression to every thought , reality to every dream -- i believe that the world would gain such a fresh impulse of joy that we would forget all the maladies of mediaevalism , and return to the hellenic ideal-- to something finer , richer than the hellenic ideal , it may be . but the bravest man amongst us is afraid of himself . the mutilation of the savage has its tragic survival in the self - denial that mars our lives . we are punished for our refusals .",75,"('dream', 'rêve', 'soñar')",0
""" ah ! this is practical -- this is real ! "" he cried : "" i should never dream that .",19,"('dream', 'rêver', 'soñar')",1
"he was about to see in reality a certain coffer of which he had twenty times beheld the image in his dreams -- a coffer long and deep , locked , bolted , fastened in the wall ; a coffer of which he had so often heard , and which the hands -- a little wrinkled , it is true , but still not without elegance -- of the procurator ’s wife were about to open to his admiring looks .",21,"('dream', 'rêve', 'sueño')",3
"porthos comprehended that this chest , although it did not correspond in shape with that which he had seen in his dreams , must be the blessed coffer , and he congratulated himself that the reality was several feet higher than the dream .",42,"('dream', 'rêve', 'soñar')",0
"the lad started , as if awakened from some dream .",9,"('dream', 'rêve', 'soñar')",0
"d’artagnan already fancied himself , so rapid is the flight of our dreams upon the wings of imagination , accosted by a messenger from the young woman , who brought him some billet appointing a meeting , a gold chain , or a diamond .",12,"('dream', 'rêve', 'sueño')",3
36 dream of vengeance,1,"('dream', 'rêve', 'soñar')",0
"felton , as pale as death , remained some instants with his ear bent and listening ; then , when the sound was quite extinct , he breathed like a man awaking from a dream , and rushed out of the apartment .",34,"('dream', 'songe', 'soñar')",2
"night fell . i went to bed . i slept pretty poorly . man - eaters played a major role in my dreams . and i found it more or less appropriate that the french word for shark , requin , has its linguistic roots in the word requiem .",22,"('dream', 'rêve', 'sueño')",3
"that is just where i was in my dream , when my uncle with a vehement thump on the table dragged me back to the realities of life .",8,"('dream', 'rêve', 'sueño')",3
""" yes ; though i touch it , it is a dream , "" said i , as i put it down from before my face .",11,"('dream', 'rêve', 'soñar')",0
"i wondered whether i was awake , whether i was dreaming , whether my brain , crazed by my fall , was not affected by imaginary noises . yet neither eyes , nor ears could be so utterly deceived .",10,"('dream', 'rêver', 'soñar')",1
"shaking off from my spirit what must have been a dream , i scanned more narrowly the real aspect of the building .",10,"('dream', 'rêve', 'soñar')",0
he had walked as one walks in a dream ; he had a glimpse of objects as through a fog . his ears had perceived sounds without comprehending them ; he might have been executed at that moment without his making a single gesture in his own defense or uttering a cry to implore mercy .,8,"('dream', 'rêve', 'sueño')",3
""" yes ; but we travel so fast that i seem to be journeying in a dream . so this is suez ? """,16,"('dream', 'rêve', 'sueño')",3
"this time felton , immovable as he was , or appeared to be , could not resist the secret influence which had already taken possession of him . to see this woman , so beautiful , fair as the brightest vision , to see her by turns overcome with grief and threatening ; to resist at once the ascendancy of grief and beauty -- it was too much for a visionary ; it was too much for a brain weakened by the ardent dreams of an ecstatic faith ; it was too much for a heart furrowed by the love of heaven that burns , by the hatred of men that devours . milady saw the trouble .",83,"('dream', 'rêve', 'sueño')",3
"at length he went to bed , fell asleep , and had golden dreams .",13,"('dream', 'rêve', 'sueño')",3
""" yes , yes ! "" said felton , passing his hands over his brow , covered with sweat , as if to remove his last doubt . "" yes , i recognize the voice which speaks to me in my dreams ; yes , i recognize the features of the angel who appears to me every night , crying to my soul , which can not sleep : ’ strike , save england , save thyself -- for thou wilt die without having appeased god ! ’",41,"('dream', 'rêve', 'sueño')",3
"we were stretched out in this delightful cave for an hour . our conversation , lively at the outset , then languished . a definite drowsiness overcame us . since i saw no good reason to resist the call of sleep , i fell into a heavy doze . i dreamed -- one does n't choose his dreams -- that my life had been reduced to the vegetating existence of a simple mollusk . it seemed to me that this cave made up my double - valved shell . . . .",57,"('dream', 'rêve', 'sueño')",3
"we painted and read together , or i listened , as if in a dream , to the wild improvisations of his speaking guitar .",14,"('dream', 'rêve', 'soñar')",0
"i said this rather to myself than to the gipsy , whose strange talk , voice , manner , had by this time wrapped me in a kind of dream .",29,"('dream', 'rêve', 'soñar')",0
""" listen , diana , "" said one of the absorbed students ; "" franz and old daniel are together in the night - time , and franz is telling a dream from which he has awakened in terror -- listen ! """,31,"('dream', 'rêve', 'soñar')",0
where was i ? did i wake or sleep ? had i been dreaming ? did i dream still ?,13,"('dream', 'rêver', 'soñar')",1
we know that the dream of his life had been to become a musketeer .,4,"('dream', 'rêve', 'soñar')",0
"candide thought himself in a trance ; he looked upon his whole life , hitherto , as a frightful dream , and the present moment as a very agreeable one .",19,"('dream', 'songe', 'soñar')",2
"as they had long been acquainted with the king , they were not much excited ; but d’artagnan , with his gascon imagination , saw in it his future fortune , and passed the night in golden dreams .",37,"('dream', 'rêve', 'sueño')",3
"he dreamed of canals facilitating the transport of the riches of the ground ; workings of quarries and mines ; machines for every industrial manufacture ; railroads ; yes , railroads ! of which a network would certainly one day cover lincoln island .",1,"('dream', 'rêver', 'soñar')",1
"at that moment i felt the sinewy hand of hans seizing me vigorously . but for him , carried away by my dream , i should have thrown myself into the sea .",22,"('dream', 'rêve', 'soñar')",0
my head is still stupefied with the vivid reality of my dream .,11,"('dream', 'rêve', 'soñar')",0
"yes , indeed , those are the marks of teeth imprinted upon the metal ! the jaws which they arm must be possessed of amazing strength . is there some monster beneath us belonging to the extinct races , more voracious than the shark , more fearful in vastness than the whale ? i could not take my eyes off this indented iron bar . surely will my last night 's dream be realised ? these thoughts agitated me all day , and my imagination scarcely calmed down after several hours ' sleep .",71,"('dream', 'rêve', 'soñar')",0
"the girl laughed again . the joy of a caged bird was in her voice . her eyes caught the melody and echoed it in radiance , then closed for a moment , as though to hide their secret . when they opened , the mist of a dream had passed across them .",48,"('dream', 'rêve', 'soñar')",0
"in fact , the dream of poor bazin had always been to serve a churchman ; and he awaited with impatience the moment , always in the future , when aramis would throw aside the uniform and assume the cassock .",4,"('dream', 'rêve', 'soñar')",0
"no one that shall ever read this account will expect that i should be able to describe the horrors of my soul at this terrible vision . i mean , that even while it was a dream , i even dreamed of those horrors . nor is it any more possible to describe the impression that remained upon my mind when i awaked , and found it was but a dream .",70,"('dream', 'songe', 'soñar')",2
""" and what was most frightful , "" continued milady , her voice altered , as if she still experienced the same agony as at that awful minute , "" was that at this time i retained a consciousness of the danger that threatened me ; was that my soul , if i may say so , waked in my sleeping body ; was that i saw , that i heard . it is true that all was like a dream , but it was not the less frightful .",80,"('dream', 'rêve', 'soñar')",0
""" oh great ! "" put in the disappointed harpooner , watching his dreams of fresh meat fade away . "" and you , professor aronnax , are you going to stick yourself inside these clothes ? """,13,"('dream', 'rêve', 'sueño')",3
i have dreamed that the unlucky englishman was dead .,2,"('dream', 'rêver', 'soñar')",1
"i can not recollect whether it was by steel or by poison ; only of this i am sure , i have dreamed he was dead , and you know my dreams never deceive me .",22,"('dream', 'rêver', 'soñar')",1
"i can not recollect whether it was by steel or by poison ; only of this i am sure , i have dreamed he was dead , and you know my dreams never deceive me .",31,"('dream', 'rêve', 'sueño')",3
"as i rose and dressed , i thought over what had happened , and wondered if it were a dream . i could not be certain of the reality till i had seen mr . rochester again , and heard him renew his words of love and promise .",19,"('dream', 'rêve', 'soñar')",0
"the lawn , the grounds were trodden and waste : the portal yawned void . the front was , as i had once seen it in a dream , but a well - like wall , very high and very fragile - looking , perforated with paneless windows : no roof , no battlements , no chimneys -- all had crashed in .",27,"('dream', 'rêve', 'sueño')",3
we might say that was his dream .,6,"('dream', 'rêve', 'soñar')",0
"milady dreamed that she at length had d’artagnan in her power , that she was present at his execution ; and it was the sight of his odious blood , flowing beneath the ax of the headsman , which spread that charming smile upon her lips .",1,"('dream', 'rêver', 'soñar')",1
""" it is that , then , "" replied the young man , anxious to find out the truth , "" it is that , then , i remember as we remember a dream . we were speaking of hanging . """,33,"('dream', 'rêve', 'soñar')",0
""" my cousin , my sister and i are skillful in interpreting dreams , and even entertain great fear of them ; but of yours it may be said , i hope , every dream is an illusion .",12,"('dream', 'rêve', 'sueño')",3
""" my cousin , my sister and i are skillful in interpreting dreams , and even entertain great fear of them ; but of yours it may be said , i hope , every dream is an illusion .",34,"('dream', 'songe', 'soñar')",2
""" and what dream does she mean ? "" asked the dragoon , who had approached during the reading .",3,"('dream', 'rêve', 'soñar')",0
""" well , pardieu ! "" said aramis , "" it was only this : i had a dream , and i related it to her . """,18,"('dream', 'rêve', 'soñar')",0
"as to bazin , he went and lay down on a truss of straw ; and as he had more imagination than the swiss , he dreamed that aramis , having become pope , adorned his head with a cardinal ’s hat .",26,"('dream', 'rêver', 'soñar')",1
""" oh , but i , "" said anne , "" i also , duke , have had presentiments ; i also have had dreams .",24,"('dream', 'rêve', 'sueño')",3
who can possibly have told you i had had that dream ?,10,"('dream', 'rêve', 'soñar')",0
would god send the same dreams to you as to me if you did not love me ?,5,"('dream', 'rêve', 'sueño')",3
"mme . bonacieux saw her go without being able to follow her ; she was like people who dream they are pursued , and who in vain try to walk .",18,"('dream', 'rêver', 'soñar')",1
