text,ind
""" ah , my dear basil , that is exactly why i can feel it . those who are faithful know only the trivial side of love : it is the faithless who know love 's tragedies . "" and lord henry struck a light on a dainty silver case and began to smoke a cigarette with a self - conscious and satisfied air , as if he had summed up the world in a phrase .",34
""" and whenever we find each other , in whatever place it may be , "" said kitty , "" you will find me loving you as i love you today . """,24
""" and whenever we find each other , in whatever place it may be , "" said kitty , "" you will find me loving you as i love you today . """,28
"lastly , she pictured to herself how this same little sister of hers would , in the after - time , be herself a grown woman ; and how she would keep , through all her riper years , the simple and loving heart of her childhood : and how she would gather about her other little children , and make their eyes bright and eager with many a strange tale , perhaps even with the dream of wonderland of long ago : and how she would feel with all their simple sorrows , and find a pleasure in all their simple joys , remembering her own child - life , and the happy summer days .",42
"well has solomon said--""better is a dinner of herbs where love is , than a stalled ox and hatred therewith . """,10
"no sooner had twilight , that hour of romance , began to lower her blue and starry banner over the lattice , than i rose , opened the piano , and entreated him , for the love of heaven , to give me a song .",36
""" and on my part , "" said d’artagnan , "" i wished to speak of you , but i find you so completely detached from everything ! to love you cry , ’ fie ! friends are shadows ! the world is a sepulcher ! ’ """,29
"i dreamed it would be nameless bliss , as i loved , loved to be ; and to this object did i press as blind as eagerly .",10
"i dreamed it would be nameless bliss , as i loved , loved to be ; and to this object did i press as blind as eagerly .",12
""" give a ball ; you know how much the queen loves dancing . i will answer for it , her resentment will not hold out against such an attention . """,11
""" appreciate it ? i am in love with it , basil . it is part of myself . i feel that . """,7
""" i love you well , my own dear gräuben ! """,2
"little by little ned developed a taste for chatting , and i loved hearing the tales of his adventures in the polar seas . he described his fishing trips and his battles with great natural lyricism . his tales took on the form of an epic poem , and i felt i was hearing some canadian homer reciting his iliad of the high arctic regions .",12
""" aha ! you are in love with gräuben ? "" he said , with the right look for a guardian .",6
""" you love gräuben , "" he went on once or twice dreamily . "" well , let us apply the process i have suggested to the document in question . """,2
"d’artagnan then remembered the injunction : "" if you value your own life or that of those who love you , remain motionless , and as if you had seen nothing . """,18
"violent as he had seemed in his despair , he , in truth , loved me far too well and too tenderly to constitute himself my tyrant : he would have given me half his fortune , without demanding so much as a kiss in return , rather than i should have flung myself friendless on the wide world .",14
"do you love me , jane?--repeat it . """,2
"this time felton , immovable as he was , or appeared to be , could not resist the secret influence which had already taken possession of him . to see this woman , so beautiful , fair as the brightest vision , to see her by turns overcome with grief and threatening ; to resist at once the ascendancy of grief and beauty -- it was too much for a visionary ; it was too much for a brain weakened by the ardent dreams of an ecstatic faith ; it was too much for a heart furrowed by the love of heaven that burns , by the hatred of men that devours . milady saw the trouble .",99
"he remembered something like it in history . was it not plato , that artist in thought , who had first analyzed it ? was it not buonarotti who had carved it in the coloured marbles of a sonnet - sequence ? but in our own century it was strange . . . . yes ; he would try to be to dorian gray what , without knowing it , the lad was to the painter who had fashioned the wonderful portrait . he would seek to dominate him -- had already , indeed , half done so . he would make that wonderful spirit his own . there was something fascinating in this son of love and death .",116
""" dear me ! "" said lady agatha , "" how you men argue ! i am sure i never can make out what you are talking about . oh ! harry , i am quite vexed with you . why do you try to persuade our nice mr . dorian gray to give up the east end ? i assure you he would be quite invaluable . they would love his playing . """,70
"on her side mme . bonacieux had also reflected ; but , it must be admitted , upon something widely different from ambition . in spite of herself her thoughts constantly reverted to that handsome young man who was so brave and appeared to be so much in love . married at eighteen to m. bonacieux , having always lived among her husband ’s friends -- people little capable of inspiring any sentiment whatever in a young woman whose heart was above her position -- mme . bonacieux had remained insensible to vulgar seductions ; but at this period the title of gentleman had great influence with the citizen class , and d’artagnan was a gentleman . besides , he wore the uniform of the guards , which next to that of the musketeers was most admired by the ladies .",48
i had a belief she loved me even when she left me : that was an atom of sweet in much bitter .,5
"he loves ( as he _ can _ love , and that is not as you love ) a beautiful young lady called rosamond . he wanted to marry me only because he thought i should make a suitable missionary 's wife , which she would not have done .",8
"he loves ( as he _ can _ love , and that is not as you love ) a beautiful young lady called rosamond . he wanted to marry me only because he thought i should make a suitable missionary 's wife , which she would not have done .",16
"but if you wish me to love you , could you but see how much i _ do _ love you , you would be proud and content .",6
"but if you wish me to love you , could you but see how much i _ do _ love you , you would be proud and content .",19
""" well , eighteen , then . and i saw you with him the other night at the opera . "" she laughed nervously as she spoke , and watched him with her vague forget - me - not eyes . she was a curious woman , whose dresses always looked as if they had been designed in a rage and put on in a tempest . she was usually in love with somebody , and , as her passion was never returned , she had kept all her illusions . she tried to look picturesque , but only succeeded in being untidy . her name was victoria , and she had a perfect mania for going to church .",71
""" i do n't think i am likely to marry , harry . i am too much in love . that is one of your aphorisms . i am putting it into practice , as i do everything that you say . """,18
""" who are you in love with ? "" asked lord henry after a pause .",5
""" choose then , sir--_her who loves you best _ . """,6
""" i will at least choose--_her i love best _ .",7
"ah ! women and young girls , how incomprehensible are your feminine hearts ! when you are not the timidest , you are the bravest of creatures . reason has nothing to do with your actions . what ! did this child encourage me in such an expedition ! would she not be afraid to join it herself ? and she was driving me to it , one whom she loved !",70
"i love you better now , when i can really be useful to you , than i did in your state of proud independence , when you disdained every part but that of the giver and protector . """,1
""" because i have loved so many of them , dorian . """,4
"richelieu , as everyone knows , had loved the queen . was this love a simple political affair , or was it naturally one of those profound passions which anne of austria inspired in those who approached her ?",7
"richelieu , as everyone knows , had loved the queen . was this love a simple political affair , or was it naturally one of those profound passions which anne of austria inspired in those who approached her ?",13
""" it is only the sacred things that are worth touching , dorian , "" said lord henry , with a strange touch of pathos in his voice . "" but why should you be annoyed ? i suppose she will belong to you some day . when one is in love , one always begins by deceiving one 's self , and one always ends by deceiving others . that is what the world calls a romance . you know her , at any rate , i suppose ? """,51
"his reflections were not very cheerful . from the time of his arrival in paris , he had been mixed up with public affairs ; but his own private affairs had made no great progress , either in love or fortune .",38
"as to love , the only woman he could have loved was mme . bonacieux ; and mme . bonacieux had disappeared , without his being able to discover what had become of her .",2
"as to love , the only woman he could have loved was mme . bonacieux ; and mme . bonacieux had disappeared , without his being able to discover what had become of her .",10
""" but , my dear love , reflect a little upon what you require of me . london is far from paris , very far , and perhaps the commission with which you charge me is not without dangers ? """,5
""" how horrid you are ! she is all the great heroines of the world in one . she is more than an individual . you laugh , but i tell you she has genius . i love her , and i must make her love me . you , who know all the secrets of life , tell me how to charm sibyl vane to love me ! i want to make romeo jealous . i want the dead lovers of the world to hear our laughter and grow sad . i want a breath of our passion to stir their dust into consciousness , to wake their ashes into pain . my god , harry , how i worship her ! "" he was walking up and down the room as he spoke . hectic spots of red burned on his cheeks . he was terribly excited .",37
""" how horrid you are ! she is all the great heroines of the world in one . she is more than an individual . you laugh , but i tell you she has genius . i love her , and i must make her love me . you , who know all the secrets of life , tell me how to charm sibyl vane to love me ! i want to make romeo jealous . i want the dead lovers of the world to hear our laughter and grow sad . i want a breath of our passion to stir their dust into consciousness , to wake their ashes into pain . my god , harry , how i worship her ! "" he was walking up and down the room as he spoke . hectic spots of red burned on his cheeks . he was terribly excited .",45
""" how horrid you are ! she is all the great heroines of the world in one . she is more than an individual . you laugh , but i tell you she has genius . i love her , and i must make her love me . you , who know all the secrets of life , tell me how to charm sibyl vane to love me ! i want to make romeo jealous . i want the dead lovers of the world to hear our laughter and grow sad . i want a breath of our passion to stir their dust into consciousness , to wake their ashes into pain . my god , harry , how i worship her ! "" he was walking up and down the room as he spoke . hectic spots of red burned on his cheeks . he was terribly excited .",66
"at first the king answered that he would not go ; but he could not resist his love of sport , and set out after dinner . """,17
"as for passepartout , he was ready for anything that might be proposed . his master 's idea charmed him ; he perceived a heart , a soul , under that icy exterior . he began to love phileas fogg .",37
"sibyl vane tossed her head and laughed . "" we do n't want him any more , mother . prince charming rules life for us now . "" then she paused . a rose shook in her blood and shadowed her cheeks . quick breath parted the petals of her lips . they trembled . some southern wind of passion swept over her and stirred the dainty folds of her dress . "" i love him , "" she said simply .",74
""" she seemed to love me so ! """,4
""" you child , why , there is not a man who has not believed , as you do , that his mistress loved him , and there lives not a man who has not been deceived by his mistress . """,23
"suddenly she felt the need to speak . the wordy silence troubled her . "" mother , mother , "" she cried , "" why does he love me so much ? i know why i love him . i love him because he is like what love himself should be . but what does he see in me ? i am not worthy of him . and yet -- why , i can not tell -- though i feel so much beneath him , i do n't feel humble . i feel proud , terribly proud . mother , did you love my father as i love prince charming ? """,27
"suddenly she felt the need to speak . the wordy silence troubled her . "" mother , mother , "" she cried , "" why does he love me so much ? i know why i love him . i love him because he is like what love himself should be . but what does he see in me ? i am not worthy of him . and yet -- why , i can not tell -- though i feel so much beneath him , i do n't feel humble . i feel proud , terribly proud . mother , did you love my father as i love prince charming ? """,36
"suddenly she felt the need to speak . the wordy silence troubled her . "" mother , mother , "" she cried , "" why does he love me so much ? i know why i love him . i love him because he is like what love himself should be . but what does he see in me ? i am not worthy of him . and yet -- why , i can not tell -- though i feel so much beneath him , i do n't feel humble . i feel proud , terribly proud . mother , did you love my father as i love prince charming ? """,40
"suddenly she felt the need to speak . the wordy silence troubled her . "" mother , mother , "" she cried , "" why does he love me so much ? i know why i love him . i love him because he is like what love himself should be . but what does he see in me ? i am not worthy of him . and yet -- why , i can not tell -- though i feel so much beneath him , i do n't feel humble . i feel proud , terribly proud . mother , did you love my father as i love prince charming ? """,47
"suddenly she felt the need to speak . the wordy silence troubled her . "" mother , mother , "" she cried , "" why does he love me so much ? i know why i love him . i love him because he is like what love himself should be . but what does he see in me ? i am not worthy of him . and yet -- why , i can not tell -- though i feel so much beneath him , i do n't feel humble . i feel proud , terribly proud . mother , did you love my father as i love prince charming ? """,102
"suddenly she felt the need to speak . the wordy silence troubled her . "" mother , mother , "" she cried , "" why does he love me so much ? i know why i love him . i love him because he is like what love himself should be . but what does he see in me ? i am not worthy of him . and yet -- why , i can not tell -- though i feel so much beneath him , i do n't feel humble . i feel proud , terribly proud . mother , did you love my father as i love prince charming ? """,107
"the elder woman grew pale beneath the coarse powder that daubed her cheeks , and her dry lips twitched with a spasm of pain . sybil rushed to her , flung her arms round her neck , and kissed her . "" forgive me , mother . i know it pains you to talk about our father . but it only pains you because you loved him so much . do n't look so sad . i am as happy to - day as you were twenty years ago . ah ! let me be happy for ever ! """,65
""" my child , you are far too young to think of falling in love . besides , what do you know of this young man ? you do n't even know his name . the whole thing is most inconvenient , and really , when james is going away to australia , and i have so much to think of , i must say that you should have shown more consideration . however , as i said before , if he is rich . . . """,14
"one of my friends -- one of my friends , please to observe , not myself , "" said athos , interrupting himself with a melancholy smile , "" one of the counts of my province -- that is to say , of berry -- noble as a dandolo or a montmorency , at twenty - five years of age fell in love with a girl of sixteen , beautiful as fancy can paint .",62
"my edward and i , then , are happy : and the more so , because those we most love are happy likewise .",19
"both captain fitzjames and mr . wharton love their wives , and are loved by them .",7
"both captain fitzjames and mr . wharton love their wives , and are loved by them .",13
"yet it was not this alone that made him gloomy and morose . inexperienced though he was , he had still a strong sense of the danger of sibyl 's position . this young dandy who was making love to her could mean her no good . he was a gentleman , and he hated him for that , hated him through some curious race - instinct for which he could not account , and which for that reason was all the more dominant within him . he was conscious also of the shallowness and vanity of his mother 's nature , and in that saw infinite peril for sibyl and sibyl 's happiness . children begin by loving their parents ; as they grow older they judge them ; sometimes they forgive them .",38
"yet it was not this alone that made him gloomy and morose . inexperienced though he was , he had still a strong sense of the danger of sibyl 's position . this young dandy who was making love to her could mean her no good . he was a gentleman , and he hated him for that , hated him through some curious race - instinct for which he could not account , and which for that reason was all the more dominant within him . he was conscious also of the shallowness and vanity of his mother 's nature , and in that saw infinite peril for sibyl and sibyl 's happiness . children begin by loving their parents ; as they grow older they judge them ; sometimes they forgive them .",118
""" stop , jim ! "" she exclaimed . "" you must not say anything against him . i love him . """,19
""" that has cured me of beautiful , poetical , and loving women , "" said athos , after a considerable pause , raising his head , and forgetting to continue the fiction of the count .",11
confidence and love made him a giant .,2
"she laughed and took his arm . "" you dear old jim , you talk as if you were a hundred . some day you will be in love yourself . then you will know what it is . do n't look so sulky . surely you should be glad to think that , though you are going away , you leave me happier than i have ever been before . life has been hard for us both , terribly hard and difficult . but it will be different now . you are going to a new world , and i have found one . here are two chairs ; let us sit down and see the smart people go by . """,28
""" but i am not angry , jane : i only love you too well ; and you had steeled your little pale face with such a resolute , frozen look , i could not endure it .",11
""" jane ! jane ! "" he said , in such an accent of bitter sadness it thrilled along every nerve i had ; "" you do n't love me , then ?",28
""" oh , do n't be so serious , jim . you are like one of the heroes of those silly melodramas mother used to be so fond of acting in . i am not going to quarrel with you . i have seen him , and oh ! to see him is perfect happiness . we wo n't quarrel . i know you would never harm any one i love , would you ? """,70
""" i _ do _ love you , "" i said , "" more than ever : but i must not show or indulge the feeling : and this is the last time i must express it . """,5
""" not as long as you love him , i suppose , "" was the sullen answer .",6
"what ! do you think you can live with me , and see me daily , and yet , if you still love me , be always cold and distant ? """,22
""" i shall love him for ever ! "" she cried .",3
"an oath broke from his lips . "" i do n't care for myself , "" he exclaimed , "" but do n't let sibyl . . . . it is a gentleman , is n't it , who is in love with her , or says he is ? highly connected , too , i suppose . """,41
"all the men in her circle seemed to admire her and envy me . i was dazzled , stimulated : my senses were excited ; and being ignorant , raw , and inexperienced , i thought i loved her .",37
"i sat in the dingy box absolutely enthralled . i forgot that i was in london and in the nineteenth century . i was away with my love in a forest that no man had ever seen . after the performance was over , i went behind and spoke to her . as we were sitting together , suddenly there came into her eyes a look that i had never seen there before . my lips moved towards hers . we kissed each other . i ca n't describe to you what i felt at that moment . it seemed to me that all my life had been narrowed to one perfect point of rose - coloured joy . she trembled all over and shook like a white narcissus . then she flung herself on her knees and kissed my hands . i feel that i should not tell you all this , but i ca n't help it . of course , our engagement is a dead secret . she has not even told her own mother . i do n't know what my guardians will say . lord radley is sure to be furious . i do n't care . i shall be of age in less than a year , and then i can do what i like . i have been right , basil , have n't i , to take my love out of poetry and to find my wife in shakespeare 's plays ? lips that shakespeare taught to speak have whispered their secret in my ear . i have had the arms of rosalind around me , and kissed juliet on the mouth . """,27
"i sat in the dingy box absolutely enthralled . i forgot that i was in london and in the nineteenth century . i was away with my love in a forest that no man had ever seen . after the performance was over , i went behind and spoke to her . as we were sitting together , suddenly there came into her eyes a look that i had never seen there before . my lips moved towards hers . we kissed each other . i ca n't describe to you what i felt at that moment . it seemed to me that all my life had been narrowed to one perfect point of rose - coloured joy . she trembled all over and shook like a white narcissus . then she flung herself on her knees and kissed my hands . i feel that i should not tell you all this , but i ca n't help it . of course , our engagement is a dead secret . she has not even told her own mother . i do n't know what my guardians will say . lord radley is sure to be furious . i do n't care . i shall be of age in less than a year , and then i can do what i like . i have been right , basil , have n't i , to take my love out of poetry and to find my wife in shakespeare 's plays ? lips that shakespeare taught to speak have whispered their secret in my ear . i have had the arms of rosalind around me , and kissed juliet on the mouth . """,236
""" my dear harry , i did not treat it as a business transaction , and i did not make any formal proposal . i told her that i loved her , and she said she was not worthy to be my wife . not worthy ! why , the whole world is nothing to me compared with her . """,29
"love ! "" pardon for what ? "" asked she .",0
""" i dare say not . i always thought him sane enough until to - day , but you can take it from me that either he or i ought to be in a strait - jacket . what 's the matter with me , anyhow ? you 've lived near me for some weeks , watson . tell me straight , now ! is there anything that would prevent me from making a good husband to a woman that i loved ? """,81
""" do n't pay any attention to him , dorian , "" said the painter . "" i understand what you mean , and i believe in this girl . any one you love must be marvellous , and any girl who has the effect you describe must be fine and noble . to spiritualize one 's age -- that is something worth doing . if this girl can give a soul to those who have lived without one , if she can create the sense of beauty in people whose lives have been sordid and ugly , if she can strip them of their selfishness and lend them tears for sorrows that are not their own , she is worthy of all your adoration , worthy of the adoration of the world . this marriage is quite right . i did not think so at first , but i admit it now . the gods made sibyl vane for you . without her you would have been incomplete . """,33
"although i joy in thee , i have no joy of this contract to - night : it is too rash , too unadvised , too sudden ; too like the lightning , which doth cease to be ere one can say , "" it lightens . "" sweet , good - night ! this bud of love by summer 's ripening breath may prove a beauteous flower when next we meet--",57
""" after a youth and manhood passed half in unutterable misery and half in dreary solitude , i have for the first time found what i can truly love -- i have found you .",28
""" do n't talk like that about any one you love , dorian . love is a more wonderful thing than art . """,10
"not a human being that ever lived could wish to be loved better than i was loved ; and him who thus loved me i absolutely worshipped : and i must renounce love and idol . one drear word comprised my intolerable duty--""depart ! """,32
