text,ind
"you came -- oh , my beautiful love!-- and you freed my soul from prison . you taught me what reality really is . to - night , for the first time in my life , i saw through the hollowness , the sham , the silliness of the empty pageant in which i had always played . to- night , for the first time , i became conscious that the romeo was hideous , and old , and painted , that the moonlight in the orchard was false , that the scenery was vulgar , and that the words i had to speak were unreal , were not my words , were not what i wanted to say . you had brought me something higher , something of which all art is but a reflection . you had made me understand what love really is . my love ! my love ! prince charming ! prince of life !",143
"you came -- oh , my beautiful love!-- and you freed my soul from prison . you taught me what reality really is . to - night , for the first time in my life , i saw through the hollowness , the sham , the silliness of the empty pageant in which i had always played . to- night , for the first time , i became conscious that the romeo was hideous , and old , and painted , that the moonlight in the orchard was false , that the scenery was vulgar , and that the words i had to speak were unreal , were not my words , were not what i wanted to say . you had brought me something higher , something of which all art is but a reflection . you had made me understand what love really is . my love ! my love ! prince charming ! prince of life !",148
"you came -- oh , my beautiful love!-- and you freed my soul from prison . you taught me what reality really is . to - night , for the first time in my life , i saw through the hollowness , the sham , the silliness of the empty pageant in which i had always played . to- night , for the first time , i became conscious that the romeo was hideous , and old , and painted , that the moonlight in the orchard was false , that the scenery was vulgar , and that the words i had to speak were unreal , were not my words , were not what i wanted to say . you had brought me something higher , something of which all art is but a reflection . you had made me understand what love really is . my love ! my love ! prince charming ! prince of life !",151
"yet it was watching him , with its beautiful marred face and its cruel smile . its bright hair gleamed in the early sunlight . its blue eyes met his own . a sense of infinite pity , not for himself , but for the painted image of himself , came over him . it had altered already , and would alter more . its gold would wither into grey . its red and white roses would die . for every sin that he committed , a stain would fleck and wreck its fairness . but he would not sin . the picture , changed or unchanged , would be to him the visible emblem of conscience . he would resist temptation . he would not see lord henry any more -- would not , at any rate , listen to those subtle poisonous theories that in basil hallward 's garden had first stirred within him the passion for impossible things . he would go back to sibyl vane , make her amends , marry her , try to love her again . yes , it was his duty to do so . she must have suffered more than he had . poor child ! he had been selfish and cruel to her . the fascination that she had exercised over him would return . they would be happy together . his life with her would be beautiful and pure .",179
""" madame bonacieux ! ah , that ’s true ! "" said athos . "" my poor friend , i had forgotten you were in love . """,25
"it was said athos had met with great crosses in love , and that a frightful treachery had forever poisoned the life of this gallant man .",10
""" you love the sea , captain . """,2
""" so i have murdered sibyl vane , "" said dorian gray , half to himself , "" murdered her as surely as if i had cut her little throat with a knife . yet the roses are not less lovely for all that . the birds sing just as happily in my garden . and to - night i am to dine with you , and then go on to the opera , and sup somewhere , i suppose , afterwards . how extraordinarily dramatic life is ! if i had read all this in a book , harry , i think i would have wept over it . somehow , now that it has happened actually , and to me , it seems far too wonderful for tears . here is the first passionate love - letter i have ever written in my life . strange , that my first passionate love - letter should have been addressed to a dead girl . can they feel , i wonder , those white silent people we call the dead ? sibyl ! can she feel , or know , or listen ? oh , harry , how i loved her once ! it seems years ago to me now . she was everything to me .",136
""" so i have murdered sibyl vane , "" said dorian gray , half to himself , "" murdered her as surely as if i had cut her little throat with a knife . yet the roses are not less lovely for all that . the birds sing just as happily in my garden . and to - night i am to dine with you , and then go on to the opera , and sup somewhere , i suppose , afterwards . how extraordinarily dramatic life is ! if i had read all this in a book , harry , i think i would have wept over it . somehow , now that it has happened actually , and to me , it seems far too wonderful for tears . here is the first passionate love - letter i have ever written in my life . strange , that my first passionate love - letter should have been addressed to a dead girl . can they feel , i wonder , those white silent people we call the dead ? sibyl ! can she feel , or know , or listen ? oh , harry , how i loved her once ! it seems years ago to me now . she was everything to me .",153
""" so i have murdered sibyl vane , "" said dorian gray , half to himself , "" murdered her as surely as if i had cut her little throat with a knife . yet the roses are not less lovely for all that . the birds sing just as happily in my garden . and to - night i am to dine with you , and then go on to the opera , and sup somewhere , i suppose , afterwards . how extraordinarily dramatic life is ! if i had read all this in a book , harry , i think i would have wept over it . somehow , now that it has happened actually , and to me , it seems far too wonderful for tears . here is the first passionate love - letter i have ever written in my life . strange , that my first passionate love - letter should have been addressed to a dead girl . can they feel , i wonder , those white silent people we call the dead ? sibyl ! can she feel , or know , or listen ? oh , harry , how i loved her once ! it seems years ago to me now . she was everything to me .",199
""" oh , the obvious consolation . taking some one else 's admirer when one loses one 's own . in good society that always whitewashes a woman . but really , dorian , how different sibyl vane must have been from all the women one meets ! there is something to me quite beautiful about her death . i am glad i am living in a century when such wonders happen . they make one believe in the reality of the things we all play with , such as romance , passion , and love . """,95
""" i am afraid that women appreciate cruelty , downright cruelty , more than anything else . they have wonderfully primitive instincts . we have emancipated them , but they remain slaves looking for their masters , all the same . they love being dominated . i am sure you were splendid . i have never seen you really and absolutely angry , but i can fancy how delightful you looked . and , after all , you said something to me the day before yesterday that seemed to me at the time to be merely fanciful , but that i see now was absolutely true , and it holds the key to everything . """,42
""" a collector , sir , nothing more . formerly i loved acquiring these beautiful works created by the hand of man . i sought them greedily , ferreted them out tirelessly , and i 've been able to gather some objects of great value . they 're my last mementos of those shores that are now dead for me . in my eyes , your modern artists are already as old as the ancients . they 've existed for 2,000 or 3,000 years , and i mix them up in my mind . the masters are ageless . """,11
"may you never appeal to heaven in prayers so hopeless and so agonised as in that hour left my lips ; for never may you , like me , dread to be the instrument of evil to what you wholly love .",40
""" you went to the opera ? "" said hallward , speaking very slowly and with a strained touch of pain in his voice . "" you went to the opera while sibyl vane was lying dead in some sordid lodging ? you can talk to me of other women being charming , and of patti singing divinely , before the girl you loved has even the quiet of a grave to sleep in ? why , man , there are horrors in store for that little white body of hers ! """,63
""" no , "" said dorian gray , "" there is nothing fearful about it . it is one of the great romantic tragedies of the age . as a rule , people who act lead the most commonplace lives . they are good husbands , or faithful wives , or something tedious . you know what i mean -- middle - class virtue and all that kind of thing . how different sibyl was ! she lived her finest tragedy . she was always a heroine . the last night she played-- the night you saw her -- she acted badly because she had known the reality of love . when she knew its unreality , she died , as juliet might have died . she passed again into the sphere of art . there is something of the martyr about her . her death has all the pathetic uselessness of martyrdom , all its wasted beauty .",109
"and besides , my dear old basil , if you really want to console me , teach me rather to forget what has happened , or to see it from a proper artistic point of view . was it not gautier who used to write about la consolation des arts ? i remember picking up a little vellum - covered book in your studio one day and chancing on that delightful phrase . well , i am not like that young man you told me of when we were down at marlow together , the young man who used to say that yellow satin could console one for all the miseries of life . i love beautiful things that one can touch and handle . old brocades , green bronzes , lacquer - work , carved ivories , exquisite surroundings , luxury , pomp -- there is much to be got from all these . but the artistic temperament that they create , or at any rate reveal , is still more to me .",115
"nature seemed to me benign and good ; i thought she loved me , outcast as i was ; and i , who from man could anticipate only mistrust , rejection , insult , clung to her with filial fondness .",11
""" you _ are _ afraid -- your self - love dreads a blunder . """,10
"he shuddered , and for a moment he regretted that he had not told basil the true reason why he had wished to hide the picture away . basil would have helped him to resist lord henry 's influence , and the still more poisonous influences that came from his own temperament . the love that he bore him -- for it was really love-- had nothing in it that was not noble and intellectual . it was not that mere physical admiration of beauty that is born of the senses and that dies when the senses tire . it was such love as michelangelo had known , and montaigne , and winckelmann , and shakespeare himself . yes , basil could have saved him . but it was too late now . the past could always be annihilated . regret , denial , or forgetfulness could do that . but the future was inevitable . there were passions in him that would find their terrible outlet , dreams that would make the shadow of their evil real .",102
""" now , my wife came home four days ago , monsieur . one of her conditions was that she should come and see me twice a week ; for , as i had the honor to tell you , my wife loves me dearly -- my wife , then , came and confided to me that the queen at that very moment entertained great fears . """,42
"but there was no other place in the house so secure from prying eyes as this . he had the key , and no one else could enter it . beneath its purple pall , the face painted on the canvas could grow bestial , sodden , and unclean . what did it matter ? no one could see it . he himself would not see it . why should he watch the hideous corruption of his soul ? he kept his youth-- that was enough . and , besides , might not his nature grow finer , after all ? there was no reason that the future should be so full of shame . some love might come across his life , and purify him , and shield him from those sins that seemed to be already stirring in spirit and in flesh-- those curious unpictured sins whose very mystery lent them their subtlety and their charm . perhaps , some day , the cruel look would have passed away from the scarlet sensitive mouth , and he might show to the world basil hallward 's masterpiece .",116
""" to return , pencroft ? "" said the captain , with a smile . "" i know , it is true , your love for this island .",24
""" the duke is in love to madness , or rather to folly , "" replied richelieu , with great bitterness . "" like the ancient paladins , he has only undertaken this war to obtain a look from his lady love .",5
""" the duke is in love to madness , or rather to folly , "" replied richelieu , with great bitterness . "" like the ancient paladins , he has only undertaken this war to obtain a look from his lady love .",41
of course not : i need not ask you ; because you never felt love .,14
""" i do n't wish to know anything about them . i love scandals about other people , but scandals about myself do n't interest me . they have not got the charm of novelty . """,12
"the rapidity of his walk heated his blood still more ; the idea that he left behind him , exposed to a frightful vengeance , the woman he loved , or rather whom he adored as a saint , the emotion he had experienced , present fatigue -- all together exalted his mind above human feeling .",28
"porthos saw nothing in all this but a love meeting , given by a lady to a cavalier , or by a cavalier to a lady , which had been disturbed by the presence of d’artagnan and his yellow horse .",8
""" now , monsieur porthos , once more , and this is the last ! do you love me still ? """,17
""" good heavens , holmes ! are you sure of what you say ? how could he have permitted sir henry to fall in love with her ? """,24
""" why does she love what we hate most in the world , the spaniards and the english ? """,4
""" spain is her country , "" replied d’artagnan ; "" and it is very natural that she should love the spanish , who are the children of the same soil as herself .",19
"as to the second reproach , i have heard it said that she does not love the english , but an englishman . """,15
""" that is to say , you are in love with this lady as you were with madame bonacieux , "" said athos , shrugging his shoulders contemptuously , as if he pitied human weakness .",9
""" save me , gentlemen , for the love of heaven , save me ! "" cried he .",8
""" she likewise charged me to tell you that she still loved you . """,11
""" i believe he is in love , "" cried lady narborough , and that he is afraid to tell me for fear i should be jealous . he is quite right . i certainly should . """,6
""" dear lady narborough , "" murmured dorian , smiling , "" i have not been in love for a whole week -- not , in fact , since madame de ferrol left town . """,17
""" how you men can fall in love with that woman ! "" exclaimed the old lady . "" i really can not understand it . """,7
"and the sailor brandishing the harpoon , repeated , not without emotion , the name which he loved so well -- the name of his birthplace .",17
""" be punished alone , for the first , miserable man ! "" said lord de winter to felton , who was being dragged away with his eyes turned toward the sea ; "" but i swear to you by the memory of my brother whom i have loved so much that your accomplice is not saved . """,48
""" narborough was n't perfect , "" cried the old lady . "" if he had been , you would not have loved him , my dear lady , "" was the rejoinder . "" women love us for our defects . if we have enough of them , they will forgive us everything , even our intellects . you will never ask me to dinner again after saying this , i am afraid , lady narborough , but it is quite true . """,22
""" of course it is true , lord henry . if we women did not love you for your defects , where would you all be ? not one of you would ever be married . you would be a set of unfortunate bachelors . not , however , that that would alter you much . nowadays all the married men live like bachelors , and all the bachelors like married men . """,15
""" what nonsense people talk about happy marriages ! "" exclaimed lord henry . "" a man can be happy with any woman , as long as he does not love her . """,30
"i looked at the broad plumed hat , the curling love - locks , the white lace collar , and the straight , severe face which was framed between them . it was not a brutal countenance , but it was prim , hard , and stern , with a firm - set , thin - lipped mouth , and a coldly intolerant eye .",10
"amy and louisa eshton had cried out simultaneously--""what a love of a child ! """,9
""" having left the house , i proceeded to do what gregson had neglected . i telegraphed to the head of the police at cleveland , limiting my enquiry to the circumstances connected with the marriage of enoch drebber . the answer was conclusive . it told me that drebber had already applied for the protection of the law against an old rival in love , named jefferson hope , and that this same hope was at present in europe . i knew now that i held the clue to the mystery in my hand , and all that remained was to secure the murderer .",64
"dorian shrugged his shoulders . "" i am sick of women who love one . women who hate one are much more interesting . besides , the stuff is better . """,12
he made me love him without looking at me .,3
"i must , then , repeat continually that we are for ever sundered:--and yet , while i breathe and think , i must love him . """,23
""" i loved madame bonacieux with my heart , while i only love milady with my head , "" said he . "" in getting introduced to her , my principal object is to ascertain what part she plays at court . """,12
"no weather seemed to hinder him in these pastoral excursions : rain or fair , he would , when his hours of morning study were over , take his hat , and , followed by his father 's old pointer , carlo , go out on his mission of love or duty -- i scarcely know in which light he regarded it .",49
"he and miss wilson took the liberty of falling in love with each other -- at least tedo and i thought so ; we surprised sundry tender glances and sighs which we interpreted as tokens of ' la belle passion , ' and i promise you the public soon had the benefit of our discovery ; we employed it as a sort of lever to hoist our dead - weights from the house .",10
""" thank god ! thank god ! oh , this villain ! see how he has treated me ! "" she shot her arms out from her sleeves , and we saw with horror that they were all mottled with bruises . "" but this is nothing -- nothing ! it is my mind and soul that he has tortured and defiled . i could endure it all , ill - usage , solitude , a life of deception , everything , as long as i could still cling to the hope that i had his love , but now i know that in this also i have been his dupe and his tool . "" she broke into passionate sobbing as she spoke .",96
"it was evident to us that all pursuit was in vain until the fog had lifted . meanwhile we left lestrade in possession of the house while holmes and i went back with the baronet to baskerville hall . the story of the stapletons could no longer be withheld from him , but he took the blow bravely when he learned the truth about the woman whom he had loved . but the shock of the night 's adventures had shattered his nerves , and before morning he lay delirious in a high fever , under the care of dr . mortimer . the two of them were destined to travel together round the world before sir henry had become once more the hale , hearty man that he had been before he became master of that ill - omened estate .",69
"his heart beat , but not like d’artagnan ’s with a young and impatient love .",14
""" not with women , "" said the duchess , shaking her head ; "" and women rule the world . i assure you we ca n't bear mediocrities . we women , as some one says , love with our ears , just as you men love with your eyes , if you ever love at all . """,38
""" not with women , "" said the duchess , shaking her head ; "" and women rule the world . i assure you we ca n't bear mediocrities . we women , as some one says , love with our ears , just as you men love with your eyes , if you ever love at all . """,55
""" no , "" said the novice , "" but of my devotion -- of a devotion to a woman i loved , for whom i would have laid down my life , for whom i would give it still . """,21
for an apprentice musketeer the young woman was almost an ideal of love .,12
"pretty , mysterious , initiated in almost all the secrets of the court , which reflected such a charming gravity over her pleasing features , it might be surmised that she was not wholly unmoved ; and this is an irresistible charm to novices in love . moreover , d’artagnan had delivered her from the hands of the demons who wished to search and ill treat her ; and this important service had established between them one of those sentiments of gratitude which so easily assume a more tender character .",45
""" that a burnt child loves the fire . """,5
"the mercer had said that he was rich ; the young man might easily guess that with so weak a man as m. bonacieux ; and interest was almost foreign to this commencement of love , which had been the consequence of it .",34
he _ did _ love me -- no one will ever love me so again .,4
he _ did _ love me -- no one will ever love me so again .,11
""" one may see that you love your family , madame coquenard , "" said the procurator , with a smile that was almost tragic . "" you are certainly treating your cousin very handsomely ! """,6
""" truly it is wonderful that you have not been killed a hundred times over . but , for the love of god , do n't let us ever separate again , or we many never see each other more . """,20
"pencroft at the beginning of the year had gone to richmond on business , with a young boy of fifteen from new jersey , son of a former captain , an orphan , whom he loved as if he had been his own child .",35
""" how fond you are of saying dangerous things , harry ! in the present instance , you are quite astray . i like the duchess very much , but i do n't love her . """,33
""" and the duchess loves you very much , but she likes you less , so you are excellently matched . """,4
""" poor carlo loves me , "" said she . "" _ he _ is not stern and distant to his friends ; and if he could speak , he would not be silent . """,3
"d’artagnan obeyed like a child , without the least resistance or objection , which proved that he was really in love .",20
"meantime , as we have said , despite the cries of his conscience and the wise counsels of athos , d’artagnan became hourly more in love with milady . thus he never failed to pay his diurnal court to her ; and the self - satisfied gascon was convinced that sooner or later she could not fail to respond .",25
""" you love my mistress , then , very dearly , monsieur chevalier ? "" said she .",2
""" because , monsieur , "" replied kitty , "" my mistress loves you not at all . """,12
""" we have always some difficulty in believing such things , my pretty dear , were it only from self - love . """,21
""" and weep over a faithless florizel , "" said lord henry , laughing , as he leaned back in his chair . "" my dear dorian , you have the most curiously boyish moods . do you think this girl will ever be really content now with any one of her own rank ? i suppose she will be married some day to a rough carter or a grinning ploughman . well , the fact of having met you , and loved you , will teach her to despise her husband , and she will be wretched . from a moral point of view , i can not say that i think much of your great renunciation . even as a beginning , it is poor . besides , how do you know that hetty is n't floating at the present moment in some starlit mill - pond , with lovely water - lilies round her , like ophelia ? """,82
d’artagnan became very pale ; he was wounded in his self - love : he thought that it was in his love .,12
"we have said that athos loved d’artagnan like a child , and this somber and inflexible personage felt the anxiety of a parent for the young man .",5
""" alas , "" replied the preceptor , "" it was love ; love , the comfort of the human species ; love , the preserver of the universe ; the soul of all sensible beings ; love ! tender love ! """,22
""" alas , "" replied the preceptor , "" it was love ; love , the comfort of the human species ; love , the preserver of the universe ; the soul of all sensible beings ; love ! tender love ! """,37
