text,ind
"so only two possible solutions to the question were left , creating two very distinct groups of supporters : on one side , those favoring a monster of colossal strength ; on the other , those favoring an "" underwater boat "" of tremendous motor power .",7
""" well ? "" captain nemo went on . "" did you hear my question ? do you know the history of spain ? """,14
""" see , "" he went on , both asking the questions and supplying the answers . "" is n't it a beauty ? yes ; splendid ! did you ever see such a binding ? does n't the book open easily ? yes ; it stops open anywhere . but does it shut equally well ? yes ; for the binding and the leaves are flush , all in a straight line , and no gaps or openings anywhere . and look at its back , after seven hundred years . why , bozerian , closs , or purgold might have been proud of such a binding ! """,11
"while rapidly making these comments my uncle kept opening and shutting the old tome . i really could do no less than ask a question about its contents , although i did not feel the slightest interest .",24
"she had a turn for narrative , i for analysis ; she liked to inform , i to question ; so we got on swimmingly together , deriving much entertainment , if not much improvement , from our mutual intercourse .",18
"you are abused , sir ; but that is not the question . i only ask you one favor ; and if you grant it me , i will bless you in this world and in the next . """,11
""" no , you do n't feel it now . some day , when you are old and wrinkled and ugly , when thought has seared your forehead with its lines , and passion branded your lips with its hideous fires , you will feel it , you will feel it terribly . now , wherever you go , you charm the world . will it always be so ? . . . you have a wonderfully beautiful face , mr . gray . do n't frown . you have . and beauty is a form of genius-- is higher , indeed , than genius , as it needs no explanation . it is of the great facts of the world , like sunlight , or spring - time , or the reflection in dark waters of that silver shell we call the moon . it can not be questioned . it has its divine right of sovereignty . it makes princes of those who have it .",149
"the whole intrigue is political , and there is not the least question of love in this letter ; but , on the other hand , there is abundant question of you . """,12
"the whole intrigue is political , and there is not the least question of love in this letter ; but , on the other hand , there is abundant question of you . """,29
"again i questioned , but this time only in thought . "" where is that region ? does it exist ? """,2
"i was not reprimanded for leaving my bed ; people had something else to think about ; no explanation was afforded then to my many questions ; but a day or two afterwards i learned that miss temple , on returning to her own room at dawn , had found me laid in the little crib ; my face against helen burns 's shoulder , my arms round her neck .",25
there looked down upon me the faithful companion of my labours and my recreations . every day she helped me to arrange my uncle 's precious specimens ; she and i labelled them together . mademoiselle gräuben was an accomplished mineralogist ; she could have taught a few things to a savant . she was fond of investigating abstruse scientific questions . what pleasant hours we have spent in study ; and how often i envied the very stones which she handled with her charming fingers .,60
"as soon as mary came down i heard the question : "" is miss eyre here ? """,9
"there only remains , then , the question of the five shillings to be settled . you think me rather parsimonious , do n’t you ? that ’s because i do n’t care to leave you the means of corrupting your jailers .",7
"would he return in triumph or in discouragement ? which would get the upper hand , he or the secret ? i was thus asking myself questions , and mechanically taking between my fingers the sheet of paper mysteriously disfigured with the incomprehensible succession of letters i had written down ; and i repeated to myself "" what does it all mean ? """,26
""" possibly ; but that is not the question . do you think , consul , that this phlegmatic gentleman resembles , feature by feature , the robber whose description i have received ? """,8
"now , for all the reasons put forward to this point , i believed that this animal was a member of the branch vertebrata , class mammalia , group pisciforma , and finally , order cetacea . as for the family in which it would be placed ( baleen whale , sperm whale , or dolphin ) , the genus to which it belonged , and the species in which it would find its proper home , these questions had to be left for later . to answer them called for dissecting this unknown monster ; to dissect it called for catching it ; to catch it called for harpooning it-- which was ned land 's business ; to harpoon it called for sighting it-- which was the crew 's business ; and to sight it called for encountering it-- which was a chancy business .",78
""" do not question me , "" said the prisoner ; "" you know that we who are true christians are forbidden to lie . """,3
"the professor stared at me over his spectacles ; no doubt he saw something unusual in the expression of my countenance ; for he laid hold of my arm , and speechlessly questioned me with his eyes . yes , never was a question more forcibly put .",43
""" what questions , mr . rochester ? """,2
"as to the road in question , the choice of trees had rendered its direction somewhat capricious , but at the same time it facilitated the access to a large part of the serpentine peninsula .",5
"so ned land had good reason to worry . in these wide seas empty of islands , it was no longer feasible to jump ship . nor did we have any way to counter captain nemo 's whims . we had no choice but to acquiesce ; but if we could n't attain our end through force or cunning , i liked to think we might achieve it through persuasion . once this voyage was over , might not captain nemo consent to set us free in return for our promise never to reveal his existence ? our word of honor , which we sincerely would have kept . however , this delicate question would have to be negotiated with the captain . but how would he receive our demands for freedom ? at the very outset and in no uncertain terms , had n't he declared that the secret of his life required that we be permanently imprisoned on board the nautilus ? would n't he see my four - month silence as a tacit acceptance of this situation ? would my returning to this subject arouse suspicions that could jeopardize our escape plans , if we had promising circumstances for trying again later on ? i weighed all these considerations , turned them over in my mind , submitted them to conseil , but he was as baffled as i was . in short , although i 'm not easily discouraged , i realized that my chances of ever seeing my fellow men again were shrinking by the day , especially at a time when captain nemo was recklessly racing toward the south atlantic !",113
"it was apparently considered out of the question to dive by filling the ballast tanks . perhaps they would n't sufficiently increase the nautilus 's specific gravity . moreover , in order to come back up , it would be necessary to expel the excess water , and our pumps might not have been strong enough to overcome the outside pressure .",7
""" exactly . i have wired to get his name and address from the official registry . i should not be surprised if this were an answer to my question . """,29
""" i will leave you to decide that question , "" i answered rather sullenly .",8
"she knew she had only two days left ; that when once the order was signed by buckingham -- and buckingham would sign it the more readily from its bearing a false name , and he could not , therefore , recognize the woman in question -- once this order was signed , we say , the baron would make her embark immediately , and she knew very well that women condemned to exile employ arms much less powerful in their seductions than the pretendedly virtuous woman whose beauty is lighted by the sun of the world , whose style the voice of fashion lauds , and whom a halo of aristocracy gilds with enchanting splendors .",45
"sir francis cromarty took mr . fogg aside , and begged him to reflect before he went any further ; to which that gentleman replied that he was not in the habit of acting rashly , that a bet of twenty thousand pounds was at stake , that the elephant was absolutely necessary to him , and that he would secure him if he had to pay twenty times his value . returning to the indian , whose small , sharp eyes , glistening with avarice , betrayed that with him it was only a question of how great a price he could obtain . mr . fogg offered first twelve hundred , then fifteen hundred , eighteen hundred , two thousand pounds . passepartout , usually so rubicund , was fairly white with suspense .",95
""" well , but , leaving his land out of the question , do you like him ?",11
"d’artagnan was not one of those foolhardy men who seek a ridiculous death in order that it may be said of them that they did not retreat a single step . besides , courage was out of the question here ; d’artagnan had fallen into an ambush .",38
""" and yet it was not entirely a question of imagination , "" i answered . "" did you , for example , happen to hear someone , a woman i think , sobbing in the night ? """,8
""" we must ask about this right away . "" he rang the bell and asked barrymore whether he could account for our experience . it seemed to me that the pallid features of the butler turned a shade paler still as he listened to his master 's question .",48
"at ten in the morning , at last , we set our feet in copenhagen ; the luggage was put upon a carriage and taken with ourselves to the phoenix hotel in breda gate . this took half an hour , for the station is out of the town . then my uncle , after a hasty toilet , dragged me after him . the porter at the hotel could speak german and english ; but the professor , as a polyglot , questioned him in good danish , and it was in the same language that that personage directed him to the museum of northern antiquities .",83
"but there was no question now . we were stretched out on the back of some kind of underwater boat that , as far as i could judge , boasted the shape of an immense steel fish . ned land had clear views on the issue . conseil and i could only line up behind him .",4
""" you are speaking about things you do n't understand , james . in the profession we are accustomed to receive a great deal of most gratifying attention . i myself used to receive many bouquets at one time . that was when acting was really understood . as for sibyl , i do not know at present whether her attachment is serious or not . but there is no doubt that the young man in question is a perfect gentleman . he is always most polite to me . besides , he has the appearance of being rich , and the flowers he sends are lovely . """,76
"i felt no fear of him , and but little shyness . had he been a handsome , heroic- looking young gentleman , i should not have dared to stand thus questioning him against his will , and offering my services unasked .",31
"the train was about to start from allahabad , and mr . fogg proceeded to pay the guide the price agreed upon for his service , and not a farthing more ; which astonished passepartout , who remembered all that his master owed to the guide 's devotion . he had , indeed , risked his life in the adventure at pillaji , and , if he should be caught afterwards by the indians , he would with difficulty escape their vengeance . kiouni , also , must be disposed of . what should be done with the elephant , which had been so dearly purchased ? phileas fogg had already determined this question .",113
this sudden question remained at first without any reply .,2
"be that as it may , forgetting their fatigue in the singularity of the event , they remained below granite house , not knowing what to think , not knowing what to do , questioning each other without any hope of a satisfactory reply , every one starting some supposition each more unlikely than the last .",34
my uncle 's eyes and mine met . he hesitated . this direct question went to the root of the matter . but after a moment 's reflection he decided on speaking .,13
""" never mind , "" said he , chuckling to himself . "" the question now is about hoemoglobin . no doubt you see the significance of this discovery of mine ? """,14
"to agitate him thus deeply , by a resistance he so abhorred , was cruel : to yield was out of the question .",22
"here a question popped into my head . how did the commander of this aquatic residence go about it ? did he obtain air using chemical methods , releasing the oxygen contained in potassium chlorate by heating it , meanwhile absorbing the carbon dioxide with potassium hydroxide ? if so , he would have to keep up some kind of relationship with the shore , to come by the materials needed for such an operation . did he simply limit himself to storing the air in high - pressure tanks and then dispense it according to his crew 's needs ? perhaps . or , proceeding in a more convenient , more economical , and consequently more probable fashion , was he satisfied with merely returning to breathe at the surface of the water like a cetacean , renewing his oxygen supply every twenty - four hours ? in any event , whatever his method was , it seemed prudent to me that he use this method without delay .",2
""" i could not quite understand the object of your questions this morning , sir henry , "" said he . "" i trust that they do not mean that i have done anything to forfeit your confidence ? """,10
""" then in spite of my cries , in spite of my resistance -- for i began to comprehend that there was a question of something worse than death -- the executioner seized me , threw me on the floor , fastened me with his bonds , and suffocated by sobs , almost without sense , invoking god , who did not listen to me , i uttered all at once a frightful cry of pain and shame . a burning fire , a red - hot iron , the iron of the executioner , was imprinted on my shoulder . """,23
"he finally resolved , moreover , before acting more positively , to question passepartout . it would not be difficult to make him talk ; and , as there was no time to lose , fix prepared to make himself known . it was now the 30th of october , and on the following day the rangoon was due at singapore .",12
"i bowed in agreement . the commander had n't put a question to me . so no answer was called for . this man expressed himself with perfect ease and without a trace of an accent . his phrasing was clear , his words well chosen , his facility in elocution remarkable . and yet , to me , he did n't have "" the feel "" of a fellow countryman .",11
"but fortunately the dog had fallen upon a brood , and besides the victim he was devouring , two other rodents -- the animals in question belonged to that order -- lay strangled on the turf .",25
i hesitated but could not escape the question .,7
"after a few moments ' silence , during which i dared not question him , he resumed :",12
""" there is no necessity , "" rejoined his companion . "" life has always poppies in her hands . of course , now and then things linger . i once wore nothing but violets all through one season , as a form of artistic mourning for a romance that would not die . ultimately , however , it did die . i forget what killed it . i think it was her proposing to sacrifice the whole world for me . that is always a dreadful moment . it fills one with the terror of eternity . well -- would you believe it?--a week ago , at lady hampshire 's , i found myself seated at dinner next the lady in question , and she insisted on going over the whole thing again , and digging up the past , and raking up the future . i had buried my romance in a bed of asphodel . she dragged it out again and assured me that i had spoiled her life .",122
"i should , if i had deliberated , have replied to this question by something conventionally vague and polite ; but the answer somehow slipped from my tongue before i was aware",12
"being composed of the sort of clay which is used for making bricks and tiles , it was very useful for the work in question .",24
"ask me questions , and i will do my best to answer them . """,2
"leaving superiority out of the question , then , you must still agree to receive my orders now and then , without being piqued or hurt by the tone of command . will you ? """,5
"mortimer had stayed to dinner , and he and the baronet played ecart ‚ afterwards . the butler brought me my coffee into the library , and i took the chance to ask him a few questions .",36
"at 8:25 a second collision took place . this time astern . i grew pale . my companions came over . i clutched conseil 's hand . our eyes questioned each other , and more directly than if our thoughts had been translated into words .",29
""" well , i 'll answer , "" she said . "" what are your questions ? """,15
""" a terrible change came over the woman 's face as i asked the question . her features turned perfectly livid . it was some seconds before she could get out the single word ' yes'—and when it did come it was in a husky unnatural tone .",14
"again and again i cross - questioned her , but i could never get past that point .",6
"cyrus harding had clearly represented their situation , although he spoke in the calmest voice , as if it was a question of directing a piece of work and not ordering a battle .",21
"i almost expected a rebuff for this hardly well - timed question , but , on the contrary , waking out of his scowling abstraction , he turned his eyes towards me , and the shade seemed to clear off his brow .",11
"i then remembered that we had searched for it in vain the evening before . my uncle questioned hans , who , after having examined attentively with the eye of a huntsman , replied :",17
"meanwhile ned land , less dedicated to conchology , questioned me about my interview with captain nemo . had i discovered who he was , where he came from , where he was heading , how deep he was taking us ? in short , a thousand questions i had no time to answer .",9
""" do you know , sir , that you are asking me very strange questions , and that i am very foolish to answer them ? """,14
"she appeared to be cross - questioning me , attempting to draw from me information unawares .",6
""" it is evidently a meeting , "" said fix , "" and its object must be an exciting one . i should not wonder if it were about the alabama , despite the fact that that question is settled . """,37
""" it would be prudent for us to retire , "" said fix , who was anxious that mr . fogg should not receive any injury , at least until they got back to london . "" if there is any question about england in all this , and we were recognised , i fear it would go hard with us . """,41
""" hannah , "" said mr . st . john , at last , "" let her sit there at present , and ask her no questions ; in ten minutes more , give her the remainder of that milk and bread .",26
""" nay , nay , brother stangerson , "" cried the other ; "" the question is not how many wives we have , but how many we can keep . my father has now given over his mills to me , and i am the richer man . """,15
"happily for gideon spilett , the animal in question did not belong to the redoubtable family of the plantigrades .",8
"i was indignant for a moment ; but remembering that anger was out of the question , and that i had indeed appeared as a beggar to her , i answered quietly , but still not without a certain marked firmness--",15
""" well , "" said athos , "" do n’t you hear monsieur de busigny , who does you the honor to ask you a question ?",25
""" no , monsieur , he is as well as a man can be with four sword wounds in his body ; for you , without question , inflicted four upon the dear gentleman , and he is still very weak , having lost almost all his blood .",26
"i entered . the captain was there . he was bending over his worktable and had n't heard me . determined not to leave without questioning him , i drew closer . he looked up sharply , with a frowning brow , and said in a pretty stern tone :",25
""" i may never be tried , "" he answered . "" you need n't look startled . it is n't suicide i am thinking of . are you a doctor ? "" he turned his fierce dark eyes upon me as he asked this last question .",46
"there was no further question , therefore , about marie michon among the four musketeers , who besides had what they wanted : that was , the order to withdraw mme . bonacieux from the convent of the carmelites of bethune .",4
""" if they knew anything , they would not question people in this manner , "" said d’artagnan to himself .",9
""" what you do in this world is a matter of no consequence , "" returned my companion , bitterly . "" the question is , what can you make people believe that you have done . never mind , "" he continued , more brightly , after a pause . "" i would not have missed the investigation for anything . there has been no better case within my recollection . simple as it was , there were several most instructive points about it . """,23
"it was the echo for the day , and the paragraph to which he pointed was devoted to the case in question .",21
"an important question then popped into my head . would the nautilus dare to tackle the english channel ? ned land ( who promptly reappeared after we hugged shore ) never stopped questioning me . what could i answer him ? captain nemo remained invisible . after giving the canadian a glimpse of american shores , was he about to show me the coast of france ?",32
""" the lives of three men are in question , sir , "" said phileas fogg .",8
"diana and mary 's general answer to this question was a sigh , and some minutes of apparently mournful meditation .",8
"looking up as i drew near--""you have a question to ask of me ? "" he said .",8
""" you have said , my lord ; for truly , at this moment when there is question of war , i confess to you that i see nothing in your grace but an englishman , and consequently an enemy whom i should have much greater pleasure in meeting on the field of battle than in the park at windsor or the corridors of the louvre -- all which , however , will not prevent me from executing to the very point my commission or from laying down my life , if there be need of it , to accomplish it ; but i repeat it to your grace , without your having personally on that account more to thank me for in this second interview than for what i did for you in the first . """,17
i thought i might have retorted the question on him who put it : but i would not take that freedom .,7
"questioning the natives , captain dumont d'urville also learned that after la pérouse 's two ships had miscarried on the island 's reefs , the count had built a smaller craft , only to go off and miscarry a second time . where ? nobody knew .",0
""" my inquiries show beyond all question that the family portrait did not lie , and that this fellow was indeed a baskerville . he was a son of that rodger baskerville , the younger brother of sir charles , who fled with a sinister reputation to south america , where he was said to have died unmarried . he did , as a matter of fact , marry , and had one child , this fellow , whose real name is the same as his father 's . he married beryl garcia , one of the beauties of costa rica , and , having purloined a considerable sum of public money , he changed his name to vandeleur and fled to england , where he established a school in the east of yorkshire . his reason for attempting this special line of business was that he had struck up an acquaintance with a consumptive tutor upon the voyage home , and that he had used this man 's ability to make the undertaking a success . fraser , the tutor , died however , and the school which had begun well sank from disrepute into infamy . the vandeleurs found it convenient to change their name to stapleton , and he brought the remains of his fortune , his schemes for the future , and his taste for entomology to the south of england . i learned at the british museum that he was a recognized authority upon the subject , and that the name of vandeleur has been permanently attached to a certain moth which he had , in his yorkshire days , been the first to describe .",6
"i could barely glimpse the swift passing of longnose sharks , hammerhead sharks , spotted dogfish that frequent these waters , big eagle rays , swarms of seahorse looking like knights on a chessboard , eels quivering like fireworks serpents , armies of crab that fled obliquely by crossing their pincers over their carapaces , finally schools of porpoise that held contests of speed with the nautilus . but by this point observing , studying , and classifying were out of the question .",82
