text,ind
""" it is a formidable difficulty , and i fear that you ask too much when you expect me to solve it . the past and the present are within the field of my inquiry , but what a man may do in the future is a hard question to answer . mrs . stapleton has heard her husband discuss the problem on several occasions . there were three possible courses . he might claim the property from south america , establish his identity before the british authorities there and so obtain the fortune without ever coming to england at all ; or he might adopt an elaborate disguise during the short time that he need be in london ; or , again , he might furnish an accomplice with the proofs and papers , putting him in as heir , and retaining a claim upon some proportion of his income . we can not doubt from what we know of him that he would have found some way out of the difficulty . and now , my dear watson , we have had some weeks of severe work , and for one evening , i think , we may turn our thoughts into more pleasant channels . i have a box for ' les huguenots . ' have you heard the de reszkes ? might i trouble you then to be ready in half an hour , and we can stop at marcini 's for a little dinner on the way ? """,48
""" it is sunday , the 8th of august , and it is ten at night . you must ask me no more questions until the 10th . """,23
"the king trembled with joy and the cardinal with vexation ; although , distant as they were from the queen , they could not count the studs . the queen had them . the only question was , had she ten or twelve ?",35
i was asking myself these unanswerable questions when the professor entered .,6
""" i have a question to ask you . you say that i am safe and sound ? """,4
"this was a question the young man asked himself , whom the demon of jealousy already gnawed , being in heart neither more nor less than an accepted lover .",3
well might she put the question : his face was blanched as her gown .,5
""" no question about his right : but have you never observed that , of all the tales told here about matrimony , mr . rochester has been favoured with the most lively and the most continuous ? """,2
""" gentlemen , "" said aramis , "" the principal question is not to know which of our four lackeys is the most discreet , the most strong , the most clever , or the most brave ; the principal thing is to know which loves money the best . """,10
""" rather an inhospitable question to put to a visitor ; but since you ask it , i answer simply to have a little talk with you ; i got tired of my mute books and empty rooms . besides , since yesterday i have experienced the excitement of a person to whom a tale has been half - told , and who is impatient to hear the sequel . """,4
""" doubtless , "" said aramis , "" for we not only require to be well served in order to succeed , but moreover , not to fail ; for in case of failure , heads are in question , not for our lackeys-- """,38
""" why , good god ! you will be deceived just the same , "" said athos , who was an optimist when things were concerned , and a pessimist when men were in question .",34
"we had been wandering , indeed , in the leafless shrubbery an hour in the morning ; but since dinner ( mrs . reed , when there was no company , dined early ) the cold winter wind had brought with it clouds so sombre , and a rain so penetrating , that further out - door exercise was now out of the question .",63
flight was out of the question now . the reptiles rose ; they wheeled around our little raft with a rapidity greater than that of express trains . they described around us gradually narrowing circles . i took up my rifle . but what could a ball do against the scaly armour with which these enormous beasts were clad ?,5
i dared not answer the question .,5
"i had a mind once to try if he had any inclination for his own country again ; and having taught him english so well that he could answer me almost any question , i asked him whether the nation that he belonged to never conquered in battle ? at which he smiled , and said—“yes , yes , we always fight the better ; ” that is , he meant always get the better in fight ; and so we began the following discourse : —",32
"ned land and conseil were there waiting for me . i questioned them . they knew nothing . lost in a heavy sleep of which they had no memory , they were quite startled to be back in their cabin .",11
"herbert , not attaching much importance to his discovery , was going to throw away the grain in question ; but harding took it , examined it , found that it was in good condition , and looking the sailor full in the face--""pencroft , "" he asked quietly , "" do you know how many ears one grain of corn can produce ? """,18
wonderful civility this ! it emboldened me to ask a question .,10
"but a sailor is never at a loss when there is a question of cables or ropes , and pencroft rapidly twisted a cord , a few fathoms long , made of dry creepers .",12
"still there was the question of provisions to be settled , and i asked--""how are we off for provisions ? """,4
"' and who is dinah , if i might venture to ask the question ? ' said the lory .",13
but that is not the question now .,5
whilst breakfasting i took the opportunity to put to my uncle the question where we were now .,12
""" that is a good long way , my friend . but whether we are under turkey or the atlantic depends very much upon the question in what direction we have been moving . perhaps we have deviated . """,25
"the professor moved towards the rock upon which hans had laid down the instruments . he was gay and full of spirits ; he rubbed his hands , he studied his attitudes . i followed him , curious to know if i was right in my estimate . as soon as we had arrived at the rock my uncle took the compass , laid it horizontally , and questioned the needle , which , after a few oscillations , presently assumed a fixed position . my uncle looked , and looked , and looked again . he rubbed his eyes , and then turned to me thunderstruck with some unexpected discovery .",68
"' and yet what a dear little puppy it was ! ' said alice , as she leant against a buttercup to rest herself , and fanned herself with one of the leaves : ' i should have liked teaching it tricks very much , if -- if i 'd only been the right size to do it ! oh dear ! i 'd nearly forgotten that i 've got to grow up again ! let me see -- how is it to be managed ? i suppose i ought to eat or drink something or other ; but the great question is , what ? '",101
"the great question certainly was , what ? alice looked all round her at the flowers and the blades of grass , but she did not see anything that looked like the right thing to eat or drink under the circumstances . there was a large mushroom growing near her , about the same height as herself ; and when she had looked under it , and on both sides of it , and behind it , it occurred to her that she might as well look and see what was on the top of it .",2
how much i wished to reply fully to this question ! how difficult it was to frame any answer !,9
"this time d’artagnan was only in part mistaken ; he himself was not in question , but his horse was .",14
""" yes , "" he pursued with animation , "" this is a fossil man , the contemporary of the mastodons whose remains fill this amphitheatre . but if you ask me how he came there , how those strata on which he lay slipped down into this enormous hollow in the globe , i confess i can not answer that question . no doubt in the post - tertiary period considerable commotions were still disturbing the crust of the earth . the long - continued cooling of the globe produced chasms , fissures , clefts , and faults , into which , very probably , portions of the upper earth may have fallen . i make no rash assertions ; but there is the man surrounded by his own works , by hatchets , by flint arrow - heads , which are the characteristics of the stone age . and unless he came here , like myself , as a tourist on a visit and as a pioneer of science , i can entertain no doubt of the authenticity of his remote origin . """,61
"cacambo vented all his curiosity upon his landlord by a thousand different questions ; the honest man answered him thus , "" i am very ignorant , sir , but i am contented with my ignorance ; however , we have in this neighborhood an old man retired from court , who is the most learned and communicative person in the whole kingdom . """,12
the old man reddened a little at this question .,8
"i must confess the people of your world ask very extraordinary questions . """,11
"the question , then , was how to change this probability into a certainty .",1
"it is a gift from my beautiful englishwoman , or rather frenchwoman -- for i am convinced she was born in france , though i have not questioned her . """,27
"i thought diana very provoking , and felt uncomfortably confused ; and while i was thus thinking and feeling , st . john bent his head ; his greek face was brought to a level with mine , his eyes questioned my eyes piercingly -- he kissed me .",40
"my companion expressed no surprise at this emotion , nor did he question me as to its cause ; he only said--",12
"' are you to get in at all ? ' said the footman . ' that 's the first question , you know . '",19
it was a chamber whose furniture was at once appropriate for a prisoner or a free man ; and yet bars at the windows and outside bolts at the door decided the question in favor of the prison .,32
"athos set the lackeys to work first because , since these men had been in the service of himself and his friends he had discovered in each of them different and essential qualities . then , lackeys who ask questions inspire less mistrust than masters , and meet with more sympathy among those to whom they address themselves .",39
"as to the animals in question , they were peccaries belonging to one of the four species which are included in the family , and they were also of the species of tajacu , recognizable by their deep color and the absence of those long teeth with which the mouths of their congeners are armed .",5
"this was an important question , which cyrus harding was anxious to answer , and yet he did not wish to treat his invalid roughly !",4
"i will tell anybody who asks me questions , this exact tale .",7
"' what did they live on ? ' said alice , who always took a great interest in questions of eating and drinking .",18
"the question of carrying the city by assault , though often debated in the council of the king , had been always rejected . in the first place , la rochelle appeared impregnable . then the cardinal , whatever he said , very well knew that the horror of bloodshed in this encounter , in which frenchman would combat against frenchman , was a retrograde movement of sixty years impressed upon his policy ; and the cardinal was at that period what we now call a man of progress .",1
"the slope of the volcano was in many places of great steepness . we slid down screes of ashes , carefully avoiding the lava streams which glided sluggishly by us like fiery serpents . as we went i chattered and asked all sorts of questions as to our whereabouts , for i was too much excited not to talk a great deal .",44
""" in that case , let there be no more question of what ’s past , and let aramis resume the letter from his cousin where the cardinal interrupted him . """,10
"' you ought to be ashamed of yourself for asking such a simple question , ' added the gryphon ; and then they both sat silent and looked at poor alice , who felt ready to sink into the earth . at last the gryphon said to the mock turtle , ' drive on , old fellow ! do n't be all day about it ! ' and he went on in these words :",13
i told him to forbear question or remark ; i desired him to leave me : i must and would be alone .,5
"the lesson had comprised part of the reign of charles i. , and there were sundry questions about tonnage and poundage and ship- money , which most of them appeared unable to answer ; still , every little difficulty was solved instantly when it reached burns : her memory seemed to have retained the substance of the whole lesson , and she was ready with answers on every point .",16
""" faith , i can not resolve your question , "" said martin , "" unless i had been in the breasts of you all . """,8
"alice did not feel encouraged to ask any more questions about it , so she turned to the mock turtle , and said ' what else had you to learn ? '",9
""" for _ you _ i have no doubt it is . i observed you in your class this morning , and saw you were closely attentive : your thoughts never seemed to wander while miss miller explained the lesson and questioned you .",41
"monsieur the principal of amiens , monsieur the curate of montdidier , and i are arguing certain theological questions in which we have been much interested ; i shall be delighted to have your opinion . """,18
""" within the last few months it became increasingly plain to me that sir charles 's nervous system was strained to the breaking point . he had taken this legend which i have read you exceedingly to heart -- so much so that , although he would walk in his own grounds , nothing would induce him to go out upon the moor at night . incredible as it may appear to you , mr . holmes , he was honestly convinced that a dreadful fate overhung his family , and certainly the records which he was able to give of his ancestors were not encouraging . the idea of some ghastly presence constantly haunted him , and on more than one occasion he has asked me whether i had on my medical journeys at night ever seen any strange creature or heard the baying of a hound . the latter question he put to me several times , and always with a voice which vibrated with excitement .",151
""" on the contrary , "" replied aramis , "" your opinion will be very valuable . the question is this : monsieur the principal thinks that my thesis ought to be dogmatic and didactic . """,18
"i should find myself , therefore , more at my ease , facilus natans , in a subject of my own choice , which would be to these hard theological questions what morals are to metaphysics in philosophy . """,30
""" your friend conseil , "" the fine lad replied serenely , "" has nothing to say for himself . he 's a completely disinterested party on this question . like his master , like his comrade ned , he 's a bachelor . neither wife , parents , nor children are waiting for him back home . he 's in master 's employ , he thinks like master , he speaks like master , and much to his regret , he ca n't be counted on to form a majority . only two persons face each other here : master on one side , ned land on the other . that said , your friend conseil is listening , and he 's ready to keep score . """,28
the host himself brought my breakfast into the parlour . i requested him to shut the door and sit down : i had some questions to ask him .,24
""" this , "" said candide , "" is a grand question . "" this discourse gave birth to new reflections , and martin especially concluded that man was born to live in the convulsions of disquiet , or in the lethargy of idleness .",11
"i asked , knowing , of course , what the answer would be , but yet desirous of deferring the direct question as to where he really was .",21
"it seems they had come in the carriage with their reverend relative , and had been conducting a rummaging scrutiny of the room upstairs , while he transacted business with the housekeeper , questioned the laundress , and lectured the superintendent .",33
