text,ind
""" agreed , but i repeat , conseil : such a phenomenon wo n't occur . the intensity of these underground forces continues to diminish . volcanoes were quite numerous in the world 's early days , but they 're going extinct one by one ; the heat inside the earth is growing weaker , the temperature in the globe 's lower strata is cooling appreciably every century , and to our globe 's detriment , because its heat is its life . """,28
"was phileas fogg rich ? undoubtedly . but those who knew him best could not imagine how he had made his fortune , and mr . fogg was the last person to whom to apply for the information . he was not lavish , nor , on the contrary , avaricious ; for , whenever he knew that money was needed for a noble , useful , or benevolent purpose , he supplied it quietly and sometimes anonymously . he was , in short , the least communicative of men . he talked very little , and seemed all the more mysterious for his taciturn manner . his daily habits were quite open to observation ; but whatever he did was so exactly the same thing that he had always done before , that the wits of the curious were fairly puzzled .",111
""" not it : she will be a restraint . "" he was quite peremptory , both in look and voice . the chill of mrs . fairfax 's warnings , and the damp of her doubts were upon me : something of unsubstantiality and uncertainty had beset my hopes . i half lost the sense of power over him .",13
"d’artagnan , on the contrary , quite full of his plans of conciliation and courtesy , approached the young men with a profound bow , accompanied by a most gracious smile .",6
""" not quite so much , i think , ma'am . """,2
"felton had fallen ; but there was still another step to be taken . he must be retained , or rather he must be left quite alone ; and milady but obscurely perceived the means which could lead to this result .",25
"at first the passengers were quite frightened , but captain anderson hastened to reassure them . in fact , there could be no immediate danger . divided into seven compartments by watertight bulkheads , the scotia could brave any leak with impunity .",5
""" oh , i will make your peace with my aunt . she is quite devoted to you . and i do n't think it really matters about your not being there . the audience probably thought it was a duet . when aunt agatha sits down to the piano , she makes quite enough noise for two people . """,14
""" oh , i will make your peace with my aunt . she is quite devoted to you . and i do n't think it really matters about your not being there . the audience probably thought it was a duet . when aunt agatha sits down to the piano , she makes quite enough noise for two people . """,53
""" on the contrary , i think we are particularly hot upon the trail , sir henry . watson here knows more about my methods than you do , but i fear that even he has not quite grasped the significance of this sentence . """,37
"when i arrived in new york , the question was at the boiling point . the hypothesis of a drifting islet or an elusive reef , put forward by people not quite in their right minds , was completely eliminated . and indeed , unless this reef had an engine in its belly , how could it move about with such prodigious speed ?",31
""" stay , harry , to oblige dorian , and to oblige me , "" said hallward , gazing intently at his picture . "" it is quite true , i never talk when i am working , and never listen either , and it must be dreadfully tedious for my unfortunate sitters . i beg you to stay . """,27
"lord henry went out to the garden and found dorian gray burying his face in the great cool lilac - blossoms , feverishly drinking in their perfume as if it had been wine . he came close to him and put his hand upon his shoulder . "" you are quite right to do that , "" he murmured . "" nothing can cure the soul but the senses , just as nothing can cure the senses but the soul . """,50
"and professor liedenbrock must have known , for he was acknowledged to be quite a polyglot . not that he could speak fluently in the two thousand languages and twelve thousand dialects which are spoken on the earth , but he knew at least his share of them .",13
""" let us go and sit in the shade , "" said lord henry . "" parker has brought out the drinks , and if you stay any longer in this glare , you will be quite spoiled , and basil will never paint you again . you really must not allow yourself to become sunburnt . it would be unbecoming . """,36
"i , on the contrary , became more cheerful , and took fresh courage : these last words gave me an insight as to where the difficulty lay ; and as it was no difficulty with me , i felt quite relieved from my previous embarrassment . i resumed a livelier vein of conversation .",40
"ah , s’blood , how you have hurt me ! my shoulder quite burns . """,12
"she stirred herself , put back the curtain , and i saw her face , pale , wasted , but quite composed : she looked so little changed that my fear was instantly dissipated .",20
""" i am quite ready now , "" was his tranquil response . "" diamonds are trumps : be so good as to play , gentlemen . """,3
"then , with the intention quite patent of not drawing back a foot from the accomplishment of the commission with which he was charged , and as the attendant of an executioner might have done in the chamber of torture , he approached anne of austria , for whose eyes at the same instant sprang tears of rage .",5
"and if master jup had not been satisfied , he would have been very difficult to please ; but he was quite contented and contemplated his own countenance with a sentimental air which expressed some small amount of conceit .",21
""" i am waiting , "" he cried . "" do come in . the light is quite perfect , and you can bring your drinks . """,17
""" and , now , gentlemen , "" said the baronet with decision , "" it seems to me that i have spoken quite enough about the little that i know . it is time that you kept your promise and gave me a full account of what we are all driving at . """,23
""" well , i seem to have come into an inheritance with a vengeance , "" said he when the long narrative was finished . "" of course , i 've heard of the hound ever since i was in the nursery . it 's the pet story of the family , though i never thought of taking it seriously before . but as to my uncle 's death -- well , it all seems boiling up in my head , and i ca n't get it clear yet . you do n't seem quite to have made up your mind whether it 's a case for a policeman or a clergyman . """,94
""" quite finished , "" said the painter . "" and you have sat splendidly to - day . i am awfully obliged to you . """,1
"mr . fogg was quite ready . under his arm might have been observed a red - bound copy of bradshaw 's continental railway steam transit and general guide , with its timetables showing the arrival and departure of steamers and railways . he took the carpet - bag , opened it , and slipped into it a goodly roll of bank of england notes , which would pass wherever he might go .",4
"oh , if she betrayed your majesty on the side of your honor , it would be quite another thing , and i should be the first to say , ’ no grace , sire -- no grace for the guilty ! ’",17
the painter stared in amazement . it was so unlike dorian to speak like that . what had happened ? he seemed quite angry . his face was flushed and his cheeks burning .,22
"in the meantime , porthos had come up , waved his hand to athos , and then turning toward d’artagnan , stood quite astonished .",22
""" oh , that would be quite unnecessary , mr . fogg , "" said ralph politely . "" we will trust your word , as a gentleman of honour . """,6
"felton , as pale as death , remained some instants with his ear bent and listening ; then , when the sound was quite extinct , he breathed like a man awaking from a dream , and rushed out of the apartment .",23
""" we 'll be quite comfortable here , "" i told conseil .",4
""" yet i have been with good people ; far better than you : a hundred times better people ; possessed of ideas and views you never entertained in your life : quite more refined and exalted . """,32
""" for my part , i think what they say is very well said , and quite worthy of two gentlemen . """,16
"seated on the afterdeck , ned land and i chatted about one thing and another , staring at that mysterious sea whose depths to this day are beyond the reach of human eyes . quite naturally , i led our conversation around to the giant unicorn , and i weighed our expedition 's various chances for success or failure . then , seeing that ned just let me talk without saying much himself , i pressed him more closely .",34
""" quite indispensable . """,1
""" well , mr . fix , "" replied the consul , "" i shall not be sorry to see the rascal 's face ; but perhaps he wo n't come here -- that is , if he is the person you suppose him to be . a robber does n't quite like to leave traces of his flight behind him ; and , besides , he is not obliged to have his passport countersigned . """,51
she had still four days before her . four days would quite suffice to complete the seduction of felton .,11
""" yes . passports are only good for annoying honest folks , and aiding in the flight of rogues . i assure you it will be quite the thing for him to do ; but i hope you will not visa the passport . """,26
""" well , who is it ? "" she asked , in a voice and with a smile i half recognised ; "" you 've not quite forgotten me , i think , miss jane ? """,26
""" well , i can tell you anything that is in an english blue book , harry , although those fellows nowadays write a lot of nonsense . when i was in the diplomatic , things were much better . but i hear they let them in now by examination . what can you expect ? examinations , sir , are pure humbug from beginning to end . if a man is a gentleman , he knows quite enough , and if he is not a gentleman , whatever he knows is bad for him . """,77
gideon spilett was quite right in his reply .,3
""" i hope he will fall into proper hands , "" continued the old man . "" he should have a pot of money waiting for him if kelso did the right thing by him . his mother had money , too . all the selby property came to her , through her grandfather . her grandfather hated kelso , thought him a mean dog . he was , too . came to madrid once when i was there . egad , i was ashamed of him . the queen used to ask me about the english noble who was always quarrelling with the cabmen about their fares . they made quite a story of it . i did n't dare show my face at court for a month . i hope he treated his grandson better than he did the jarvies . """,111
""" missis looks stout and well enough in the face , but i think she 's not quite easy in her mind : mr . john 's conduct does not please her -- he spends a deal of money . """,17
"i smiled at bessie 's frank answer : i felt that it was correct , but i confess i was not quite indifferent to its import : at eighteen most people wish to please , and the conviction that they have not an exterior likely to second that desire brings anything but gratification .",21
""" monseigneur , "" said d’artagnan , quite confused , "" i went-- """,7
"he looked quite a gentleman , and i believe he was your father 's brother . """,2
""" quite so , conseil , and what 's more , i imagine that people will soon be poking fun at us ! """,1
"half an hour after the canadian 's latest exploits , we were back on the inner beach . there the local flora was represented by a wide carpet of samphire , a small umbelliferous plant that keeps quite nicely , which also boasts the names glasswort , saxifrage , and sea fennel . conseil picked a couple bunches . as for the local fauna , it included thousands of crustaceans of every type : lobsters , hermit crabs , prawns , mysid shrimps , daddy longlegs , rock crabs , and a prodigious number of seashells , such as cowries , murex snails , and limpets .",37
i told him very humbly -- for i could not conceal from myself the scrape i had got into by laying hands on one of his majesty ’s musketeers -- i told him i was quite ready to submit to his conditions .,35
""" quite so . well , sir henry , i am of one mind with you as to the advisability of your going down to devonshire without delay . there is only one provision which i must make . you certainly must not go alone . """,1
""" not quite , my friends ! "" i replied . "" it was the tide , merely the tide , which wellnigh caught us by surprise just as it did sir walter scott 's hero ! the ocean outside is rising , and by a perfectly natural law of balance , the level of this lake is also rising . we 've gotten off with a mild dunking . let 's go change clothes on the nautilus . """,2
""" how dreadful ! "" cried lord henry . "" i can stand brute force , but brute reason is quite unbearable . there is something unfair about its use . it is hitting below the intellect . """,20
""" dear me ! "" said lady agatha , "" how you men argue ! i am sure i never can make out what you are talking about . oh ! harry , i am quite vexed with you . why do you try to persuade our nice mr . dorian gray to give up the east end ? i assure you he would be quite invaluable . they would love his playing . """,65
""" speak , my boy , do n't be afraid . you are quite at liberty to express your opinions . you are no longer my nephew only , but my colleague . pray go on . """,13
"did fix pay any attention to passepartout 's trouble about the gas ? it is not probable . he was not listening , but was cogitating a project . passepartout and he had now reached the shop , where fix left his companion to make his purchases , after recommending him not to miss the steamer , and hurried back to the consulate . now that he was fully convinced , fix had quite recovered his equanimity .",73
""" quite so , "" answered the young lord . "" it is the problem of slavery , and we try to solve it by amusing the slaves . """,1
"lord henry laughed . "" i do n't desire to change anything in england except the weather , "" he answered . "" i am quite content with philosophic contemplation . but , as the nineteenth century has gone bankrupt through an over - expenditure of sympathy , i would suggest that we should appeal to science to put us straight . the advantage of the emotions is that they lead us astray , and the advantage of science is that it is not emotional . """,25
""" ah ! i quite recognise you . you are the servant of the strange englishman-- """,4
"at last , liveried in the costume of the age , reality entered the room in the shape of a servant to tell the duchess that her carriage was waiting . she wrung her hands in mock despair . "" how annoying ! "" she cried . "" i must go . i have to call for my husband at the club , to take him to some absurd meeting at willis 's rooms , where he is going to be in the chair . if i am late he is sure to be furious , and i could n't have a scene in this bonnet . it is far too fragile . a harsh word would ruin it . no , i must go , dear agatha . good- bye , lord henry , you are quite delightful and dreadfully demoralizing . i am sure i do n't know what to say about your views . you must come and dine with us some night . tuesday ? are you disengaged tuesday ? """,137
""" well , well , "" said the cardinal , "" i do n’t wish you any ill ; but you must be aware that it is quite trouble enough to defend and recompense our friends . we owe nothing to our enemies ; and let me give you a piece of advice ; take care of yourself , monsieur d’artagnan , for from the moment i withdraw my hand from behind you , i would not give an obolus for your life . """,27
""" i quite forget what i said , "" smiled lord henry . "" was it all very bad ? """,2
"to be sure it is pleasant at any time ; for thornfield is a fine old hall , rather neglected of late years perhaps , but still it is a respectable place ; yet you know in winter - time one feels dreary quite alone in the best quarters .",43
""" ah ! i have talked quite enough for to - day , "" said lord henry , smiling . "" all i want now is to look at life . you may come and look at it with me , if you care to . """,6
at the churchyard wicket he stopped : he discovered i was quite out of breath .,11
""" you thought it was my husband . it is only his wife . you must let me introduce myself . i know you quite well by your photographs . i think my husband has got seventeen of them . """,24
""" yet it is evident that the surface of the globe has been subject to the action of fire , "" i replied , "" and it is quite reasonable to suppose that the external crust cooled down first , whilst the heat took refuge down to the centre . """,28
""" quite a mistake , "" my uncle answered . "" the earth has been heated by combustion on its surface , that is all . its surface was composed of a great number of metals , such as potassium and sodium , which have the peculiar property of igniting at the mere contact with air and water ; these metals kindled when the atmospheric vapours fell in rain upon the soil ; and by and by , when the waters penetrated into the fissures of the crust of the earth , they broke out into fresh combustion with explosions and eruptions . such was the cause of the numerous volcanoes at the origin of the earth . """,1
""" ah ! that is one of harry 's views , is n't it , mr . gray ? i always hear harry 's views from his friends . it is the only way i get to know of them . but you must not think i do n't like good music . i adore it , but i am afraid of it . it makes me too romantic . i have simply worshipped pianists-- two at a time , sometimes , harry tells me . i do n't know what it is about them . perhaps it is that they are foreigners . they all are , ai n't they ? even those that are born in england become foreigners after a time , do n't they ? it is so clever of them , and such a compliment to art . makes it quite cosmopolitan , does n't it ?",145
"unhappily for his master , as well as himself , his curiosity drew him unconsciously farther off than he intended to go . at last , having seen the parsee carnival wind away in the distance , he was turning his steps towards the station , when he happened to espy the splendid pagoda on malabar hill , and was seized with an irresistible desire to see its interior . he was quite ignorant that it is forbidden to christians to enter certain indian temples , and that even the faithful must not go in without first leaving their shoes outside the door . it may be said here that the wise policy of the british government severely punishes a disregard of the practices of the native religions .",72
""" i hope that this will not happen again , "" said phileas fogg coldly , as he got into the train . poor passepartout , quite crestfallen , followed his master without a word . fix was on the point of entering another carriage , when an idea struck him which induced him to alter his plan .",26
"the present mr . rochester 's mother was a fairfax , and second cousin to my husband : but i never presume on the connection -- in fact , it is nothing to me ; i consider myself quite in the light of an ordinary housekeeper : my employer is always civil , and i expect nothing more . """,38
""" but are you quite sure of having seen it ?",4
"i looked at my pupil , who did not at first appear to notice me : she was quite a child , perhaps seven or eight years old , slightly built , with a pale , small - featured face , and a redundancy of hair falling in curls to her waist .",18
""" but this encounter , sire , is quite out of the ordinary conditions of a duel . it is a brawl ; and the proof is that there were five of the cardinal ’s guardsmen against my three musketeers and monsieur d’artagnan . """,8
""" my dear dorian , it is quite true . i am analysing women at present , so i ought to know . the subject is not so abstruse as i thought it was . i find that , ultimately , there are only two kinds of women , the plain and the coloured . the plain women are very useful . if you want to gain a reputation for respectability , you have merely to take them down to supper . the other women are very charming . they commit one mistake , however . they paint in order to try and look young . our grandmothers painted in order to try and talk brilliantly . rouge and esprit used to go together . that is all over now . as long as a woman can look ten years younger than her own daughter , she is perfectly satisfied .",7
""" is that quite true ? """,3
""" it depends upon the breed of men quite as much as on the county , "" said dr . mortimer . "" a glance at our friend here reveals the rounded head of the celt , which carries inside it the celtic enthusiasm and power of attachment . poor sir charles 's head was of a very rare type , half gaelic , half ivernian in its characteristics . but you were very young when you last saw baskerville hall , were you not ? """,8
"it formed quite a natural harbor , invisible from the sea , and was entered by a narrow channel .",2
""" master will reply , my friends , that baleen whales are localized , according to species , within certain seas that they never leave . and if one of these animals went from the bering strait to the davis strait , it 's quite simply because there 's some passageway from the one sea to the other , either along the coasts of canada or siberia . """,44
""" and you are quite certain of having seen this fire ? """,4
"ordinary women never appeal to one 's imagination . they are limited to their century . no glamour ever transfigures them . one knows their minds as easily as one knows their bonnets . one can always find them . there is no mystery in any of them . they ride in the park in the morning and chatter at tea - parties in the afternoon . they have their stereotyped smile and their fashionable manner . they are quite obvious . but an actress ! how different an actress is ! harry ! why did n't you tell me that the only thing worth loving is an actress ? """,79
"i spent an awful night . next morning i was called early . i had quite decided i would not open the door . but how was i to resist the sweet voice which was always music to my ears , saying , "" my dear axel ? """,15
"in this room , too , there was a cabinet piano , quite new and of superior tone ; also an easel for painting and a pair of globes .",12
""" the sun has dried up all the rain - drops , sir . the breeze is still : it is quite hot . """,21
""" i should not wonder if he was quite right there . but , on the other hand , judging from their appearance , most of them can not be at all expensive . """,8
when night came the workmen were really quite exhausted .,7
""" only when it is quite convenient to you , sir . """,5
""" you were quite right . there is always something infinitely mean about other people 's tragedies . """,3
""" that is the reason , i suppose , that you never dine with me now . i thought you must have some curious romance on hand . you have ; but it is not quite what i expected . """,35
"and yet it was not quite the last . i found myself weary and yet wakeful , tossing restlessly from side to side , seeking for the sleep which would not come . far away a chiming clock struck out the quarters of the hours , but otherwise a deathly silence lay upon the old house . and then suddenly , in the very dead of the night , there came a sound to my ears , clear , resonant , and unmistakable . it was the sob of a woman , the muffled , strangling gasp of one who is torn by an uncontrollable sorrow . i sat up in bed and listened intently . the noise could not have been far away and was certainly in the house . for half an hour i waited with every nerve on the alert , but there came no other sound save the chiming clock and the rustle of the ivy on the wall .",5
"as he , however , had no other hat , he picked up this as he ran , and arrived at his quarters very pale and quite out of breath . he sat down without saying a word to anybody , and began to reflect .",26
""" that is curious , for i did when i was half asleep fancy that i heard something of the sort . i waited quite a time , but there was no more of it , so i concluded that it was all a dream . """,24
""" there it was an issue of obtaining fresh meat for my crew . here it would be killing for the sake of killing . i 'm well aware that 's a privilege reserved for mankind , but i do n't allow such murderous pastimes . when your peers , mr . land , destroy decent , harmless creatures like the southern right whale or the bowhead whale , they commit a reprehensible offense . thus they 've already depopulated all of baffin bay , and they 'll wipe out a whole class of useful animals . so leave these poor cetaceans alone . they have quite enough natural enemies , such as sperm whales , swordfish , and sawfish , without you meddling with them . """,106
""" basil , my dear boy , puts everything that is charming in him into his work . the consequence is that he has nothing left for life but his prejudices , his principles , and his common sense . the only artists i have ever known who are personally delightful are bad artists . good artists exist simply in what they make , and consequently are perfectly uninteresting in what they are . a great poet , a really great poet , is the most unpoetical of all creatures . but inferior poets are absolutely fascinating . the worse their rhymes are , the more picturesque they look . the mere fact of having published a book of second - rate sonnets makes a man quite irresistible . he lives the poetry that he can not write . the others write the poetry that they dare not realize . """,126
""" it 's pointless to run any risks , professor . the nautilus will suffice to disperse these sperm whales . it 's armed with a steel spur quite equal to mr . land 's harpoon , i imagine . """,28
