text,ind
""" no noise from without by which i could measure the time reached me ; i only supposed it must be seven or eight o’clock in the evening , for it was in the month of october and it was quite dark .",40
"you have not quite forgotten little adele , have you , reader ?",3
there were days when she was quite silent ; but there were others when i could not account for the sounds she made .,6
""" quite ready , james , "" she answered , keeping her eyes on her work . for some months past she had felt ill at ease when she was alone with this rough stern son of hers . her shallow secret nature was troubled when their eyes met . she used to wonder if he suspected anything . the silence , for he made no other observation , became intolerable to her . she began to complain . women defend themselves by attacking , just as they attack by sudden and strange surrenders . "" i hope you will be contented , james , with your sea - faring life , "" she said . "" you must remember that it is your own choice . you might have entered a solicitor 's office . solicitors are a very respectable class , and in the country often dine with the best families . """,1
""" that name was the most convenient , and it came to me quite of myself .",13
""" my son , you distress me very much . sibyl is always under my special care . of course , if this gentleman is wealthy , there is no reason why she should not contract an alliance with him . i trust he is one of the aristocracy . he has all the appearance of it , i must say . it might be a most brilliant marriage for sibyl . they would make a charming couple . his good looks are really quite remarkable ; everybody notices them . """,84
""" that is the great grimpen mire , "" said he . "" a false step yonder means death to man or beast . only yesterday i saw one of the moor ponies wander into it . he never came out . i saw his head for quite a long time craning out of the bog - hole , but it sucked him down at last . even in dry seasons it is a danger to cross it , but after these autumn rains it is an awful place . and yet i can find my way to the very heart of it and return alive . by george , there is another of those miserable ponies ! """,47
"his companions searched in the darkness on the wall , in case the wind should have moved the ladder , and on the ground , thinking that it might have fallen down .... but the ladder had quite disappeared .",37
"i did ; whereupon began a heaving , stamping , clattering process , accompanied by a barking and baying which removed me effectually some yards ' distance ; but i would not be driven quite away till i saw the event .",34
i was in the library -- sitting in his chair -- he was quite near .,13
"jim frowned from time to time when he caught the inquisitive glance of some stranger . he had that dislike of being stared at , which comes on geniuses late in life and never leaves the commonplace . sibyl , however , was quite unconscious of the effect she was producing . her love was trembling in laughter on her lips . she was thinking of prince charming , and , that she might think of him all the more , she did not talk of him , but prattled on about the ship in which jim was going to sail , about the gold he was certain to find , about the wonderful heiress whose life he was to save from the wicked , red - shirted bushrangers . for he was not to remain a sailor , or a supercargo , or whatever he was going to be . oh , no ! a sailor 's existence was dreadful . fancy being cooped up in a horrid ship , with the hoarse , hump - backed waves trying to get in , and a black wind blowing the masts down and tearing the sails into long screaming ribands !",43
""" the peasants say it is the hound of the baskervilles calling for its prey . i 've heard it once or twice before , but never quite so loud . """,27
""" oh , if that is all , you are quite right ; but after all , when we have gone down , we shall have to get up again , i suppose ? """,10
""" but it is quite a town . when was it inhabited ? """,4
"a small fly or moth had fluttered across our path , and in an instant stapleton was rushing with extraordinary energy and speed in pursuit of it . to my dismay the creature flew straight for the great mire , and my acquaintance never paused for an instant , bounding from tuft to tuft behind it , his green net waving in the air . his gray clothes and jerky , zigzag , irregular progress made him not unlike some huge moth himself . i was standing watching his pursuit with a mixture of admiration for his extraordinary activity and fear lest he should lose his footing in the treacherous mire , when i heard the sound of steps , and turning round found a woman near me upon the path . she had come from the direction in which the plume of smoke indicated the position of merripit house , but the dip of the moor had hid her until she was quite close .",163
""" my god , my god ! "" cried d’artagnan , quite stunned by the relation of this horrible adventure .",11
"phileas fogg contented himself with saying that it was impossible . it was quite unlikely that he should be arrested for preventing a suttee . the complainants would not dare present themselves with such a charge . there was some mistake . moreover , he would not , in any event , abandon aouda , but would escort her to hong kong .",13
"all this doubt only gave rise to a more lively desire of arriving at a certainty , and he went into his friend ’s chamber with a fixed determination of renewing the conversation of the preceding evening ; but he found athos quite himself again -- that is to say , the most shrewd and impenetrable of men .",42
""" quite so . """,1
""" quite happy , "" said she , but there was no ring of conviction in her words .",1
""" ’ ah ! ’ said my enemy , in a jeering tone , ’ that ’s quite another thing .",17
"meanwhile preparations for this daring attempt were getting under way . the nautilus 's powerful pumps forced air down into the tanks and stored it under high pressure . near four o'clock captain nemo informed me that the platform hatches were about to be closed . i took a last look at the dense ice bank we were going to conquer . the weather was fair , the skies reasonably clear , the cold quite brisk , namely -12 degrees centigrade ; but after the wind had lulled , this temperature did n't seem too unbearable .",74
""" quite serious , basil . i should be miserable if i thought i should ever be more serious than i am at the present moment . """,1
""" i could not quite understand the object of your questions this morning , sir henry , "" said he . "" i trust that they do not mean that i have done anything to forfeit your confidence ? """,4
i sat down quite disembarrassed .,3
""" i hope you will always be very happy , dorian , "" said hallward , "" but i do n't quite forgive you for not having let me know of your engagement . you let harry know . """,21
"if it is only to be recognized , why the saddle will suffice for that ; it is quite remarkable enough .",18
""" perhaps the apes will think we have gone quite away and will show themselves again .",9
"during the first days of the journey aouda became better acquainted with her protector , and constantly gave evidence of her deep gratitude for what he had done . the phlegmatic gentleman listened to her , apparently at least , with coldness , neither his voice nor his manner betraying the slightest emotion ; but he seemed to be always on the watch that nothing should be wanting to aouda 's comfort . he visited her regularly each day at certain hours , not so much to talk himself , as to sit and hear her talk . he treated her with the strictest politeness , but with the precision of an automaton , the movements of which had been arranged for this purpose . aouda did not quite know what to make of him , though passepartout had given her some hints of his master 's eccentricity , and made her smile by telling her of the wager which was sending him round the world . after all , she owed phileas fogg her life , and she always regarded him through the exalting medium of her gratitude .",128
""" therefore , sire , your majesty sees that they are come , quite contrite and repentant , to offer you their excuses . """,13
""" quite contrite and repentant !",1
"the vegetation on this desolate continent struck me as quite limited . a few lichens of the species usnea melanoxanthra sprawled over the black rocks . the whole meager flora of this region consisted of certain microscopic buds , rudimentary diatoms made up of a type of cell positioned between two quartz - rich shells , plus long purple and crimson fucus plants , buoyed by small air bladders and washed up on the coast by the surf .",9
""" its quite simple , my boy , "" said he , "" for , in plunging my hand into the water , i felt no sensation either of heat or cold .",2
""" quite in the back row , eh ? but her brother was well up to the front . did you see him come out on us ? """,1
"seven men in two days , and those of his very best ! but that ’s quite enough , gentlemen ; please to understand , that ’s enough . you have taken your revenge for the rue ferou , and even exceeded it ; you ought to be satisfied . """,16
""" do n't pay any attention to him , dorian , "" said the painter . "" i understand what you mean , and i believe in this girl . any one you love must be marvellous , and any girl who has the effect you describe must be fine and noble . to spiritualize one 's age -- that is something worth doing . if this girl can give a soul to those who have lived without one , if she can create the sense of beauty in people whose lives have been sordid and ugly , if she can strip them of their selfishness and lend them tears for sorrows that are not their own , she is worthy of all your adoration , worthy of the adoration of the world . this marriage is quite right . i did not think so at first , but i admit it now . the gods made sibyl vane for you . without her you would have been incomplete . """,137
""" thanks , basil , "" answered dorian gray , pressing his hand . "" i knew that you would understand me . harry is so cynical , he terrifies me . but here is the orchestra . it is quite dreadful , but it only lasts for about five minutes . then the curtain rises , and you will see the girl to whom i am going to give all my life , to whom i have given everything that is good in me . """,40
"i drew conseil 's attention to the considerable growth of the cerebral lobes found in these intelligent cetaceans . no mammal except man has more abundant cerebral matter . accordingly , seals are quite capable of being educated ; they make good pets , and together with certain other naturalists , i think these animals can be properly trained to perform yeoman service as hunting dogs for fishermen .",33
""" captain , "" said pencroft , when the engineer and the reporter had rejoined them , "" captain , you see quite well we ca n't get on unless we make a few guns .",22
""" oh , i am quite sure of that ! "" cried passepartout , laughing heartily .",5
"so things happened on board that were quite odd to say the least , things never to be seen by people not placing themselves beyond society 's laws ! among all the surprises the future had in store for me , this would not be the mildest .",7
""" then , sir , "" i went on , "" you give us , quite simply , a choice between life and death ? """,15
""" quite simply . """,1
"the englishman , quite triumphant , did not even give himself the trouble to shake the dice .",3
""" far from it . i was tormented by the contrast between my idea and my handiwork : in each case i had imagined something which i was quite powerless to realise . """,28
""" not quite : you have secured the shadow of your thought ; but no more , probably .",2
"felton , quite bewildered , almost mad , stood speechless .",2
"they have a worth -- so i have always believed ; and if i can not believe it now , it is because i am insane -- quite insane : with my veins running fire , and my heart beating faster than i can count its throbs .",27
"he made no answer at first , but remained quite still . the knocking still continued and grew louder . yes , it was better to let lord henry in , and to explain to him the new life he was going to lead , to quarrel with him if it became necessary to quarrel , to part if parting was inevitable . he jumped up , drew the screen hastily across the picture , and unlocked the door .",9
"we had to cross a few narrow fiords , and at last quite a wide gulf ; the tide , then high , allowed us to pass over without delay , and to reach the hamlet of alftanes , one mile beyond .",12
""" well , if a man can stride four and a - half feet without the smallest effort , he ca n't be quite in the sere and yellow . that was the breadth of a puddle on the garden walk which he had evidently walked across . patent - leather boots had gone round , and square - toes had hopped over . there is no mystery about it at all . i am simply applying to ordinary life a few of those precepts of observation and deduction which i advocated in that article . is there anything else that puzzles you ? """,23
""" no , sir , and i might add that it 's quite a humble one next to yours . you own 6,000 or 7,000 volumes here . . . """,12
"his changes of mood did not offend me , because i saw that i had nothing to do with their alternation ; the ebb and flow depended on causes quite disconnected with me .",29
"ordinary women always console themselves . some of them do it by going in for sentimental colours . never trust a woman who wears mauve , whatever her age may be , or a woman over thirty - five who is fond of pink ribbons . it always means that they have a history . others find a great consolation in suddenly discovering the good qualities of their husbands . they flaunt their conjugal felicity in one 's face , as if it were the most fascinating of sins . religion consoles some . its mysteries have all the charm of a flirtation , a woman once told me , and i can quite understand it . besides , nothing makes one so vain as being told that one is a sinner . conscience makes egotists of us all . yes ; there is really no end to the consolations that women find in modern life . indeed , i have not mentioned the most important one . """,113
"now , one evening when d’artagnan , who was in the trenches , was not able to accompany them , athos , porthos , and aramis , mounted on their battle steeds , enveloped in their war cloaks , with their hands upon their pistol butts , were returning from a drinking place called the red dovecot , which athos had discovered two days before upon the route to jarrie , following the road which led to the camp and quite on their guard , as we have stated , for fear of an ambuscade , when , about a quarter of a league from the village of boisnau , they fancied they heard the sound of horses approaching them . they immediately all three halted , closed in , and waited , occupying the middle of the road . in an instant , and as the moon broke from behind a cloud , they saw at a turning of the road two horsemen who , on perceiving them , stopped in their turn , appearing to deliberate whether they should continue their route or go back .",80
"mr . rochester , as he sat in his damask - covered chair , looked different to what i had seen him look before ; not quite so stern -- much less gloomy .",26
""" these composers , "" captain nemo answered me , "" are the contemporaries of orpheus , because in the annals of the dead , all chronological differences fade ; and i 'm dead , professor , quite as dead as those friends of yours sleeping six feet under ! """,37
""" so , "" i said , "" our maneuvers are quite simple . we 'll return in our tracks and go out the southern opening . that 's all . """,11
""" i am willing to amuse you , if i can , sir -- quite willing ; but i can not introduce a topic , because how do i know what will interest you ?",14
""" but , captain , you have a tremendous speed of movement that does n't square with the strength of electricity . until now , its dynamic potential has remained quite limited , capable of producing only small amounts of power ! """,30
""" only my christian name , and that i am quite sure she never mentioned to any one . she told me once that they were all rather curious to learn who i was , and that she invariably told them my name was prince charming . it was pretty of her . you must do me a drawing of sibyl , basil . i should like to have something more of her than the memory of a few kisses and some broken pathetic words . """,10
""" that question deserves an answer , "" captain nemo replied . "" first off , i 'll mention that at the bottom of the sea there exist veins of zinc , iron , silver , and gold whose mining would quite certainly be feasible . but i 've tapped none of these land - based metals , and i wanted to make demands only on the sea itself for the sources of my electricity . """,41
""" accordingly , professor , i do n't extract it with batteries ; quite simply , i utilize the heat of coal from the earth . """,13
""" basil , "" he said , coming over quite close and looking him straight in the face , "" we have each of us a secret . let me know yours , and i shall tell you mine . what was your reason for refusing to exhibit my picture ? """,9
""" yes ; two or three . quite as many as there was employment for . """,7
""" pleasanter for you , i am afraid , "" murmured hallward regretfully . "" and now good - bye . i am sorry you wo n't let me look at the picture once again . but that ca n't be helped . i quite understand what you feel about it . """,44
gregson looked quite crest - fallen .,2
""" here , professor aronnax , are the different dimensions of this boat now transporting you . it 's a very long cylinder with conical ends . it noticeably takes the shape of a cigar , a shape already adopted in london for several projects of the same kind . the length of this cylinder from end to end is exactly seventy meters , and its maximum breadth of beam is eight meters . so it is n't quite built on the ten - to - one ratio of your high - speed steamers ; but its lines are sufficiently long , and their tapering gradual enough , so that the displaced water easily slips past and poses no obstacle to the ship 's movements .",78
"i listened to the dull thuds of the descending bale . my uncle , leaning over the abyss , followed the descent of the luggage with a satisfied nod , and only rose erect when he had quite lost sight of it .",37
""" it 's quite exciting , "" said sherlock holmes , with a yawn . "" what happened next ? """,3
that evening the hunters returned to granite house quite exhausted .,8
""" quite sure . consult the barometer . """,1
""" my strength is quite failing me , "" i said in a soliloquy . "" i feel i can not go much farther . shall i be an outcast again this night ? while the rain descends so , must i lay my head on the cold , drenched ground ?",4
my glazed eye wandered over the dim and misty landscape . i saw i had strayed far from the village : it was quite out of sight .,23
""" that is an _ ignis fatuus _ , "" was my first thought ; and i expected it would soon vanish . it burnt on , however , quite steadily , neither receding nor advancing .",29
""" it was quite thick enough before , "" grumbled lestrade , taking a chair . "" i seem to have dropped into a sort of council of war . """,3
"he was quite conscious that this would tell them nothing . it was true that the portrait still preserved , under all the foulness and ugliness of the face , its marked likeness to himself ; but what could they learn from that ? he would laugh at any one who tried to taunt him . he had not painted it . what was it to him how vile and full of shame it looked ? even if he told them , would they believe it ?",2
""" it seemed to me that my sudden appearance might shake his nerves and lead him to say something unguarded . the boots volunteered to show me the room : it was on the second floor , and there was a small corridor leading up to it . the boots pointed out the door to me , and was about to go downstairs again when i saw something that made me feel sickish , in spite of my twenty years ' experience . from under the door there curled a little red ribbon of blood , which had meandered across the passage and formed a little pool along the skirting at the other side . i gave a cry , which brought the boots back . he nearly fainted when he saw it . the door was locked on the inside , but we put our shoulders to it , and knocked it in . the window of the room was open , and beside the window , all huddled up , lay the body of a man in his nightdress . he was quite dead , and had been for some time , for his limbs were rigid and cold . when we turned him over , the boots recognized him at once as being the same gentleman who had engaged the room under the name of joseph stangerson . the cause of death was a deep stab in the left side , which must have penetrated the heart . and now comes the strangest part of the affair . what do you suppose was above the murdered man ? """,184
""" i may not know exactly where he is , but i am quite sure that i could help the police to lay their hands on him . has it never struck you that the way to catch that man was to find out where he got his food , and so trace it to him ? """,13
""" dorian ! what an extraordinary piece of luck ! i have been waiting for you in your library ever since nine o'clock . finally i took pity on your tired servant and told him to go to bed , as he let me out . i am off to paris by the midnight train , and i particularly wanted to see you before i left . i thought it was you , or rather your fur coat , as you passed me . but i was n't quite sure . did n't you recognize me ? """,88
""" you see your servant made me quite at home , dorian . he gave me everything i wanted , including your best gold - tipped cigarettes . he is a most hospitable creature . i like him much better than the frenchman you used to have . what has become of the frenchman , by the bye ? """,7
"dorian shrugged his shoulders . "" i believe he married lady radley 's maid , and has established her in paris as an english dressmaker . anglomanie is very fashionable over there now , i hear . it seems silly of the french , does n't it ? but -- do you know?--he was not at all a bad servant . i never liked him , but i had nothing to complain about . one often imagines things that are quite absurd . he was really very devoted to me and seemed quite sorry when he went away . have another brandy - and - soda ? or would you like hock - and - seltzer ? i always take hock - and - seltzer myself . there is sure to be some in the next room . """,80
"dorian shrugged his shoulders . "" i believe he married lady radley 's maid , and has established her in paris as an english dressmaker . anglomanie is very fashionable over there now , i hear . it seems silly of the french , does n't it ? but -- do you know?--he was not at all a bad servant . i never liked him , but i had nothing to complain about . one often imagines things that are quite absurd . he was really very devoted to me and seemed quite sorry when he went away . have another brandy - and - soda ? or would you like hock - and - seltzer ? i always take hock - and - seltzer myself . there is sure to be some in the next room . """,92
"somebody -- i wo n't mention his name , but you know him -- came to me last year to have his portrait done . i had never seen him before , and had never heard anything about him at the time , though i have heard a good deal since . he offered an extravagant price . i refused him . there was something in the shape of his fingers that i hated . i know now that i was quite right in what i fancied about him . his life is dreadful . but you , dorian , with your pure , bright , innocent face , and your marvellous untroubled youth-- i ca n't believe anything against you . and yet i see you very seldom , and you never come down to the studio now , and when i am away from you , and i hear all these hideous things that people are whispering about you , i do n't know what to say .",81
"the professor 's calculations were quite correct . we had already attained a depth of six thousand feet beyond that hitherto reached by the foot of man , such as the mines of kitz bahl in tyrol , and those of wuttembourg in bohemia .",5
"i wo n't tell you that i do n't want to preach to you . i remember harry saying once that every man who turned himself into an amateur curate for the moment always began by saying that , and then proceeded to break his word . i do want to preach to you . i want you to lead such a life as will make the world respect you . i want you to have a clean name and a fair record . i want you to get rid of the dreadful people you associate with . do n't shrug your shoulders like that . do n't be so indifferent . you have a wonderful influence . let it be for good , not for evil . they say that you corrupt every one with whom you become intimate , and that it is quite sufficient for you to enter a house for shame of some kind to follow after . i do n't know whether it is so or not . how should i know ? but it is said of you . i am told things that it seems impossible to doubt .",145
""" ah , you are quite the pet of the ladies , monsieur porthos ! "" resumed the procurator ’s wife , with a sigh .",5
