text,ind
"the whole thing occurred in a moment — so quickly that i had no time to realize it . i have a vivid recollection of that instant , of holmes ' triumphant expression and the ring of his voice , of the cabman 's dazed , savage face , as he glared at the glittering handcuffs , which had appeared as if by magic upon his wrists . for a second or two we might have been a group of statues . then , with an inarticulate roar of fury , the prisoner wrenched himself free from holmes 's grasp , and hurled himself through the window . woodwork and glass gave way before him ; but before he got quite through , gregson , lestrade , and holmes sprang upon him like so many staghounds . he was dragged back into the room , and then commenced a terrific conflict . so powerful and so fierce was he , that the four of us were shaken off again and again . he appeared to have the convulsive strength of a man in an epileptic fit . his face and hands were terribly mangled by his passage through the glass , but loss of blood had no effect in diminishing his resistance . it was not until lestrade succeeded in getting his hand inside his neckcloth and half - strangling him that we made him realize that his struggles were of no avail ; and even then we felt no security until we had pinioned his feet as well as his hands . that done , we rose to our feet breathless and panting .",120
"everyone knows that fish make up the fourth and last class in the vertebrate branch . they have been quite aptly defined as : "" cold - blooded vertebrates with a double circulatory system , breathing through gills , and designed to live in water . "" they consist of two distinct series : the series of bony fish , in other words , those whose spines have vertebrae made of bone ; and cartilaginous fish , in other words , those whose spines have vertebrae made of cartilage .",19
""" well then , "" cried the sailor , "" i am quite ready to be captain -- as soon as you can make a craft that 's able to keep at sea ! """,12
"if you were a duchess , a marchioness , or a countess , it would be quite a different thing ; it would be unpardonable . """,16
"the canadian was quite disheartened , having counted on putting his plans into execution in the gulf , either by reaching shore or by pulling alongside one of the many boats plying a coastal trade from one island to another . an escape attempt would have been quite feasible , assuming ned land managed to seize the skiff without the captain 's knowledge . but in midocean it was unthinkable .",3
"the canadian was quite disheartened , having counted on putting his plans into execution in the gulf , either by reaching shore or by pulling alongside one of the many boats plying a coastal trade from one island to another . an escape attempt would have been quite feasible , assuming ned land managed to seize the skiff without the captain 's knowledge . but in midocean it was unthinkable .",47
""" it do n't matter . it ai n't quite regular , but he wo n't mind that , you bet . you say over them ones that you used to say every night in the waggon when we was on the plains . """,9
""" you are right in doing this , my uncle , and i should quite approve of your determination , if there were not a danger threatening us nearer and nearer . """,14
""" my god ! if it is true , "" he exclaimed , "" and this is what you have done with your life , why , you must be worse even than those who talk against you fancy you to be ! "" he held the light up again to the canvas and examined it . the surface seemed to be quite undisturbed and as he had left it . it was from within , apparently , that the foulness and horror had come . through some strange quickening of inner life the leprosies of sin were slowly eating the thing away . the rotting of a corpse in a watery grave was not so fearful .",62
"it happened also , on the 23rd of november , that passepartout made a joyful discovery . it will be remembered that the obstinate fellow had insisted on keeping his famous family watch at london time , and on regarding that of the countries he had passed through as quite false and unreliable . now , on this day , though he had not changed the hands , he found that his watch exactly agreed with the ship 's chronometers . his triumph was hilarious . he would have liked to know what fix would say if he were aboard !",49
"this was not quite real wheaten bread , but it was very like it .",3
"come in -- your sisters are quite uneasy about you , and i believe there are bad folks about .",6
""" the island is quite comfortable where it is ! """,4
""" none at all , my friends , at least in those that go beyond the bounds of credibility and fly off into fable or legend . yet for the imaginings of these storytellers there had to be , if not a cause , at least an excuse . it ca n't be denied that some species of squid and other devilfish are quite large , though still smaller than cetaceans . aristotle put the dimensions of one squid at five cubits , or 3.1 meters . our fishermen frequently see specimens over 1.8 meters long . the museums in trieste and montpellier have preserved some devilfish carcasses measuring two meters . besides , according to the calculations of naturalists , one of these animals only six feet long would have tentacles as long as twenty - seven . which is enough to make a fearsome monster . """,63
bessie leaven had said i was quite a lady ; and she spoke truth -- i was a lady .,6
""" oh , quite well ! i never felt better . """,3
"i believe there is quite a party assembled there ; lord ingram , sir george lynn , colonel dent , and others . """,4
""" ah , ah ! it is quite regular and explicit , "" said the governor .",7
""" but what has happened ? "" asked gideon spilett , quite stunned by this unexpected catastrophe .",11
""" ill or well , she would always be plain . the grace and harmony of beauty are quite wanting in those features . """,18
""" and you would be quite wrong , my dear de winter , "" said buckingham , holding out his hand to him . "" i do not know the man who deserves being regretted during the whole life of another man ; but leave us , i pray you . """,5
""" but that is not quite what i mean to ask you , aramis , "" replied athos . "" i want to know if you were left alone , and nobody interrupted you . """,5
"the vessel was quite ready to sail , and the captain was waiting on the wharf .",3
""" that is well . the house is watched on every side . that is why i crawled my way up to it . they may be darned sharp , but they 're not quite sharp enough to catch a washoe hunter . """,34
"adele ran quite wild in the midst of it : the preparations for company and the prospect of their arrival , seemed to throw her into ecstasies .",2
"at this moment the duke ’s surgeon arrived , quite terrified ; he was already on board the admiral ’s ship , where they had been obliged to seek him .",9
"her guests this evening were rather tedious . the fact was , as she explained to dorian , behind a very shabby fan , one of her married daughters had come up quite suddenly to stay with her , and , to make matters worse , had actually brought her husband with her . "" i think it is most unkind of her , my dear , "" she whispered . "" of course i go and stay with them every summer after i come from homburg , but then an old woman like me must have fresh air sometimes , and besides , i really wake them up . you do n't know what an existence they lead down there . it is pure unadulterated country life . they get up early , because they have so much to do , and go to bed early , because they have so little to think about . there has not been a scandal in the neighbourhood since the time of queen elizabeth , and consequently they all fall asleep after dinner . you sha n't sit next either of them . you shall sit by me and amuse me . """,32
""" dorian , "" said lord henry at last , as the chaud - froid was being handed round , "" what is the matter with you to - night ? you are quite out of sorts . """,33
""" i believe he is in love , "" cried lady narborough , and that he is afraid to tell me for fear i should be jealous . he is quite right . i certainly should . """,30
"but , to decide this important question , it was necessary to wait until the tide was quite low , so that every part of the brig 's hull might be examined .",17
"then i began to hear distinctly quite a new sound of something running within the thickness of the granite wall , a kind of dull , dead rumbling , like distant thunder . during the first part of our walk , not meeting with the promised spring , i felt my agony returning ; but then my uncle acquainted me with the cause of the strange noise .",6
""" she is still décolletée , "" he answered , taking an olive in his long fingers ; "" and when she is in a very smart gown she looks like an édition de luxe of a bad french novel . she is really wonderful , and full of surprises . her capacity for family affection is extraordinary . when her third husband died , her hair turned quite gold from grief . """,68
""" i believe , "" she said , "" i was quite mista'en in my thoughts of you : but there is so mony cheats goes about , you mun forgie me . """,11
""" porthos , "" said aramis , "" athos has already told you that you are a simpleton , and i am quite of his opinion .",22
"the host had not quite so good a bargain as he at first hoped for , but he made amends by slipping in two bottles of anjou wine instead of two bottles of champagne .",4
""" it is quite plain , "" said i , "" that the higher body of this water is at a considerable elevation . the force of the jet shows that . """,3
"but no one heard this sage reflection , nor would anyone have acknowledged its justice . the passengers resumed their places in the cars . passepartout took his seat without telling what had passed . the whist - players were quite absorbed in their game .",40
""" you were charming last night . the little duchess is quite devoted to you . she tells me she is going down to selby . """,11
"he was young -- perhaps from twenty- eight to thirty -- tall , slender ; his face riveted the eye ; it was like a greek face , very pure in outline : quite a straight , classic nose ; quite an athenian mouth and chin .",33
"he was young -- perhaps from twenty- eight to thirty -- tall , slender ; his face riveted the eye ; it was like a greek face , very pure in outline : quite a straight , classic nose ; quite an athenian mouth and chin .",40
"on this occasion i witnessed one of the finest gunshots ever to thrill the marrow of a hunter . a large bird with a wide wingspan , quite clearly visible , approached and hovered over us . when it was just a few meters above the waves , captain nemo 's companion took aim and fired . the animal dropped , electrocuted , and its descent brought it within reach of our adroit hunter , who promptly took possession of it . it was an albatross of the finest species , a wonderful specimen of these open - sea fowl .",27
"this incident did not interrupt our walk . for two hours we were sometimes led over plains of sand , sometimes over prairies of seaweed that were quite arduous to cross . in all honesty , i was dead tired by the time i spotted a hazy glow half a mile away , cutting through the darkness of the waters . it was the nautilus 's beacon . within twenty minutes we would be on board , and there i could breathe easy again -- because my tank 's current air supply seemed to be quite low in oxygen . but i was reckoning without an encounter that slightly delayed our arrival .",27
"this incident did not interrupt our walk . for two hours we were sometimes led over plains of sand , sometimes over prairies of seaweed that were quite arduous to cross . in all honesty , i was dead tired by the time i spotted a hazy glow half a mile away , cutting through the darkness of the waters . it was the nautilus 's beacon . within twenty minutes we would be on board , and there i could breathe easy again -- because my tank 's current air supply seemed to be quite low in oxygen . but i was reckoning without an encounter that slightly delayed our arrival .",95
""" this will take us a long way , "" he cried , "" and without much difficulty ; for the projections in the rock form quite a staircase . """,26
""" i confess , "" said i , "" that i do not quite follow you . """,13
""" quite probable . """,1
""" that ’s quite as many as we shall want .",3
""" you are quite right , i am sure , "" said diana .",3
"in the broad electric daylight , an enormous black mass , quite motionless , hung suspended in the midst of the waters . i observed it carefully , trying to find out the nature of this gigantic cetacean . then a sudden thought crossed my mind .",11
"you pay her , of course ; i should think it quite as expensive,--more so ; for you have them both to keep in addition . """,11
""" well , admitting all your calculations to be quite correct , you must allow me to draw one rigid result therefrom . """,9
""" right , "" said mr . st . john , quite coolly . "" if such is your spirit , i promise to aid you , in my own time and way . """,11
"this greatness of spirit in a man who was quite destitute struck even porthos ; and this french generosity , repeated by lord de winter and his friend , was highly applauded , except by mm grimaud , bazin , mousqueton and planchet .",9
""" quite so . but you had your suspicions ? """,1
"i could observe these strange walls quite closely : our sounding lines indicated that they dropped perpendicularly for more than 300 meters , and our electric beams made the bright limestone positively sparkle .",6
""" why did n't you kill him ? "" she hissed out , putting haggard face quite close to his . "" i knew you were following him when you rushed out from daly 's . you fool ! you should have killed him . he has lots of money , and he 's as bad as bad . """,16
""" certainly , my best . and i was quite right : depend on that : there are a thousand reasons why liaisons between governesses and tutors should never be tolerated a moment in any well - regulated house ; firstly-- """,9
""" but i do n't want to be rechristened , harry , "" rejoined the duchess , looking up at him with her wonderful eyes . "" i am quite satisfied with my own name , and i am sure mr . gray should be satisfied with his . """,29
""" i am at quite a loss how to answer you , i admit , "" said mme . bonacieux . "" my intention was to inform monsieur laporte , through my husband , in order that monsieur laporte might tell us precisely what had taken place at the louvre in the last three days , and whether there is any danger in presenting myself there . """,4
"then dumont d'urville tried to depart ; but his crews were run down from the fevers raging on these unsanitary shores , and quite ill himself , he was unable to weigh anchor until march 17 .",23
""" quite seriously . """,1
"at neufchatel , as at st . valery , he found a horse quite ready and awaiting him . he was about to remove the pistols from the saddle he had quit to the one he was about to fill , but he found the holsters furnished with similar pistols .",13
"the face of the young woman was entirely unknown to her . each examined the other with great attention , while exchanging the customary compliments ; both were very handsome , but of quite different styles of beauty .",33
"do n’t condemn it from appearances ; you will find a horse in the stables quite as good as this . """,15
"the prairie , across which the sledge was moving in a straight line , was as flat as a sea . it seemed like a vast frozen lake . the railroad which ran through this section ascended from the south - west to the north - west by great island , columbus , an important nebraska town , schuyler , and fremont , to omaha . it followed throughout the right bank of the platte river . the sledge , shortening this route , took a chord of the arc described by the railway . mudge was not afraid of being stopped by the platte river , because it was frozen . the road , then , was quite clear of obstacles , and phileas fogg had but two things to fear -- an accident to the sledge , and a change or calm in the wind .",118
it was not till after dinner that i saw him again : he then seemed quite at his ease .,15
"the clerks , who , as it appeared , had smelled unusual perfumes in the house , were of military punctuality , and held their stools in hand quite ready to sit down .",28
""" quite my opinion . """,1
"suddenly there was no ground under me . i felt myself revolving in air , striking and rebounding against the craggy projections of a vertical gallery , quite a well ; my head struck against a sharp corner of the rock , and i became unconscious .",27
"but though neb had been able to make his way into richmond , it was quite another thing to get out again , for the northern prisoners were very strictly watched .",15
"it is a ray of daylight , i thought , sliding in through this cleft in the rock ! that is indeed the murmuring of waves ! that is the rustling noise of wind . am i quite mistaken , or have we returned to the surface of the earth ? has my uncle given up the expedition , or is it happily terminated ?",37
""" how fond you are of saying dangerous things , harry ! in the present instance , you are quite astray . i like the duchess very much , but i do n't love her . """,19
""" quite . """,1
""" not quite , professor , "" the canadian replied . "" we need some fruit to go with it , or at least some vegetables . """,2
""" papa says you never come to see us now , "" continued miss oliver , looking up . "" you are quite a stranger at vale hall .",22
"nothing was easier , since if the level of the lake was raised two or three feet , the opening would be quite beneath it .",22
"his constitution brought him through , the fever gradually subsided , and gideon spilett , who was a bit of a doctor , pronounced him quite out of danger .",25
this method was so simple that d’artagnan employed it quite naturally and instinctively .,9
"it was quite an ocean , with the irregular shores of earth , but desert and frightfully wild in appearance .",2
""" quite well , "" he enunciated ; and , with a bow , he left the gate . she went one way ; he another .",1
"harding did not appear to be much astonished at this incident , and he cited several examples of tame apes , to whom the use of tobacco had become quite familiar .",29
"wholly untaught , with faculties quite torpid , they seemed to me hopelessly dull ; and , at first sight , all dull alike : but i soon found i was mistaken . there was a difference amongst them as amongst the educated ; and when i got to know them , and they me , this difference rapidly developed itself .",5
"as miss cunegund had a great disposition for the sciences , she observed with the utmost attention the experiments which were repeated before her eyes ; she perfectly well understood the force of the doctor 's reasoning upon causes and effects . she retired greatly flurried , quite pensive and filled with the desire of knowledge , imagining that she might be a sufficing reason for young candide , and he for her .",47
"at seven o’clock in the morning he arose and called planchet , who at the second summons opened the door , his countenance not yet quite freed from the anxiety of the preceding night .",25
"but if my desires were fulfilled by the capture of this bird of paradise , those of our canadian huntsman remained unsatisfied . luckily , near two o'clock ned land brought down a magnificent wild pig of the type the natives call "" bari - outang . "" this animal came in the nick of time for us to bag some real quadruped meat , and it was warmly welcomed . ned land proved himself quite gloriously with his gunshot . hit by an electric bullet , the pig dropped dead on the spot .",75
""" no ; it is quite natural . """,5
""" my dear fellow , "" said lord henry , elevating his eyebrows in surprise , "" i asked you because i thought you might be able to give me an answer . that is all . i was going through the park last sunday , and close by the marble arch there stood a little crowd of shabby - looking people listening to some vulgar street- preacher . as i passed by , i heard the man yelling out that question to his audience . it struck me as being rather dramatic . london is very rich in curious effects of that kind . a wet sunday , an uncouth christian in a mackintosh , a ring of sickly white faces under a broken roof of dripping umbrellas , and a wonderful phrase flung into the air by shrill hysterical lips -- it was really very good in its way , quite a suggestion . i thought of telling the prophet that art had a soul , but that man had not . i am afraid , however , he would not have understood me . """,152
""" do you feel quite sure of that , dorian ? """,4
""" quite sure . """,1
""" yes , you are the same . i wonder what the rest of your life will be . do n't spoil it by renunciations . at present you are a perfect type . do n't make yourself incomplete . you are quite flawless now . you need not shake your head : you know you are . besides , dorian , do n't deceive yourself . life is not governed by will or intention . life is a question of nerves , and fibres , and slowly built - up cells in which thought hides itself and passion has its dreams . you may fancy yourself safe and think yourself strong . but a chance tone of colour in a room or a morning sky , a particular perfume that you had once loved and that brings subtle memories with it , a line from a forgotten poem that you had come across again , a cadence from a piece of music that you had ceased to play-- i tell you , dorian , that it is on things like these that our lives depend . browning writes about that somewhere ; but our own senses will imagine them for us .",42
""" why have you stopped playing , dorian ? go back and give me the nocturne over again . look at that great , honey - coloured moon that hangs in the dusky air . she is waiting for you to charm her , and if you play she will come closer to the earth . you wo n't ? let us go to the club , then . it has been a charming evening , and we must end it charmingly . there is some one at white 's who wants immensely to know you -- young lord poole , bournemouth 's eldest son . he has already copied your neckties , and has begged me to introduce him to you . he is quite delightful and rather reminds me of you . """,125
""" certainly . the park is quite lovely now . i do n't think there have been such lilacs since the year i met you . """,6
""" out of seven , "" added neb ; "" top is quite worth another . """,12
"the obstinate sailor did not reply , and let the conversation drop , quite determined to resume it again .",13
""" yes , "" replied mme . bonacieux ; "" therefore , ask my own secrets , and i will reveal them to you ; but those of others -- that is quite another thing . """,32
""" no -- wait , "" said herbert ; "" i do n't quite see . luff again -- right -- now . """,13
""" i am quite convinced , although it is incredible ! """,3
""" are you quite sure of that , pencroft ? "" asked the engineer , looking at the sailor .",3
""" of course we shall not be quite sure , till we have explored it in every direction , "" replied pencroft .",7
"these wise and sober thoughts continued all the while the storm lasted , and indeed some time after ; but the next day the wind was abated , and the sea calmer , and i began to be a little inured to it ; however , i was very grave for all that day , being also a little sea - sick still ; but towards night the weather cleared up , the wind was quite over , and a charming fine evening followed ; the sun went down perfectly clear , and rose so the next morning ; and having little or no wind , and a smooth sea , the sun shining upon it , the sight was , as i thought , the most delightful that ever i saw .",75
"be easy , kitty , there is something between that man and me that he is quite ignorant of : he nearly made me lose my credit with his eminence .",16
""" yes , "" answered herbert , "" it has certainly been done quite lately . """,13
"yet such was the fright i had taken of the moors , and the dreadful apprehensions i had of falling into their hands , that i would not stop , or go on shore , or come to an anchor ; the wind continuing fair till i had sailed in that manner five days ; and then the wind shifting to the southward , i concluded also that if any of our vessels were in chase of me , they also would now give over ; so i ventured to make to the coast , and came to an anchor in the mouth of a little river , i knew not what , nor where , neither what latitude , what country , what nation , or what river . i neither saw , nor desired to see any people ; the principal thing i wanted was fresh water . we came into this creek in the evening , resolving to swim on shore as soon as it was dark , and discover the country ; but as soon as it was quite dark , we heard such dreadful noises of the barking , roaring , and howling of wild creatures , of we knew not what kinds , that the poor boy was ready to die with fear , and begged of me not to go on shore till day .",182
""" ah , i was quite sure you were a good and brave young man , "" said mme . bonacieux , holding out her hand to him , and placing the other upon the knocker of a little door almost hidden in the wall .",5
""" now , there is one , "" said kitty , "" who appears to me quite a different sort of a man from that poor monsieur d’artagnan . """,16
