text,ind
"but , alas ! for me to do wrong that never did right , was no great wonder . i hail no remedy but to go on : i had got into an employment quite remote to my genius , and directly contrary to the life i delighted in , and for which i forsook my father ’s house , and broke through all his good advice . nay , i was coming into the very middle station , or upper degree of low life , which my father advised me to before , and which , if i resolved to go on with , i might as well have stayed at home , and never have fatigued myself in the world as i had done ; and i used often to say to myself , i could have done this as well in england , among my friends , as have gone five thousand miles off to do it among strangers and savages , in a wilderness , and at such a distance as never to hear from any part of the world that had the least knowledge of me .",34
""" one drift took me up to the waist ; happily the snow is quite soft yet . """,14
""" but , "" as the sailor said , "" they quite took the wind out of the sails of the robinsons , for whom everything was done by a miracle . """,11
""" it is not quite so deserted as all that , "" replied pencroft .",4
""" why should we be ill , since there are no doctors in the island ? "" asked pencroft quite seriously .",19
""" well , perhaps . i will say , then , monsieur , quite short . """,13
""" ah , that ’s quite another thing ; but promise me , if you should not be killed tonight , that you will go tomorrow . """,5
"the sailor could rely upon herbert ; the young boy was well up in natural history , and always had had quite a passion for the science .",21
""" oh , you do quite right , monsieur . """,5
"the chimneys would have been quite insufficient to protect them against the rigor of winter , and it was to be feared that the high tides would make another irruption .",5
""" quite the contrary , planchet ; the more ill will i have toward monsieur bonacieux , the more punctual i shall be in keeping the appointment made by that letter which makes you so uneasy . """,1
""" are you quite sure of it ? """,3
"_ may _ 8.—went to the wreck , and carried an iron crow to wrench up the deck , which lay now quite clear of the water or sand . i wrenched open two planks , and brought them on shore also with the tide . i left the iron crow in the wreck for next day .",22
"it was quite dark , and no one saw them go out .",2
""" yes , you , rich -- quite an heiress . """,7
"as long as he was in the city , planchet kept at the respectful distance he had imposed upon himself ; but as soon as the road began to be more lonely and dark , he drew softly nearer , so that when they entered the bois de boulogne he found himself riding quite naturally side by side with his master .",53
"the current here was quite rapid , and drifted down some dead wood .",4
"and if nothing happens without his knowledge , he knows that i am here , and am in this dreadful condition ; and if nothing happens without his appointment , he has appointed all this to befall me . nothing occurred to my thought to contradict any of these conclusions , and therefore it rested upon me with the greater force , that it must needs be that god had appointed all this to befall me ; that i was brought into this miserable circumstance by his direction , he having the sole power , not of me only , but of everything that happened in the world . immediately it followed : why has god done this to me ? what have i done to be thus used ? my conscience presently checked me in that inquiry , as if i had blasphemed , and methought it spoke to me like a voice : “ wretch ! dost _ thou _ ask what thou hast done ? look back upon a dreadful misspent life , and ask thyself what thou hast _ not _ done ? ask , why is it that thou wert not long ago destroyed ? why wert thou not drowned in yarmouth roads ; killed in the fight when the ship was taken by the sallee man - of - war ; devoured by the wild beasts on the coast of africa ; or drowned _ here _ , when all the crew perished but thyself ? dost _ thou _ ask , what have i done ? ” i was struck dumb with these reflections , as one astonished , and had not a word to say — no , not to answer to myself , but rose up pensive and sad , walked back to my retreat , and went up over my wall , as if i had been going to bed ; but my thoughts were sadly disturbed , and i had no inclination to sleep ; so i sat down in my chair , and lighted my lamp , for it began to be dark . now , as the apprehension of the return of my distemper terrified me very much , it occurred to my thought that the brazilians take no physic but their tobacco for almost all distempers , and i had a piece of a roll of tobacco in one of the chests , which was quite cured , and some also that was green , and not quite cured .",409
"and if nothing happens without his knowledge , he knows that i am here , and am in this dreadful condition ; and if nothing happens without his appointment , he has appointed all this to befall me . nothing occurred to my thought to contradict any of these conclusions , and therefore it rested upon me with the greater force , that it must needs be that god had appointed all this to befall me ; that i was brought into this miserable circumstance by his direction , he having the sole power , not of me only , but of everything that happened in the world . immediately it followed : why has god done this to me ? what have i done to be thus used ? my conscience presently checked me in that inquiry , as if i had blasphemed , and methought it spoke to me like a voice : “ wretch ! dost _ thou _ ask what thou hast done ? look back upon a dreadful misspent life , and ask thyself what thou hast _ not _ done ? ask , why is it that thou wert not long ago destroyed ? why wert thou not drowned in yarmouth roads ; killed in the fight when the ship was taken by the sallee man - of - war ; devoured by the wild beasts on the coast of africa ; or drowned _ here _ , when all the crew perished but thyself ? dost _ thou _ ask , what have i done ? ” i was struck dumb with these reflections , as one astonished , and had not a word to say — no , not to answer to myself , but rose up pensive and sad , walked back to my retreat , and went up over my wall , as if i had been going to bed ; but my thoughts were sadly disturbed , and i had no inclination to sleep ; so i sat down in my chair , and lighted my lamp , for it began to be dark . now , as the apprehension of the return of my distemper terrified me very much , it occurred to my thought that the brazilians take no physic but their tobacco for almost all distempers , and i had a piece of a roll of tobacco in one of the chests , which was quite cured , and some also that was green , and not quite cured .",421
"such was the engineer 's project ; and it was quite feasible , since he had lime and sulphuric acid , while the amphibians of the islet would furnish the fat necessary for the manufacture .",10
"i was not quite sure whether they had locked the door ; and when i dared move , i got up and went to see .",3
"when i was on shore , god i fell on my knees and gave god thanks for my deliverance , resolving to lay aside all thoughts of my deliverance by my boat ; and refreshing myself with such things as i had , i brought my boat close to the shore , in a little cove that i had spied under some trees , and laid me down to sleep , being quite spent with the labour and fatigue of the voyage .",72
"after a while , finding that nothing more happened , she decided on going into the garden at once ; but , alas for poor alice ! when she got to the door , she found she had forgotten the little golden key , and when she went back to the table for it , she found she could not possibly reach it : she could see it quite plainly through the glass , and she tried her best to climb up one of the legs of the table , but it was too slippery ; and when she had tired herself out with trying , the poor little thing sat down and cried .",68
"she ate a little bit , and said anxiously to herself , ' which way ? which way ? ' , holding her hand on the top of her head to feel which way it was growing , and she was quite surprised to find that she remained the same size : to be sure , this generally happens when one eats cake , but alice had got so much into the way of expecting nothing but out - of - the - way things to happen , that it seemed quite dull and stupid for life to go on in the common way .",41
""" what a dreadful noise ! it went quite through me ! "" exclaimed abbot .",8
"ned land and conseil were there waiting for me . i questioned them . they knew nothing . lost in a heavy sleep of which they had no memory , they were quite startled to be back in their cabin .",32
"in five minutes more the cloud of bewilderment dissolved : i knew quite well that i was in my own bed , and that the red glare was the nursery fire .",12
""" take care of him , "" said mr . rochester to the latter , "" and keep him at your house till he is quite well : i shall ride over in a day or two to see how he gets on .",25
"' perhaps it does n't understand english , ' thought alice ; ' i daresay it 's a french mouse , come over with william the conqueror . ' ( for , with all her knowledge of history , alice had no very clear notion how long ago anything had happened . ) so she began again : ' ou est ma chatte ? ' which was the first sentence in her french lesson - book . the mouse gave a sudden leap out of the water , and seemed to quiver all over with fright . ' oh , i beg your pardon ! ' cried alice hastily , afraid that she had hurt the poor animal 's feelings . ' i quite forgot you did n't like cats . '",123
"so she called softly after it , ' mouse dear ! do come back again , and we wo n't talk about cats or dogs either , if you do n't like them ! ' when the mouse heard this , it turned round and swam slowly back to her : its face was quite pale ( with passion , alice thought ) , and it said in a low trembling voice , ' let us get to the shore , and then i 'll tell you my history , and you 'll understand why it is i hate cats and dogs . '",54
"it was high time to go , for the pool was getting quite crowded with the birds and animals that had fallen into it : there were a duck and a dodo , a lory and an eaglet , and several other curious creatures . alice led the way , and the whole party swam to the shore .",12
"d’artagnan uttered a cry of surprise , which was not quite free from joy .",10
"milady was like a good general who contemplates at the same time victory and defeat , and who is quite prepared , according to the chances of the battle , to march forward or to beat a retreat .",19
""" good god ! "" cried he , laughing , "" i quite despair of my poor michon ; she will never write like monsieur de voiture . """,12
""" mr . rivers ! you quite put me out of patience : i am rational enough ; it is you who misunderstand , or rather who affect to misunderstand . """,6
"first it marked out a race - course , in a sort of circle , ( ' the exact shape does n't matter , ' it said , ) and then all the party were placed along the course , here and there . there was no ' one , two , three , and away , ' but they began running when they liked , and left off when they liked , so that it was not easy to know when the race was over . however , when they had been running half an hour or so , and were quite dry again , the dodo suddenly called out ' the race is over ! ' and they all crowded round it , panting , and asking , ' but who has won ? '",102
"' but who is to give the prizes ? ' quite a chorus of voices asked . ' why , she , of course , ' said the dodo , pointing to alice with one finger ; and the whole party at once crowded round her , calling out in a confused way , ' prizes ! prizes ! '",10
i ought by this time to have been quite accustomed to my uncle 's ways ; yet there was always something fresh about him to astonish me .,8
""" are you quite sure that this is a man , or that he has ever been one ? "" said pencroft to the reporter .",3
"by this time she had found her way into a tidy little room with a table in the window , and on it ( as she had hoped ) a fan and two or three pairs of tiny white kid gloves : she took up the fan and a pair of the gloves , and was just going to leave the room , when her eye fell upon a little bottle that stood near the looking- glass . there was no label this time with the words ' drink me , ' but nevertheless she uncorked it and put it to her lips . ' i know something interesting is sure to happen , ' she said to herself , ' whenever i eat or drink anything ; so i 'll just see what this bottle does . i do hope it 'll make me grow large again , for really i 'm quite tired of being such a tiny little thing ! '",153
"' mary ann ! mary ann ! ' said the voice . ' fetch me my gloves this moment ! ' then came a little pattering of feet on the stairs . alice knew it was the rabbit coming to look for her , and she trembled till she shook the house , quite forgetting that she was now about a thousand times as large as the rabbit , and had no reason to be afraid of it .",53
""" little friend , "" said he , in quite a changed tone -- while his face changed too , losing all its softness and gravity , and becoming harsh and sarcastic--""you have noticed my tender penchant for miss ingram : do n't you think if i married her she would regenerate me with a vengeance ? """,9
"he got up instantly , went quite to the other end of the walk , and when he came back he was humming a tune .",6
""" jane , jane , "" said he , stopping before me , "" you are quite pale with your vigils : do n't you curse me for disturbing your rest ? """,16
"so she swallowed one of the cakes , and was delighted to find that she began shrinking directly . as soon as she was small enough to get through the door , she ran out of the house , and found quite a crowd of little animals and birds waiting outside . the poor little lizard , bill , was in the middle , being held up by two guinea - pigs , who were giving it something out of a bottle . they all made a rush at alice the moment she appeared ; but she ran off as hard as she could , and soon found herself safe in a thick wood .",41
"for our young man had a steed which was the observed of all observers . it was a bearn pony , from twelve to fourteen years old , yellow in his hide , without a hair in his tail , but not without windgalls on his legs , which , though going with his head lower than his knees , rendering a martingale quite unnecessary , contrived nevertheless to perform his eight leagues a day .",63
"this seemed to alice a good opportunity for making her escape ; so she set off at once , and ran till she was quite tired and out of breath , and till the puppy 's bark sounded quite faint in the distance .",24
"this seemed to alice a good opportunity for making her escape ; so she set off at once , and ran till she was quite tired and out of breath , and till the puppy 's bark sounded quite faint in the distance .",38
"to my mind , it is quite possible that all these islands , emerging from this vast ocean , are but the summits of a continent , now submerged , but which was above the waters at a prehistoric period . """,6
"' not quite right , i 'm afraid , ' said alice , timidly ; ' some of the words have got altered . '",2
"the sailor first made sure that it was quite dry ; that done , "" we must have some paper , "" said he .",8
""" he is better , "" said the host , "" he fainted quite away . """,13
"he left the mercer quite astonished at his singular farewell , and asking himself if he had not been a little inconsiderate .",4
"now , my dear host , while your young man was insensible , you did not fail , i am quite sure , to ascertain what that pocket contained .",20
"you look quite red , as if you had been about some mischief : what were you opening the window for ? """,2
"' i have tasted eggs , certainly , ' said alice , who was a very truthful child ; ' but little girls eat eggs quite as much as serpents do , you know . '",25
""" we would make them do it , neb , we would make them , "" replied pencroft , in quite an authoritative tone .",20
""" oh , i saw the snare , and i answered you would be quite in despair on your return .",14
"this was such a new idea to alice , that she was quite silent for a minute or two , which gave the pigeon the opportunity of adding , ' you 're looking for eggs , i know that well enough ; and what does it matter to me whether you 're a little girl or a serpent ? '",12
"in the course of my necessary correspondence with mr . briggs about the will , i had inquired if he knew anything of mr . rochester 's present residence and state of health ; but , as st . john had conjectured , he was quite ignorant of all concerning him .",45
"that which would now be considered as disgraceful to a gentleman was at that time quite a simple and natural affair , and the younger sons of the best families were frequently supported by their mistresses .",15
"teach me ; i 'm not quite up to it . """,6
"' please would you tell me , ' said alice , a little timidly , for she was not quite sure whether it was good manners for her to speak first , ' why your cat grins like that ? '",19
"she said the last word with such sudden violence that alice quite jumped ; but she saw in another moment that it was addressed to the baby , and not to her , so she took courage , and went on again:--",11
"' i do n't know of any that do , ' alice said very politely , feeling quite pleased to have got into a conversation .",17
"alice did not at all like the tone of this remark , and thought it would be as well to introduce some other subject of conversation . while she was trying to fix on one , the cook took the cauldron of soup off the fire , and at once set to work throwing everything within her reach at the duchess and the baby --the fire - irons came first ; then followed a shower of saucepans , plates , and dishes . the duchess took no notice of them even when they hit her ; and the baby was howling so much already , that it was quite impossible to say whether the blows hurt it or not .",108
"i told her he was rather an ugly man , but quite a gentleman ; and that he treated me kindly , and i was content . then i went on to describe to her the gay company that had lately been staying at the house ; and to these details bessie listened with interest : they were precisely of the kind she relished .",11
""" this is the state of things i quite approve , "" returned mrs . reed ; "" had i sought all england over , i could scarcely have found a system more exactly fitting a child like jane eyre .",8
""" quite right , sir . i may then depend upon this child being received as a pupil at lowood , and there being trained in conformity to her position and prospects ? """,1
"alice was just beginning to think to herself , ' now , what am i to do with this creature when i get it home ? ' when it grunted again , so violently , that she looked down into its face in some alarm . this time there could be no mistake about it : it was neither more nor less than a pig , and she felt that it would be quite absurd for her to carry it further .",73
"so she set the little creature down , and felt quite relieved to see it trot away quietly into the wood . ' if it had grown up , ' she said to herself , ' it would have made a dreadfully ugly child : but it makes rather a handsome pig , i think . ' and she began thinking over other children she knew , who might do very well as pigs , and was just saying to herself , ' if one only knew the right way to change them-- ' when she was a little startled by seeing the cheshire cat sitting on a bough of a tree a few yards off .",10
"at all events , the poor creature was quite quiet and sad !",8
"john does not at all resemble his father , and i am glad of it : john is like me and like my brothers -- he is quite a gibson .",27
"unmarried to him , this would never grieve me ; but can i let him complete his calculations -- coolly put into practice his plans -- go through the wedding ceremony ? can i receive from him the bridal ring , endure all the forms of love ( which i doubt not he would scrupulously observe ) and know that the spirit was quite absent ?",63
"' i said pig , ' replied alice ; ' and i wish you would n't keep appearing and vanishing so suddenly : you make one quite giddy . '",26
"' all right , ' said the cat ; and this time it vanished quite slowly , beginning with the end of the tail , and ending with the grin , which remained some time after the rest of it had gone .",14
"i opened the glass - door in the breakfast - room : the shrubbery was quite still : the black frost reigned , unbroken by sun or breeze , through the grounds .",15
""" well , "" said pencroft , "" here is game , which is quite within the reach of hunters like us .",14
""" no , "" replied my uncle , "" that is impossible -- quite impossible ! """,13
""" like a fish , "" replied the sailor quite seriously .",9
"i knew quite well that according to the best received theories the mineral covering of the globe is never at absolute rest ; the changes brought about by the chemical decomposition of its component parts , the agitation caused by great liquid torrents , and the magnetic currents , are continually tending to disturb it -- even when living beings upon its surface may fancy that all is quiet below . a phenomenon of this kind would not have greatly alarmed me , or at any rate it would not have given rise to dreadful apprehensions .",2
""" you little sharp thing ! you 've got quite a new way of talking .",9
""" quite certain ? "" said milady , with a last doubt .",1
""" you are quite a stranger to me -- where is bessie ? """,3
"i now gently assured her that i was the person she supposed and desired me to be : and seeing that i was understood , and that her senses were quite collected , i explained how bessie had sent her husband to fetch me from thornfield .",30
""" well , those are only sulphureous flames and vapours , which one must expect to see in an eruption . they are quite natural . """,23
""" it was quite right , bessie .",3
"alice did not quite know what to say to this : so she helped herself to some tea and bread - and - butter , and then turned to the dormouse , and repeated her question . ' why did they live at the bottom of a well ? '",3
""" in that case , you may be quite at ease ; she will soon be softened . besides , porthos can not owe you much . """,8
"this letter told buckingham that the city was at an extremity ; but instead of adding , "" if your succor does not arrive within fifteen days , we will surrender , "" it added , quite simply , "" if your succor comes not within fifteen days , we shall all be dead with hunger when it comes . """,36
"' what did they draw ? ' said alice , quite forgetting her promise .",10
"the evening arrival at the great town of -- scattered these thoughts ; night gave them quite another turn : laid down on my traveller 's bed , i left reminiscence for anticipation .",16
his lips and cheeks turned white -- quite white .,7
""" no , monseigneur , no , it is not he ! "" cried bonacieux ; "" no , i was deceived . this is quite another man , and does not resemble him at all . monsieur is , i am sure , an honest man . """,25
"no sooner did she enter his apartment than she cried out , "" how , monsieur candide , have you quite forgot your pacquette ? do you not know her again ? """,20
"truant ! truant ! "" he added , when he had paused an instant . "" absent from me a whole month , and forgetting me quite , i 'll be sworn ! """,26
"his eyes burned strangely , and he had quite resumed the wild aspect of his worst days .",8
""" yes , all hail to that great french citizen , "" i replied , quite startled by how emphatically captain nemo had just spoken .",15
"but d’artagnan , whose ideas had taken quite another course , forgot himself like a fool , and answered gallantly that it was too late to think about duels and sword thrusts .",7
"when she got back to the cheshire cat , she was surprised to find quite a large crowd collected round it : there was a dispute going on between the executioner , the king , and the queen , who were all talking at once , while all the rest were quite silent , and looked very uncomfortable .",14
"when she got back to the cheshire cat , she was surprised to find quite a large crowd collected round it : there was a dispute going on between the executioner , the king , and the queen , who were all talking at once , while all the rest were quite silent , and looked very uncomfortable .",51
""" i am quite ready , "" said d’artagnan ; "" but in the first place i should like to be certain of one thing . """,3
"she had quite forgotten the duchess by this time , and was a little startled when she heard her voice close to her ear . ' you 're thinking about something , my dear , and that makes you forget to talk . i ca n't tell you just now what the moral of that is , but i shall remember it in a bit . '",2
"' i think i should understand that better , ' alice said very politely , ' if i had it written down : but i ca n't quite follow it as you say it . '",27
""" well , my captain , "" said porthos , quite beside himself , "" the truth is that we were six against six . but we were not captured by fair means ; and before we had time to draw our swords , two of our party were dead , and athos , grievously wounded , was very little better . for you know athos .",10
""" my dear cousin , i think i shall make up my mind to set out for bethune , where my sister has placed our little servant in the convent of the carmelites ; this poor child is quite resigned , as she knows she can not live elsewhere without the salvation of her soul being in danger .",38
"then the queen left off , quite out of breath , and said to alice , ' have you seen the mock turtle yet ? '",6
