text,ind
""" when once i had pressed the frail shoulder , something new -- a fresh sap and sense -- stole into my frame .",17
""" i believe the queen to have too high a sense of her duty , sire . """,10
""" not it : she will be a restraint . "" he was quite peremptory , both in look and voice . the chill of mrs . fairfax 's warnings , and the damp of her doubts were upon me : something of unsubstantiality and uncertainty had beset my hopes . i half lost the sense of power over him .",55
""" ha ! explain ! "" commanded the lady . "" pardon me , madam : no need of explanation ; your own fine sense must inform you that one of your frowns would be a sufficient substitute for capital punishment . """,24
""" can you doubt it ? "" said he ; "" do you take us for wretches lost to all sense of gratitude ? """,20
"i looked , shaking my head incredulously . but though at first i was unbelieving i had to yield to the evidence of my senses .",24
no ; it was merely an illusion wrought on the troubled senses . the horrible night that he had passed had left phantoms behind it . suddenly there had fallen upon his brain that tiny scarlet speck that makes men mad . the picture had not changed . it was folly to think so .,11
"yet it was watching him , with its beautiful marred face and its cruel smile . its bright hair gleamed in the early sunlight . its blue eyes met his own . a sense of infinite pity , not for himself , but for the painted image of himself , came over him . it had altered already , and would alter more . its gold would wither into grey . its red and white roses would die . for every sin that he committed , a stain would fleck and wreck its fairness . but he would not sin . the picture , changed or unchanged , would be to him the visible emblem of conscience . he would resist temptation . he would not see lord henry any more -- would not , at any rate , listen to those subtle poisonous theories that in basil hallward 's garden had first stirred within him the passion for impossible things . he would go back to sibyl vane , make her amends , marry her , try to love her again . yes , it was his duty to do so . she must have suffered more than he had . poor child ! he had been selfish and cruel to her . the fascination that she had exercised over him would return . they would be happy together . his life with her would be beautiful and pure .",33
suddenly i felt a mild jolt . i realized the nautilus had come to rest on the ocean floor . my alarm increased . the canadian 's signal had n't reached me . i longed to rejoin ned land and urge him to postpone his attempt . i sensed that we were no longer navigating under normal conditions .,48
"one thing , however , he felt that it had done for him . it had made him conscious how unjust , how cruel , he had been to sibyl vane . it was not too late to make reparation for that . she could still be his wife . his unreal and selfish love would yield to some higher influence , would be transformed into some nobler passion , and the portrait that basil hallward had painted of him would be a guide to him through life , would be to him what holiness is to some , and conscience to others , and the fear of god to us all . there were opiates for remorse , drugs that could lull the moral sense to sleep . but here was a visible symbol of the degradation of sin . here was an ever - present sign of the ruin men brought upon their souls .",125
"there 's sense in the suggestion ; not a doubt of it . adele , as you say , must go to school ; and you , of course , must march straight to -- the devil ? """,2
""" well , mislaid it , anyhow . i put them both outside my door last night , and there was only one in the morning . i could get no sense out of the chap who cleans them . the worst of it is that i only bought the pair last night in the strand , and i have never had them on . """,31
"' there might be some sense in your knocking , ' the footman went on without attending to her , ' if we had the door between us . for instance , if you were inside , you might knock , and i could let you out , you know . ' he was looking up into the sky all the time he was speaking , and this alice thought decidedly uncivil . ' but perhaps he ca n't help it , ' she said to herself ; ' his eyes are so very nearly at the top of his head . but at any rate he might answer questions.--how am i to get in ? ' she repeated , aloud .",5
""" this is what is called a cryptogram , or cipher , "" he said , "" in which letters are purposely thrown in confusion , which if properly arranged would reveal their sense . only think that under this jargon there may lie concealed the clue to some great discovery ! """,33
"those piles of stones just mentioned were laid out on the ocean floor with a distinct but inexplicable symmetry . i spotted gigantic furrows trailing off into the distant darkness , their length incalculable . there also were other peculiarities i could n't make sense of . it seemed to me that my heavy lead soles were crushing a litter of bones that made a dry crackling noise . so what were these vast plains we were now crossing ? i wanted to ask the captain , but i still did n't grasp that sign language that allowed him to chat with his companions when they went with him on his underwater excursions .",44
"i , for instance , am but dust and ashes . with st . paul , i acknowledge myself the chiefest of sinners ; but i do not suffer this sense of my personal vileness to daunt me .",30
"it might have been , as i guessed , about ten at night . the first of my senses which came into play after this last bout was that of hearing . all at once i could hear ; and it was a real exercise of the sense of hearing . i could hear the silence in the gallery after the din which for hours had stunned me . at last these words of my uncle 's came to me like a vague murmuring :",47
"i knew by her stony eye -- opaque to tenderness , indissoluble to tears -- that she was resolved to consider me bad to the last ; because to believe me good would give her no generous pleasure : only a sense of mortification .",41
""" to exhibit it ! you want to exhibit it ? "" exclaimed dorian gray , a strange sense of terror creeping over him . was the world going to be shown his secret ? were people to gape at the mystery of his life ? that was impossible . something -- he did not know what -- had to be done at once .",18
"ere i had finished this reply , my soul began to expand , to exult , with the strangest sense of freedom , of triumph , i ever felt .",19
""" nothing , axel , nothing at all . but will it do you any more good to devour it with your eyes than with your teeth ? your reasoning has in it neither sense nor energy . """,34
i took a book -- some arabian tales ; i sat down and endeavoured to read . i could make no sense of the subject ; my own thoughts swam always between me and the page i had usually found fascinating .,21
""" in that sense i do feel apprehensive -- i have no wish to talk nonsense . """,3
""" if you did , it would be in such a grave , quiet manner , i should mistake it for sense .",21
"have you no sense to devise a system which will make you independent of all efforts , and all wills , but your own ?",3
""" well , that ’s something , for i have not the shadow of one , "" said athos coolly ; "" but as to d’artagnan , gentlemen , the idea of belonging to ours has driven him out of his senses . a thousand livres ! for my part , i declare i want two thousand . """,41
""" bah ! "" he replied . "" nothing 's out there , professor aronnax , and if there is some animal , what chance would we have of spotting it ? ca n't you see we 're just wandering around at random ? people say they 've sighted this slippery beast again in the pacific high seas-- i 'm truly willing to believe it , but two months have already gone by since then , and judging by your narwhale 's personality , it hates growing moldy from hanging out too long in the same waterways ! it 's blessed with a terrific gift for getting around . now , professor , you know even better than i that nature does n't violate good sense , and she would n't give some naturally slow animal the ability to move swiftly if it had n't a need to use that talent . so if the beast does exist , it 's already long gone ! """,125
""" all right , uncle george , i 'll tell her , but it wo n't have any effect . philanthropic people lose all sense of humanity . it is their distinguishing characteristic . """,24
"i now gently assured her that i was the person she supposed and desired me to be : and seeing that i was understood , and that her senses were quite collected , i explained how bessie had sent her husband to fetch me from thornfield .",28
""" yes , and in eighty days ! he says it is on a wager ; but , between us , i do n't believe a word of it . that would n't be common sense . there 's something else in the wind . """,35
"half lying on a couch in the library , i was suffocating . my face was purple , my lips blue , my faculties in abeyance . i could no longer see or hear . i had lost all sense of time . my muscles had no power to contract .",39
""" no : adele is not answerable for either her mother 's faults or yours : i have a regard for her ; and now that i know she is , in a sense , parentless -- forsaken by her mother and disowned by you , sir -- i shall cling closer to her than before .",33
"often , on returning home from one of those mysterious and prolonged absences that gave rise to such strange conjecture among those who were his friends , or thought that they were so , he himself would creep upstairs to the locked room , open the door with the key that never left him now , and stand , with a mirror , in front of the portrait that basil hallward had painted of him , looking now at the evil and aging face on the canvas , and now at the fair young face that laughed back at him from the polished glass . the very sharpness of the contrast used to quicken his sense of pleasure . he grew more and more enamoured of his own beauty , more and more interested in the corruption of his own soul . he would examine with minute care , and sometimes with a monstrous and terrible delight , the hideous lines that seared the wrinkling forehead or crawled around the heavy sensual mouth , wondering sometimes which were the more horrible , the signs of sin or the signs of age . he would place his white hands beside the coarse bloated hands of the picture , and smile . he mocked the misshapen body and the failing limbs .",115
"the steamer lay puffing alongside the quay , on the point of starting . passepartout had but few steps to go ; and , rushing upon the plank , he crossed it , and fell unconscious on the deck , just as the carnatic was moving off . several sailors , who were evidently accustomed to this sort of scene , carried the poor frenchman down into the second cabin , and passepartout did not wake until they were one hundred and fifty miles away from china . thus he found himself the next morning on the deck of the carnatic , and eagerly inhaling the exhilarating sea - breeze . the pure air sobered him . he began to collect his sense , which he found a difficult task ; but at last he recalled the events of the evening before , fix 's revelation , and the opium - house .",122
"when we parted , she said : "" good - bye , cousin jane eyre ; i wish you well : you have some sense . """,24
""" yes , you are the same . i wonder what the rest of your life will be . do n't spoil it by renunciations . at present you are a perfect type . do n't make yourself incomplete . you are quite flawless now . you need not shake your head : you know you are . besides , dorian , do n't deceive yourself . life is not governed by will or intention . life is a question of nerves , and fibres , and slowly built - up cells in which thought hides itself and passion has its dreams . you may fancy yourself safe and think yourself strong . but a chance tone of colour in a room or a morning sky , a particular perfume that you had once loved and that brings subtle memories with it , a line from a forgotten poem that you had come across again , a cadence from a piece of music that you had ceased to play-- i tell you , dorian , that it is on things like these that our lives depend . browning writes about that somewhere ; but our own senses will imagine them for us .",196
""" yes , "" he continued , "" that is one of the great secrets of life . nowadays most people die of a sort of creeping common sense , and discover when it is too late that the only things one never regrets are one 's mistakes . """,28
"as i approached the hut , walking as warily as stapleton would do when with poised net he drew near the settled butterfly , i satisfied myself that the place had indeed been used as a habitation . a vague pathway among the boulders led to the dilapidated opening which served as a door . all was silent within . the unknown might be lurking there , or he might be prowling on the moor . my nerves tingled with the sense of adventure . throwing aside my cigarette , i closed my hand upon the butt of my revolver and , walking swiftly up to the door , i looked in . the place was empty .",81
"this last statement appeared to me to be so startling , that i could hardly believe that he was in his sober senses . there was the dead dog , however , to prove that his conjecture had been correct . it seemed to me that the mists in my own mind were gradually clearing away , and i began to have a dim , vague perception of the truth .",22
""" i hope so , monsieur fix . you see , a man of sound sense ought not to spend his life jumping from a steamer upon a railway train , and from a railway train upon a steamer again , pretending to make the tour of the world in eighty days ! no ; all these gymnastics , you may be sure , will cease at bombay . """,15
""" keep to common sense , st . john : you are verging on nonsense .",4
"the canadian and i sat him up ; we massaged his contracted arms , and when he regained his five senses , that eternal classifier mumbled in a broken voice :",20
"had i now had the sense to have gone back to hull , and have gone home , i had been happy , and my father , as in our blessed saviour ’s parable , had even killed the fatted calf for me ; for hearing the ship i went away in was cast away in yarmouth roads , it was a great while before he had any assurances that i was not drowned .",5
"while the direction was being executed , the lady consulted moved slowly up the room . i suppose i have a considerable organ of veneration , for i retain yet the sense of admiring awe with which my eyes traced her steps .",31
"phileas fogg had not concealed from sir francis his design of going round the world , nor the circumstances under which he set out ; and the general only saw in the wager a useless eccentricity and a lack of sound common sense . in the way this strange gentleman was going on , he would leave the world without having done any good to himself or anybody else .",42
"sense would resist delirium : judgment would warn passion . too feverish to rest , i rose as soon as day dawned .",0
"' ah , well ! it means much the same thing , ' said the duchess , digging her sharp little chin into alice 's shoulder as she added , ' and the moral of that is--""take care of the sense , and the sounds will take care of themselves . "" '",40
"neither i nor any other italian can possibly take pleasure in such melancholy reveries ; but the marriage of sin and death , and snakes issuing from the womb of the former , are enough to make any person sick that is not lost to all sense of delicacy .",46
"i still possessed my senses , though just now i could not speak .",4
"i rubbed my eyes , i looked at him attentively . i saw him hanged , and i fainted away : scarce had i recovered my senses , when i saw you stripped of clothing ; this was the height of horror , grief , and despair .",26
"but still we marched on , and i alone was forgetting the length of the way by losing myself in the midst of geological contemplations . the temperature remained what it had been during our passage through the lava and schists . only my sense of smell was forcibly affected by an odour of protocarburet of hydrogen . i immediately recognised in this gallery the presence of a considerable quantity of the dangerous gas called by miners firedamp , the explosion of which has often occasioned such dreadful catastrophes .",44
"he felt that if he brooded on what he had gone through he would sicken or grow mad . there were sins whose fascination was more in the memory than in the doing of them , strange triumphs that gratified the pride more than the passions , and gave to the intellect a quickened sense of joy , greater than any joy they brought , or could ever bring , to the senses . but this was not one of them . it was a thing to be driven out of the mind , to be drugged with poppies , to be strangled lest it might strangle one itself .",54
""" no matter -- a girl of your sense will not object to the voyage or the distance . """,8
"candide , divided between joy and grief , charmed to have thus met with his faithful agent again , and surprised to hear he was a slave , his heart palpitating , his senses confused , but full of the hopes of recovering his dear cunegund , sat down to table with martin , who beheld all these scenes with great unconcern , and with six strangers , who had come to spend the carnival at venice .",33
"lord henry watched him with a subtle sense of pleasure . how different he was now from the shy frightened boy he had met in basil hallward 's studio ! his nature had developed like a flower , had borne blossoms of scarlet flame . out of its secret hiding - place had crept his soul , and desire had come to meet it on the way .",7
""" basil , my dear boy , puts everything that is charming in him into his work . the consequence is that he has nothing left for life but his prejudices , his principles , and his common sense . the only artists i have ever known who are personally delightful are bad artists . good artists exist simply in what they make , and consequently are perfectly uninteresting in what they are . a great poet , a really great poet , is the most unpoetical of all creatures . but inferior poets are absolutely fascinating . the worse their rhymes are , the more picturesque they look . the mere fact of having published a book of second - rate sonnets makes a man quite irresistible . he lives the poetry that he can not write . the others write the poetry that they dare not realize . """,38
"yes , the lad was premature . he was gathering his harvest while it was yet spring . the pulse and passion of youth were in him , but he was becoming self - conscious . it was delightful to watch him . with his beautiful face , and his beautiful soul , he was a thing to wonder at . it was no matter how it all ended , or was destined to end . he was like one of those gracious figures in a pageant or a play , whose joys seem to be remote from one , but whose sorrows stir one 's sense of beauty , and whose wounds are like red roses .",106
"however , the event showed me i was a fool for entertaining a sense even of surprise .",13
""" oh , my god ! my senses fail me amid such a chaos of iniquities .",7
"thin - lipped wisdom spoke at her from the worn chair , hinted at prudence , quoted from that book of cowardice whose author apes the name of common sense . she did not listen . she was free in her prison of passion . her prince , prince charming , was with her . she had called on memory to remake him . she had sent her soul to search for him , and it had brought him back . his kiss burned again upon her mouth . her eyelids were warm with his breath .",29
"when once more alone , i reviewed the information i had got ; looked into my heart , examined its thoughts and feelings , and endeavoured to bring back with a strict hand such as had been straying through imagination 's boundless and trackless waste , into the safe fold of common sense .",52
no snivel!--no sentiment!--no regret ! i will endure only sense and resolution .,9
"mr . reed had been dead nine years : it was in this chamber he breathed his last ; here he lay in state ; hence his coffin was borne by the undertaker 's men ; and , since that day , a sense of dreary consecration had guarded it from frequent intrusion .",43
"yet it was not this alone that made him gloomy and morose . inexperienced though he was , he had still a strong sense of the danger of sibyl 's position . this young dandy who was making love to her could mean her no good . he was a gentleman , and he hated him for that , hated him through some curious race - instinct for which he could not account , and which for that reason was all the more dominant within him . he was conscious also of the shallowness and vanity of his mother 's nature , and in that saw infinite peril for sibyl and sibyl 's happiness . children begin by loving their parents ; as they grow older they judge them ; sometimes they forgive them .",23
"i was hard pressed by ned land 's common sense , and i felt myself losing ground . i no longer knew what arguments to put forward on my behalf .",9
"soon after , phileas fogg , sir francis cromarty , and passepartout , installed in a carriage with aouda , who had the best seat , were whirling at full speed towards benares . it was a run of eighty miles , and was accomplished in two hours . during the journey , the young woman fully recovered her senses .",59
"i felt an inward power ; a sense of influence , which supported me . the crisis was perilous ; but not without its charm : such as the indian , perhaps , feels when he slips over the rapid in his canoe .",7
"i heard voices , too , speaking with a hollow sound , and as if muffled by a rush of wind or water : agitation , uncertainty , and an all - predominating sense of terror confused my faculties .",33
"the incident had occurred and was gone for me : it _ was _ an incident of no moment , no romance , no interest in a sense ; yet it marked with change one single hour of a monotonous life .",27
"for a moment a hideous sense of humiliation came over the woman . her head drooped . she wiped her eyes with shaking hands . "" sibyl has a mother , "" she murmured ; "" i had none . """,5
"i reentered my stateroom , very puzzled , as you can imagine . i tried in vain to fall asleep . i kept searching for a relationship between the appearance of the diver and that chest filled with gold . soon , from certain rolling and pitching movements , i sensed that the nautilus had left the lower strata and was back on the surface of the water .",50
"all the men in her circle seemed to admire her and envy me . i was dazzled , stimulated : my senses were excited ; and being ignorant , raw , and inexperienced , i thought i loved her .",21
"i speak particularly of the young ladies . st . john 's eyes , though clear enough in a literal sense , in a figurative one were difficult to fathom . he seemed to use them rather as instruments to search other people 's thoughts , than as agents to reveal his own : the which combination of keenness and reserve was considerably more calculated to embarrass than to encourage .",20
"from the corner of the divan of persian saddle - bags on which he was lying , smoking , as was his custom , innumerable cigarettes , lord henry wotton could just catch the gleam of the honey - sweet and honey- coloured blossoms of a laburnum , whose tremulous branches seemed hardly able to bear the burden of a beauty so flamelike as theirs ; and now and then the fantastic shadows of birds in flight flitted across the long tussore - silk curtains that were stretched in front of the huge window , producing a kind of momentary japanese effect , and making him think of those pallid , jade - faced painters of tokio who , through the medium of an art that is necessarily immobile , seek to convey the sense of swiftness and motion .",134
"he was talking , at the moment , to louisa and amy eshton . i wondered to see them receive with calm that look which seemed to me so penetrating : i expected their eyes to fall , their colour to rise under it ; yet i was glad when i found they were in no sense moved .",56
at that moment mme . bonacieux recovered her senses .,8
""" then in spite of my cries , in spite of my resistance -- for i began to comprehend that there was a question of something worse than death -- the executioner seized me , threw me on the floor , fastened me with his bonds , and suffocated by sobs , almost without sense , invoking god , who did not listen to me , i uttered all at once a frightful cry of pain and shame . a burning fire , a red - hot iron , the iron of the executioner , was imprinted on my shoulder . """,54
"aramis conducted them to the foot of the stairs , and then immediately came up again to d’artagnan , whose senses were still in a state of confusion .",20
"there was a dead silence instantly , and alice thought to herself , ' i wonder what they will do next ! if they had any sense , they 'd take the roof off . ' after a minute or two , they began moving about again , and alice heard the rabbit say , ' a barrowful will do , to begin with . '",26
""" i have not considered the subject , "" said he indifferently , looking straight before him . "" no , you men never do consider economy and common sense .",29
"this speech appeared very reasonable to the oreillons ; they deputed two of their people with all expedition to inquire into the truth of this affair , who acquitted themselves of their commission like men of sense , and soon returned with good tidings for our distressed adventurers .",36
