text,ind,sense,label
"d’artagnan , be it remembered , was only twenty years old , and at that age sleep has its imprescriptible rights which it imperiously insists upon , even with the saddest hearts .",16,"('sleep', 'sommeil', 'soñar')",0
"he was not long in making his toilet . he examined himself to see if advantage had been taken of his sleep , and having found his diamond ring on his finger , his purse in his pocket , and his pistols in his belt , he rose , paid for his bottle , and went out to try if he could have any better luck in his search after his lackey than he had had the night before . the first thing he perceived through the damp gray mist was honest planchet , who , with the two horses in hand , awaited him at the door of a little blind cabaret , before which d’artagnan had passed without even a suspicion of its existence .",21,"('sleep', 'sommeil', 'soñar')",0
"most of these seals were sleeping on the rocks or the sand . among those properly termed seals -- which have no external ears , unlike sea lions whose ears protrude -- i observed several varieties of the species stenorhynchus , three meters long , with white hair , bulldog heads , and armed with ten teeth in each jaw : four incisors in both the upper and lower , plus two big canines shaped like the fleur - de - lis . among them slithered some sea elephants , a type of seal with a short , flexible trunk ; these are the giants of the species , with a circumference of twenty feet and a length of ten meters . they did n't move as we approached .",5,"('sleep', 'dormir', 'dormir')",1
"the night passed , and whether the prisoner slept or not could not be known , but at any rate , although he had been unbound , he did not move .",8,"('sleep', 'dormir', 'dormir')",1
"herbert , neb , and pencroft did the same , while top slept at his master 's feet .",12,"('sleep', 'dormir', 'dormir')",1
""" monsieur has well slept this morning , "" he said , smiling .",4,"('sleep', 'dormir', 'dormir')",1
"although milady would very willingly have gone without sleep , sustained as she was by all the excitements which a new adventure awakened in her heart , ever thirsting for intrigues , she nevertheless accepted the offer of the superior . during the last fifteen days she had experienced so many and such various emotions that if her frame of iron was still capable of supporting fatigue , her mind required repose .",8,"('sleep', 'sommeil', 'soñar')",0
""" well , "" said milady , "" what can those who sleep wish for -- a happy awakening ?",12,"('sleep', 'dormir', 'dormir')",1
"the reporter retired into a dark corner after having shortly noted down the occurrences of the day ; the first appearance of this new land , the loss of their leader , the exploration of the coast , the incident of the matches , etc . ; and then overcome by fatigue , he managed to forget his sorrows in sleep .",60,"('sleep', 'sommeil', 'soñar')",0
herbert went to sleep directly .,3,"('sleep', 'endormir', 'dormir')",2
"in the morning milady , under the pretext that she had not slept well in the night and wanted rest , sent away the woman who attended her .",12,"('sleep', 'dormir', 'dormir')",1
"after a busy day the colonists were sleeping soundly , when towards four o'clock in the morning they were suddenly awakened by top 's barking .",7,"('sleep', 'dormir', 'dormir')",1
"cyrus harding had profited by a moment when he was sleeping , to cut his hair and matted beard , which formed a sort of mane and gave him such a savage aspect .",10,"('sleep', 'dormir', 'dormir')",1
"how i wished sleep would silence her . it seemed as if , could i but go back to the idea which had last entered my mind as i stood at the window , some inventive suggestion would rise for my relief .",3,"('sleep', 'sommeil', 'soñar')",0
"this ayrton resolved to learn at any cost , and as an hour after his arrival the vociferations had begun to die away , and as a large number of the convicts were already buried in a drunken sleep , ayrton did not hesitate to venture onto the "" speedy 's "" deck , which the extinguished lanterns now left in total darkness .",38,"('sleep', 'sommeil', 'soñar')",0
"as to the men lying on the deck , they were about ten in number , but it was to be supposed that more were sleeping down below .",25,"('sleep', 'dormir', 'dormir')",1
""" you can hardly fail to be better , for you have slept quietly . hans and i watched you by turns , and we have noticed you were evidently recovering . """,12,"('sleep', 'dormir', 'dormir')",1
"ayrton stole carefully along the between - decks , strewn with numerous sleepers , overcome more by drunkenness than sleep .",19,"('sleep', 'sommeil', 'soñar')",0
"planchet , two hours before , had asked his master for some dinner , and he had answered him with the proverb , "" he who sleeps , dines . """,26,"('sleep', 'dormir', 'dormir')",1
and planchet dined by sleeping .,4,"('sleep', 'dormir', 'dormir')",1
"hans slept peaceably at the foot of a rock , in a lava bed , where he had found a suitable couch for himself ; but my uncle was pacing around the bottom of the crater like a wild beast in a cage . i had neither the wish nor the strength to rise , and following the guide 's example i went off into an unhappy slumber , fancying i could hear ominous noises or feel tremblings within the recesses of the mountain .",1,"('sleep', 'dormir', 'dormir')",1
"after this , satisfied with the way in which he had conducted himself at meung , without remorse for the past , confident in the present , and full of hope for the future , he retired to bed and slept the sleep of the brave .",40,"('sleep', 'endormir', 'dormir')",2
"after this , satisfied with the way in which he had conducted himself at meung , without remorse for the past , confident in the present , and full of hope for the future , he retired to bed and slept the sleep of the brave .",42,"('sleep', 'sommeil', 'soñar')",0
"this sleep , provincial as it was , brought him to nine o’clock in the morning ; at which hour he rose , in order to repair to the residence of m. de treville , the third personage in the kingdom , in the paternal estimation .",1,"('sleep', 'sommeil', 'soñar')",0
"the lad then fell into a kind of feverish sleep , and the reporter and pencroft remained near the bed .",9,"('sleep', 'sommeil', 'soñar')",0
"the passengers , with the exception of the sailor , scarcely slept as well on board the "" bonadventure "" as they would have done in their rooms at granite house , but they did sleep however .",35,"('sleep', 'dormir', 'dormir')",1
""" in the very heart of an extinct volcano , "" the captain answered me , "" a volcano whose interior was invaded by the sea after some convulsion in the earth . while you were sleeping , professor , the nautilus entered this lagoon through a natural channel that opens ten meters below the surface of the ocean . this is our home port , secure , convenient , secret , and sheltered against winds from any direction ! along the coasts of your continents or islands , show me any offshore mooring that can equal this safe refuge for withstanding the fury of hurricanes . """,36,"('sleep', 'dormir', 'dormir')",1
"and poor martha had to go away unanswered . as for me , after long resistance , i was overcome by sleep , and fell off at the end of the sofa , while uncle liedenbrock went on calculating and rubbing out his calculations .",21,"('sleep', 'sommeil', 'soñar')",0
"' you might just as well say , ' added the dormouse , who seemed to be talking in his sleep , ' that "" i breathe when i sleep "" is the same thing as "" i sleep when i breathe "" ! '",38,"('sleep', 'dormir', 'dormir')",1
"at five o'clock he rang his bell for his servant and gave him orders to pack his things for the night - express to town , and to have the brougham at the door by eight - thirty . he was determined not to sleep another night at selby royal . it was an ill - omened place . death walked there in the sunlight . the grass of the forest had been spotted with blood .",44,"('sleep', 'dormir', 'dormir')",1
"the calculations were left for the next day , and at ten o'clock every one was sleeping soundly .",16,"('sleep', 'dormir', 'dormir')",1
"ned land still kept up the most tenacious skepticism ; beyond his spells on watch , he pretended that he never even looked at the surface of the waves , at least while no whales were in sight . and yet the marvelous power of his vision could have performed yeoman service . but this stubborn canadian spent eight hours out of every twelve reading or sleeping in his cabin . a hundred times i chided him for his unconcern .",66,"('sleep', 'dormir', 'dormir')",1
"we were finally in the area of the monster 's latest antics ! and in all honesty , shipboard conditions became life - threatening . hearts were pounding hideously , gearing up for futures full of incurable aneurysms . the entire crew suffered from a nervous excitement that it 's beyond me to describe . nobody ate , nobody slept . twenty times a day some error in perception , or the optical illusions of some sailor perched in the crosstrees , would cause intolerable anguish , and this emotion , repeated twenty times over , kept us in a state of irritability so intense that a reaction was bound to follow .",59,"('sleep', 'dormir', 'dormir')",1
""" yes , yes ! "" said felton , passing his hands over his brow , covered with sweat , as if to remove his last doubt . "" yes , i recognize the voice which speaks to me in my dreams ; yes , i recognize the features of the angel who appears to me every night , crying to my soul , which can not sleep : ’ strike , save england , save thyself -- for thou wilt die without having appeased god ! ’",67,"('sleep', 'dormir', 'dormir')",1
"we were stretched out in this delightful cave for an hour . our conversation , lively at the outset , then languished . a definite drowsiness overcame us . since i saw no good reason to resist the call of sleep , i fell into a heavy doze . i dreamed -- one does n't choose his dreams -- that my life had been reduced to the vegetating existence of a simple mollusk . it seemed to me that this cave made up my double - valved shell . . . .",40,"('sleep', 'sommeil', 'soñar')",0
"this prediction was but half fulfilled : i did not indeed dream of sorrow , but as little did i dream of joy ; for i never slept at all .",27,"('sleep', 'dormir', 'dormir')",1
cyrus harding and his companions slept like innocent marmots in the cave which the jaguar had so politely left at their disposal .,5,"('sleep', 'dormir', 'dormir')",1
"notwithstanding the fury of the hurricane , the uproar of the tempest , the thunder , and the tumult , herbert slept profoundly .",21,"('sleep', 'dormir', 'dormir')",1
"sleep at last took possession of pencroft , whom a seafaring life had habituated to anything .",0,"('sleep', 'sommeil', 'soñar')",0
"candide , notwithstanding so many disasters , ate and slept .",9,"('sleep', 'dormir', 'dormir')",1
it was more than the sleep of a volcano ; it was its complete extinction .,5,"('sleep', 'sommeil', 'soñar')",0
""" i mean to say , young man , that he who sleeps over a mine the match of which is already lighted , may consider himself in safety in comparison with you . """,12,"('sleep', 'endormir', 'dormir')",2
"after their meal my two companions laid themselves down upon their rugs , and found in sleep a solace for their fatigue . but i could not sleep , and i counted every hour until morning .",16,"('sleep', 'sommeil', 'soñar')",0
""" the servants sleep so far off , you know , miss , they would not be likely to hear .",3,"('sleep', 'dormir', 'dormir')",1
"all the rest of the day i spent in afflicting myself at the dismal circumstances i was brought to — viz . i had neither food , house , clothes , weapon , nor place to fly to ; and in despair of any relief , saw nothing but death before me — either that i should be devoured by wild beasts , murdered by savages , or starved to death for want of food . at the approach of night i slept in a tree , for fear of wild creatures ; but slept soundly , though it rained all night .",82,"('sleep', 'dormir', 'dormir')",1
"all the rest of the day i spent in afflicting myself at the dismal circumstances i was brought to — viz . i had neither food , house , clothes , weapon , nor place to fly to ; and in despair of any relief , saw nothing but death before me — either that i should be devoured by wild beasts , murdered by savages , or starved to death for want of food . at the approach of night i slept in a tree , for fear of wild creatures ; but slept soundly , though it rained all night .",94,"('sleep', 'dormir', 'dormir')",1
"the night was cold . the parsee lit a fire in the bungalow with a few dry branches , and the warmth was very grateful , provisions purchased at kholby sufficed for supper , and the travellers ate ravenously . the conversation , beginning with a few disconnected phrases , soon gave place to loud and steady snores . the guide watched kiouni , who slept standing , bolstering himself against the trunk of a large tree . nothing occurred during the night to disturb the slumberers , although occasional growls from panthers and chatterings of monkeys broke the silence ; the more formidable beasts made no cries or hostile demonstration against the occupants of the bungalow . sir francis slept heavily , like an honest soldier overcome with fatigue . passepartout was wrapped in uneasy dreams of the bouncing of the day before . as for mr . fogg , he slumbered as peacefully as if he had been in his serene mansion in saville row .",65,"('sleep', 'endormir', 'dormir')",2
"no : stillness returned : each murmur and movement ceased gradually , and in about an hour thornfield hall was again as hushed as a desert . it seemed that sleep and night had resumed their empire .",30,"('sleep', 'sommeil', 'soñar')",0
sleep came not near my couch — while the hours waned and waned away .,0,"('sleep', 'sommeil', 'soñar')",0
"sometimes , however , when the conversation bore on some interesting subject the hour for sleep was delayed for a time .",15,"('sleep', 'sommeil', 'soñar')",0
"overpowered by an intense sentiment of horror , unaccountable yet unendurable , i threw on my clothes with haste ( for i felt that i should sleep no more during the night ) , and endeavored to arouse myself from the pitiable condition into which i had fallen , by pacing rapidly to and fro through the apartment .",26,"('sleep', 'dormir', 'dormir')",1
"its strange form caught the eye , and when gideon spilett , on the engineer 's advice , had drawn the outline , they found that it resembled some fantastic animal , a monstrous leviathan , which lay sleeping on the surface of the pacific .",38,"('sleep', 'endormir', 'dormir')",2
"_ tuesday , august 18 . _ --evening came , or rather the time came when sleep weighs down the weary eyelids , for there is no night here , and the ceaseless light wearies the eyes with its persistency just as if we were sailing under an arctic sun . hans was at the helm . during his watch i slept .",61,"('sleep', 'endormir', 'dormir')",2
external existence then resembles a sleep of which this thought is the dream .,5,"('sleep', 'sommeil', 'soñar')",0
""" no ; they occupy a range of smaller apartments to the back ; no one ever sleeps here : one would almost say that , if there were a ghost at thornfield hall , this would be its haunt . """,17,"('sleep', 'dormir', 'dormir')",1
"herbert dozed again , but his sleep appeared more natural .",6,"('sleep', 'sommeil', 'soñar')",0
""" it is only eight now , "" said the brigadier , "" and these guards may also go to sleep . """,20,"('sleep', 'sommeil', 'soñar')",0
"when i reopened them i saw my two companions motionless and rolled up in their coverings . were they asleep ? as for me , i could not get one moment 's sleep . i was suffering too keenly , and what embittered my thoughts was that there was no remedy . my uncle 's last words echoed painfully in my ears : "" it 's all over ! "" for in such a fearful state of debility it was madness to think of ever reaching the upper world again .",32,"('sleep', 'sommeil', 'soñar')",0
"during the whole of that day they struggled on through the defiles , and by evening they calculated that they were more than thirty miles from their enemies . at night - time they chose the base of a beetling crag , where the rocks offered some protection from the chill wind , and there huddled together for warmth , they enjoyed a few hours ' sleep . before daybreak , however , they were up and on their way once more . they had seen no signs of any pursuers , and jefferson hope began to think that they were fairly out of the reach of the terrible organization whose enmity they had incurred . he little knew how far that iron grasp could reach , or how soon it was to close upon them and crush them .",66,"('sleep', 'sommeil', 'soñar')",0
""" alas ! this desperate resistance could not last long . i felt my strength fail , and this time it was not my sleep that enabled the coward to prevail , but my swoon . """,24,"('sleep', 'sommeil', 'soñar')",0
"i tried to fight off this drowsiness . it was impossible . my breathing grew weaker . i felt a mortal chill freeze my dull , nearly paralyzed limbs . like little domes of lead , my lids fell over my eyes . i could n't raise them . a morbid sleep , full of hallucinations , seized my whole being . then the visions disappeared and left me in utter oblivion .",51,"('sleep', 'sommeil', 'soñar')",0
"ned land and conseil were there waiting for me . i questioned them . they knew nothing . lost in a heavy sleep of which they had no memory , they were quite startled to be back in their cabin .",22,"('sleep', 'sommeil', 'soñar')",0
"near two o'clock i was busy organizing my notes in the lounge , when the captain opened the door and appeared . i bowed to him . he gave me an almost imperceptible bow in return , without saying a word to me . i resumed my work , hoping he might give me some explanation of the previous afternoon 's events . he did nothing of the sort . i stared at him . his face looked exhausted ; his reddened eyes had n't been refreshed by sleep ; his facial features expressed profound sadness , real chagrin . he walked up and down , sat and stood , picked up a book at random , discarded it immediately , consulted his instruments without taking his customary notes , and seemed unable to rest easy for an instant .",88,"('sleep', 'sommeil', 'soñar')",0
"herbert alone slept for two hours , for at his age sleep is a necessity .",2,"('sleep', 'dormir', 'dormir')",1
"herbert alone slept for two hours , for at his age sleep is a necessity .",11,"('sleep', 'sommeil', 'soñar')",0
"they respected this sleep , and the reporter began immediately to make arrangements for transporting harding to a more comfortable place .",3,"('sleep', 'sommeil', 'soñar')",0
"to say that the settlers , notwithstanding their fatigue , slept well on the sandy floor of the chimneys would not be true .",10,"('sleep', 'dormir', 'dormir')",1
""" who has told me this fine story , monsieur ? who should it be but he who watches while i sleep , who labors while i amuse myself , who conducts everything at home and abroad -- in france as in europe ? """,21,"('sleep', 'dormir', 'dormir')",1
"the engineer was just awaking from the sleep , or rather from the drowsiness , in which they had found him .",7,"('sleep', 'sommeil', 'soñar')",0
""" there they are sleeping quietly as if they were in their own house .",4,"('sleep', 'dormir', 'dormir')",1
""" there was not a soul to be seen , nor a sound to be heard , except the dripping of the rain . when i looked in at the window , i found drebber all huddled together in a drunken sleep . i shook him by the arm , ' it 's time to get out , ' i said .",41,"('sleep', 'sommeil', 'soñar')",0
""" sarah , come and sleep with me in the nursery ; i dare n't for my life be alone with that poor child to - night : she might die ; it 's such a strange thing she should have that fit : i wonder if she saw anything . missis was rather too hard . """,5,"('sleep', 'dormir', 'dormir')",1
"she slept as a prisoner sleeps , rocked by his first hope .",1,"('sleep', 'dormir', 'dormir')",1
""" i am in a fever , "" said she ; "" i have not slept a single instant during all this long night . i suffer horribly . are you likely to be more humane to me than others were yesterday ?",15,"('sleep', 'dormir', 'dormir')",1
"i sleep no longer , monsieur . i sometimes dream , that ’s all .",1,"('sleep', 'dormir', 'dormir')",1
"however ill the king might sleep , m. de treville slept still worse . he had ordered his three musketeers and their companion to be with him at half past six in the morning .",10,"('sleep', 'dormir', 'dormir')",1
""" at least , captain , your dead can sleep serenely there , out of the reach of sharks ! """,9,"('sleep', 'dormir', 'dormir')",1
"in the evening i took a short walk on the beach and returned at night to my plank - bed , where i slept soundly all night .",23,"('sleep', 'dormir', 'dormir')",1
