text,sense,label,ind,new_label
"she was struck , no doubt , with a superstitious idea ; she conceived that heaven denied its aid , and she remained in the attitude in which she had fallen , her head drooping and her hands clasped .","('remain', 'rester', 'permanecer')",2,22,2
"he was seized with a sort of trembling , and remained a few moments without being able to articulate a word .","('remain', 'rester', 'permanecer')",0,10,2
"neb took one of the oars , herbert the other , and pencroft remained in the stern in order to use the scull .","('remain', 'rester', 'permanecer')",2,13,2
"as to d’artagnan , he remained perfectly insensible to the enthusiasm of the two men in black .","('remain', 'rester', 'permanecer')",0,5,2
"d’artagnan remained alone in front of the cardinal ; this was his second interview with richelieu , and he afterward confessed that he felt well assured it would be his last .","('remain', 'rester', 'permanecer')",2,1,2
"richelieu remained standing , leaning against the mantelpiece ; a table was between him and d’artagnan .","('remain', 'rester', 'permanecer')",2,1,2
"the colonists remained , therefore , near the cart , and carefully watched the neighboring parts of the forest .","('remain', 'rester', 'permanecer')",0,2,2
felton remained behind ; he held a book in his hand .,"('remain', 'rester', 'quedar')",1,1,1
neb remained at the onagers ' heads to hold them .,"('remain', 'rester', 'quedar')",1,1,1
"the young officer , however , remained mute and motionless ; his look alone had spoken .","('remain', 'rester', 'permanecer')",0,6,2
