text,sense,label,ind,new_label
"i bowed in agreement . the commander had n't put a question to me . so no answer was called for . this man expressed himself with perfect ease and without a trace of an accent . his phrasing was clear , his words well chosen , his facility in elocution remarkable . and yet , to me , he did n't have "" the feel "" of a fellow countryman .","('express', 'exprimer', 'expresar')",0,24,0
"before i had time to express the surprise this new proposition caused me , a camera was carried into the lounge at captain nemo 's request . the liquid setting , electrically lit , unfolded with perfect clarity through the wide - open panels . no shadows , no blurs , thanks to our artificial light . not even sunshine could have been better for our purposes . with the thrust of its propeller curbed by the slant of its fins , the nautilus stood still . the camera was aimed at the scenery on the ocean floor , and in a few seconds we had a perfect negative .","('express', 'exprimer', 'expresar')",0,5,0
"d’artagnan , "" continued athos , "" you , who but lately were so anxious for such an opportunity for expressing your gratitude to monseigneur , here it is ; avail yourself of it . ""","('express', 'exprimer', 'expresar')",0,20,0
"it is impossible to express the astonishment of these poor creatures at the noise and fire of my gun : some of them were even ready to die for fear , and fell down as dead with the very terror ; but when they saw the creature dead , and sunk in the water , and that i made signs to them to come to the shore , they took heart and came , and began to search for the creature . i found him by his blood staining the water ; and by the help of a rope , which i slung round him , and gave the negroes to haul , they dragged him on shore , and found that it was a most curious leopard , spotted , and fine to an admirable degree ; and the negroes held up their hands with admiration , to think what it was i had killed him with .","('express', 'exprimer', 'expresar')",0,4,0
"i lack words to express the full extent , or the earnest abandon of his persuasion .","('express', 'exprimer', 'expresar')",0,4,0
"when i did speak , it was only to express an impetuous wish that i had never been born , or never come to thornfield . "" because you are sorry to leave it ? ""","('express', 'exprimer', 'expresar')",0,9,0
"the four countenances expressed four different feelings : that of porthos , tranquillity ; that of d’artagnan , hope ; that of aramis , uneasiness ; that of athos , carelessness .","('express', 'exprimer', 'expresar')",0,3,0
"near two o'clock i was busy organizing my notes in the lounge , when the captain opened the door and appeared . i bowed to him . he gave me an almost imperceptible bow in return , without saying a word to me . i resumed my work , hoping he might give me some explanation of the previous afternoon 's events . he did nothing of the sort . i stared at him . his face looked exhausted ; his reddened eyes had n't been refreshed by sleep ; his facial features expressed profound sadness , real chagrin . he walked up and down , sat and stood , picked up a book at random , discarded it immediately , consulted his instruments without taking his customary notes , and seemed unable to rest easy for an instant .","('express', 'exprimer', 'expresar')",0,93,0
i loved him very much -- more than i could trust myself to say -- more than words had power to express .,"('express', 'exprimer', 'expresar')",0,21,0
